Title,Publisher,Date,Link
These Five Altcoins Flashing Signs of Life After Crypto Collapse: Analyst Michaël van de Poppe,The Daily Hodl,2021-07-06,https://dailyhodl.com/2021/07/06/these-five-altcoins-flashing-signs-of-life-after-crypto-collapse-analyst-michael-van-de-poppe/
Aave price hits 3-week high as ‘Aave Pro’ debuts for institutional lending,Cointelegraph,2021-07-06,https://cointelegraph.com/news/aave-price-hits-3-week-high-as-aave-pro-debuts-for-institutional-lending
CryptoKickers Is Bringing NFT Sneakers to the Hypebeasts of the Metaverse,CoinDesk,2021-07-06,https://www.coindesk.com/tech/2021/07/06/cryptokickers-is-bringing-nft-sneakers-to-the-hypebeasts-of-the-metaverse/
The feature for sale of NFTs on Instagram coming soon!,Cryptopolitan,2021-07-06,https://www.cryptopolitan.com/users-will-be-able-to-sell-nfts-on-instagram/
Tiger King Crypto: What Is TKING? 10 Things to Know About ...,InvestorPlace,2021-07-06,https://investorplace.com/2021/07/tiger-king-crypto-what-is-tking-10-things-to-know-about-the-new-meme-coin/
"Crypto YouTuber Rug-Pulled His Own Followers, Claims It's A ...",Securities.io,2021-07-06,https://www.securities.io/crypto-youtuber-rug-pulled-his-own-followers-claims-its-a-social-project/
Why this could actually be true for Bitcoin,AMBCrypto,2021-07-06,https://ambcrypto.com/what-is-bitcoins-price-target-for-this-decade/
Australian Crypto Companies Call for “Innovation-Friendly” Regulation,Coinfomania,2021-07-06,https://coinfomania.com/australian-crypto-companies-call-for-regulation/
"25yo Malta Man Accused of Stealing Friend’s $700,000 Worth of Cryptocurrency",Coinfomania,2021-07-06,https://coinfomania.com/malta-man-steal-friend-cryptocurrency/
Flare Details Plan to Airdrop 100 Billion Spark ($FLR) Tokens ...,Cryptoglobe,2021-07-06,https://www.cryptoglobe.com/latest/2021/07/flare-details-plan-to-airdrop-100-billion-spark-flr-tokens-to-xrp-holders/
5 Biggest Altcoin Gainers in 2021 and How They Have ...,Market Realist,2021-07-06,https://marketrealist.com/p/biggest-altcoin-gainers-2021/
Shiba Inu (SHIB) Roadmap Is Becoming Clearer: The Reverse Uno Of The Crypto World,The Currency Analytics,2021-07-06,https://thecurrencyanalytics.com/altcoins/shiba-inu-shib-roadmap-is-becoming-clearer-the-reverse-uno-of-the-crypto-world-30123.php
