Title,Publisher,Date,Link
Join the Most Awaited ICO of the Year and Get your Ticket to ...,Crypto News,2021-03-03,https://cryptonews.com/news/join-the-most-awaited-ico-of-the-year-and-get-your-ticket-to-9411.htm
Badger DAO announces $21 million treasury diversification via VC partners,Cointelegraph,2021-03-03,https://cointelegraph.com/news/badger-dao-announces-21-million-treasury-diversification-via-vc-partners
"Someone paid $4,480 for an XRP transaction",AMBCrypto,2021-03-03,https://ambcrypto.com/someone-paid-4480-for-an-xrp-transaction/
"Cardano, NEM, Sushiswap Price Analysis: 03 March",AMBCrypto,2021-03-03,https://ambcrypto.com/cardano-nem-sushiswap-price-analysis-03-march/
ETH: Technology Play or Store of Value? A CoinDesk Research Report,CoinDesk,2021-03-03,https://www.coindesk.com/markets/2021/03/03/eth-technology-play-or-store-of-value-a-coindesk-research-report/
PayPal all set to takeover Crypto Custody firm Curv ...,The Market Periodical,2021-03-03,https://themarketperiodical.com/2021/03/03/paypal-all-set-to-takeover-crypto-custody-firm-curv/
"Bull flag breakout sets a $55,000 target for Bitcoin price",CryptoNewsPipe,2021-03-03,https://cryptonewspipe.com/bull-flag-breakout-sets-a-55000-target-for-bitcoin-price/
Dogecoin ($DOGE) Developers Announce Update For ...,Cryptoglobe,2021-03-03,https://www.cryptoglobe.com/latest/2021/03/dogecoin-doge-developers-announce-update-for-internets-favorite-meme-cryptocurrency/
Tim Draper Predicts Netflix Might Be Next to Buy Bitcoin; Doubles Down on $250k,Coinfomania,2021-03-03,https://coinfomania.com/tim-draper-predicts-netflix-next-to-buy-bitcoin/
