Title,Publisher,Date,Link
Ray Dalio considers Bitcoin as digital gold,Cryptopolitan,2021-08-06,https://www.cryptopolitan.com/ray-dalio-considers-bitcoin-as-digital-gold/
"Virtual Land Ownership Project, Next Earth, Joins the Reef ...",Cryptopolitan,2021-08-06,https://www.cryptopolitan.com/virtual-land-ownership-project-next-earth-joins-the-reef-ecosystem/
Altcoin Roundup: Hodling Ethereum? Here’s how and where to stake your ETH,Cointelegraph,2021-08-06,https://cointelegraph.com/news/altcoin-roundup-hodling-ethereum-here-s-how-and-where-to-stake-your-eth
Ready to deploy? Amazon’s Bitcoin acceptance can prime a payments future,Cointelegraph,2021-08-06,https://cointelegraph.com/news/ready-to-deploy-amazon-s-bitcoin-acceptance-can-prime-a-payments-future
Osiris Browser: True Web 3.0 experience or another surveillance trap?,Cointelegraph,2021-08-06,https://cointelegraph.com/press-releases/osiris-browser-true-web-30-experience-or-another-surveillance-trap
Proof of Stake vs Proof of Work: What's Better?,Cryptopolitan,2021-08-06,https://www.cryptopolitan.com/proof-of-stake-vs-proof-of-work-whats-better/
"India might launch its CBDC model by December 2021, but here’s the problem",AMBCrypto,2021-08-06,https://ambcrypto.com/india-might-launch-its-cbdc-model-by-december-2021-but-heres-the-problem/
What Bitcoin’s S2F deviation means for its $100k projections,AMBCrypto,2021-08-06,https://ambcrypto.com/what-bitcoins-s2f-deviation-means-for-its-100k-projections/
Understand This before Buying Binance Coin (BNB),Herald Sheets,2021-08-06,https://heraldsheets.com/understand-this-before-buying-binance-coin-bnb/
