Title,Publisher,Date,Link
"Binance Launches Solana Staking, Offering Yields Up to 43%",Decrypt,2021-02-25,https://decrypt.co/59417/binance-launches-solana-staking-offering-yields-up-to-43
"The NFT Boom Has Arrived, With Mainstream Adoption",BeInCrypto,2021-02-25,https://beincrypto.com/the-nft-boom-has-arrived-with-mainstream-adoption/
How have Bitcoin’s recent price woes impacted institutional interest,AMBCrypto,2021-02-25,https://ambcrypto.com/how-has-recent-bitcoins-recent-price-woes-impacted-institutional-interest/
"Grayscale’s Ethereum Trust added over 10,000 ETH during price correction",AMBCrypto,2021-02-25,https://ambcrypto.com/grayscales-ethereum-trust-added-over-10000-eth-during-price-correction/
Everything you need to know about the next key support for Bitcoin,AMBCrypto,2021-02-25,https://ambcrypto.com/everything-you-need-to-know-about-the-next-key-support-for-bitcoin/
"Will Bitcoin fall to zero after a “death spiral”, this economist thinks so",AMBCrypto,2021-02-25,https://ambcrypto.com/will-bitcoin-fall-to-zero-after-death-spiral-this-economist-thinks-so/
"Stellar Lumens, Aave, Decred Price Analysis: 25 February",AMBCrypto,2021-02-25,https://ambcrypto.com/stellar-lumens-aave-decred-price-analysis-25-february/
What a negative premium means for Bitcoin’s rally,AMBCrypto,2021-02-25,https://ambcrypto.com/what-a-negative-premium-means-for-bitcoins-rally/
"Finance Redefined: Ethereum exodus continues as Binance ‘helps,’ Feb 17–24.",Cointelegraph,2021-02-25,https://cointelegraph.com/news/finance-redefined-ethereum-exodus-continues-as-binance-helps-feb-17-24
"Ethereum, Polkadot and Cardano can all co-exist says Hoskinson",AMBCrypto,2021-02-25,https://ambcrypto.com/ethereum-polkadot-and-cardano-can-all-co-exist-says-hoskinson/
Coingate: Steps to buy Bitcoin using a credit card,AMBCrypto,2021-02-25,https://ambcrypto.com/coingate-steps-to-buy-bitcoin-using-a-credit-card/
UK banks turning down the application of Peter McCormack ...,The Market Periodical,2021-02-25,https://themarketperiodical.com/2021/02/25/uk-banks-turning-down-the-application-of-peter-mccormack/
How Not to Summon a Demon Lord Season 2 Trailer,Tech Lapse,2021-02-25,https://techlapse.com/entertainment/how-not-to-summon-a-demon-lord-season-2-trailer/
