Title,Publisher,Date,Link
DeFi gaming: A catalyst to mainstream adoption of decentralized finance,Cointelegraph,2021-09-25,https://cointelegraph.com/news/defi-gaming-a-catalyst-to-mainstream-adoption-of-decentralized-finance
Sam Bankman-Fried's FTX moves HQ to Bahamas,Cryptopolitan,2021-09-25,https://www.cryptopolitan.com/sam-bankman-frieds-ftx-moves-hq-to-bahamas/
"Binance Coin, Sushiswap, DASH Price Analysis: 25 September",AMBCrypto,2021-09-25,https://ambcrypto.com/binance-coin-sushiswap-dash-price-analysis-25-september/
Cardano Makes Big Announcements Ahead of Summit ...,Securities.io,2021-09-25,https://www.securities.io/cardano-makes-big-announcements-ahead-of-summit-cardano-weekly/
Novatti to leverage Ripple’s cross-border solution to tap into Thailand,AMBCrypto,2021-09-25,https://ambcrypto.com/novatti-to-leverage-ripples-cross-border-solution-to-tap-into-thailand/
"Tron, Algorand, VeChain Price Analysis: 25 September",AMBCrypto,2021-09-25,https://ambcrypto.com/tron-algorand-vechain-price-analysis-25-september/
What these indicators say about AVAX’s incoming corrective phase,AMBCrypto,2021-09-25,https://ambcrypto.com/what-these-indicators-say-about-avaxs-incoming-corrective-phase/
"DappRadar Releases NFT Marketplace Sales Results, With ...",BeInCrypto,2021-09-25,https://beincrypto.com/dappradar-releases-nft-marketplace-sales-results-with-opensea-dominating/
Harmony Price Analysis: ONE Coin Price Continues To Move ...,The Market Periodical,2021-09-25,https://themarketperiodical.com/2021/09/25/harmony-price-analysis-one-coin-price-continues-to-move-in-an-uptrend-despite-the-fall-in-market/
