Title,Publisher,Date,Link
"Cardano, Solana and Polkadot compete for dominance ahead of Ethereum's ETH2 upgrade",FXStreet,2021-08-13,https://www.fxstreet.com/cryptocurrencies/news/cardano-solana-and-polkadot-compete-for-dominance-ahead-of-ethereums-eth2-upgrade-202108130916
"Solana, Ethereum and Ethereum Classic Price Analysis: August 13",AMBCrypto,2021-08-13,https://ambcrypto.com/solana-ethereum-and-ethereum-classic-price-analysis-august-13/
"These Four Ethereum Competitors Are Set To Explode This Year, According to Altcoin Daily",The Daily Hodl,2021-08-13,https://dailyhodl.com/2021/08/13/these-four-ethereum-competitors-are-set-to-explode-this-year-according-to-altcoin-daily/
Why Polkadot traders must stay cautious,AMBCrypto,2021-08-13,https://ambcrypto.com/why-polkadot-traders-must-stay-cautious/
"Black Manta Identifies Leading Players, while STM Highlights ...",Securities.io,2021-08-13,https://www.securities.io/black-manta-identifies-leading-players-while-stm-highlights-tokenized-real-estate-digital-securities-weekly/
"IRS, in Boon to Crypto, Will Reportedly Ignore How Bill Defines Broker; Bitcoin Rises",CoinDesk,2021-08-13,https://www.coindesk.com/policy/2021/08/13/irs-in-boon-to-crypto-will-reportedly-ignore-how-bill-defines-broker-bitcoin-rises/
What Blockchain Oracles Do Not See,CoinDesk,2021-08-13,https://www.coindesk.com/markets/2021/08/13/what-blockchain-oracles-do-not-see/
Live Indices Prices: Get Indices Prices in Real-Time from FX ...,FXLeaders,2021-08-13,https://www.fxleaders.com/live-rates/indices/
Polygon ($MATIC): Coin Bureau Says Price 'Could Easily ...,Cryptoglobe,2021-08-13,https://www.cryptoglobe.com/latest/2021/08/polygon-matic-coin-bureau-says-price-could-easily-reach-5-by-end-of-2021/
