Title,Publisher,Date,Link
Ethereum Rival Solana Climbs to Seventh in Crypto Top 10,Bloomberg.com,2021-09-06,https://www.bloomberg.com/news/articles/2021-09-06/token-of-ethereum-rival-solana-jumps-to-seventh-in-crypto-top-10
Solana Leads Massive Altcoin And Bitcoin Rally As JPMorgan Warns Crypto Markets Are Looking Bubbly Again,Forbes,2021-09-06,https://www.forbes.com/sites/jonathanponciano/2021/09/06/solana-leads-massive-altcoin-rally-as-jpmorgan-warns-crypto-markets-are-looking-bubbly-again/
"This unlikely factor supported Bitcoin, Ethereum Options in August",AMBCrypto,2021-09-06,https://ambcrypto.com/this-unlikely-factor-assisted-bitcoin-ethereum-options-in-august/
Why U.S. Senator Elizabeth Warren Thinks Crypto Is “The New Shadow Bank” | Bitcoinist.com,Bitcoinist,2021-09-06,https://bitcoinist.com/why-u-s-senator-elizabeth-warren-thinks-crypto-is-the-new-shadow-bank/
Binance Coin (BNB/USD) On A Bullish Run - Ascending ...,FXLeaders,2021-09-06,https://www.fxleaders.com/news/2021/09/06/binance-coin-bnb-usd-on-a-bullish-run-ascending-triangle-in-play/
Senegalese worried over progress made Akon crypto city,Cryptopolitan,2021-09-06,https://www.cryptopolitan.com/senegalese-worried-over-akon-crypto-city/
Who created nft,Cryptopolitan,2021-09-06,https://www.cryptopolitan.com/who-created-nft/
The Crypto Market in 2021 a Detailed Analysis by Adel Al ...,Crypto News,2021-09-06,https://cryptonews.com/news/the-crypto-market-in-2021-a-detailed-analysis-by-adel-al-shirawi.htm
What is crypto staking? Best staking coins in 2021,FXStreet,2021-09-06,https://www.fxstreet.com/cryptocurrencies/news/what-is-crypto-staking-best-staking-coins-in-2021-202109060807
Jeegar Chauhan's Dhuandhaar trailer ignites an array of appreciation by the audience post-release,MyNation,2021-09-06,https://www.mynation.com/entertainment/jeegar-chauhan-s-dhuandhaar-trailer-ignites-an-array-of-appreciation-by-the-audience-post-release-vpn-qz03v2
Sam Bankman-Fried's 'Test' NFT on Sale as FTX Eyes Marketplace Launch,Decrypt,2021-09-06,https://decrypt.co/80282/sam-bankman-fried-test-nft-sale-ftx-eyes-marketplace-launch
"Ethereum, MATIC, Tron Price Analysis: 06 September",AMBCrypto,2021-09-06,https://ambcrypto.com/ethereum-matic-tron-price-analysis-06-september/
"Bitcoin Cash, EOS, Axie Infinity Price Analysis: 06 September",AMBCrypto,2021-09-06,https://ambcrypto.com/bitcoin-cash-eos-axie-infinity-price-analysis-06-september/
Here’s why crypto-mining rigs are in high demand in Vietnam,AMBCrypto,2021-09-06,https://ambcrypto.com/heres-why-crypto-mining-rigs-are-in-high-demand-in-vietnam/
Ethereum can expect prices to hike when this happens,AMBCrypto,2021-09-06,https://ambcrypto.com/ethereum-can-expect-prices-to-hike-when-this-happens/
Digital Eyes NFT Information about listing in Digital Eyes,Publicist Paper,2021-09-06,https://publicistpaper.com/digital-eyes-nft-information-about-listing-in-digital-eyes/
