Title,Publisher,Date,Link
Bitcoin whales are betting $40K isn't the top as data hints bull run is only beginning,Cointelegraph,2021-01-20,https://cointelegraph.com/news/bitcoin-whales-are-betting-40k-isn-t-the-top-as-data-hints-bull-run-is-only-beginning
Brave Browser Takes Steps Toward Web 3.0 by Integrating IPFS,BeInCrypto,2021-01-20,https://beincrypto.com/brave-browser-web-3-0-integrating-ipfs/
Firo is latest proof-of-work coin to suffer 51% attack; 306 blocks rolled back,AMBCrypto,2021-01-20,https://ambcrypto.com/firo-is-latest-proof-of-work-coin-to-suffer-51-attack-306-blocks-rolled-back/
"Lightspeed, Pantera Join $20M Raise for Crypto Market Maker Wintermute",CoinDesk,2021-01-20,https://www.coindesk.com/business/2021/01/20/lightspeed-pantera-join-20m-raise-for-crypto-market-maker-wintermute/
"$7.8Trn Asset Manager, Blackrock Tells the SEC It Could Start Trading Bitcoin Futures",Coinfomania,2021-01-20,https://coinfomania.com/blackrock-sec-filing-bitcoin-futures-trading/
Crypto Lending Platform Celsius Announces $5.3 Billion in AUM,Coinfomania,2021-01-20,https://coinfomania.com/crypto-lender-celsius-announces-5b-in-aum/
Why Big Mac’s price should encourage Bitcoin staking,AMBCrypto,2021-01-20,https://ambcrypto.com/why-big-macs-price-should-encourage-bitcoin-staking/
Analyst Lyn Alden Says Ethereum Is Still an 'Unfinished ...,Bitcoin.com News,2021-01-20,https://news.bitcoin.com/analyst-lyn-alden-says-ethereum-is-still-an-unfinished-project/
4-Hour Work Week Author Tim Ferriss Shares His Thoughts ...,Cryptoglobe,2021-01-20,https://www.cryptoglobe.com/latest/2021/01/4-hour-work-week-author-tim-ferriss-shares-his-thoughts-about-bitcoin/
