Title,Publisher,Date,Link
Should You (or Anyone) Buy Solana (SOL)?,Nasdaq,2021-08-24,https://www.nasdaq.com/articles/should-you-or-anyone-buy-solana-sol-2021-08-24
Solana [SOL] Launched On Phemex On 20th Aug,UseTheBitcoin,2021-08-24,https://usethebitcoin.com/solana-sol-launched-on-phemex-on-20th-aug/
"Ether, Cardano and Solana Outlook: Bitwise's Matt Hougan",Business Insider,2021-08-24,https://www.businessinsider.com/ether-ethereum-bullish-cardano-solana-crypto-strategy-bitwise-matt-hougan-2021-8
Terra Token LUNA Sets Another New All-Time High,Crypto Briefing,2021-08-24,https://cryptobriefing.com/terra-token-luna-sets-another-new-all-time-high/
VORTECS™ Report: CT Markets Pro's algorithmic indicators identify half of the week's best-performing assets,Cointelegraph,2021-08-24,https://cointelegraph.com/news/vortecs-report-ct-markets-pro-s-algorithmic-indicators-identify-half-of-the-week-s-best-performing-assets
CENTRE Consortium To Change The Reserves Composition ...,Futures Magazine,2021-08-24,http://m.futuresmag.com/2021/08/24/centre-consortium-change-reserves-composition-usdc
Experts believe Cardano will displace Ethereum as the second-largest crypto as ADA prepares for 400% breakout,FXStreet,2021-08-24,https://www.fxstreet.com/cryptocurrencies/news/experts-believe-cardano-will-displace-ethereum-as-the-second-largest-crypto-as-ada-prepares-for-400-breakout-202108240826
Ethereum Looks Ready for a Supply Shock,Crypto Briefing,2021-08-24,https://cryptobriefing.com/ethereum-looks-ready-supply-shock/
The Birth of the ITO and the Democratization of the Metaverse,Cryptopolitan,2021-08-24,https://www.cryptopolitan.com/the-birth-of-the-ito-and-the-democratization-of-the-metaverse/
DeFi Exchange SushiSwap Builds on Avalanche as Part of $180M Incentive Program,CoinDesk,2021-08-24,https://www.coindesk.com/business/2021/08/24/defi-exchange-sushiswap-builds-on-avalanche-as-part-of-180m-incentive-program/
"Banking executives assert Bitcoin, Ethereum and XRP will replace fiat currencies by 2026",FXStreet,2021-08-24,https://www.fxstreet.com/cryptocurrencies/news/banking-executives-assert-bitcoin-ethereum-and-xrp-will-replace-fiat-currencies-by-2026-202108241317
Bitcoin Cash to $800 might just play out like this,AMBCrypto,2021-08-24,https://ambcrypto.com/bitcoin-cash-to-800-might-just-play-out-like-this/
XRP might eye another surge but short-sellers could play spoilsport,AMBCrypto,2021-08-24,https://ambcrypto.com/xrp-might-eye-another-surge-but-short-sellers-could-play-spoilsport/
Blockchain Startup InfStones Raises $10M in Series A Funding Round,CoinDesk,2021-08-24,https://www.coindesk.com/markets/2021/08/24/blockchain-startup-infstones-raises-10m-in-series-a-funding-round/
Binance dismisses allegations of ‘market manipulation’ by supposed ex-employee,AMBCrypto,2021-08-24,https://ambcrypto.com/binance-dismisses-allegations-of-market-manipulation-by-supposed-ex-employee/
FUN Token Launches DPLAY Casino to Promote Decentralization in iGaming,AMBCrypto,2021-08-24,https://ambcrypto.com/fun-token-launches-dplay-casino-to-promote-decentralization-in-igaming/
Will everyone realize this ‘reality’ about El Salvador’s adoption of Bitcoin as legal tender,AMBCrypto,2021-08-24,https://ambcrypto.com/will-everyone-realize-this-reality-about-el-salvadors-adoption-of-bitcoin-as-legal-tender/
"Tether Announces USDT Supply Peak, Crypto Twitter Cheers ...",BeInCrypto,2021-08-24,https://beincrypto.com/tether-usdt-supply-peak-crypto-twitter-cheers-jeers/
Bitcoin BEP2 Price Prediction for 2022-2026,CryptoNewsZ,2021-08-24,https://www.cryptonewsz.com/forecast/bitcoin-bep2-price-prediction/
Artificial intelligence to replace these professions: Doctors and Journalists at the fore,Tech Lapse,2021-08-24,https://techlapse.com/ai/artificial-intelligence-terrorizes-the-future-of-jobs-doctors-and-journalists-at-the-fore/
