Title,Publisher,Date,Link
Altcoins nurse double-digit losses as Bitcoin bulls fight to retake $49K,Cointelegraph,2021-02-23,https://cointelegraph.com/news/altcoins-nurse-double-digit-losses-as-bitcoin-bulls-fight-to-retake-49k
Doubled in a Week: Why Is Solana (SOL) Rising?,Somag News,2021-02-23,https://www.somagnews.com/doubled-in-a-week-why-is-solana-sol-rising/
Discover Student Coin and Start Exploring New Utilities of ...,Crypto News,2021-02-23,https://cryptonews.com/news/discover-student-coin-and-start-exploring-new-utilities-of-c-9313.htm
Ethereum: Here’s Buterin’s take on the prospect of miners leaving,AMBCrypto,2021-02-23,https://ambcrypto.com/ethereum-heres-buterins-take-on-the-prospect-of-miners-leaving/
Bitcoin under $50k: Here’s the best option for traders right now,AMBCrypto,2021-02-23,https://ambcrypto.com/bitcoin-under-50k-heres-the-best-option-for-traders-right-now/
Crypto Custody Platform Koine Goes Into Insolvency,CoinDesk,2021-02-23,https://www.coindesk.com/business/2021/02/23/crypto-custody-platform-koine-goes-into-insolvency/
How Coinbase Is Worth $100B,CoinDesk,2021-02-23,https://www.coindesk.com/business/2021/02/23/how-coinbase-is-worth-100b/
"Central Banks of China, UAE Join Blockchain-Based CBDC Payments Project",CoinDesk,2021-02-23,https://www.coindesk.com/tech/2021/02/23/central-banks-of-china-uae-join-blockchain-based-cbdc-payments-project/
