Title,Publisher,Date,Link
Alchemy Pay to launch virtual crypto cards with Visa and Mastercard support,Cointelegraph,2021-08-09,https://cointelegraph.com/news/alchemy-pay-to-launch-virtual-crypto-cards-with-visa-and-mastercard-support
"No, Bitcoin isn’t entering a 2018-like bear cycle, new data suggests, as BTC targets $45K",Cointelegraph,2021-08-09,https://cointelegraph.com/news/no-bitcoin-isn-t-entering-a-2018-like-bear-cycle-new-data-suggests-as-btc-targets-45k
Twelve Days In Office and Crisis Swamps Peru's Leftist ...,Bloomberg.com,2021-08-09,https://www.bloomberg.com/news/articles/2021-08-09/twelve-days-in-office-and-crisis-swamps-peru-s-leftist-president
The evolving relationship between Bitcoin and the Kimchi premium,AMBCrypto,2021-08-09,https://ambcrypto.com/the-evolving-relationship-between-bitcoin-and-the-kimchi-premium/
Evolution Land: Land economics in the Metaverse,AMBCrypto,2021-08-09,https://ambcrypto.com/evolution-land-land-economics-in-the-metaverse/
Former Goldman Sachs Exec Raoul Pal Says Ethereum Is the ...,Cryptoglobe,2021-08-09,https://www.cryptoglobe.com/latest/2021/08/former-goldman-sachs-exec-raoul-pal-says-ethereum-is-the-greatest-trade/
US senators reach last-minute compromise on cryptocurrency regulations as infrastructure bill vote looms,The Register,2021-08-09,https://www.theregister.com/2021/08/09/us_cryptocurrency_regulations/
