Title,Publisher,Date,Link
"3 Cryptos for Giant Gains in 2022: Solana (SOL), Cardano (ADA), and FIREPIN (FRPN)",Coinspeaker,2022-04-26,https://www.coinspeaker.com/giant-gains-2022-solana-cardano-firepin/
SOL Crypto Will Soar With Its Popularity as a Web 3.0 Platform,InvestorPlace,2022-04-26,https://investorplace.com/2022/04/sol-crytpto-will-soar-over-the-next-several-years-with-the-growth-of-web-3-0/
"How Binance Smart Chain (BNB) Solana (SOL), and Quitriam ...",Cyprus Mail,2022-04-26,https://cyprus-mail.com/2022/04/26/how-binance-smart-chain-bnb-solana-sol-and-quitriam-finance-qtm-are-solving-defi-problems/
"Solana, ApeCoin, EOS Price Analysis: 26 April",AMBCrypto,2022-04-26,https://ambcrypto.com/solana-apecoin-eos-price-analysis-26-april/
"Seesaw Protocol (SSW) Soars After Its Launch, Competing for Top Spot With Heavyweights Like Solana (SOL) And Dogecoin (DOGE)",CryptoMode,2022-04-26,https://cryptomode.com/seesaw-protocol-ssw-soars-after-its-launch-competing-for-top-spot-with-heavyweights-like-solana-sol-and-dogecoin-doge/
It’s the NFT era - Are these coins the perfect investment ...,Cyprus Mail,2022-04-26,https://cyprus-mail.com/2022/04/26/its-the-nft-era-are-these-coins-the-perfect-investment-solana-decentraland-and-parody-coin/
Ethereum on-chain data hints at further downside for ETH price,Cointelegraph,2022-04-26,https://cointelegraph.com/news/ethereum-on-chain-data-hints-at-further-downside-for-eth-price
3 Cryptos to Buy and Hold Forever Not Named Bitcoin or ...,InvestorPlace,2022-04-26,https://investorplace.com/2022/04/3-cryptos-to-buy-and-hold-forever-not-named-bitcoin-or-ethereum/
Top 3 Money Makers of the Crypto World? Pacman Frog (PAC ...,NewsBTC,2022-04-26,https://www.newsbtc.com/press-releases/top-3-money-makers-of-the-crypto-world-pacman-frog-pac-ripple-xrp-and-avalanche-avax/
Cardano price analysis: Bullish trend halted by bears as ADA ...,Cryptopolitan,2022-04-26,https://www.cryptopolitan.com/cardano-price-analysis-2022-04-26/
Fiesta Del Sol Annual Beach Music Festival,There San Diego,2022-04-26,https://theresandiego.com/event/fiesta-del-sol-beach-music-festival/
"Meta to launch its first meta store: Portal, Ray-Ban Stories, and ...",Cryptopolitan,2022-04-26,https://www.cryptopolitan.com/meta-to-launch-its-first-meta-store/
Here’s why the growth of token staking could be bullish for Lido (LDO),Cointelegraph,2022-04-26,https://cointelegraph.com/news/here-s-why-the-growth-of-token-staking-could-be-bullish-for-lido-ldo
"Hong Kong Monetary Authority Launches Regtech Knowledge Hub, Bitcoin Rises",Outlook India,2022-04-26,https://www.outlookindia.com/business/hong-kong-monetary-authority-launches-regtech-knowledge-hub-bitcoin-rises-news-193361
"Ethereum, Fantom, PancakeSwap Price Analysis: 26 April",AMBCrypto,2022-04-26,https://ambcrypto.com/ethereum-fantom-pancakeswap-price-analysis-26-april/
Cyprus cricket prepares for new season,Cyprus Mail,2022-04-26,https://cyprus-mail.com/2022/04/26/cyprus-cricket-prepares-for-new-season/
NewTribe Capital Joins Paris Blockchain Week Summit,Cryptopolitan,2022-04-26,https://www.cryptopolitan.com/newtribe-capital-joins-paris-blockchain-week-summit/
MetaMakerz May is Going to be Amazing!,Crypto News,2022-04-26,https://cryptonews.com/news/metamakerz-may-going-amazing.htm
On-chain sleuth uncovers hackers behind majority of NFT ...,Cryptopolitan,2022-04-26,https://www.cryptopolitan.com/sleuth-uncovers-nft-discord-hacks/
Scammers hijacked BAYC’s Instagram page to steal $2.5 ...,Cryptopolitan,2022-04-26,https://www.cryptopolitan.com/scammers-hijacked-bayc-instagram-page/
XRP Price Prediction: Ripple spells trouble,FXStreet,2022-04-26,https://www.fxstreet.com/cryptocurrencies/news/ripple-price-undergoes-rejection-against-a-technical-cap-in-a-downtrend-202204261247
Why Pacman Frog (PAC) could be the next big crypto — Can it ...,Techpoint Africa,2022-04-26,https://techpoint.africa/2022/04/26/pacman-frog-next-big-crypto
How Sheesha Finance Is Making Portfolio Diversification Simple,Cryptopolitan,2022-04-26,https://www.cryptopolitan.com/how-sheesha-finance-is-making-portfolio-diversification-simple/
Could HUH Token Overtake The Big Players Like Ethereum ...,Crypto News,2022-04-26,https://cryptonews.com/news/could-huh-token-overtake-big-players-like-ethereum-eth-binance-bnb.htm
hi: A Next-Gen Crypto Exchange and Mobile Banking Platform,CryptoPotato,2022-04-26,https://cryptopotato.com/hi-a-next-gen-crypto-exchange-and-mobile-banking-platform/
How to store Bitcoin on MetaMask,Cointelegraph,2022-04-26,https://cointelegraph.com/news/how-to-store-bitcoin-on-metamask
"Ethereum L2 Coins Like Polygon (MATIC) Having A Rough Year While L1s Walk Toe-To-Toe, Says Research",Benzinga,2022-04-26,https://www.benzinga.com/news/22/04/26805056/2022-proving-to-be-a-terrible-year-for-layer-2-coins-such-as-matic-but-layer-1s-like-solana-luna-mov
Cypriot advisers weigh in on child hepatitis outbreak after ...,Cyprus Mail,2022-04-26,https://cyprus-mail.com/2022/04/26/cypriot-advisers-weigh-in-on-child-hepatitis-outbreak-after-uptick-in-cases-abroad/
"Shiba Inu Is The Strongest Growing Google Trend in 98 Countries, Ethereum Nudges Ahead of Bitcoin",CryptoMode,2022-04-26,https://cryptomode.com/shiba-inu-is-the-strongest-growing-google-trend-in-98-countries-ethereum-nudges-ahead-of-bitcoin/
Decoding the effects of 1M DOGE tip to Dogecoin Foundation,AMBCrypto,2022-04-26,https://ambcrypto.com/decoding-the-effects-of-1m-doge-tip-to-dogecoin-foundation-on-price/
FaniTrade has Solana's largest NFT airdrop to date valued at ...,Trading U,2022-04-26,https://trading-u.com/ecampus/fanitrade-has-solanas-largest-nft-airdrop-to-date-valued-at-55-7-million-with-the-fanibooster-starter-pack-cryptomode/
