Title,Publisher,Date,Link
Solana price approaches launching pad that could propel SOL by 40%,FXStreet,2022-02-20,https://www.fxstreet.com/cryptocurrencies/news/solana-price-approaches-launching-pad-that-could-propel-sol-by-40-202202200800
"Analyst Says Bitcoin (BTC) Bulls on Life Support, Updates Outlook Ethereum (ETH), Solana (SOL) and Cardano ...",The Daily Hodl,2022-02-20,https://dailyhodl.com/2022/02/20/analyst-says-bitcoin-btc-bulls-on-life-support-updates-outlook-ethereum-eth-solana-sol-and-cardano-ada/
Avalanche price analysis: AVAX loses value at $78.8,Cryptopolitan,2022-02-20,https://www.cryptopolitan.com/avalanche-price-analysis-2022-02-20/
Future of finance: US banks partner with crypto custodians,Cointelegraph,2022-02-20,https://cointelegraph.com/news/future-of-finance-us-banks-partner-with-crypto-custodians
"News Round-Up: Polygon, Avalanche and Algorand ...",Securities.io,2022-02-20,https://www.securities.io/news-round-up-polygon-avalanche-and-algorand-ecosystems/
First Look at Natalie Portman as Thor in Love and Thunder,D1SoftballNews.com,2022-02-20,https://d1softballnews.com/first-look-at-natalie-portman-as-thor-in-love-and-thunder/
