Title,Publisher,Date,Link
Solana: This report on latest outage could be a relief to SOL investors,AMBCrypto,2022-05-04,https://ambcrypto.com/solana-this-report-on-latest-outage-could-be-a-relief-to-sol-investors/
"Bloomberg Analyst Says Says One Ethereum Competitor To Outlast the Rest, Makes Huge Long Term Bitcoin",The Daily Hodl,2022-05-04,https://dailyhodl.com/2022/05/04/bloomberg-analyst-says-says-one-ethereum-competitor-to-outlast-the-rest-makes-huge-long-term-bitcoin/
The Ultimate Comparison Guide Between Avalanche and ...,Altcoin Buzz,2022-05-04,https://www.altcoinbuzz.io/top-article/the-ultimate-comparison-guide-between-avalanche-and-solana/
"Bitcoin and Ethereum Try to Recover, APE Pumps and Dumps ...",Crypto News,2022-05-04,https://cryptonews.com/news/bitcoin-and-ethereum-try-to-recover-ape-pumps-and-dumps-on-musks-move.htm
Institutions Trigger Fourth Straight Week of Outflows From Crypto Markets Amid Rate Hike Uncertainty: CoinS...,The Daily Hodl,2022-05-04,https://dailyhodl.com/2022/05/04/institutions-trigger-fourth-straight-week-of-outflows-from-crypto-markets-amid-rate-hike-uncertainty-coinshares/
"Bitcoin price triggers relief rally to $42,000",FXStreet,2022-05-04,https://www.fxstreet.com/cryptocurrencies/news/bitcoin-price-triggers-relief-rally-to-42-000-202205041446
CoinMarketCap launches The Capital conference in the Metaverse,Cointelegraph,2022-05-04,https://cointelegraph.com/press-releases/coinmarketcap-launches-the-capital-conference-in-the-metaverse
How Scalable Quantum-Safe Blockchains Help Against Network Outages,NewsBTC,2022-05-04,https://www.newsbtc.com/news/company/how-scalable-quantum-safe-blockchains-help-aganist-network-outages/
3 key metrics signal Terra (LUNA) price is preparing for a recovery,Cointelegraph,2022-05-04,https://cointelegraph.com/news/3-key-metrics-signal-terra-luna-price-is-preparing-for-a-recovery
California governor issues blockchain executive order building on US President’s regulatory efforts,Cointelegraph,2022-05-04,https://cointelegraph.com/news/california-governor-issues-blockchain-executive-order-building-on-us-president-s-regulatory-efforts
Standing Committee On Finance Meets Indian Crypto Players; Bitcoin Rises,Outlook India,2022-05-04,https://www.outlookindia.com/business/standing-committee-on-finance-meets-indian-crypto-players-bitcoin-rises-news-194907
"Bitcoin and Ethereum Accelerate, ADA, SOL, and More ...",Crypto News,2022-05-04,https://cryptonews.com/news/bitcoin-and-ethereum-accelerate-ada-sol-and-more-altcoins-rally.htm
Bitcoin Up 6% on Fed Rate Announcement,The Motley Fool,2022-05-04,https://www.fool.com/the-ascent/cryptocurrency/articles/bitcoin-up-6-on-fed-rate-announcement/
The Phantom NFT collection by Disney artist Michael Kutsche has just been announced,MyNation,2022-05-04,https://www.mynation.com/business/the-phantom-nft-collection-by-disney-artist-michael-kutsche-has-just-been-announced-vpn-rbcvbx
Investing In Velas (VLX) – Everything You Need to Know,Securities.io,2022-05-04,https://www.securities.io/investing-in-velas-vlx-everything-you-need-to-know/
Reasons why Algorand [ALGO] traders shouldn’t be disappointed in short-term,AMBCrypto,2022-05-04,https://ambcrypto.com/reasons-why-algorand-algo-traders-shouldnt-be-disappointed/
Crypto Index Tracker – Crypto Markets Plunge,The Daily Hodl,2022-05-04,https://dailyhodl.com/2022/05/04/crypto-index-tracker-crypto-markets-plunge/
Solana-based Move-to-Earn Platform STEPN Hits 2.3 Million Active Users,Coinfomania,2022-05-04,https://coinfomania.com/stepn-hits-2-3-million-active-users/
How to make millions with Solana (SOL) PancakeSwap ...,Trading U,2022-05-04,https://trading-u.com/ecampus/how-to-make-millions-with-solana-sol-pancakeswap-cake-and-chronoly-crno/
LA Kings launches its first NFT auction by Crypto.com,Cryptopolitan,2022-05-04,https://www.cryptopolitan.com/la-kings-launches-its-first-nft-auction/
Top 5 Metaverse Crypto Coins Below $30 Million Market Cap ...,The VR Soldier,2022-05-04,https://thevrsoldier.com/top-5-metaverse-crypto-coins-below-30-million-market-cap-to-watch-in-may-2022/
