Title,Publisher,Date,Link
Ominous Solana technicals hint at SOL price crashing 35% by September,Cointelegraph,2022-08-13,https://cointelegraph.com/news/ominous-solana-technicals-hint-at-sol-price-crashing-35-by-september
The SOL goes on – All the reasons behind Solana’s latest uptick,AMBCrypto,2022-08-13,https://ambcrypto.com/the-sol-goes-on-all-the-reasons-behind-solanas-latest-uptick/
Solana price analysis: SOL price surges by 11 percent as it ...,Cryptopolitan,2022-08-13,https://www.cryptopolitan.com/solana-price-analysis-2022-08-13/
"Bitcoin, Solana, and Persystic Token: Who Will Lead The Recovery Rally?",CryptoMode,2022-08-13,https://cryptomode.com/bitcoin-solana-and-persystic-token-who-will-lead-the-recovery-rally/
"HypaSwap, Bitcoin, and Solana – Crypto Crash 2022 Buy For ...",NewsBTC,2022-08-13,https://www.newsbtc.com/press-releases/hypaswap-bitcoin-and-solana-crypto-crash-2022-buy-for-massive-bull-run-profits/
"Here’s What’s Next for Bitcoin, Ethereum, Solana and One Gaming Altcoin, According to Top Crypto Trader",The Daily Hodl,2022-08-13,https://dailyhodl.com/2022/08/13/heres-whats-next-for-bitcoin-ethereum-solana-and-one-gaming-altcoin-according-to-top-crypto-trader/
"Polkadot, Solana, and GryffinDAO: Three Crypto Tokens to Watch in This Crypto Winter",CryptoMode,2022-08-13,https://cryptomode.com/polkadot-solana-and-gryffindao-three-crypto-tokens-to-watch-in-this-crypto-winter/
GNOX (GNOX) Record Presale Sell-out Rumored To Be Caused By Ethereum (ETH) And Solana (SOL) Whales,Coinpedia,2022-08-13,https://coinpedia.org/press-release/gnox-record-presale-sell-out-rumored-to-be-caused-by-ethereum-solana-whales/
Crypto Market Daily Highlights – ADA Led the Top Ten in a ...,FX Empire,2022-08-13,https://www.fxempire.com/forecasts/article/crypto-market-daily-highlights-ada-led-the-top-ten-in-a-mixed-session-1095840
Mark Cuban Is Watching These 6 Cryptos Right Now. Should You?,Nasdaq,2022-08-13,https://www.nasdaq.com/articles/mark-cuban-is-watching-these-6-cryptos-right-now.-should-you
"ROSEN, RECOGNIZED INVESTOR COUNSEL, Encourages ...",Longview News-Journal,2022-08-13,https://www.news-journal.com/rosen-recognized-investor-counsel-encourages-solana-investors-with-losses-to-secure-counsel-before-important-deadline/article_e0165f4a-ce97-5aa4-9d2b-5e3a70b218e6.html
Best Decentralized Tokens To Rule The Metaverse: Petrousus ...,The VR Soldier,2022-08-13,https://thevrsoldier.com/best-decentralized-tokens-to-rule-the-metaverse-petrousus-and-the-sandbox/
FTX and Paradigm Join Forces to Unveil Crypto Futures Spread Trading,CryptoPotato,2022-08-13,https://cryptopotato.com/ftx-and-paradigm-join-forces-to-unveil-crypto-futures-spread-trading/
3 of the Best Cryptos for NFTs,The Motley Fool,2022-08-13,https://www.fool.com/investing/2022/08/13/3-best-cryptos-for-nfts/
3 Reasons I'm Buying This Crypto Hand Over Fist,Nasdaq,2022-08-13,https://www.nasdaq.com/articles/3-reasons-im-buying-this-crypto-hand-over-fist
"Mehracki, Binance Coin, and Chainlink Are The Next Tokens ...",Crypto Reporter,2022-08-13,https://www.crypto-reporter.com/news/mehracki-binance-coin-and-chainlink-are-the-next-tokens-rumored-to-explode-in-2022-35373/
"El precio de Ethereum supera los $2,000 en medio del hype ...",BeInCrypto,2022-08-13,https://es.beincrypto.com/precio-ethereum-eth-supera-2000-hype-fusion/
"Top Crypto Trader Plots What’s Next for Solana and Avalanche, Says Altcoins Ready To Explode by Up to 200% - The Daily Hodl",Inferse.com,2022-08-13,https://www.inferse.com/182564/top-crypto-trader-plots-whats-next-for-solana-and-avalanche-says-altcoins-ready-to-explode-by-up-to-200-the-daily-hodl/
"Crypto Price Analysis August-12: Ethereum, Binance Coin, Cardano, Solana, and Avalanche - CryptoPotato",Inferse.com,2022-08-13,https://www.inferse.com/182490/crypto-price-analysis-august-12-ethereum-binance-coin-cardano-solana-and-avalanche-cryptopotato/
Your Investments vs. a Bear Market: How to Come Out on Top,Nasdaq,2022-08-13,https://www.nasdaq.com/articles/your-investments-vs.-a-bear-market%3A-how-to-come-out-on-top
"Ethereum Faces Stiff Resistance at $2,000; Social Volume to Dictate Trend",CoinTrust.com,2022-08-13,https://www.cointrust.com/ethereum-news/ethereum-faces-stiff-resistance-at-2000-social-volume-to-dictate-trend
All Blacks v South Africa: All Blacks star Ardie Savea's strong ...,UP Jobs News,2022-08-13,https://upjobsnews.com/all-blacks-v-south-africa-all-blacks-star-ardie-saveas-strong-words-for-ian-foster-more-latest-news-here/
"Cryptocurrency News Live: RBI Has Started Work For Phased Implementation Of CBDC, Pankaj Chaudhary Says - ABP Live",Inferse.com,2022-08-13,https://www.inferse.com/182478/cryptocurrency-news-live-rbi-has-started-work-for-phased-implementation-of-cbdc-pankaj-chaudhary-says-abp-live/
Woman in her 50s bleeding from the head after hit-and-run in ...,UP Jobs News,2022-08-13,https://upjobsnews.com/woman-in-her-50s-bleeding-from-the-head-after-hit-and-run-in-christchurch-more-latest-news-here/
Kiwi student breaks nearly every bone in her body in rock ...,UP Jobs News,2022-08-13,https://upjobsnews.com/kiwi-student-breaks-nearly-every-bone-in-her-body-in-rock-climbing-fall-in-us-more-latest-news-here/
Dogecoin price shows signs of exhaustion as DOGE bulls disappear - FXStreet,Inferse.com,2022-08-13,https://www.inferse.com/183303/dogecoin-price-shows-signs-of-exhaustion-as-doge-bulls-disappear-fxstreet/
Antarctica – The lost world – HeritageDaily & More Latest ...,UP Jobs News,2022-08-13,https://upjobsnews.com/antarctica-the-lost-world-heritagedaily-more-latest-news-here/
"LUNA 2.0 price remains a rebellion coin, could trigger another rally soon - FXStreet",Inferse.com,2022-08-13,https://www.inferse.com/183057/luna-2-0-price-remains-a-rebellion-coin-could-trigger-another-rally-soon-fxstreet/
Shiba Inu Coin (SHIB) Price Prediction 2025-2030: How high will SHIB really go? - AMBCrypto News,Inferse.com,2022-08-13,https://www.inferse.com/183257/shiba-inu-coin-shib-price-prediction-2025-2030-how-high-will-shib-really-go-ambcrypto-news/
