Title,Publisher,Date,Link
Solana price could hit $122 target with Sam Bankman-Fried’s vision for SOL,FXStreet,2022-04-17,https://www.fxstreet.com/cryptocurrencies/news/solana-price-could-hit-122-target-with-sam-bankman-frieds-vision-for-sol-202204170830
"Algorand price could recover as Spain’s Air Europa, and TravelX drop NFT flight tickets",FXStreet,2022-04-17,https://www.fxstreet.com/cryptocurrencies/news/algorand-price-could-recover-as-spains-air-europa-and-travelx-drop-nft-flight-tickets-202204171503
"Price Analysis 4/17: BTC, ETH, BNB, XRP, SOL.",Coinfomania,2022-04-17,https://coinfomania.com/price-analysis-4-17-btc-eth-bnb-xrp/
"3 Must Buy Meme Tokens for 2022: Dogecoin (DOGE), Shiba ...",Crypto News,2022-04-17,https://cryptonews.com/news/3-must-buy-meme-tokens-for-2022-dogecoin-doge-shiba-inu-shib-parody-coin-paro.htm
Become an Overnight Sensation with these Cryptos. Calyx ...,Crypto News,2022-04-17,https://cryptonews.com/news/become-an-overnight-sensation-with-these-cryptos-calyx-token-clx-cardano-ada-terra-luna.htm
Kazakhstan to implement a new tax system for Bitcoin miners,Cryptopolitan,2022-04-17,https://www.cryptopolitan.com/kazakhstan-to-enact-tax-for-bitcoin-miners/
Top 3 Metaverse Crypto Coins With a Market Cap Below $95 ...,The VR Soldier,2022-04-17,https://thevrsoldier.com/top-3-metaverse-crypto-coins-with-a-market-cap-below-95-million-to-watch-in-april-2022/
