Title,Publisher,Date,Link
"What is Solana (SOL) Pay, and how does it work?",Cointelegraph,2022-03-13,https://cointelegraph.com/news/what-is-solana-sol-pay-and-how-does-it-work
Shiba Inu price action set to tank another 25% and print new yearly lows,FXStreet,2022-03-13,https://www.fxstreet.com/cryptocurrencies/news/shiba-inu-price-action-set-to-tank-another-25-and-printing-new-yearly-low-202203130910
Best NFT Projects With Great Potential In March 2022 - Blog,The Island Now,2022-03-13,https://theislandnow.com/blog-112/best-nft-projects/
"Privacy Crypto Assets XMR, ZEC See Double-Digit Gains ...",Bitcoin.com News,2022-03-13,https://news.bitcoin.com/privacy-crypto-assets-xmr-zec-see-double-digit-gains-amid-tightened-global-economy/
"A Deep Dive Into Near Protocol (NEAR) – Price Prediction, Features, And Tokenomics",Herald Sheets,2022-03-13,https://heraldsheets.com/a-deep-dive-into-near-protocol-near-price-prediction-features-and-tokenomics/
Pedro Troglio adds his first victory with San Lorenzo after beating Talleres de Córdoba,D1SoftballNews.com,2022-03-13,https://d1softballnews.com/pedro-troglio-adds-his-first-victory-with-san-lorenzo-after-beating-talleres-de-cordoba/
