Title,Publisher,Date,Link
$SOL: Coin Bureau Bullish on Solana for Altcoin Rally,Cryptoglobe,2022-08-21,https://www.cryptoglobe.com/latest/2022/08/sol-coin-bureau-bullish-on-solana-for-altcoin-rally/
Does Solana Have a Fixed Max Supply?,Watcher Guru,2022-08-21,https://watcher.guru/news/does-solana-have-a-fixed-max-supply
Tamadoge Makes Noise – Is TAMA A Better Alternative To SOL? | Global Online Money,Global Online Money,2022-08-21,https://globalonlinemony.com/tamadoge-makes-noise-is-tama-a-better-alternative-to-sol/
"Uniglo (GLO), Cardano (ADA), Solana (SOL) Could Generate Massive Gains For Their Holders This Autumn",CryptoMode,2022-08-21,https://cryptomode.com/uniglo-glo-cardano-ada-solana-sol-could-generate-massive-gains-for-their-holders-this-autumn/
"As Solana Opens Its Flagship Store, PrivaCrip Enters Presale | Bitcoinist.com",Bitcoinist,2022-08-21,https://bitcoinist.com/as-solana-opens-its-flagship-store-privacrip-enters-presale/
"Why 'buying the dip' with Solana, Ethereum, or Supontis ...",Digital Journal,2022-08-21,https://www.digitaljournal.com/business/why-buying-the-dip-with-solana-ethereum-or-supontis-token-is-a-good-idea/article
Audited: Gnox (GNOX) Is One Of The Safest Crypto Investments Ahead Of Ripple (XRP) And Solana (SOL) |,Bitcoinist,2022-08-21,https://bitcoinist.com/audited-gnox-gnox-is-one-of-the-safest-crypto-investments-ahead-of-ripple-xrp-and-solana-sol/
Solana price analysis: SOL touches $35 as the bearish drive ...,Cryptopolitan,2022-08-21,https://www.cryptopolitan.com/solana-price-analysis-2022-08-21/
8 Most Eco Friendly Crypto Coins in 2022,Business 2 Community,2022-08-21,https://www.business2community.com/cryptocurrency/most-eco-friendly-crypto
"Bragar Eagel & Squire, P.C. Reminds Investors That Class ...","Bragar Eagel & Squire, P.C. Reminds Investors That Class ...",2022-08-21,https://www.bdtonline.com/news/nation_world/bragar-eagel-squire-p-c-reminds-investors-that-class-action-lawsuits-have-been-filed/article_0ccc1731-4713-5dad-b518-1ccd6d9617f2.html
NFTs In A Nutshell: A Weekly Review | Bitcoinist.com,Bitcoinist,2022-08-21,https://bitcoinist.com/nfts-in-a-nutshell-a-weekly-review-63/
"Bragar Eagel & Squire, P.C. Reminds Investors That Class ...","Bragar Eagel & Squire, P.C. Reminds Investors That Class ...",2022-08-21,https://www.bdtonline.com/news/nation_world/bragar-eagel-squire-p-c-reminds-investors-that-class-action-lawsuits-have-been-filed/article_0ccc1731-4713-5dad-b518-1ccd6d9617f2.html
New Digital Asset Staking Service Available Via Gemini - Crowdfund Insider,CrowdFund Insider,2022-08-21,https://www.crowdfundinsider.com/2022/08/195009-new-digital-asset-staking-service-available-via-gemini/
"Polygon, NEAR Protocol, and Zompot Token: Altcoins with Potential of 200x Profit in the Bear Market",CryptoMode,2022-08-21,https://cryptomode.com/polygon-near-protocol-and-zompot-token-altcoins-with-potential-of-200x-profit-in-the-bear-market/
Crypto Market Forecast: Week of August 22nd 2022 » Brave ...,Brave New Coin,2022-08-21,https://bravenewcoin.com/insights/crypto-market-forecast-week-of-august-22nd-2022
Audited: Gnox (GNOX) Is One Of The Safest Crypto ...,Crypto News BTC,2022-08-21,https://cryptonewsbtc.org/2022/08/21/audited-gnox-gnox-is-one-of-the-safest-crypto-investments-ahead-of-ripple-xrp-and-solana-sol/
A new blockchain search engine Ora emerges from Solana ...,Crypto News BTC,2022-08-21,https://cryptonewsbtc.org/2022/08/21/a-new-blockchain-search-engine-ora-emerges-from-solana-hackathon/
"Ethereum Plunges 21% In Last 7 Days, Drops Below $1,600",RecentlyHeard,2022-08-21,https://recentlyheard.com/2022/08/21/ethereum-plunges-21-in-last-7-days-drops-below-1600/
3 Cryptos That Could Disrupt Financial Services - The Motley Fool,Inferse.com,2022-08-21,https://www.inferse.com/189128/3-cryptos-that-could-disrupt-financial-services-the-motley-fool/
Will Ethereum Cryptocurrency Flip Bitcoin at #1 | by Stephen ...,Crypto News BTC,2022-08-21,https://cryptonewsbtc.org/2022/08/21/will-ethereum-cryptocurrency-flip-bitcoin-at-1-by-stephen-dalton-aug-2022/
Institutional Investors Pile Into Ethereum (ETH) at Highest ...,Crypto News BTC,2022-08-21,https://cryptonewsbtc.org/2022/08/22/institutional-investors-pile-into-ethereum-eth-at-highest-rate-since-november-2021-coinshares/
Shiba Inu Coin (SHIB) Price Prediction 2025-2030: Will SHIB surge by 2800% in 2030? - AMBCrypto News,Inferse.com,2022-08-21,https://www.inferse.com/189117/shiba-inu-coin-shib-price-prediction-2025-2030-will-shib-surge-by-2800-in-2030-ambcrypto-news/
Where is Bitcoin price headed with threat of $2.97 billion selling pressure on BTC - FXStreet,Inferse.com,2022-08-21,https://www.inferse.com/189358/where-is-bitcoin-price-headed-with-threat-of-2-97-billion-selling-pressure-on-btc-fxstreet/
Epic Games Funds New P2E Blockchain-based Racing Game,RecentlyHeard,2022-08-21,https://recentlyheard.com/2022/08/21/epic-games-funds-new-p2e-blockchain-based-racing-game/
XRP Signals Considerable Uptick – Will Social Media Lift Its Price Past $0.34?,RecentlyHeard,2022-08-21,https://recentlyheard.com/2022/08/21/xrp-signals-considerable-uptick-will-social-media-lift-its-price-past-0-34/
‘Block’ Under Scrutiny by Consumer Financial Protection Bureau,RecentlyHeard,2022-08-21,https://recentlyheard.com/2022/08/22/block-under-scrutiny-by-consumer-financial-protection-bureau/
MTV Awards Adds Best Metaverse Performance Category,RecentlyHeard,2022-08-21,https://recentlyheard.com/2022/08/21/mtv-awards-adds-best-metaverse-performance-category/
