Title,Publisher,Date,Link
"Solana Labs, Multicoin Accused of Violating Securities Law by SOL Investor",CoinDesk,2022-07-06,https://www.coindesk.com/policy/2022/07/06/solana-labs-multicoin-accused-of-violating-securities-law-by-sol-investor/
"Solana Price Analysis: SOL Stuck in a Range, Breakout Inbound?",CryptoPotato,2022-07-06,https://cryptopotato.com/solana-price-analysis-sol-stuck-in-a-range-breakout-inbound/
Novel Utility Token Chronoly (CRNO) Launches in Pre-Sale to Compete with Solana (SOL),U.Today,2022-07-06,https://u.today/novel-utility-token-chronoly-crno-launches-in-pre-sale-to-compete-with-solana-sol
Why Solana price is far away from entering a bull rally,FXStreet,2022-07-06,https://www.fxstreet.com/cryptocurrencies/news/why-solana-price-is-far-away-from-entering-a-bull-rally-202207061437
"4 Altcoins to Surge 5x to 10x – SOL, DOT, AVAX & NEAR Price to Thrive in the Upcoming Cycle!",Coinpedia,2022-07-06,https://coinpedia.org/price-analysis/sol-dot-avax-near-price-to-thrive-in-the-upcoming-cycle/
"Mehracki , FTX Token and Axie Infinity - Cryptocurrencies ...",Deccan Herald,2022-07-06,https://www.deccanherald.com/brandspot/pr-spot/mehracki-ftx-token-and-axie-infinity-cryptocurrencies-keeping-warm-this-crypto-winter-2022-1124286.html
"Bitcoin and Ethereum Still Range-Bound, AVAX and SAND ...",Crypto News,2022-07-06,https://cryptonews.com/news/bitcoin-and-ethereum-still-range-bound-avax-and-sand-accelerate.htm
7 Cryptos to Watch as They Attempt to Break Out of ...,InvestorPlace,2022-07-06,https://investorplace.com/2022/07/7-cryptos-to-watch-as-they-attempt-to-break-out-of-consolidation/
"Makers Of Nothing Smartphone Get Into NFT In Build-Up Prior To Physical Launch, Bitcoin Up",Outlook India,2022-07-06,https://www.outlookindia.com/business/makers-of-nothing-smartphone-get-into-nft-in-build-up-prior-to-physical-launch-bitcoin-up-news-207239
"Jpex launches NFT index contracts for bull, bear market success",Cointelegraph,2022-07-06,https://cointelegraph.com/press-releases/jpex-launches-nft-index-contracts-for-bull-bear-market-success
Polygon Matic has the potential to hit a new ATH,Cryptopolitan,2022-07-06,https://www.cryptopolitan.com/polygon-matic-hit-a-new-ath/
Is Investing in Cryptocurrency Really Safe Right Now?,The Motley Fool,2022-07-06,https://www.fool.com/investing/2022/07/06/is-investing-in-cryptocurrency-really-safe-right-n/
Zebec Protocol Announces a New Partnership with Sypool,Securities.io,2022-07-06,https://www.securities.io/zebec-protocol-announces-a-new-partnership-with-sypool/
"NFTs to authenticate racing car parts: Nifty Newsletter, June 29–July 5",Cointelegraph,2022-07-06,https://cointelegraph.com/news/nfts-to-authenticate-racing-car-parts-nifty-newsletter-june-29-july-5
"Ripple tests NFT support and hires new lawyers to fight the SEC, setting XRP price up for a breakout",FXStreet,2022-07-06,https://www.fxstreet.com/cryptocurrencies/news/ripple-tests-nft-support-and-hires-new-lawyers-to-fight-the-sec-setting-xrp-price-up-for-a-breakout-202207060846
Crypto tax deters 83% Indian investors from crypto trading: WazirX report,Cointelegraph,2022-07-06,https://cointelegraph.com/news/crypto-tax-deters-83-indian-investors-from-crypto-trading-waxirx-report
"Tezos' XTZ price bottomed last time this happened, is history set to repeat?",FXStreet,2022-07-06,https://www.fxstreet.com/cryptocurrencies/news/tezos-xtz-price-bottomed-last-time-this-happened-is-history-set-to-repeat-202207062136
3 Cryptocurrencies That Will Shape the Future,The Motley Fool,2022-07-06,https://www.fool.com/investing/2022/07/06/3-cryptocurrencies-that-will-shape-the-future/
"Voyager Digital files for Chapter 11 bankruptcy, proposes recovery plan",Cointelegraph,2022-07-06,https://cointelegraph.com/news/voyager-digital-files-for-chapter-11-bankruptcy-proposes-recovery-plan
The bottom is in: CNBC’s Jim Cramer says crypto has ‘no real value’,Cointelegraph,2022-07-06,https://cointelegraph.com/news/the-bottom-is-in-cnbc-s-jim-cramer-says-crypto-has-no-real-value
"Mushe (XMU) Launches on UniSwap, Aims to be the Next ...",Crypto News,2022-07-06,https://cryptonews.com/news/mushe-xmu-launches-uniswap-aims-next-doge.htm
Security Token Market's 'Web3-Enabled' Tokenized ...,Securities.io,2022-07-06,https://www.securities.io/security-token-markets-first-web3-enabled-tokenized-crowdfund-goes-live/
Cardano ($ADA) Sees 13000 GitHub Commits in June as ...,Cryptoglobe,2022-07-06,https://www.cryptoglobe.com/latest/2022/07/cardano-ada-sees-13000-github-commits-in-june-as-development-activity-grows-ahead-of-vasil-hard-fork/
Top 5 Rollups Tokens to Watch in July 2022,The VR Soldier,2022-07-06,https://thevrsoldier.com/top-5-rollups-cryptocurrencies-to-watch-in-july-2022/
"Web3 will unite users from social media platforms, says Aave exec",Cointelegraph,2022-07-06,https://cointelegraph.com/news/web3-will-unite-users-from-social-media-platforms-says-aave-exec
NFT : Opensea dit adieu à son co-fondateur – La nouvelle ...,Journal Du Coin,2022-07-06,https://journalducoin.com/nft/opensea-adieu-co-fondateur/
"NFT platform wars could be ahead, says new DappRadar report",Cointelegraph,2022-07-06,https://cointelegraph.com/news/nft-platform-wars-could-be-ahead-says-new-dappradar-report
Royal Mint launches new Alan Turing 50p coin with hidden ...,NationalWorld,2022-07-06,https://www.nationalworld.com/recommended/royal-mint-coin-alan-turing-3757827
Q&A: What does the future of Web3 really look like?,Cointelegraph,2022-07-06,https://cointelegraph.com/news/qa-what-does-the-future-of-web3-really-look-like
What Is NFT Rug Pull?,Parhlo.com,2022-07-06,https://www.parhlo.com/what-is-nft-rug-pull/
"Bitmark Raises $5.6M, Launches Interoperable NFT Wallet",CoinDesk,2022-07-06,https://www.coindesk.com/business/2022/07/06/bitmark-raises-56m-launches-interoperable-nft-wallet/
$ADA: IOG's Olga Hryniuk Explains 'Key Features of the ...,Cryptoglobe,2022-07-06,https://www.cryptoglobe.com/latest/2022/07/ada-iogs-olga-hryniuk-explains-key-features-of-the-cardano-evm-sidechain/
How to Transfer Crypto from Binance to PayPal: Step-by-Step,Cryptoglobe,2022-07-06,https://www.cryptoglobe.com/latest/2022/07/how-to-transfer-crypto-from-binance-to-paypal-step-by-step/
Axie Infinity Ronin Bridge relaunches after hack,CryptoNewsPipe,2022-07-06,https://cryptonewspipe.com/axie-infinity-ronin-bridge-relaunches-after-hack/
BitBuy Comprehensive Review 2022 - Canadian Crypto ...,Coinrevolution,2022-07-06,https://coinrevolution.com/ca/cryptocurrency/bitbuy-review/
"Ripple effect: Health care providers, attorneys predict impact ...",Crypto News BTC,2022-07-06,https://cryptonewsbtc.org/2022/07/06/ripple-effect-health-care-providers-attorneys-predict-impact-of-dobbs-on-hoosier-women/
