Title,Publisher,Date,Link
How Much Does It Cost to Mine 1 Bitcoin?,Decrypt,2022-07-16,https://decrypt.co/105251/how-much-does-cost-mine-1-bitcoin
Crypto Price Alert: JPMorgan Reveals $160 Billion Bitcoin Bombshell,Forbes,2022-07-16,https://www.forbes.com/sites/billybambrough/2022/07/16/crypto-price-alert-jpmorgan-reveals-bitcoin-160-billion-bombshell/
On-Chain Data Shows Bitcoin Miners May Be Preparing To Dump | Bitcoinist.com,Bitcoinist,2022-07-16,https://bitcoinist.com/on-chain-data-shows-bitcoin-miners-preparing-dump/
Sweden Prefers Steel Over Bitcoin Miners as Power Gets Scarce,Bloomberg.com,2022-07-16,https://www.bloomberg.com/news/articles/2022-07-17/sweden-prefers-steel-over-bitcoin-miners-as-power-gets-scarce
"Paraguay’s Senate Passes Bill Regulating Bitcoin And Crypto Mining, Trading; Bitcoin Rises",Outlook India,2022-07-16,https://www.outlookindia.com/business/paraguay-s-senate-passes-bill-regulating-bitcoin-and-crypto-mining-trading-bitcoin-rises-news-209687
Bitcoin Gives Way To Ruble: Putin Signs Law Banning Crypto Payments In Russia | Bitcoinist.com,Bitcoinist,2022-07-16,https://bitcoinist.com/bitcoin-putin-signs-law-banning-crypto/
"Top Predictions for Bitcoin(BTC), Ethereum(ETH) & Ripple (XRP) Price By the End of 2022",Coinpedia,2022-07-16,https://coinpedia.org/price-analysis/top-predictions-for-bitcoinbtc-ethereumeth-ripple-xrp-price-by-the-end-of-2022/
"This Week in Coins: Ethereum Bounces Back, Bitcoin Slides, Russia Bans Crypto Payments",Decrypt,2022-07-16,https://decrypt.co/105273/this-week-in-coins-ethereum-bounces-back-bitcoin-slides-russia-bans-crypto-payments
"While the 'Timeline Isn't Final,' Ethereum Could Implement The ...",Bitcoin.com News,2022-07-16,https://news.bitcoin.com/while-the-timeline-isnt-final-ethereum-could-implement-merge-on-september-19/
India Calls on G20 to Bring Crypto Within Global 'Automatic ...,Bitcoin.com News,2022-07-16,https://news.bitcoin.com/india-calls-on-g20-to-bring-crypto-within-global-automatic-exchange-of-information-framework/
Bitcoin ATMs — An Easy Guide To Bitcoin Teller Machines,Nasdaq,2022-07-16,https://www.nasdaq.com/articles/bitcoin-atms-an-easy-guide-to-bitcoin-teller-machines
"Has Crypto (BTC, ETH) Contagion Run Its Course?",Bloomberg.com,2022-07-16,https://www.bloomberg.com/news/articles/2022-07-16/crypto-world-crosses-fingers-in-hopes-contagion-has-run-course
Billionaire Thomas Peterffy Plans to Buy Bitcoin Despite ...,Bitcoin.com News,2022-07-16,https://news.bitcoin.com/billionaire-thomas-peterffy-plans-to-buy-bitcoin-despite-concerns-btc-could-become-worthless-or-outlawed/
Why was Bitcoin created?,Cyprus Mail,2022-07-16,https://cyprus-mail.com/2022/07/16/why-was-bitcoin-created/
"'Rich Dad Poor Dad' author rips bitcoin, touts gold, bemoans inflation",Markets Insider,2022-07-16,https://markets.businessinsider.com/news/stocks/rich-poor-dad-radio-kiyosaki-bitcoin-crypto-gold-dollars-inflation-2022-7
Leading Monaco-based Yacht Company Now Accepting Bitcoin (BTC) and Shiba Inu (SHIB) as Payment Methods,Times Tabloid,2022-07-16,https://timestabloid.com/leading-monaco-based-yacht-company-now-accepting-bitcoin-btc-and-shiba-inu-shib-as-payment-methods/
Bitcoin on-Chain Analysis: UTXOs at Loss Surpasses 2019 ...,BeInCrypto,2022-07-16,https://beincrypto.com/bitcoin-on-chain-analysis-utxos-at-loss-surpasses-2019-bear-market/
Andorra green lights Bitcoin and blockchain with Digital Assets Act,Cointelegraph,2022-07-16,https://cointelegraph.com/news/andorra-green-lights-bitcoin-and-blockchain-with-digital-assets-act
BitMEX Explains Why Ethereum Has More Dapps Than Bitcoin,CryptoPotato,2022-07-16,https://cryptopotato.com/bitmex-explains-why-ethereum-has-more-dapps-than-bitcoin/
Bitcoin (BTC) Brushes off Inflation-fueled Losses but Faces an ...,Securities.io,2022-07-16,https://www.securities.io/bitcoin-btc-brushes-off-inflation-fueled-losses-but-faces-an-uphill-task-breaching-22k/
Articles by Alice Mackenzie,Bitcoin Magazine,2022-07-16,https://bitcoinmagazine.com/authors/alice-mackenzie
"DeFi Market Cap Dumped 75% in Q2, But User Activity Fared Better: Report",CryptoPotato,2022-07-16,https://cryptopotato.com/defi-market-cap-dumped-75-in-q2-but-user-activity-fared-better-report/
Have Bitcoin and Ethereum Bottomed Out? Top Trader Examines Path Forward for the Two Largest Crypto Assets,The Daily Hodl,2022-07-16,https://dailyhodl.com/2022/07/16/have-bitcoin-and-ethereum-bottomed-out-top-trader-examines-path-forward-for-the-two-largest-crypto-assets/
Crypto Mixers Usage From Cybercriminals Sees All-Time High: Chainalysis,CryptoPotato,2022-07-16,https://cryptopotato.com/crypto-mixers-usage-from-cybercriminals-sees-all-time-high-chainalysis/
"Meet Michael Saylor, the Bitcoin billionaire - The tech ...",Luxurylaunches,2022-07-16,https://luxurylaunches.com/celebrities/meet-michael-saylor.php
7 Bitcoin and Crypto Custodians Facilitating Institutional ...,Crypto News,2022-07-16,https://cryptonews.com/exclusives/7-bitcoin-crypto-custodians-facilitating-institutional-digital-asset-adoption.htm
"Under-the-Radar Altcoin Surges More Than 115% in Seven Days, Defying the Crypto Market Doldrums",The Daily Hodl,2022-07-16,https://dailyhodl.com/2022/07/16/under-the-radar-altcoin-surges-more-than-115-in-seven-days-defying-the-crypto-market-doldrums/
"Major Bitcoin Relief Rally Imminent As Sellers Lose Confidence, Says Crypto Analyst Nicholas Merten",The Daily Hodl,2022-07-16,https://dailyhodl.com/2022/07/16/major-bitcoin-relief-rally-imminent-as-sellers-lose-confidence-says-crypto-analyst-nicholas-merten/
Accused Bitfinex Bitcoin Money Launderer Granted ...,Bitcoin.com News,2022-07-16,https://news.bitcoin.com/accused-bitfinex-bitcoin-money-launderer-granted-permission-to-engage-in-legitimate-employment/
"Changpeng Zhao, Net Worth $65B - 'Remote Work Beats ...",Business 2 Community,2022-07-16,https://www.business2community.com/business-innovation/changpeng-zhao-net-worth-65b-on-remote-work-vs-office-work-02523713
"Stop Panicking And Invest In: Gnox (GNOX), Litecoin (LTC), And Bitcoin Cash (BCH)",CryptoMode,2022-07-16,https://cryptomode.com/stop-panicking-and-invest-in-gnox-gnox-litecoin-ltc-and-bitcoin-cash-bch/
"ETH Explodes 40% in Two Days, Here’s the Next Target (Ethereum Price Analysis)",CryptoPotato,2022-07-16,https://cryptopotato.com/eth-explodes-40-in-two-days-heres-the-next-target-ethereum-price-analysis/
What's Next for Very Bullish Rated Bitcoin Gold (BTG)?,InvestorsObserver,2022-07-16,https://www.investorsobserver.com/news/crypto-update/whats-next-for-very-bullish-rated-bitcoin-gold-btg-2
Why Bitcoin and Homesteading Are A Perfect Match,Crypto News,2022-07-16,https://cryptonews.com/videos/why-bitcoin-and-homesteading-are-a-perfect-match.htm
"Top Crypto Analysts Say These Cryptos Have The Best Long-term Value: Gnox (GNOX), Stacks (STX) And STEPN",Bitcoinist,2022-07-16,https://bitcoinist.com/top-crypto-analysts-say-these-cryptos-have-the-best-long-term-value-gnox-gnox-stacks-stx-and-stepn-gmt/
New Robinhood Listing Spurs Gains for Ethereum-Based Decentralized Exchange Crypto Project,The Daily Hodl,2022-07-16,https://dailyhodl.com/2022/07/16/new-robinhood-listing-spurs-gains-for-ethereum-based-decentralized-exchange-crypto-project/
Crypto Exchange Bit2Me Decides To Salvage 2gether Customers After The Account Block | Bitcoinist.com,Bitcoinist,2022-07-16,https://bitcoinist.com/crypto-bit2me-decides-salvage-2gether-customers/
WeWait: Adam Neumann's Flowcarbon Ebbs,Decrypt,2022-07-16,https://decrypt.co/105267/wewait-adam-neumanns-flowcarbon-ebbs
Over $150 Million Liquidated as ETH Price Skyrockets to a Monthly High,CryptoPotato,2022-07-16,https://cryptopotato.com/over-150-million-liquidated-as-eth-price-skyrockets-to-a-monthly-high/
"Latin Americans Most Bullish on Crypto, Ripple Study Found",CryptoPotato,2022-07-16,https://cryptopotato.com/latin-americans-most-bullish-on-crypto-ripple-study-found/
3 Crypto Stocks to Buy Ahead of a Crypto Rebound,The Motley Fool,2022-07-16,https://www.fool.com/investing/2022/07/16/3-crypto-stocks-to-buy-ahead-of-a-crypto-rebound/
This is the Level XRP Must Break to Defeat the Downtrend (Ripple Price Analysis),CryptoPotato,2022-07-16,https://cryptopotato.com/this-is-the-level-xrp-must-break-to-defeat-the-downtrend-ripple-price-analysis/
Texas crypto mines briefly shut down to help conserve power during heat wave,Washington Times,2022-07-16,https://www.washingtontimes.com/news/2022/jul/16/texas-crypto-mines-briefly-shut-down-help-conserve/
"Celsius Network Reveals Plans To Compensate Depositors Despite Massive $1,190,000,000 Balance Sheet Deficit",The Daily Hodl,2022-07-16,https://dailyhodl.com/2022/07/16/celsius-network-reveals-plans-to-compensate-depositors-despite-massive-1190000000-balance-sheet-deficit/
How to identify and avoid a crypto pump-and-dump scheme?,Cointelegraph,2022-07-16,https://cointelegraph.com/news/how-to-identify-and-avoid-a-crypto-pump-and-dump-scheme
"Cardano (ADA) Will Increase To $2.93 By 2025, Says Experts | Bitcoinist.com",Bitcoinist,2022-07-16,https://bitcoinist.com/cardano-ada-will-increase-to-2-93-by-2025-says-experts/
TeaDAO announcing rewards for contributing to the TeaDAO community from anywhere in the world | Bitcoinist.com,Bitcoinist,2022-07-16,https://bitcoinist.com/teadao-announcing-rewards-for-contributing-to-the-teadao-community-from-anywhere-in-the-world/
Ripple Survey Says 85% of Countries in the World Will Adopt This Class of Crypto Assets Within Four Years,The Daily Hodl,2022-07-16,https://dailyhodl.com/2022/07/16/ripple-survey-says-85-of-countries-in-the-world-will-adopt-this-class-of-crypto-assets-within-four-years/
John McAfee Partner Fined by the SEC For ICO and Pump and Dump Scams,CryptoPotato,2022-07-16,https://cryptopotato.com/john-mcafee-partner-fined-by-the-sec-for-ico-and-pump-and-dump-scams/
Crypto Exchange OKX Is Paying $20 Million-Plus To Sponsor ...,Cryptoglobe,2022-07-16,https://www.cryptoglobe.com/latest/2022/07/crypto-exchange-okx-is-paying-20-million-plus-to-sponsor-premier-league-football-club/
Ethereum’s centralized dApps may overshadow the decentralization of proof-of-stake,CryptoSlate,2022-07-16,https://cryptoslate.com/ethereums-centralized-dapps-may-overshadow-the-decentralization-of-proof-of-stake/
"Celsius’ Bankruptcy Is Unsurprising, Says Tezos Co-Founder",CryptoPotato,2022-07-16,https://cryptopotato.com/celsius-bankruptcy-is-unsurprising-says-tezos-co-founder/
6 Ways to Survive in the Bear Crypto Market,MakeUseOf,2022-07-16,https://www.makeuseof.com/how-to-survive-bear-crypto-market/
Polkadot’s Network Usage Remained Consistent in Q2 Despite Market Downturn: Report,CryptoPotato,2022-07-16,https://cryptopotato.com/polkadots-network-usage-remained-consistent-in-q2-despite-market-downturn-report/
Ripple Trading Volume Jumps 1500% Amid Crypto Bear,Crypto Briefing,2022-07-16,https://cryptobriefing.com/ripple-trading-volume-jumps-1500-amid-crypto-bear/
Why USDC Is Gaining Ground on USDT,Crypto News,2022-07-16,https://cryptonews.com/videos/ether-rallies-opensea-cuts-jobs-by-20-and-why-usdc-is-gaining-ground-on-usdt-cnbc-crypto-world.htm
Start-ups turn to crypto-native messaging platforms,CryptoSlate,2022-07-16,https://cryptoslate.com/start-ups-turn-to-crypto-native-messaging-platforms/
Claressa Shields 'Is a Bully' - WBO Champion Savannah ...,Business 2 Community,2022-07-16,https://www.business2community.com/sports/claressa-shields-is-a-bully-wbo-champion-savannah-marshall-02523767
Cardano [ADA] would need to climb past this level to break its bearish movement,AMBCrypto,2022-07-16,https://ambcrypto.com/cardano-ada-would-need-to-climb-past-this-level-to-break-its-bearish-movement/
TeaDAO announcing rewards for contributing to the TeaDAO ...,NewsBTC,2022-07-16,https://www.newsbtc.com/press-releases/teadao-announcing-rewards-for-contributing-to-the-teadao-community-from-anywhere-in-the-world/
"Crypto Bankruptcies: 3AC, Celsius and Voyager",Crypto News,2022-07-16,https://cryptonews.com/videos/three-crypto-bankruptcies-3ac-celsius-and-voyager-what-happens-now-ep-374.htm
"As Crypto Competition Heats Up, Here's What Smart Investors ...",The Motley Fool,2022-07-16,https://www.fool.com/investing/2022/07/16/as-crypto-competition-heats-up-heres-what-smart-in/
Ethereum Classic Price Prediction for July 17: ETC/USD ...,InsideBitcoins,2022-07-16,https://insidebitcoins.com/news/ethereum-classic-price-prediction-for-july-17-etc-usd-attracting-profits
What are Camilla and Jamie Jewitt of Love Island Up to Now ...,Business 2 Community,2022-07-16,https://www.business2community.com/celebrity/what-are-camilla-and-jamie-jewitt-love-island-doing-now-02523677
US Cryptomining's Energy Consumption Affects Rising Utility Bills? Lawmakers Say Investigation's Results are Disturbing,Tech Times,2022-07-16,https://www.techtimes.com/articles/278111/20220716/cryptominings-energy-consumption-affect-rising-utility-bills-lawmakers-investigations-results.htm
Experts sense trouble as Coinbase shuts down US affiliate ...,Cryptopolitan,2022-07-16,https://www.cryptopolitan.com/experts-trouble-coinbase-shuts-affiliate/
"Why Crypto Giants Celsius, 3AC, and Voyager All Filed for ...",Business Insider,2022-07-16,https://www.businessinsider.com/why-crypto-celsius-three-arrows-voyager-filed-bankruptcy-2022-7
Bad timing? Canadian condo project accepting crypto,The Real Deal,2022-07-16,https://therealdeal.com/2022/07/16/bad-timing-canadian-condo-project-accepting-crypto/
8 New Cryptocurrency Releases on Top Exchanges in 2022,Coinspeaker,2022-07-16,https://www.coinspeaker.com/8-new-cryptocurrency-releases-2022/
Ripple Co-Founder Jed McCaleb Made U-Turn on Selling His Last 5 Million XRP; Here's Why,U.Today,2022-07-16,https://u.today/ripple-co-founder-jed-mccaleb-made-u-turn-on-selling-his-last-5-million-xrp-heres-why
What is Immutable X? – The hidden Champion In the Crypto ...,CryptoTicker,2022-07-16,https://cryptoticker.io/en/what-is-immutable-x-invest-now/
Mona El Isa on The Future of Asset Management,Crypto News,2022-07-16,https://cryptonews.com/videos/mona-el-isa-enzyme-the-future-of-asset-management-452.htm
Anatoly Yakovenko on Why Solana Is Building the SAGA Phone,Crypto News,2022-07-16,https://cryptonews.com/videos/the-chopping-block-anatoly-yakovenko-on-why-solana-is-building-the-saga-phone-ep-373.htm
The History of the World’s First and the Largest Cryptocurrency-Bitcoin,AsumeTech,2022-07-16,https://asumetech.com/the-history-of-the-worlds-first-and-the-largest-cryptocurrency-bitcoin/
The Crypto Space Is Being Brought Down By Fear,Live Bitcoin News,2022-07-16,https://www.livebitcoinnews.com/the-crypto-space-is-being-brought-down-by-fear/
MiCA and ToFR: The EU moves to regulate the crypto-asset market,Cointelegraph,2022-07-16,https://cointelegraph.com/news/mica-and-tofr-the-eu-moves-to-regulate-the-crypto-asset-market
How to Buy WAGMI NFT? Easy Guide,CryptoTicker,2022-07-16,https://cryptoticker.io/en/how-to-buy-wagmi-nft-easy-guide/
Aishwary Strikes Gold in Men's 50m Rifle 3 Positions at Changwon Shooting World Cup Read ... - Latest,Latestly,2022-07-16,https://www.latestly.com/socially/india/news/aishwary-strikes-gold-in-mens-50m-rifle-3-positions-at-changwon-shooting-world-cupread-latest-tweet-by-ani-digital-3957732.html
Bitcoin Profit App- The One-stop Trading Solution For Busy People,Inferse.com,2022-07-16,https://www.inferse.com/149889/bitcoin-profit-app-the-one-stop-trading-solution-for-busy-people/
Investing in Bitcoin: How to Make the Right Moves,Inferse.com,2022-07-16,https://www.inferse.com/149886/investing-in-bitcoin-how-to-make-the-right-moves/
"Banks' Bitcoin Holdings Should Be Capped, Basel Committee ...",Crypto News BTC,2022-07-16,https://cryptonewsbtc.org/2022/07/17/banks-bitcoin-holdings-should-be-capped-basel-committee-proposes-coindesk/
"Crypto Winter 2022: All Systems Normal, No Risk of Crashing ...",CoinCodex,2022-07-16,https://coincodex.com/article/16825/crypto-winter-2022-all-systems-normal-no-risk-of-crashing-and-burning/
Sports News | People Can Only Dream About What You've Done: Kevin Pietersen Backs Virat Kohli,LatestLY,2022-07-16,https://www.latestly.com/agency-news/sports-news-people-can-only-dream-about-what-youve-done-kevin-pietersen-backs-virat-kohli-3958004.html
Terra's LUNA Sets New All-Time High Following $135 Million Bitcoin Buy - Decrypt,Inferse.com,2022-07-16,https://www.inferse.com/151050/terras-luna-sets-new-all-time-high-following-135-million-bitcoin-buy-decrypt/
