Title,Publisher,Date,Link
Edward Snowden on the Long Road to Internet Privacy,CoinDesk,2022-07-08,https://www.coindesk.com/podcasts/coindesks-money-reimagined/edward-snowden-on-the-long-road-to-internet-privacy/
Terra’s LUNA price remains at risk of crashing hard,FXStreet,2022-07-08,https://www.fxstreet.com/cryptocurrencies/news/terras-luna-price-remains-at-risk-of-crashing-hard-202207081357
Banking blockchain: A solution in search of a problem,Fast Company,2022-07-08,https://www.fastcompany.com/90764813/banking-blockchain-a-solution-in-search-of-a-problem
Coinbase Is Offering Up to $50 in Rewards for Staking Ethereum,The Motley Fool,2022-07-08,https://www.fool.com/the-ascent/cryptocurrency/articles/coinbase-is-offering-up-to-50-in-rewards-for-staking-ethereum/
QNAP warns yet another wave of attacks are targeting NAS ...,TechRadar,2022-07-08,https://www.techradar.com/news/qnap-warns-yet-another-wave-of-attacks-are-targeting-nas-devices
How can blockchain innovate the e-commerce industry?,CoinGeek,2022-07-08,https://coingeek.com/how-can-blockchain-innovate-the-e-commerce-industry/
"Best Crypto Tokenomics To Defy The Bear Market: Gnox (GNOX), Horizen (Zen), And Fantom (FTM)",Outlook India,2022-07-08,https://www.outlookindia.com/business-spotlight/best-crypto-tokenomics-to-defy-the-bear-market-gnox-gnox-horizen-zen-and-fantom-ftm--news-207747
Remesas en stablecoins podrán ser enviadas entre Colombia y EE.UU. con este servicio,CriptoNoticias,2022-07-08,https://www.criptonoticias.com/negocios/remesas-stablecoins-podran-envidas-colombia-eeuu-servicio/
Analysts are clear on the short-term future of Bitcoin after the ...,Ruetir,2022-07-08,https://www.ruetir.com/2022/07/08/analysts-are-clear-on-the-short-term-future-of-bitcoin-after-the-latest-positive-trend/
"Ford Issues New Fire Risk Recall, Expands Earlier Call Back - Latest Tweet by Reuters",Latestly,2022-07-08,https://www.latestly.com/socially/world/ford-issues-new-fire-risk-recall-expands-earlier-call-back-latest-tweet-by-reuters-3926831.html
The Assassination of Former Japan Prime Minister Shinzo ...,Bloomberg.com,2022-07-08,https://www.bloomberg.com/news/photo-essays/2022-07-08/the-assassination-of-former-japan-prime-minister-shinzo-abe-in-photos
"In the bleak mid-Crypto Winter, a regulatory thaw begins",AltFi,2022-07-08,https://www.altfi.com/article/9516_in-the-bleak-mid-crypto-winter-a-regulatory-thaw-begins
"German Households and Industries Should Brace for an ""enormous Wave"" of Higher Energy ... - Latest Tweet by",Latestly,2022-07-08,https://www.latestly.com/socially/business/german-households-and-industries-should-brace-for-an-enormous-wave-of-higher-energy-latest-tweet-by-bloomberg-3926384.html
Discord Name and Shame Scam Explained,Trend Micro News,2022-07-08,https://news.trendmicro.com/2022/07/08/discord-name-and-shame-scam-server-shaming/
Former Indian Skipper #KapilDev Will Be Seen as the Guest of Honour at ... - Latest Tweet by IANS India,Latestly,2022-07-08,https://www.latestly.com/socially/india/news/former-indian-skipper-kapildev-will-be-seen-as-the-guest-of-honour-at-latest-tweet-by-ians-india-3924003.html
Point72 Asset Management in ‘Early Innings’ of ‘Big Crypto ...,Blockworks,2022-07-08,https://blockworks.co/point72-asset-management-in-early-innings-of-big-crypto-push/
MicroStrategy Exec Defends BTC Despite Crash,Live Bitcoin News,2022-07-08,https://www.livebitcoinnews.com/despite-crash-microstrategy-exec-continues-to-defend-btc/
Roblox: How To Get A Free Dominus In Mining Simulator 2,TheGamer,2022-07-08,https://www.thegamer.com/roblox-mining-simulator-2-how-to-get-free-dominus/
"IND vs ENG, 1st T20I 2022: Jos Buttler Believes India Bowled Fantastically Well With the New Ball",Latestly,2022-07-08,https://www.latestly.com/sports/cricket/ind-vs-eng-1st-t20i-2022-jos-buttler-believes-india-bowled-fantastically-well-with-the-new-ball-3924122.html
Here's Why Bitcoin Just Dropped to Intraday Low,Crypto News BTC,2022-07-08,https://cryptonewsbtc.org/2022/07/08/heres-why-bitcoin-just-dropped-to-intraday-low/
