Title,Publisher,Date,Link
The Relationship Between Bitcoin and Inflation,ReadWrite,2022-07-23,https://readwrite.com/the-relationship-between-bitcoin-and-inflation/
This Week in Coins: Ethereum Outpaces Bitcoin as Markets Thaw,Decrypt,2022-07-23,https://decrypt.co/105817/this-week-in-coins-ethereum-outpaces-bitcoin-as-markets-thaw
Better Bitcoin Stock: Block vs. Coinbase Global,The Motley Fool,2022-07-23,https://www.fool.com/investing/2022/07/23/better-bitcoin-stock-block-vs-coinbase-global/
"Bitcoin, Ethereum Technical Analysis: BTC Moves Towards ...",Bitcoin.com News,2022-07-23,https://news.bitcoin.com/bitcoin-ethereum-technical-analysis-bitcoin-moves-towards-22000-to-start-weekend/
Ethereum price ‘cup and handle’ pattern hints at potential breakout versus Bitcoin,Cointelegraph,2022-07-23,https://cointelegraph.com/news/ethereum-price-cup-and-handle-pattern-hints-at-potential-breakout-versus-bitcoin
"Bitcoin & Ethereum Price Poised for Prominent Pullbacks This Weekend, Here are Levels to Watch",Coinpedia,2022-07-23,https://coinpedia.org/price-analysis/bitcoin-ethereum-price-poised-for-prominent-pullbacks-this-weekend-here-are-levels-to-watch/
Bitcoin Price Activity Causes Whales to Re-think Portfolio ...,BSC News,2022-07-23,https://www.bsc.news/post/bitcoin-price-activity-causes-whales-to-re-think-portfolio-allocation
Chasing Bitcoin: Why North Korea Ransomware Attacks Target U.S. Health Care Providers,Forbes,2022-07-23,https://www.forbes.com/sites/jasonbrett/2022/07/23/chasing-bitcoin-why-north-korea-ransomware-attacks-target-us-health-care-providers/
"There Will Be 1 Billion Cryptocurrency Users Worldwide By 2030, Says BCG Report",Outlook India,2022-07-23,https://www.outlookindia.com/business/there-will-be-1-billion-cryptocurrency-users-worldwide-by-2030-says-bcg-report-news-211406
"Upon hearing that Tesla is selling off its 75% stake, bitcoin has recovered since",The Tech Outlook,2022-07-23,https://www.thetechoutlook.com/news/crypto/upon-hearing-that-tesla-is-selling-off-its-75-stake-bitcoin-has-recovered-since/
"Zee Entertainment Welcomes New Recruits Via Metaverse, Bitcoin Falls",Outlook India,2022-07-23,https://www.outlookindia.com/business/zee-entertainment-welcomes-new-recruits-via-metaverse-bitcoin-falls-news-211480
"BNB Was the Top Ten's Best Market Performer in Q2, Bitcoin ...",Bitcoin.com News,2022-07-23,https://news.bitcoin.com/bnb-was-the-top-tens-best-market-performer-in-q2-bitcoin-takes-second-place-solana-performed-the-worst/
Robert Kiyosaki Warns of 'Biggest Bond Crash Since 1788 ...,Bitcoin.com News,2022-07-23,https://news.bitcoin.com/robert-kiyosaki-warns-of-biggest-bond-crash-since-1788-waiting-to-buy-bitcoin-at-lower-price/
Bitcoin Gold Up 50% to $24.13 - Why BTG Could Struggle at ...,Business 2 Community,2022-07-23,https://www.business2community.com/crypto-news/bitcoin-gold-up-50-to-24-13-why-btg-could-struggle-at-25-02526443
Finland Sells 1889 Seized Bitcoins for $47 Million ...,Bitcoin.com News,2022-07-23,https://news.bitcoin.com/finland-sells-1889-seized-bitcoins-for-47-million-proceeds-going-to-ukraine/
Using Bitcoin To Establish VPN Connections Without Trusted Third Parties,Bitcoin Magazine,2022-07-23,https://bitcoinmagazine.com/technical/bitcoin-vpn-eliminates-trust-for-privacy
Not just Bitcoin price: Factors affecting BTC miner profitability,Cointelegraph,2022-07-23,https://cointelegraph.com/news/not-just-bitcoin-price-factors-affecting-btc-miner-profitability
SkyBridge Founder Anthony Scaramucci Still Likes Bitcoin ‘Long Term’ Despite His Fund’s Current Diffi...,The Daily Hodl,2022-07-23,https://dailyhodl.com/2022/07/23/skybridge-founder-anthony-scaramucci-still-likes-bitcoin-long-term-despite-his-funds-current-difficulties/
Articles by Moustafa Amin,Bitcoin Magazine,2022-07-23,https://bitcoinmagazine.com/authors/moustafa-amin
"Expect the next Bitcoin bull run in a year, says finance ...",Finbold,2022-07-23,https://finbold.com/expect-the-next-bitcoin-bull-run-in-a-year-says-finance-professional-f-grummes/
Bitcoin (BTC) Price To See Another Drop Below $20K Before New Rally! Analyst Maps Low Levels,Coinpedia,2022-07-23,https://coinpedia.org/bitcoin/bitcoin-btc-price-to-see-another-drop-below-20k-before-new-rally/
CoinGeek TV: Bitcoin creator Craig Wright likens blockchains ...,CoinGeek,2022-07-23,https://coingeek.com/coingeek-tv-bitcoin-creator-craig-wright-likens-blockchains-that-cant-scale-to-digital-beanie-babies/
Bank Indonesia Prepares to Issue Digital Rupiah as Legal ...,Bitcoin.com News,2022-07-23,https://news.bitcoin.com/bank-indonesia-prepares-to-issue-digital-rupiah-as-legal-tender-for-digital-payments/
Bitcoin Corrects Towards $22K But How Low Can it Go? (Bitcoin Price Analysis),CryptoPotato,2022-07-23,https://cryptopotato.com/bitcoin-corrects-towards-22k-but-how-low-can-it-go-bitcoin-price-analysis/
Prince Philip of Serbia Speaks on the Country's Bitcoin Adoption,Business 2 Community,2022-07-23,https://www.business2community.com/crypto-news/prince-philip-of-serbia-speaks-on-the-countrys-bitcoin-adoption-02526781
A Newcomer’s Perspective On Toxic Bitcoin Maximalism,Bitcoin Magazine,2022-07-23,https://bitcoinmagazine.com/culture/what-toxic-bitcoin-maximalism-means-to-onlookers
Research: Long-term holders possess 80% of all Bitcoins,CryptoSlate,2022-07-23,https://cryptoslate.com/research-80-of-all-bitcoins-are-held-by-long-term-holders/
Research: Who is buying Bitcoin? — Regional Market Overview: Asia vs Europe and the U.S.,CryptoSlate,2022-07-23,https://cryptoslate.com/who-is-buying-crypto-regional-market-overview-asia-vs-europe-and-the-u-s/
Bitcoin technical anlalysis & managing a profitable bitcoin short trade,Forexlive,2022-07-23,https://www.forexlive.com/technical-analysis/bitcoin-technical-anlalysis-managing-a-profitable-bitcoin-short-trade-20220723/
"FED Decks Up For FOMC Meeting, Analysts Predict The Bitcoin Price To Hit $28k",Coinpedia,2022-07-23,https://coinpedia.org/news/fed-decks-up-for-fomc-meeting-analysts-predict-the-bitcoin-price-to-hit-28k/
"This week in tech: Tesla drops bitcoin, Amazon may become ...",Windows Central,2022-07-23,https://www.windowscentral.com/microsoft/this-week-in-tech-tesla-drops-bitcoin-amazon-may-become-your-doctor-robot-dogs-with-guns
Biggest Movers: DOGE Drops Towards $0.05900 Support ...,Bitcoin.com News,2022-07-23,https://news.bitcoin.com/biggest-movers-doge-drops-towards-0-05900-support-level-despite-elon-musk-comments/
Crypto's boom and crash: The many lives of cryptocurrency,Axios,2022-07-23,https://www.axios.com/2022/07/23/bitcoin-crypto-crash-digital-currency
Neopets Hacker Tries To Sell 69 Million Users' Account ...,CBR,2022-07-23,https://www.cbr.com/neopets-hacker-bitcoin-69million-users/
Crypto still an important market for non-white investors despite crash,Markets Insider,2022-07-23,https://markets.businessinsider.com/news/currencies/crypto-crash-bear-market-minorities-black-investors-financial-discrimination-bitcoin-2022-7
Stock Market This Week (US): US markets ended higher amid ...,INDmoney,2022-07-23,https://www.indmoney.com/articles/us-stocks/stock-market-this-week-us-2307
Coinbase Disputes SEC's Allegation That the Exchange Lists ...,Bitcoin.com News,2022-07-23,https://news.bitcoin.com/coinbase-disputes-secs-allegation-that-the-exchange-lists-9-crypto-securities/
Crypto: A Bernie Madoff-Style Scheme May Have Crushed Prominent Lenders,TheStreet,2022-07-23,https://www.thestreet.com/investing/cryptocurrency/crypto-a-bernie-madoff-style-scheme-may-have-crushed-prominent-lenders
Crypto Payments More Popular in LATAM and EMEA Countries (Report),CryptoPotato,2022-07-23,https://cryptopotato.com/crypto-payments-more-popular-in-latam-and-emea-countries-report/
"They Thought 'Crypto Banks' Were Safe, and Then Came the ...",Wall Street Journal,2022-07-23,https://www.wsj.com/articles/they-thought-crypto-banks-were-safe-and-then-came-the-crash-11658568780
Crypto Donations To Boost California Politicians' Chance Of Winning In Elections | Bitcoinist.com,Bitcoinist,2022-07-23,https://bitcoinist.com/crypto-donations-to-be-allowed-in-california/
"Gnox (GNOX), Avalanche (AVAX), Fantom (FTM) and Polygon (MATIC) Are The Top DeFi Projects For July |",Bitcoinist,2022-07-23,https://bitcoinist.com/gnox-gnox-avalanche-avax-fantom-ftm-and-polygon-matic-are-the-top-defi-projects-for-july/
XRP flips $0.35 to support but could the bullish move have reached its apex?,AMBCrypto,2022-07-23,https://ambcrypto.com/xrp-flips-0-35-to-support-but-could-the-bullish-move-have-reached-its-apex/
"XRP Pulls Back Towards $0.35, Here’s the Critical Support to Watch (Ripple Price Analysis)",CryptoPotato,2022-07-23,https://cryptopotato.com/xrp-pulls-back-towards-0-35-heres-the-critical-support-to-watch-ripple-price-analysis/
"Ethereum Price Prediction for Today, July 23: ETH May Slide ...",InsideBitcoins,2022-07-23,https://insidebitcoins.com/news/ethereum-price-prediction-for-today-july-23-eth-may-slide-below-1500-support
Board of the Bank of Central African States set to launch a ...,InsideBitcoins,2022-07-23,https://insidebitcoins.com/news/board-of-the-bank-of-central-african-states-set-to-launch-a-cbdc
How Rising Interest Rates Propelled This Crypto Stock Higher,The Motley Fool,2022-07-23,https://www.fool.com/investing/2022/07/23/how-rising-interest-rates-propelled-this-crypto-st/
Half of South Africans Will Invest in Crypto If Banks Provided Such Services: Survey,CryptoPotato,2022-07-23,https://cryptopotato.com/half-of-south-africans-will-invest-in-crypto-if-banks-provided-such-services-survey/
"NFTs banned in Minecraft, SEC lists 9 tokens as securities ...",Cointelegraph,2022-07-23,https://cointelegraph.com/magazine/2022/07/23/nfts-banned-minecraft-sec-lists-9-tokens-securities-3ac-founder-blames-cockyness-company-meltdown-hodlers-digest-july17-23
Radio Caca Impresses Through Q2,BSC News,2022-07-23,https://www.bsc.news/post/radio-caca-impresses-through-q2
Why Axie Infinity [AXS] could see a near-term setback before bouncing back,AMBCrypto,2022-07-23,https://ambcrypto.com/why-axie-infinity-axs-could-see-a-near-term-setback-before-bouncing-back/
Bitcoin Network Difficulty Continues Downhill,CoinTrust.com,2022-07-23,https://www.cointrust.com/bitcoin-news/bitcoin-network-difficulty-continues-downhill
Blockchain.com Layoffs: Top Cryptocurrency Exchange Cuts 25% of Its Workforce Amid Global Economic,Latestly,2022-07-23,https://www.latestly.com/business/blockchain-com-layoffs-top-cryptocurrency-exchange-cuts-25-of-its-workforce-amid-global-economic-meltdown-nearly-150-employees-impacted-3986518.html
Shiba Inu flashes a bear signal as correction gets underway ...,CoinJournal,2022-07-23,https://coinjournal.net/news/shiba-inu-flashes-a-bear-signal-as-correction-gets-underway-what-next/
The alternative to web5 using smart tokens on EVM ...,CryptoSlate,2022-07-23,https://cryptoslate.com/videos/the-alternative-to-web5-using-smart-tokens-on-evm-compatible-chains/
GroveToken price prediction: What’s next for the green crypto?,Capital.com,2022-07-23,https://capital.com/grove-gvr-price-prediction
"Bitcoin, Ethereum, Cardano, Solana Price Prediction for 2022 ...",Crypto News BTC,2022-07-23,https://cryptonewsbtc.org/2022/07/24/bitcoin-ethereum-cardano-solana-price-prediction-for-2022-2025-2030/
How will Bitcoin change the scenario of Paper Boat marketing,Market Capitalize,2022-07-23,https://marketcapitalize.com/how-will-bitcoin-change-the-scenario-of-paper-boat-marketing/
Bitcoin cash (BCH) Price May Change to Bullish Direction at ...,Cryptovibes.com,2022-07-23,https://www.cryptovibes.com/blog/2022/07/23/bitcoin-cash-bch-price-may-change-to-bullish-direction-at-96-level/
Lamborghini of the ‘king of bitcoin’ is sold for R$ 805 thousand; RJ resident wins – News,Play Crazy Game,2022-07-23,https://playcrazygame.com/2022/07/23/lamborghini-of-the-king-of-bitcoin-is-sold-for-r-805-thousand-rj-resident-wins-news-2/
Can Bitcoin [BTC]'s movement above realized price fizzle out ...,Crypto News BTC,2022-07-23,https://cryptonewsbtc.org/2022/07/23/can-bitcoin-btcs-movement-above-realized-price-fizzle-out-based-on-market-sentiment/
Abby Johnson of Fidelity: Crypto Is the Future,Live Bitcoin News,2022-07-23,https://www.livebitcoinnews.com/abby-johnson-of-fidelity-crypto-is-the-future/
"Cardano Price Prediction for Today, July 23: ADA Crashes at ...",InsideBitcoins,2022-07-23,https://insidebitcoins.com/news/cardano-price-prediction-for-today-july-23-ada-crashes-at-0-49-level
Small Cap Stock Watch: Bitcoin Miner Marathon Strikes Power Deal; Electric Carmaker Faraday Deflates As Short Squeeze Ends - Forbes,Inferse.com,2022-07-23,https://www.inferse.com/160959/small-cap-stock-watch-bitcoin-miner-marathon-strikes-power-deal-electric-carmaker-faraday-deflates-as-short-squeeze-ends-forbes/
An Introduction to Parallel Finance - Bitcoin & Crypto Guide,Crypto News BTC,2022-07-23,https://cryptonewsbtc.org/2022/07/24/an-introduction-to-parallel-finance-bitcoin-crypto-guide/
News: Bitcoin network difficulty drops to 27.693T as hash rate ...,Bitfinex Pulse,2022-07-23,https://pulse.bitfinex.com/post/News/20220723103737970
"News: Crypto Winter & Ethereum Forecasts, Sustainable ...",Bitfinex Pulse,2022-07-23,https://pulse.bitfinex.com/post/News/20220723103838970
Utiliser son NFT dans n'importe quel metaverse - L'idée ...,Journal Du Coin,2022-07-23,https://journalducoin.com/nft/echanger-nft-metavers-animoca-brands/
Revisiting the Taxation of Cryptocurrency: What Happens ...,Crypto News BTC,2022-07-23,https://cryptonewsbtc.org/2022/07/23/revisiting-the-taxation-of-cryptocurrency-what-happens-when-crypto-crashes/
What's next after the crypto market crash? Q&A - Financial Times,Inferse.com,2022-07-23,https://www.inferse.com/186794/whats-next-after-the-crypto-market-crash-qa-financial-times/
