Title,Publisher,Date,Link
Bitcoin Rides Stock Rally to Hit Highest Level in Over a Week,Bloomberg.com,2022-07-08,https://www.bloomberg.com/news/articles/2022-07-07/bitcoin-rides-stock-rally-to-hit-highest-level-in-over-a-week
"Bitcoin Is Getting Ready for 20% Rally: Crypto Market Review, July 8",U.Today,2022-07-08,https://u.today/bitcoin-is-getting-ready-for-20-rally-crypto-market-review-july8
Bitcoin Soars as Crypto Traders Turn Bullish. 2 Signs the Rally Has Momentum.,Barron's,2022-07-08,https://www.barrons.com/articles/bitcoin-crypto-bullish-rally-momentum-51657282934
Market Wrap: Bitcoin Gains for Third Consecutive Day as Binance Launches Zero Trading Fees,CoinDesk,2022-07-08,https://www.coindesk.com/markets/2022/07/08/market-wrap-bitcoin-gains-for-third-consecutive-day-as-binance-launches-zero-trading-fees/
Why Is Crypto Crashing? Should You Hang On?,GOBankingRates,2022-07-08,https://www.gobankingrates.com/investing/crypto/why-is-crypto-crashing/
"Why Ethereum Is “Obviously A Security”, Says Michael Saylor",Bitcoinist,2022-07-08,https://bitcoinist.com/ethereum-security-says-bitcoin-bull-michael-saylor/
"After Bitcoin Wash Trading Surges on Binance, CEO Nixes Incentives",Decrypt,2022-07-08,https://decrypt.co/104765/after-bitcoin-wash-trading-surges-on-binance-ceo-nixes-incentives
"Bitcoin Rises 6.1% to $21,792; Ether Climbs 5.21%",NDTV.com,2022-07-08,https://www.ndtv.com/business/bitcoin-rises-6-1-to-21-792-ether-climbs-5-21-3139049
‘Crash Potential’—Crypto Billionaire Issues Stark Warning As The Price Of Bitcoin And Ethereum Rebound,Forbes,2022-07-08,https://www.forbes.com/sites/billybambrough/2022/07/08/crash-potential-crypto-billionaire-issues-stark-warning-as-the-price-of-bitcoin-and-ethereum-rebounds/
Tether Says It Liquidated a Bitcoin Loan Made to Crypto Lender Celsius,Decrypt,2022-07-08,https://decrypt.co/104738/tether-liquidated-celsius-loan-bitcoin
"Warning: 150,000 Bitcoin tokens about to flood the market could trigger sell-off",FXStreet,2022-07-08,https://www.fxstreet.com/cryptocurrencies/news/warning-150-00-bitcoin-tokens-about-to-flood-the-market-could-trigger-sell-off-202207080905
"Bitcoin spikes above $22,500, but odds are it’s a fakeout",CryptoSlate,2022-07-08,https://cryptoslate.com/bitcoin-spikes-above-22500-but-odds-are-its-a-fakeout/
"Mt. Gox Trustee Moves Closer to Pay-Out, Asks Creditors for ...",Crypto News,2022-07-08,https://cryptonews.com/news/mt-gox-trustee-moves-closer-to-pay-out-asks-creditors-for-payment-details.htm
Unpacking the Latest Bitcoin ETF Rejections,CoinDesk,2022-07-08,https://www.coindesk.com/policy/2022/07/08/unpacking-the-latest-bitcoin-etf-rejections/
Institutional Investors Are Getting Back in Bitcoin and Cryptocurrency Market,U.Today,2022-07-08,https://u.today/institutional-investors-are-getting-back-in-bitcoin-and-cryptocurrency-market
Argentinian Exchange Ripio Presents Crypto Educational ...,Bitcoin.com News,2022-07-08,https://news.bitcoin.com/argentinian-exchange-ripio-presents-crypto-educational-textbook-and-web3-metaverse-wallet/
Bitcoin was supposed to hedge against inflation—here's why it hasn't worked that way,CNBC,2022-07-08,https://www.cnbc.com/2022/07/08/why-bitcoin-doesnt-seem-to-be-a-hedge-against-inflation.html
"Crypto Analytics Firm Glassnode Says Nearly Half of Bitcoin (BTC) Holders at a Loss, Evaluates ETH and USDT",The Daily Hodl,2022-07-08,https://dailyhodl.com/2022/07/08/crypto-analytics-firm-glassnode-says-nearly-half-of-bitcoin-btc-holders-at-a-loss-evaluates-eth-and-usdt/
Bitcoin 'Bear Cross' Raises Outlook for Bull Revival,CoinDesk,2022-07-08,https://www.coindesk.com/markets/2022/07/08/bitcoin-bear-cross-raises-outlook-for-bull-revival/
Here’s The Large Public Bitcoin Miner That Has Refused To Succumb To The Bears | Bitcoinist.com,Bitcoinist,2022-07-08,https://bitcoinist.com/bitcoin-miner-refused-to-succumb-to-the-bears/
Bitcoin benefiting from gains in equities,FXStreet,2022-07-08,https://www.fxstreet.com/cryptocurrencies/news/bitcoin-benefiting-from-gains-in-equities-202207080725
Bitcoin blockchain activity has plummeted in recent months,TechRadar,2022-07-08,https://www.techradar.com/news/bitcoin-blockchain-activity-has-plummeted-in-recent-months
"Bitcoin Will Make a Comeback, Rockefeller International Chairman Says",CoinDesk,2022-07-08,https://www.coindesk.com/layer2/2022/07/08/bitcoin-will-make-a-comeback-rockefeller-international-chairman-says/
Biden Administration Expected to Publish Report on Bitcoin ...,Bitcoin.com News,2022-07-08,https://news.bitcoin.com/biden-administration-expected-to-publish-report-on-bitcoin-mining-and-the-industrys-impact-on-climate/
"The Week in Crypto: The Next Bull Market, Bitcoin Games & More",GOBankingRates,2022-07-08,https://www.gobankingrates.com/investing/crypto/the-week-in-crypto-the-next-bull-market-bitcoin-games-more/
Bitcoin 'Fear & Greed' index recovers to 2-month high after ...,Finbold,2022-07-08,https://finbold.com/bitcoin-fear-greed-index-recovers-to-2-month-high-after-market-sell-off/
How Silent Payments Are Bringing New Privacy Protections To Bitcoin,Bitcoin Magazine,2022-07-08,https://bitcoinmagazine.com/technical/silent-payments-make-bitcoin-more-private
"An Arab Country is About to Adopt Bitcoin, says Prince Philip ...",Business 2 Community,2022-07-08,https://www.business2community.com/crypto-news/an-arab-country-is-about-to-adopt-bitcoin-says-prince-philip-of-serbia-02519322
Why Bitcoin- And Ethereum-Related Stock Riot Blockchain Is Up 27% Over The Past Week,Benzinga,2022-07-08,https://www.benzinga.com/news/small-cap/22/07/28005211/why-bitcoin-and-ethereum-related-stock-riot-blockchain-is-up-27-over-the-past-week
The Bitcoin Conference And The Pursuit Of Hyperbitcoinization,Bitcoin Magazine,2022-07-08,https://bitcoinmagazine.com/industry-events/bitcoin-conference-2023-and-amsterdam
Crypto Mining Stocks Bounce Amid Bitcoin Recovery,CoinDesk,2022-07-08,https://www.coindesk.com/business/2022/07/08/crypto-mining-stocks-bounce-amid-bitcoin-recovery/
Blockstream Announces Progress On Signature Aggregation Research,Bitcoin Magazine,2022-07-08,https://bitcoinmagazine.com/technical/blockstream-announces-progress-on-signature-aggregation
Celsius moved $529M worth of wBTC to FTX exchange ...,Cointelegraph,2022-07-08,https://cointelegraph.com/news/celsius-moved-529m-worth-of-wbtc-to-ftx-exchange-should-we-be-worried
Here's Why Bitcoin Just Dropped to Intraday Low,U.Today,2022-07-08,https://u.today/heres-why-bitcoin-just-dropped-to-intraday-low
"Gloria Zhao Becomes First Female Bitcoin Core Maintainer, Pieter Wuille Steps Down",Bitcoin Magazine,2022-07-08,https://bitcoinmagazine.com/technical/first-female-bitcoin-core-maintainer
"Bitcoin briefly above $22,000; Binance Philippines ban urged",Forkast,2022-07-08,https://forkast.news/video-audio/bitcoin-briefly-above-22000-binance-philippines-ban-urged/
Articles by Dan,Bitcoin Magazine,2022-07-08,https://bitcoinmagazine.com/authors/dan
Mind games: Bitcoin education at an escape room in Lebanon,Cointelegraph,2022-07-08,https://cointelegraph.com/news/mind-games-bitcoin-education-at-an-escape-room-in-lebanon
Bitcoin and Ether Prices Look to Rebound but Analysts Are Calling for Caution,Coinspeaker,2022-07-08,https://www.coinspeaker.com/bitcoin-ether-prices-rebound-caution/
"Bitcoin (BTC) Set To Explode by Over 400% and Hit Six Figures, According to Crypto Trader – Here’s the ...",The Daily Hodl,2022-07-08,https://dailyhodl.com/2022/07/08/bitcoin-btc-set-to-explode-by-over-400-and-hit-six-figures-according-to-crypto-trader-heres-the-timeline/
Bitcoin daily chart alert - Bulls gain some momentum - Jul. 8,KITCO,2022-07-08,https://www.kitco.com/news/2022-07-08/Bitcoin-daily-chart-alert-Bulls-gain-some-momentum-Jul-8.html
Nayib Bukele’s failed Bitcoin experiment in El Salvador,The Boston Globe,2022-07-08,https://www.bostonglobe.com/2022/07/08/opinion/nayib-bukeles-failed-bitcoin-experiment-el-salvador/
Crypto Futures Observes $280m Flush As Bitcoin Breaks $22k | Bitcoinist.com,Bitcoinist,2022-07-08,https://bitcoinist.com/crypto-futures-260m-flush-bitcoin-breaks-22k/
How bad is the crypto market crash? Take a look at Coinbase,CBS News,2022-07-08,https://www.cbsnews.com/news/coinbase-crypto-market-crash-bitcoin-growth/
Binance CEO Meets Senegalese and Ivory Coast Presidents ...,Bitcoin.com News,2022-07-08,https://news.bitcoin.com/binance-ceo-meets-senegalese-and-ivory-coast-presidents-says-africa-is-primed-for-crypto-adoption/
"Bitcoin Hovering at the Support, Bear Finding the Scope to Drag the Price Back Below $20,000",Coinpedia,2022-07-08,https://coinpedia.org/price-analysis/bitcoin-hovering-at-the-support-bear-finding-the-scope-to-drag-the-price-back-below-20000/
"Market Wrap: Bitcoin Rally Continues With Rise to $22,000",Blockworks,2022-07-08,https://blockworks.co/market-wrap-bitcoin-rally-continues-with-rise-to-22000/
Bitcoin SV Price Analysis: BSV looks Determined to Breakout ...,The Market Periodical,2022-07-08,https://themarketperiodical.com/2022/07/08/bitcoin-sv-price-analysis-bsv-looks-determined-to-breakout-from-the-range/
"Bitcoin prices march higher, and why crypto miners turned into ...",CNBC,2022-07-08,https://www.cnbc.com/video/2022/07/08/bitcoin-prices-crypto-mining-ether-solana.html
"Top 3 Price Prediction Bitcoin, Ethereum, Ripple: It's Crypto ...",FXStreet,2022-07-08,https://www.fxstreet.com/cryptocurrencies/news/top-3-price-prediction-bitcoin-ethereum-ripple-its-crypto-season-202207081804
"Compass Mining, A Bitcoin Mining Firm Lays Off 15% Employees",TronWeekly,2022-07-08,https://www.tronweekly.com/compass-mining-a-lays-off-15-employees/
Compass Mining Cuts Staff by 15% After Departure of Two Key Executives,CryptoPotato,2022-07-08,https://cryptopotato.com/compass-mining-cuts-staff-by-15-after-departure-of-two-key-executives/
"Compass Mining retrenches 15% of staff, execs to take major pay-cuts",Cointelegraph,2022-07-08,https://cointelegraph.com/news/compass-mining-retrenches-15-of-staff-execs-to-take-major-pay-cuts
CoinGeek: How the original Bitcoin protocol re-emerged,PR Newswire,2022-07-08,https://www.prnewswire.com/news-releases/coingeek-how-the-original-bitcoin-protocol-re-emerged-301583044.html
Report: Blockchain.com CEO Reveals Company Lost $270 ...,Bitcoin.com News,2022-07-08,https://news.bitcoin.com/report-blockchain-com-ceo-reveals-company-lost-270-million-from-3ac-exposure/
"BTC, ADA and BNB Price Analysis for July 8",U.Today,2022-07-08,https://u.today/btc-ada-and-bnb-price-analysis-for-july-8
The uncertainty of cryptocurrency - DCD,Data Center Dynamics,2022-07-08,https://www.datacenterdynamics.com/en/marketwatch/the-uncertainty-of-cryptocurrency/
"Trader Predicts What’s Next for a Leading Ethereum Rival Solana, Updates Stance on Polygon and Bitcoin",The Daily Hodl,2022-07-08,https://dailyhodl.com/2022/07/08/trader-predicts-whats-next-for-a-leading-ethereum-rival-solana-updates-stance-on-polygon-and-bitcoin/
This 'biblical' Bitcoin pattern suggests BTC price can rise 30% by October,Cointelegraph,2022-07-08,https://cointelegraph.com/news/this-biblical-bitcoin-pattern-suggests-btc-price-can-rise-30-by-october
"Bitcoin looks good, but the Cardano price faces one more shake-out",FXStreet,2022-07-08,https://www.fxstreet.com/cryptocurrencies/news/bitcoin-looks-good-but-the-cardano-price-faces-one-more-shake-out-202207081959
"The euro’s race to the bottom, US jobs and Bitcoin rebound [Video]",FXStreet,2022-07-08,https://www.fxstreet.com/analysis/the-euros-race-to-the-bottom-us-jobs-and-bitcoin-rebound-video-202207080814
Orange Pilling the White House with David Zell,What Bitcoin Did,2022-07-08,https://www.whatbitcoindid.com/podcast/orange-pilling-the-white-house
Did Cathie Wood Correctly Call a Bitcoin Bottom?,TheStreet,2022-07-08,https://www.thestreet.com/video/bitcoin-bottom-was-cathie-wood-right
How Do Crypto Casinos Work?,Cryptoglobe,2022-07-08,https://www.cryptoglobe.com/latest/2022/07/how-do-crypto-casinos-work/
First Bitcoin Miner in Zimbabwe,Crypto News,2022-07-08,https://cryptonews.com/videos/first-bitcoin-miner-in-zimbabwe-the-anita-posch-show-157.htm
New Lawsuit Claims Solana Is Unregistered Security ...,Bitcoin.com News,2022-07-08,https://news.bitcoin.com/new-lawsuit-claims-solana-is-unregistered-security-investors-have-suffered-enormous-losses/
Russia to improve crypto transaction monitoring as regulation ...,Reuters,2022-07-08,https://www.reuters.com/technology/russia-improve-crypto-transaction-monitoring-regulation-draws-closer-2022-07-08/
"3 Lessons From The Oslo Freedom Forum: Privacy & Tax - Odell, Sneidermanis, Nwosu | Bitcoinist.com",Bitcoinist,2022-07-08,https://bitcoinist.com/oslo-freedom-forum-odell-sneidermanis-nwosu/
Investors Duped In Major Crypto Scam In India | Bitcoinist.com,Bitcoinist,2022-07-08,https://bitcoinist.com/investors-duped-in-major-crypto-scam-in-india/
Be Grateful for Crypto's Well-Timed Meltdown,Bloomberg.com,2022-07-08,https://www.bloomberg.com/opinion/articles/2022-07-08/crypto-crash-comes-at-an-opportune-moment
UK think tank calls for global digital currency rules,Reuters,2022-07-08,https://www.reuters.com/technology/uk-think-tank-calls-global-digital-currency-rules-2022-07-08/
Decentralization's Failed Promise in Iran,CoinDesk,2022-07-08,https://www.coindesk.com/layer2/2022/07/08/decentralizations-failed-promise-in-iran/
"Fed Vice Chair Calls for More Crypto Regulation, Notes Terra Collapse",Decrypt,2022-07-08,https://decrypt.co/104741/fed-vice-chair-more-crypto-regulation-terra-collapse
U.S. Treasury Published Framework For Crypto Regulation,Bitcoinist,2022-07-08,https://bitcoinist.com/why-us-published-a-framework-for-crypto-regulation/
"Robinhood Adds New Features for Shiba Inu, Bitcoin, and Others",Coinspeaker,2022-07-08,https://www.coinspeaker.com/robinhood-features-shiba-inu-bitcoin/
Lummis-Gillibrand Crypto Bill: An Important Step In Bringing ...,Forbes,2022-07-08,https://www.forbes.com/sites/theapothecary/2022/07/08/lummis-gillibrand-crypto-bill-an-important-step-in-bringing-regulatory-clarity-to-bitcoin-stablecoins--digital-assets/
Best Crypto Margin Trading Exchanges for August 2022,Business 2 Community,2022-07-08,https://www.business2community.com/cryptocurrency/best-crypto-margin-trading-exchanges
Podcast episode with Concordium CEO,CoinJournal,2022-07-08,https://coinjournal.net/news/knowing-identity-is-vital-to-trust-on-the-blockchain-interview-with-condordium-ceo/
Speech by Vice Chair Brainard on crypto-assets and ...,Board of Governors of the Federal Reserve System,2022-07-08,https://www.federalreserve.gov/newsevents/speech/brainard20220708a.htm
"Bitcoin, Ethereum, Crypto News and Price Data","CoinDesk: Bitcoin, Ethereum, Crypto News and Price Data",2022-07-08,https://www.coindesk.com/tv/money-reimagined/money-reimagined-july-8-2022/
U.S Fact Sheet On Global Crypto Regulation; Here's What We Know | Bitcoinist.com,Bitcoinist,2022-07-08,https://bitcoinist.com/u-s-fact-sheet-on-global-crypto-regulation/
How ‘Baby Al Capone’ Pulled Off a $24 Million Crypto Heist,Rolling Stone,2022-07-08,https://www.rollingstone.com/culture/culture-features/crypto-heist-teenage-hacker-ellis-pinsky-1367400/
Bitfarms Stock: In Distress But Still Functional (NASDAQ:BITF),Seeking Alpha,2022-07-08,https://seekingalpha.com/article/4522481-bitfarms-in-distress-but-still-functional
Dogecoin Technicals Are Bullish; Can DOGE Reach $0.1 in 2022?,CryptoNewsZ,2022-07-08,https://www.cryptonewsz.com/dogecoin-technicals-are-bullish-can-doge-reach-0-1-usd-in-2022/
Twitter Says It Won't Let Elon Musk Go as 'Dogecoin CEO ...,Crypto News,2022-07-08,https://cryptonews.com/news/twitter-says-it-wont-let-elon-musk-go-as-dogecoin-ceo-terminates-deal.htm
"Stop Your Crypto Operations in Russia, Washington Tells ...",Crypto News,2022-07-08,https://cryptonews.com/news/stop-your-crypto-operations-in-russia-washington-tells-japanese-exchanges-miners.htm
These companies hopped on the crypto train when times were booming. Which are exposed in a downturn?,MarketWatch,2022-07-08,https://www.marketwatch.com/story/these-companies-hopped-on-the-crypto-train-when-times-were-booming-which-are-exposed-in-a-downturn-11657304767
Here's Your On-Chain Checklist for Cryptocurrency Market Reversal,U.Today,2022-07-08,https://u.today/heres-your-on-chain-checklist-for-cryptocurrency-market-reversal
"DeFi Protocols At Higher Risk Of Exploit During The Bear Market, Here’s Why | Bitcoinist.com",Bitcoinist,2022-07-08,https://bitcoinist.com/defi-high-risk-of-exploit-during-bear-market/
Decentraland and The Sandbox May Not be Ready for Prime Time—But Gorilix (SILVA) Might be | Bitcoinist.com,Bitcoinist,2022-07-08,https://bitcoinist.com/decentraland-and-the-sandbox-may-not-be-ready-for-prime-time-but-gorilix-silva-might-be/
Banking Circle adds USDC payments and fiat conversion,CryptoSlate,2022-07-08,https://cryptoslate.com/banking-circle-adds-usdc-payments-and-fiat-conversion/
Does the Wash Sale Rule Apply to Cryptocurrency?,TheStreet,2022-07-08,https://www.thestreet.com/personal-finance/does-wash-sale-rule-apply-cryptocurrency
"Balance your portfolio with Helium (HNT), Huobi Token (HT) and Chronoly (CRNO) | Bitcoinist.com",Bitcoinist,2022-07-08,https://bitcoinist.com/balance-your-portfolio-with-helium-hnt-huobi-token-ht-and-chronoly-crno/
Where to Buy Serum Crypto (SRM) - 2022 Beginner's Guide,Business 2 Community,2022-07-08,https://www.business2community.com/cryptocurrency/buy-serum
This DeFi Coin Has Secret Sauce of Brand Power and ...,Business 2 Community,2022-07-08,https://www.business2community.com/crypto-news/this-defi-coin-has-secret-sauce-of-brand-power-and-transparency-02519160
Many Crypto SPAC Deals Now In Jeopardy,Forbes,2022-07-08,https://www.forbes.com/sites/mariagraciasantillanalinares/2022/07/08/many-crypto-spac-deals-now-in-jeopardy/
"Embattled crypto lender Celsius is a 'fraud' and 'Ponzi scheme,' lawsuit alleges",CNBC,2022-07-08,https://www.cnbc.com/2022/07/08/crypto-lender-celsius-is-a-fraud-and-ponzi-scheme-lawsuit-claims.html
NFT Signals Launches Algo Trading That Makes Flipping ...,Business 2 Community,2022-07-08,https://www.business2community.com/crypto-news/nft-signals-launches-algo-trading-that-makes-flipping-nfts-for-profit-easy-02519127
"Top Crypto Trader Reveals Outlook for XRP, Polygon (MATIC), Cardano (ADA), and Ethereum Challenger Fantom (...",The Daily Hodl,2022-07-08,https://dailyhodl.com/2022/07/08/top-crypto-trader-reveals-outlook-for-xrp-polygon-matic-cardano-ada-and-ethereum-challenger-fantom-ftm/
Coinbase users unable to withdraw to bank accounts,Cryptopolitan,2022-07-08,https://www.cryptopolitan.com/coinbase-users-unable-to-withdraw-to-bank/
Reddit Introduces More NFTs But Calls Them Collectible ...,Business 2 Community,2022-07-08,https://www.business2community.com/crypto-news/reddit-introduces-more-nfts-but-calls-them-collectible-avatars-not-nfts-02519509
"Three Cryptos to Buy for Early Retirement? Gnox (GNOX), Waves (WAVES), and Neo (NEO) | Bitcoinist.com",Bitcoinist,2022-07-08,https://bitcoinist.com/three-cryptos-to-buy-for-early-retirement-gnox-gnox-waves-waves-and-neo-neo/
The CoinGeek Pulse Episode 94: Voyager files bankruptcy ...,CoinGeek,2022-07-08,https://coingeek.com/the-coingeek-pulse-episode-94-voyager-files-bankruptcy-doj-goes-after-crypto-frauds-meta-shuts-down-novi-video/
Here’s why the crypto downturn isn’t the end for DeFi,CryptoSlate,2022-07-08,https://cryptoslate.com/heres-why-the-crypto-downturn-isnt-the-end-for-defi/
FDIC to Investigate Bankrupt Voyager Digital’s Insurance Claims,Decrypt,2022-07-08,https://decrypt.co/104688/fdic-to-investigate-bankrupt-voyager-digitals-insurance-claims
Get Your Funds Off Crypto Exchanges! - Now Spanish 2gether ...,Business 2 Community,2022-07-08,https://www.business2community.com/crypto-news/get-your-funds-off-crypto-exchanges-now-spanish-2gether-cex-cuts-user-access-02519241
Buffett Continues to Pour Money into Energy Stocks with ...,Business 2 Community,2022-07-08,https://www.business2community.com/stock-news/buffett-continues-to-pour-money-into-energy-stocks-with-occidental-purchase-02519295
Aave Proposes to Launch an USD-Pegged Stablecoin Called GHO,CryptoPotato,2022-07-08,https://cryptopotato.com/aave-proposes-to-launch-an-usd-pegged-stablecoin-called-gho/
Cryptocurrency Internet Computer Rises More Than 5% In 24 hours,Benzinga,2022-07-08,https://www.benzinga.com/markets/cryptocurrency/22/07/28004114/cryptocurrency-internet-computer-rises-more-than-5-in-24-hours
Umetaworld Announces New Website and App Launch,The Daily Hodl,2022-07-08,https://dailyhodl.com/2022/07/08/umetaworld-announces-new-website-and-app-launch/
Citigroup Makes Morningstar Financial-Stock List,TheStreet,2022-07-08,https://www.thestreet.com/investing/blackrock-citigroup-morningstar-financial-stocks
Ethereum Monthly Analysis – June 2022,Securities.io,2022-07-08,https://www.securities.io/ethereum-monthly-analysis-june-2022/
Decentral Bank DAO Bug Allows User to Mint $10 Trillion of ...,Business 2 Community,2022-07-08,https://www.business2community.com/crypto-news/decentral-bank-dao-bug-allows-user-to-mint-10-trillion-of-usn-stablecoin-02519166
VIDT Datalink is up 50% Today - What is VIDT and Where to ...,Business 2 Community,2022-07-08,https://www.business2community.com/crypto-news/vidt-datalink-is-up-50-today-what-is-vidt-and-where-to-buy-02519262
EOS Recovers Marginally; Is It the Right Time to Buy?,CryptoNewsZ,2022-07-08,https://www.cryptonewsz.com/eos-recovers-marginally-is-it-the-right-time-to-buy/
Binance secures Virtual Asset Services Provider license from Spanish central bank,CryptoSlate,2022-07-08,https://cryptoslate.com/the-bank-of-spain-grants-binance-virtual-asset-services-provider-vasp-status/
Binance Completed the BEL Airdrop Distribution for the 7th Round,CryptoNewsZ,2022-07-08,https://www.cryptonewsz.com/binance-completed-the-bel-airdrop-distribution-for-the-7th-round/
Chainlink Fails to Continue the Uptrend; Should You Hold LINK?,CryptoNewsZ,2022-07-08,https://www.cryptonewsz.com/chainlink-fails-to-continue-the-uptrend-should-you-hold-link/
Canada Experiencing Massive Telecommunications Outage,Crypto Briefing,2022-07-08,https://cryptobriefing.com/canada-experiencing-massive-telecommunications-outage/
PNPCOIN Worlds first regulated cryptocurrency,Khaleej Times,2022-07-08,https://www.khaleejtimes.com/kt-engage/pnpcoin-worlds-first-regulated-cryptocurrency
Treasury unveils its global crypto response — sort of,Politico,2022-07-08,https://www.politico.com/newsletters/digital-future-daily/2022/07/08/treasury-unveils-its-global-crypto-response-sort-of-00044762
"Robinhood Introduces New Feature for SHIB, Solana Hit with Class-Action Lawsuit, DOGE Back Above Crucial Price Level: Crypto News Digest by U.Today",U.Today,2022-07-08,https://u.today/robinhood-introduces-new-feature-for-shib-solana-hit-with-class-action-lawsuit-doge-back-above
IOTA Consolidation Continues Further; Will MIOTA Ever Rise?,NameCoinNews,2022-07-08,https://www.namecoinnews.com/iota-consolidation-continues-further-will-miota-ever-rise/
Axie Infinity co-founder attempts to entice players back by saying “nature is healing”,CryptoSlate,2022-07-08,https://cryptoslate.com/axie-infinity-co-founder-attempts-to-entice-players-back-by-saying-nature-is-healing/
"US: You can own 'crypto' OR help write policy/regs, not both",CoinGeek,2022-07-08,https://coingeek.com/us-you-can-own-crypto-or-help-write-policy-regs-not-both/
Morocco Remains An African Crypto 'Trading Hub' Despite ...,Morocco World News,2022-07-08,https://www.moroccoworldnews.com/2022/07/350161/morocco-remains-an-african-crypto-trading-hub-despite-state-ban
What Is a Crypto Liquidity Pool? Why Are They So Important to ...,MakeUseOf,2022-07-08,https://www.makeuseof.com/what-are-crypto-liquidity-pools/
Crypto Basics Series: How Does Centralized Crypto Lending Work?,PYMNTS.com,2022-07-08,https://www.pymnts.com/cryptocurrency/2022/crypto-basics-series-how-does-centralized-crypto-lending-work/
TON Foundation Establishes Ecosystem Fund Worth $90 Million,Coinspeaker,2022-07-08,https://www.coinspeaker.com/ton-ecosystem-fund-90m/
InsureDAO Partners With Arthswap,NameCoinNews,2022-07-08,https://www.namecoinnews.com/insuredao-partners-with-arthswap/
How High can XRP Price reach? Here's a Realistic Prediction!,CryptoTicker,2022-07-08,https://cryptoticker.io/en/how-high-can-xrp-price-reach/
"XRP leads recovery among major cryptocurrencies, Fed policymakers back 75 basis point hike",FXStreet,2022-07-08,https://www.fxstreet.com/cryptocurrencies/news/xrp-leads-recovery-among-major-cryptocurrencies-fed-policymakers-back-75-basis-point-hike-202207081341
Best Tezos Wallets For 2022,CryptoTicker,2022-07-08,https://cryptoticker.io/en/best-tezos-wallets-for-2022/
Delayed Ethereum Merger Proves Costly,Seeking Alpha,2022-07-08,https://seekingalpha.com/article/4522400-delayed-ethereum-merger-proves-costly
Man Loses Down Payment for House When Crypto Exchange ...,Futurism,2022-07-08,https://futurism.com/the-byte/man-loses-down-payment-crypto-exchange-bankrupt
Behind-the-scenes fintech Paxos powering crypto efforts on Wall Street,Business Insider,2022-07-08,https://www.businessinsider.com/paxos-blockchain-tech-powering-crypto-efforts-at-wall-street-giants-2022-7
Fairfax County highlights the value in the 'short-term nature' of yield farming,Cointelegraph,2022-07-08,https://cointelegraph.com/news/fairfax-county-highlights-the-value-in-the-short-term-nature-of-yield-farming
How Helium Uses Crypto to Grow Decentralized Internet,Crypto News,2022-07-08,https://cryptonews.com/videos/how-helium-uses-crypto-to-grow-decentralized-wifi-and-mobile-networks-ep-371.htm
Due Diligence on Tokenomics with Lisa Tan,Crypto News,2022-07-08,https://cryptonews.com/videos/due-diligence-on-tokenomics-fantasy-lineup-with-lisa-tan.htm
MEXC Global Exchange Enables Crypto Purchasing with Cards,U.Today,2022-07-08,https://u.today/mexc-global-exchange-enables-crypto-purchasing-with-cards
