Title,Publisher,Date,Link
Ripples Scores Legal Victory As Tetragon Loses Its Case Against Fintech Giant,U.Today,2021-03-06,https://u.today/ripples-scores-legal-victory-as-tetragon-loses-its-case-against-fintech-giant
Exclusive Legal Hurdles of Blockchain Application Jettisoned ...,BeInCrypto,2021-03-06,https://beincrypto.com/hurdles-of-blockchain-app-jettisoned-liechtenstein-blockchain-act/
Survey By Goldman Sachs: 34% Think Bitcoin Will Reach $100K Next Year,CryptoPotato,2021-03-06,https://cryptopotato.com/survey-by-goldman-sachs-34-think-bitcoin-will-reach-100k-next-year/
Dev says $31 million Meerkat Finance exploit was a ‘test’; will return funds,Cointelegraph,2021-03-06,https://cointelegraph.com/news/dev-says-31-million-meerkat-finance-exploit-was-a-test-will-return-funds
OpenDAX 3.0 With Exchange Liquidity Network (XLN) by Openware Goes Live,The Daily Hodl,2021-03-06,https://dailyhodl.com/2021/03/06/opendax-3-0-with-exchange-liquidity-network-xln-by-openware-goes-live/
"Little-Known Crypto Project Soars 10,000% in Just One Week Amid NFT Craze",The Daily Hodl,2021-03-06,https://dailyhodl.com/2021/03/06/little-known-crypto-project-soars-10000-in-just-one-week-amid-nft-craze/
"Here Are the Top Small-Cap Altcoins That Will Beat the Market, According to Crypto Trader Tyler Swope",The Daily Hodl,2021-03-06,https://dailyhodl.com/2021/03/06/here-are-the-top-small-cap-altcoins-that-will-beat-the-market-according-to-crypto-trader-tyler-swope/
"Tezos, Augur, Compound Price Analysis: 06 March",AMBCrypto,2021-03-06,https://ambcrypto.com/tezos-augur-compound-price-analysis-06-march/
Apple Pay integration and Staking 3.0 launch push COTI price to a new high,Cointelegraph,2021-03-06,https://cointelegraph.com/news/apple-pay-integration-and-staking-3-0-launch-push-coti-price-to-a-new-high
Sologenic to Unveil XRP Ledger-Powered DEX Before March End,CoinTrust.com,2021-03-06,https://www.cointrust.com/market-news/sologenic-to-unveil-xrp-ledger-powered-dex-before-march-end
