Title,Publisher,Date,Link
"Are Cardano, XRP, Litecoin, Binance Coin the ‘low-investment, high-return’ alts you need in your portfolio",AMBCrypto,2021-09-05,https://ambcrypto.com/are-cardano-xrp-litecoin-binance-coin-the-low-investment-high-return-alts-you-need-in-your-portfolio/
"XRP can make it to $6, provided these conditions are met",AMBCrypto,2021-09-05,https://ambcrypto.com/xrp-can-make-it-to-6-provided-these-conditions-are-met/
Sudden whale activity involving large sums may signify this for XRP,AMBCrypto,2021-09-05,https://ambcrypto.com/sudden-activity-among-xrp-whales-may-signify-this/
Analyst Michaël van de Poppe Says XRP Gaining Momentum ...,The Daily Hodl,2021-09-05,https://dailyhodl.com/2021/09/05/analyst-michael-van-de-poppe-says-xrp-gaining-momentum-predicts-massive-breakout-against-bitcoin/
Cardano needs this to sustain its rally to $3 and beyond,AMBCrypto,2021-09-05,https://ambcrypto.com/cardano-needs-this-to-sustain-its-rally-to-3-and-beyond/
Five Under-the-Radar Altcoins All Surge 144% or More in Just Seven Days As Crypto Markets Rally,The Daily Hodl,2021-09-05,https://dailyhodl.com/2021/09/05/five-under-the-radar-altcoins-all-surge-144-or-more-in-just-seven-days-as-crypto-markets-rally/
"New NFT Collections Loot for Adventurers, MAYC, Inertial ...",Bitcoin.com News,2021-09-05,https://news.bitcoin.com/new-nft-collections-loot-for-adventurers-mayc-inertial-moment-make-serious-headway-in-sales/
Cryptocurrency can actually make a difference by helping people,Cointelegraph,2021-09-05,https://cointelegraph.com/news/cryptocurrency-can-actually-make-a-difference-by-helping-people
"When You Buy an NFT, You Don't Completely Own It – Here's ...",Crypto News,2021-09-05,https://cryptonews.com/exclusives/when-you-buy-an-nft-you-don-t-completely-own-it-here-s-why-11692.htm
