Title,Publisher,Date,Link
"Crypto Price Surge: Surprise Tech Giant Support Suddenly Sends Bitcoin, Ethereum, BNB, XRP And Dogecoin Sharply Higher",Forbes,2021-07-24,https://www.forbes.com/sites/billybambrough/2021/07/24/crypto-price-surge-surprise-tech-giant-support-suddenly-sends-bitcoin-ethereum-bnb-xrp-and-dogecoin-sharply-higher/
Coinbase Adding Support for 3 New Crypto Assets in July – And These 16 Altcoins Could Be Next,The Daily Hodl,2021-07-24,https://dailyhodl.com/2021/07/24/coinbase-adding-support-for-3-new-crypto-assets-in-july-and-these-16-altcoins-could-be-next/
NFTs Are Coming to India's Flourishing Art Market,CoinDesk,2021-07-24,https://www.coindesk.com/markets/2021/07/24/nfts-are-coming-to-indias-flourishing-art-market/
Gallup Poll: 6% of American Investors Own Bitcoin,Decrypt,2021-07-24,https://decrypt.co/76802/gallup-poll-6-of-american-investors-own-bitcoin
What Is Neo (NEO) Token?,Coinspeaker,2021-07-24,https://www.coinspeaker.com/guides/what-is-neo-neo-token/
What Is Bitcoin SV (BSV)?,Coinspeaker,2021-07-24,https://www.coinspeaker.com/guides/what-is-bitcoin-sv-bsv/
Locked Out of Millions: Couple Can’t Access $5.8M Worth of Ethereum,CryptoPotato,2021-07-24,https://cryptopotato.com/locked-out-of-millions-couple-cant-access-5-8m-worth-of-ethereum/
Bitcoin price hits $34K as trader forecasts fresh weekend resistance showdown,Cointelegraph,2021-07-24,https://cointelegraph.com/news/bitcoin-price-hits-34k-as-trader-forecasts-fresh-weekend-resistance-showdown
"After Barclays and Santander, UK Bank Natwest Blocks ...",Bitcoin.com News,2021-07-24,https://news.bitcoin.com/barclays-santander-uk-bank-natwest-blocks-payments-to-binance/
Powered by the people: 3 altcoins whose tweet volume spiked before a strong rally,Cointelegraph,2021-07-24,https://cointelegraph.com/news/powered-by-the-people-3-altcoins-whose-tweet-volume-spiked-before-a-strong-rally
Did Uniswap just yield to the ‘evolving regulatory landscape’,AMBCrypto,2021-07-24,https://ambcrypto.com/did-uniswap-just-yield-to-the-evolving-regulatory-landscape/
