Title,Publisher,Date,Link
"SEC vs. Ripple case takes another turn, making investor bullish on XRP",FXStreet,2021-09-11,https://www.fxstreet.com/cryptocurrencies/news/sec-vs-ripple-case-takes-another-turn-making-investor-bullish-on-xrp-202109111628
Here are the BTC price levels to watch as $38K emerges as bulls' line in the sand,Cointelegraph,2021-09-11,https://cointelegraph.com/news/here-are-the-btc-price-levels-to-watch-as-38k-emerges-as-bulls-line-in-the-sand
"El Salvador buys the dip as Bitcoin Law goes live, 101 Bored ...",Cointelegraph,2021-09-11,https://cointelegraph.com/magazine/2021/09/11/el-salvador-bitcoin-law-101-bored-ape-nfts-ukraine-passes-crypto-legislation-hodlers-digest-sept-5-11
Ark Investment Management Opens Door for Fund to Invest in Canadian Crypto ETFs,CoinDesk,2021-09-11,https://www.coindesk.com/business/2021/09/11/ark-investment-management-opens-door-for-fund-to-invest-in-canadian-etfs/
Crypto Trader Michaël van de Poppe Says These Three Altcoins Could Follow Solana’s Breakout,The Daily Hodl,2021-09-11,https://dailyhodl.com/2021/09/11/crypto-trader-michael-van-de-poppe-says-these-three-altcoins-could-follow-solanas-breakout/
Buy Pax Dollar Online | How to Buy USDP Instantly,YouHodler.com,2021-09-11,https://www.youhodler.com/buy/usdp
Highly Anticipated Cardano Upgrade Receives Major Boost From Binance,The Daily Hodl,2021-09-11,https://dailyhodl.com/2021/09/11/highly-anticipated-cardano-upgrade-receives-major-boost-from-binance/
French soccer giant PSG names official crypto partner,Cryptopolitan,2021-09-11,https://www.cryptopolitan.com/psg-names-official-crypto-partner/
Stanford researcher-led Pledge raises $3M for decentralized lending protocol,Cointelegraph,2021-09-11,https://cointelegraph.com/news/stanford-researcher-led-pledge-raises-3m-for-decentralized-lending-protocol
"Bitcoin isn’t far from its peak, but here’s some HODLing advice for investors",AMBCrypto,2021-09-11,https://ambcrypto.com/bitcoin-isnt-far-from-its-peak-but-heres-some-hodling-advice-for-investors/
