Title,Publisher,Date,Link
"Here’s Ripple’s Strongest Defense Against the SEC in XRP Lawsuit, According to Legal Expert Jeremy Hogan",The Daily Hodl,2021-07-27,https://dailyhodl.com/2021/07/27/heres-ripples-strongest-defense-against-the-sec-in-xrp-lawsuit-according-to-crypto-legal-expert-jeremy-hogan/
"Ripple's XRP, what about now? SWIFT announces cross ...",FinanceFeeds,2021-07-27,https://financefeeds.com/ripples-xrp-now-swift-announces-cross-border-payments-seconds/
"Cardano Could Become ‘Big Three’ Mainstream Cryptocurrency, According to Morningstar Portfolio ...",The Daily Hodl,2021-07-27,https://dailyhodl.com/2021/07/27/cardano-could-become-big-three-mainstream-cryptocurrencies-according-to-morningstar-portfolio-strategist/
Senator Warren Urges ‘Coordinated and Holistic’ Response to ‘Dangers’ of Crypto,CoinDesk,2021-07-27,https://www.coindesk.com/markets/2021/07/27/senator-warren-urges-coordinated-and-holistic-response-to-dangers-of-crypto/
Russia's Telecom Giant MTS Invests $11.7M in Blockchain Trade-Finance Service: Report,CoinDesk,2021-07-27,https://www.coindesk.com/business/2021/07/27/russias-telecom-giant-mts-invests-117m-in-blockchain-trade-finance-service-report/
"Crypto Veteran Bobby Lee Predicts Bitcoin Peak Over $250,000 Before Massive Drop – Here’s When",The Daily Hodl,2021-07-27,https://dailyhodl.com/2021/07/27/crypto-veteran-bobby-lee-predicts-bitcoin-peak-over-250000-before-massive-drop-heres-when/
Crypto derivatives exchange Bitget to list USDC as collateral for margin trading,Cointelegraph,2021-07-27,https://cointelegraph.com/news/crypto-derivatives-exchange-bitget-to-list-usdc-as-collateral-for-margin-trading
Bitcoin Trading Volumes Returned as Price Spiked Over $40K,CoinDesk,2021-07-27,https://www.coindesk.com/markets/2021/07/27/bitcoin-trading-volumes-returned-as-price-spiked-over-40k/
Robinhood Reportedly Testing Feature to Protect Crypto Investors From Volatility,CoinDesk,2021-07-27,https://www.coindesk.com/markets/2021/07/27/robinhood-reportedly-testing-feature-to-protect-crypto-investors-from-volatility/
Crypto Custody Firm Fireblocks Raises $310M at $2B Valuation,CoinDesk,2021-07-27,https://www.coindesk.com/business/2021/07/27/crypto-custody-firm-fireblocks-raises-310m-at-2b-valuation/
Dash Launches Retail-Focused DashDirect App to Boost Adoption,CoinDesk,2021-07-27,https://www.coindesk.com/business/2021/07/27/dash-launches-retail-focused-dashdirect-app-to-boost-adoption/
Solana's Saber Labs Raises $7.7M in Seed Funding Round Led by Race Capital,CoinDesk,2021-07-27,https://www.coindesk.com/markets/2021/07/27/solanas-saber-labs-raises-77m-in-seed-funding-round-led-by-race-capital/
DeFi Insurance Platform Tidal Finance Goes Live on Polygon,CoinDesk,2021-07-27,https://www.coindesk.com/business/2021/07/27/defi-insurance-platform-tidal-finance-goes-live-on-polygon/
AS Roma Football Club Signs $42M Deal With Blockchain Fintech Zytara Labs,CoinDesk,2021-07-27,https://www.coindesk.com/business/2021/07/27/as-roma-football-club-signs-42m-deal-with-blockchain-fintech-zytara-labs/
How to Fix Ethereum’s MEV Problem and Give Traders the Best Price,CoinDesk,2021-07-27,https://www.coindesk.com/markets/2021/07/27/how-to-fix-ethereums-mev-problem-and-give-traders-the-best-price/
Justin Sun Joins Research Project at Communist Party School,CoinDesk,2021-07-27,https://www.coindesk.com/markets/2021/07/27/justin-sun-joins-research-project-at-communist-party-school/
A16z Leads $20M Bet That Celo’s Valora Becomes a ‘Global Gateway to Crypto’,CoinDesk,2021-07-27,https://www.coindesk.com/business/2021/07/27/a16z-leads-20m-bet-that-celos-valora-becomes-a-global-gateway-to-crypto/
Hedgehog Markets Raises $3.5M in Funding Round,CoinDesk,2021-07-27,https://www.coindesk.com/business/2021/07/27/hedgehog-markets-raises-35m-in-funding-round/
TitanSwap Successfully Achieves Cross-chain with BSC,Coinspeaker,2021-07-27,https://www.coinspeaker.com/titanswap-cross-chain-bsc/
1inch to Airdrop 10M Tokens to DeFi Users to 'Refund' Gas Costs,CoinDesk,2021-07-27,https://www.coindesk.com/tech/2021/07/27/1inch-to-airdrop-10m-tokens-to-defi-users-to-refund-gas-costs/
Crypto Fintech Eco Raises $60M for High-Yield USDC Savings App,CoinDesk,2021-07-27,https://www.coindesk.com/business/2021/07/27/crypto-fintech-eco-raises-60m-for-high-yield-usdc-savings-app/
Why Stablecoins Are Suddenly in the News,CoinDesk,2021-07-27,https://www.coindesk.com/markets/2021/07/27/why-stablecoins-are-suddenly-in-the-news/
"Popular Analyst Predicts Parabolic Second Phase of Bitcoin Bull Run, Says Bottom In for Ethereum",The Daily Hodl,2021-07-27,https://dailyhodl.com/2021/07/27/popular-analyst-predicts-parabolic-second-phase-of-bitcoin-bull-run-says-bottom-in-for-ethereum/
What Is Telcoin (TEL)?,Coinspeaker,2021-07-27,https://www.coinspeaker.com/guides/what-is-telcoin-tel/
Senate Banking Committee Bashes Bitcoin's 'Phony' Populism,CoinDesk,2021-07-27,https://www.coindesk.com/policy/2021/07/27/senate-banking-committee-bashes-bitcoins-phony-populism/
India to use Ethereum blockchain to verify diploma certificates,Cointelegraph,2021-07-27,https://cointelegraph.com/news/india-to-use-ethereum-blockchain-to-verify-diploma-certificates
'No-Code' Platform for Token Minting Introduced on Solana,CoinDesk,2021-07-27,https://www.coindesk.com/markets/2021/07/27/no-code-platform-for-token-minting-introduced-on-solana/
Tether rejects claims of renewed scrutiny over suspected bank fraud,Forkast News,2021-07-27,https://forkast.news/tether-rejects-claims-renewed-scrutiny-over-bank-fraud/
"Here Are the Top 10 Crypto Assets To Hold As Market Volatility Shifts Into Overdrive, According to Trader T...",The Daily Hodl,2021-07-27,https://dailyhodl.com/2021/07/27/here-are-the-top-10-crypto-assets-to-hold-as-market-volatility-shifts-into-overdrive-according-to-trader-tyler-swope/
Crypto gets starring role in South Korean historical drama,Forkast,2021-07-27,https://forkast.news/headlines/crypto-south-korean-historical-tv-drama/
Kazakhstan to reportedly allow banks to process crypto purchases,Cointelegraph,2021-07-27,https://cointelegraph.com/news/kazakhstan-to-reportedly-allow-banks-to-process-crypto-purchases
What’s Ethereum's price outlook for the rest of 2021?,Forkast,2021-07-27,https://forkast.news/whats-ethereums-price-outlook-for-2021/
Peter Thiel-Backed Exchange Bullish Begins Pilot Program,CoinDesk,2021-07-27,https://www.coindesk.com/markets/2021/07/27/peter-thiel-backed-exchange-bullish-begins-pilot-program/
This new relationship is developing between Bitcoin and Coinbase’s COIN,AMBCrypto,2021-07-27,https://ambcrypto.com/this-new-relationship-is-developing-between-bitcoin-and-coinbases-coin/
Blockchain platform offers security and accountability that DeFi cannot,Cointelegraph,2021-07-27,https://cointelegraph.com/news/blockchain-platform-offers-security-and-accountability-that-defi-cannot
What Are Liquid Funds? – Forbes Advisor INDIA,Forbes,2021-07-27,https://www.forbes.com/advisor/in/investing/what-are-liquid-funds/
Binance CEO wants to 'work with regulators' as the exchange expands,Cointelegraph,2021-07-27,https://cointelegraph.com/news/binance-will-work-with-regulators-as-it-expands-says-ceo
"Newly found Monero bug may impact transaction privacy, developers warn",Cointelegraph,2021-07-27,https://cointelegraph.com/news/newly-found-monero-bug-may-impact-transaction-privacy-developers-warn
Pennsylvania legislature mulls crypto task force bill,Cointelegraph,2021-07-27,https://cointelegraph.com/news/pennsylvania-legislature-mulls-crypto-task-force-bill
Axie Infinity Price Up 22.15% To $49.3018 – Where To Buy AXS,InsideBitcoins,2021-07-27,https://insidebitcoins.com/news/axie-infinity-price-up-22-15-to-49-3018-where-to-buy-axs
Reddit Tokens Soar on Ethereum Arbitrum Launch,Crypto Briefing,2021-07-27,https://cryptobriefing.com/reddit-tokens-soar-ethereum-arbitrum-launch/
BitTorrent (BTT) Price Prediction: What Will It Take to Reach 1 ...,Market Realist,2021-07-27,https://marketrealist.com/p/btt-price-prediction/
