Title,Publisher,Date,Link
LAST CHANCE to Buy XRP below 40 cents! Here's why...,CryptoTicker,2022-06-26,https://cryptoticker.io/en/last-chance-to-buy-xrp-below-40-cents-heres-why/
"Crypto Now Braced For A $2 Billion Goldman Sachs Bombshell As The Price Of Bitcoin, Ethereum, BNB, XRP, Solana, Cardano And Dogecoin Swing",Forbes,2022-06-26,https://www.forbes.com/sites/billybambrough/2022/06/26/crypto-now-braced-for-a-2-billion-goldman-sachs-bombshell-as-the-price-of-bitcoin-ethereum-bnb-xrp-solana-cardano-and-dogecoin-swing/
"Five Altcoins Are Showing Strength As Bitcoin Bottoming Begins, According to Analyst Nicholas Merten",The Daily Hodl,2022-06-26,https://dailyhodl.com/2022/06/25/five-altcoins-are-showing-strength-as-bitcoin-begins-bottoming-begins-according-to-analyst-nicholas-merten/
SEC Chair Gary Gensler Proposes ‘One Rule Book’ for Regulation of All Crypto Asset Trading: Report,The Daily Hodl,2022-06-26,https://dailyhodl.com/2022/06/26/sec-chair-gary-gensler-proposes-one-rule-book-for-regulation-of-all-crypto-asset-trading-report/
JPMorgan Says This Is The 'Fair Value' Of Bitcoin: Why Analysts Say BTC Is Going 28% Higher,Benzinga,2022-06-26,https://www.benzinga.com/markets/cryptocurrency/22/06/27855428/jpmorgan-believes-bitcoin-is-undervalued-backs-btc-to-rise-28
"Gnox (GNOX), Binance Coin (BNB), Cardano (ADA): Coins To Watch Amidst Bear Market",U.Today,2022-06-26,https://u.today/gnox-gnox-binance-coin-bnb-cardano-ada-coins-to-watch-amidst-bear-market
"Top Analyst Bullish on Ethereum and Its Rival Solana, Says Both ETH and SOL Could Ignite Huge Rallies in Co...",The Daily Hodl,2022-06-26,https://dailyhodl.com/2022/06/26/top-analyst-bullish-on-ethereum-and-its-rival-solana-says-both-eth-and-sol-could-ignite-huge-rallies-in-coming-months/
Cosmin Mesenschi of FirstByte Media Explains How The Company Remains A Driving Force Behind Crypto Companies,Bitcoinist,2022-06-26,https://bitcoinist.com/cosmin-mesenschi-of-firstbyte-media-explains-how-the-company-remains-a-driving-force-behind-crypto-companies/
"Billionaire Chamath Palihapitiya Issues Crypto Warning, Predicts Industry’s ‘Honeypots’ W...",The Daily Hodl,2022-06-26,https://dailyhodl.com/2022/06/26/heres-the-next-stage-of-the-crypto-cleansing-according-to-billionaire-chamath-palihapitiya/
ApeCoin Gains 22% After Debut of Bored Ape-Themed Video With Eminem and Snoop Dogg,Decrypt,2022-06-26,https://decrypt.co/103880/apecoin-gains-22-after-debut-of-bored-ape-themed-video-with-eminem-and-snoop-dogg
Don't Fear the Reaper: Why the Market Downtrend Is Good for ...,Crypto News,2022-06-26,https://cryptonews.com/exclusives/dont-fear-the-reaper-why-the-market-downtrend-is-good-for-crypto.htm
Can Move-to-Earn NFT Game Stepn Avoid the Pitfalls of Axie Infinity?,Decrypt,2022-06-26,https://decrypt.co/103827/can-move-to-earn-nft-game-stepn-avoid-the-pitfalls-of-axie-infinity
Harmony Offers $1M Bounty After Discovering $100M Altcoin Hack,Decrypt,2022-06-26,https://decrypt.co/103873/harmony-offers-1-million-bounty-for-returning-stolen-funds
"Top 5 cryptocurrencies to watch this week: BTC, UNI, XLM, THETA, HNT",Cointelegraph,2022-06-26,https://cointelegraph.com/news/top-5-cryptocurrencies-to-watch-this-week-btc-uni-xlm-theta-hnt
"SHIB vs DOGE: Shiba Inu Up 48% Over Past Week, While Dogecoin Sees Only 26% Gains | Bitcoinist.com",Bitcoinist,2022-06-26,https://bitcoinist.com/shib-vs-doge-shiba-inu-up-48-while-dogecoin-24-gain/
NHL Partners With NFT Marketplace Sweet To Bring Digital Collectibles To Fans,Bitcoinist,2022-06-26,https://bitcoinist.com/nhl-with-nft-sweet-bring-digital-collectibles-fans/
TIME Partners With The Sandbox to Build TIME Square in the Metaverse,CryptoPotato,2022-06-26,https://cryptopotato.com/time-partners-with-the-sandbox-to-build-time-square-in-the-metaverse/
CoinFLEX Becomes the Latest Crypto Exchange to Halt Withdrawals,CryptoPotato,2022-06-26,https://cryptopotato.com/coinflex-becomes-the-latest-crypto-exchange-to-halt-withdrawals/
"BlockFi Increased Deposit Rates And Removed Free Withdrawals, Here's What We Know | Bitcoinist.com",Bitcoinist,2022-06-26,https://bitcoinist.com/blockfi-deposit-rates-remove-free-withdrawals/
Influencers Intentionally Loot Millions From Crypto Community In Pump And Dump Scam | Bitcoinist.com,Bitcoinist,2022-06-26,https://bitcoinist.com/influencers-intentionally-loot-millions-from-crypto-community-in-pump-and-dump-scam/
"Top Crypto That Analysts Believe Can Pump 500%: Gnox (GNOX), Quant (QNT) And Synthetix (SNX) | Bitcoinist.com",Bitcoinist,2022-06-26,https://bitcoinist.com/top-crypto-that-analysts-believe-can-pump-500-gnox-gnox-quant-qnt-and-synthetix-snx/
"Crypto conspiracy theories abound, but prop traders are just doing their job",Cointelegraph,2022-06-26,https://cointelegraph.com/news/crypto-conspiracy-theories-abound-but-prop-traders-are-just-doing-its-job
Solid Proof Audit - New Legit Crypto Projects,Business 2 Community,2022-06-26,https://www.business2community.com/crypto-news/solid-proof-audit-legit-new-crypto-projects-02511075
Binance CEO Gives His Answer to One of the Most Frequently ...,Cryptoglobe,2022-06-26,https://www.cryptoglobe.com/latest/2022/06/binance-ceo-gives-his-answer-to-one-of-the-most-frequently-asked-questions-about-bitcoin/
Lacoste Is Embracing Web3 With an Iconic NFT Collection,Cryptoglobe,2022-06-26,https://www.cryptoglobe.com/latest/2022/06/lacoste-is-embracing-web3-with-an-iconic-nft-collection/
"First Mover Asia: Bitcoin Holds Above $21K in Weekend Trading, Solana Web3 Phone Faces Long Odds",CoinDesk,2022-06-26,https://www.coindesk.com/markets/2022/06/26/first-mover-asia-bitcoin-holds-above-21k-in-weekend-trading-solana-web3-phone-faces-long-odds/
This Team Is All About security: Here Is Your Favorite New Mobile Game,Coinpedia,2022-06-26,https://coinpedia.org/press-release/this-team-is-all-about-security-here-is-your-favorite-new-mobile-game/
UK presses on with changes to Brexit deal despite EU opposition,FXStreet,2022-06-26,https://www.fxstreet.com/news/uk-presses-on-with-changes-to-brexit-deal-despite-eu-opposition-202206262217
Why Pain May Not Be Over For Bitcoin Holders Just Yet,NewsBTC,2022-06-26,https://www.newsbtc.com/news/bitcoin/why-pain-may-not-over-bitcoin-holders-yet/
Crypto Market Forecast: Week of June 27th 2022 » Brave New ...,Brave New Coin,2022-06-26,https://bravenewcoin.com/insights/crypto-market-forecast-week-of-june-27th-2022
Goodbye to Crypto Fees?,99Bitcoins,2022-06-26,https://99bitcoins.com/bitcoin-news-summary-jun-27-2022/
Sandbox (SAND) Blows Up 20% Over Last 24 Hours Following ‘Takeover’ Rumors,NewsBTC,2022-06-26,https://www.newsbtc.com/metaverse/sandbox-sand-blows-up-20/
Wire Network : une solution pour l'interopérabilité des ...,Journal Du Coin,2022-06-26,https://journalducoin.com/defi/wire-network-solution-interoperabilite-blockchains/
"Roundup: Solana Unveils Flagship Android Phone, Coinbase ...",Securities.io,2022-06-26,https://www.securities.io/roundup-solana-unveils-flagship-android-phone-coinbase-to-support-solana-crypto-transfers/
Tron's [TRX] Total Users Tap 100M; Justin Sun Says 'Just A Beginning',TronWeekly,2022-06-26,https://www.tronweekly.com/tron-trx-justin-sun/
Is Anonymity in Crypto Creating New Avenues For Women In Finance?,CryptoMode,2022-06-26,https://cryptomode.com/is-anonymity-in-crypto-creating-new-avenues-for-women-in-finance/
"Crypto Coins with Significant Income Facilities: RoboApe (RBA), Akitu Inu (AKITA) and Kishu Inu (KISHU)",CryptoMode,2022-06-26,https://cryptomode.com/crypto-coins-with-significant-income-facilities-roboape-rba-akitu-inu-akita-and-kishu-inu-kishu/
"$300 Silver, $5K gold is possible; Peter Krauth predicts these ...",KITCO,2022-06-26,https://www.kitco.com/news/2022-06-26/-300-Silver-5K-gold-is-possible-Peter-Krauth-predicts-these-prices-in-5-10-years.html
Gold will lead a stock market recovery once the next recession ...,KITCO,2022-06-26,https://www.kitco.com/news/2022-06-26/Gold-will-lead-a-stock-market-recovery-once-the-next-recession-ends-Chen-Lin.html
EM Weekly Podcast: Yield Hunters Look to Frontier Bond Bets,Bloomberg.com,2022-06-26,https://www.bloomberg.com/news/audio/2022-06-27/em-weekly-podcast-yield-hunters-look-to-frontier-bond-bets-l4w1a7a2
France's central bank says users have more trust in banks ...,Finbold,2022-06-26,https://finbold.com/frances-central-bank-says-users-have-more-trust-in-banks-than-cryptocurrencies-wef22/
"GST Council Meet: Rate Changes On Some Items On Cards, States' Compensation Tops Agenda",Outlook India,2022-06-26,https://www.outlookindia.com/business/gst-council-meet-rate-changes-on-some-items-on-cards-states-compensation-tops-agenda-news-204814
Putin Weaponizes Inflation,CoinDesk,2022-06-26,https://www.coindesk.com/podcasts/the-breakdown-with-nlw/putin-weaponizes-inflation/
What is Marinade Finance?,Asia Crypto Today,2022-06-26,https://www.asiacryptotoday.com/marinade-finance/
Significant Correction In Bitcoin Value Is Creating Stress On ...,Bitcoinik,2022-06-26,https://bitcoinik.com/significant-correction-in-bitcoin-value-is-creating-stress-on-bitcoin-mining-firms/
GPT-3 Training Programmers for the Present (and the Future),HackerNoon,2022-06-26,https://hackernoon.com/gpt-3-training-programmers-for-the-present-and-the-future
Generation Start-up: how Pyypl helps the unbanked take control of their money,The National,2022-06-26,https://www.thenationalnews.com/business/money/2022/06/27/generation-start-up-how-pyypl-helps-the-unbanked-take-control-of-their-money/
"Bitcoin, ether, other cryptocurrency prices today fall; dogecoin ...",Crypto News BTC,2022-06-26,https://cryptonewsbtc.org/2022/06/27/bitcoin-ether-other-cryptocurrency-prices-today-fall-dogecoin-surges-10/
"Bitcoin, Ethereum extend poor performance on fears of ...",Crypto News BTC,2022-06-26,https://cryptonewsbtc.org/2022/06/26/bitcoin-ethereum-extend-poor-performance-on-fears-of-celsius-bankruptcy-%EC%BD%94%EB%A6%AC%EC%95%84%ED%83%80%EC%9E%84%EC%8A%A4/
"Blockchain.com Comprehensive Review 2022 - Fees, Pros ...",Coinrevolution,2022-06-26,https://coinrevolution.com/cryptocurrency/exchanges/blockchain-com-comprehensive-review-2022-fees-pros-and-cons/
