Title,Publisher,Date,Link
One Billion XRP Withdrawn by Ripple as 412 Million XRP Gets Moved by Exchanges,U.Today,2022-04-01,https://u.today/one-billion-xrp-withdrawn-by-ripple-as-412-million-xrp-gets-moved-by-exchanges
XRP Price Prediction: Ripple to eke out weekly gains,FXStreet,2022-04-01,https://www.fxstreet.com/cryptocurrencies/news/xrp-price-prediction-ripple-to-eke-out-weekly-gains-202204011133
"Don't Go All in on XRP, But an SEC Lawsuit Win Would Be a ...",InvestorPlace,2022-04-01,https://investorplace.com/2022/04/xrp-looking-like-compelling-wager/
"Top 3 Price Prediction Bitcoin, Ethereum, XRP: April looks bright for cryptos",FXStreet,2022-04-01,https://www.fxstreet.com/cryptocurrencies/news/top-3-price-prediction-bitcoin-ethereum-xrp-april-looks-bright-for-cryptos-202204011651
Solana Jumps XRP in Market Cap and Leads in Weekly Gains: Details,U.Today,2022-04-01,https://u.today/solana-jumps-xrp-in-market-cap-and-leads-in-weekly-gains-details
XRP price road to $1 remains intact,FXStreet,2022-04-01,https://www.fxstreet.com/cryptocurrencies/news/xrp-price-road-to-1-remains-intact-202204011443
"Crypto Price Analysis April-1: Ethereum, Ripple, Cardano, Solana, and Shiba Inu",CryptoPotato,2022-04-01,https://cryptopotato.com/crypto-price-analysis-april-1-ethereum-ripple-cardano-solana-and-shiba-inu/
2 Top Cryptocurrencies to Buy and Hold Forever,Nasdaq,2022-04-01,https://www.nasdaq.com/articles/2-top-cryptocurrencies-to-buy-and-hold-forever-2
"Institutional Investors Are Storming Back to Bitcoin and Ethereum From Altcoins, Says New CoinShares Survey",The Daily Hodl,2022-04-01,https://dailyhodl.com/2022/04/01/institutional-investors-are-storming-back-to-bitcoin-and-ethereum-from-altcoins-says-new-coinshares-survey/
Citi Sees Metaverse Economy as Large as $13T by 2030,CoinDesk,2022-04-01,https://www.coindesk.com/business/2022/04/01/citi-sees-metaverse-economy-as-large-as-13t-by-2030/
What is Sologenic (SOLO) crypto? Know price and performance,Kalkine Media,2022-04-01,https://kalkinemedia.com/us/news/cryptocurrency/what-is-sologenic-solo-crypto-know-price-and-performance
Crypto Staking 101: What Is Staking?,CoinDesk,2022-04-01,https://www.coindesk.com/learn/crypto-staking-101-what-is-staking/
Cowen CEO Says There’s High Demand for Crypto,U.Today,2022-04-01,https://u.today/cowen-ceo-says-theres-high-demand-for-crypto
"Terra's UST Criticized by Peter Schiff, Here's Why",U.Today,2022-04-01,https://u.today/terras-ust-criticized-by-peter-schiff-heres-why
Bitcoin's 'Guppy' Indicator Flashes Green for Bulls,CoinDesk,2022-04-01,https://www.coindesk.com/markets/2022/04/01/bitcoins-guppy-indicator-flashes-green-for-bulls/
