Title,Publisher,Date,Link
"XRP, DOGE, ETH Are at Loss as Crypto Investors Enter Bear Mode: Crypto Market Review, August 22",U.Today,2022-08-22,https://u.today/xrp-doge-eth-are-at-loss-as-crypto-investors-enter-bear-mode-crypto-market-review-august-22
Top 3 Trending Coins: XRP Bears Eye Annual Lows Under $0.30 Ahead of Busy Week,FX Empire,2022-08-22,https://www.fxempire.com/forecasts/article/top-3-trending-coins-xrp-bears-eye-annual-lows-under-0-30-ahead-of-busy-week-1103178
Vitalik Buterin Says Ripple and XRP Lost Their Right to Regulatory Protection Years Ago – Here’s What H...,The Daily Hodl,2022-08-22,https://dailyhodl.com/2022/08/22/vitalik-buterin-says-ripple-and-xrp-lost-their-right-to-regulatory-protection-years-ago-heres-what-he-means/
XRP Rewards Announced by Binance for Users: Details,U.Today,2022-08-22,https://u.today/xrp-rewards-announced-by-binance-for-users-details
XRP (XRP) Bounces Close to 900-Day Support Line,BeInCrypto,2022-08-22,https://beincrypto.com/xrp-xrp-bounces-close-to-900-day-support-line/
XRP Price Pressures Mount as the Jackson Hole Symposium Nears,FX Empire,2022-08-22,https://www.fxempire.com/forecasts/article/xrp-price-pressures-mount-as-the-jackson-hole-symposium-nears-1103546
"Leak Reveals Surprise 1,000% FTX Crypto Surge Amid Bitcoin, Ethereum, BNB, XRP, Solana, Cardano And Dogecoin Price Crash—CryptoCodex",Forbes,2022-08-22,https://www.forbes.com/sites/billybambrough/2022/08/22/leak-reveals-surprise-1000-ftx-crypto-surge-amid-bitcoin-ethereum-bnb-xrp-solana-cardano-and-dogecoin-price-crash-cryptocodex/
"Top 3 Price Prediction Bitcoin, Ethereum, Ripple: Knife ...",FXStreet,2022-08-22,https://www.fxstreet.com/cryptocurrencies/news/top-3-price-prediction-bitcoin-ethereum-ripple-knife-catching-102-sir-guillotins-fate-202208222010
Most Active XRPL Project Integrates First Ever Blockchain Game with Staking Mechanics,U.Today,2022-08-22,https://u.today/most-active-xrpl-project-integrates-first-ever-blockchain-game-with-staking-mechanics
"Cryptocurrency Prices Today: Bitcoin Rebounds After Falling Below $21,000, ETH Dips 10.57%",Outlook India,2022-08-22,https://www.outlookindia.com/business/cryptocurrency-prices-today-bitcoin-rebounds-after-falling-below-21-000-eth-dips-10-57--news-218147
"Cryptos Fear The Fed's Fury, Market Cap Briefly Falls Below ...",RTTNews,2022-08-22,https://www.rttnews.com/3306709/cryptos-fear-the-fed-s-fury-market-cap-briefly-falls-below-1-trillion.aspx
"Metaverse is a key factor in long-term NFT success, says new research",Cointelegraph,2022-08-22,https://cointelegraph.com/news/metaverse-is-a-key-factor-in-long-term-nft-success-says-new-research
"Cryptocurrencies react to Jackson Hole, Fed rate hike plans and a weakening bear market rally",Cointelegraph,2022-08-22,https://cointelegraph.com/news/cryptocurrencies-react-to-jackson-hole-fed-rate-hike-plans-and-a-weakening-bear-market-rally
The XRP Lawyer Hints at the SEC's Making Baseless ...,The Crypto Update,2022-08-22,https://www.thecryptoupdates.com/the-xrp-lawyer-hints-at-the-secs-making-baseless-accusations-against-crypto-exchanges/
Crypto Funds See Minor Outflows Amid Trading Volume Dip: CoinShares,CoinDesk,2022-08-22,https://www.coindesk.com/markets/2022/08/22/crypto-funds-see-minor-outflows-amid-trading-volume-dip-coinshares/
Fantom (FTM) Hit By Bearish Sentiment Despite Logging Over ...,TheGWW.com,2022-08-22,https://thegww.com/fantom-ftm-hit-by-bearish-sentiment-despite-logging-over-300000-active-users/
"Cryptocurrency prices today: Bitcoin, Shiba Inu fall while ether ...",UP Jobs News,2022-08-22,https://upjobsnews.com/cryptocurrency-prices-today-bitcoin-shiba-inu-fall-while-ether-dogecoin-gain-more-latest-news-here/
5 Things to Know in Crypto Today: BTC Hovers Above $21K Amid Risk-off Macro Tone,FX Empire,2022-08-22,https://www.fxempire.com/forecasts/article/5-things-to-know-in-crypto-today-btc-hovers-above-21k-amid-risk-off-macro-tone-1103056
Coins.ph Teams Up with OK Remit to Enable Low-Cost ...,The Korea Herald,2022-08-22,https://m.koreaherald.com/view.php?ud=20220823000547
Markets Fall On Renewed Rate Hike Fears,RTTNews,2022-08-22,https://www.rttnews.com/3306617/markets-fall-on-renewed-rate-hike-fears.aspx?type=cryp
Markets Fall On Renewed Rate Hike Fears,RTTNews,2022-08-22,https://www.rttnews.com/3306617/markets-fall-on-renewed-rate-hike-fears.aspx
Crypto On Aug. 22: Market Turns Slightly Green After Weekend Crash,International Business Times,2022-08-22,https://www.ibtimes.com/crypto-aug-22-bitcoin-ether-crash-violently-over-weekend-3604325
Polkadot (DOT) Hits The Brakes At $7.34 After Brief Recovery,TheGWW.com,2022-08-22,https://thegww.com/polkadot-dot-hits-the-brakes-at-7-34-after-brief-recovery/
Crypto Market Daily Highlights – SOL Leads ETH and the Top Ten into the Red,FX Empire,2022-08-22,https://www.fxempire.com/forecasts/article/crypto-market-daily-highlights-sol-leads-eth-and-the-top-ten-into-the-red-2-1103487
Cardano (ADA) Reclaims Strong Buy Territory – Here's How,TheGWW.com,2022-08-22,https://thegww.com/cardano-ada-reclaims-strong-buy-territory-heres-how/
Crypto Market Daily Highlights – SOL Leads the Top Ten into the Red,FX Empire,2022-08-22,https://www.fxempire.com/forecasts/article/crypto-market-daily-highlights-sol-leads-the-top-ten-into-the-red-2-1103487
Mark Zuckerberg to Overhaul Meta's Metaverse App Horizon ...,Bitcoin.com News,2022-08-22,https://news.bitcoin.com/mark-zuckerberg-to-overhaul-metas-metaverse-app-horizon-worlds-after-criticism-of-its-simple-graphics/
Stifel Financial: 97% of US Executives Surveyed Are Bracing ...,Bitcoin.com News,2022-08-22,https://news.bitcoin.com/stifel-financial-97-of-us-executives-surveyed-are-bracing-for-recession/
IMF Sees Significant Increase in Correlations Between Bitcoin ...,Bitcoin.com News,2022-08-22,https://news.bitcoin.com/imf-sees-significant-increase-in-correlations-between-bitcoin-and-asian-equity-markets/
"Biggest Movers: EOS Higher Despite Crypto Sell-off, FLOW ...",Bitcoin.com News,2022-08-22,https://news.bitcoin.com/biggest-movers-eos-higher-despite-crypto-sell-off-flow-extends-declines/
Hodlnaut Court Filings Highlight a $193 Million Shortfall ...,Bitcoin.com News,2022-08-22,https://news.bitcoin.com/hodlnaut-court-filings-highlight-a-193-million-shortfall-whistleblower-condemns-crypto-lenders-contradictory-statements/
Two head-turner cryptos under $5,Crypto News BTC,2022-08-22,https://cryptonewsbtc.org/2022/08/22/two-head-turner-cryptos-under-5/
"Rwanda, Norway launch coalition to end plastic pollution by ...",UP Jobs News,2022-08-22,https://upjobsnews.com/rwanda-norway-launch-coalition-to-end-plastic-pollution-by-2040-the-new-times-more-latest-news-here/
Trump files motion over Mar-a-Lago search & More Latest ...,UP Jobs News,2022-08-22,https://upjobsnews.com/trump-files-motion-over-mar-a-lago-search-more-latest-news-here/
Cardano Price Forecast as U.S. Dollar Index Rises,Born2Invest,2022-08-22,https://born2invest.com/articles/cardano-price-forecast-as-u-s-dollar-index-rises/
RadioCACA Seals off New Partnership With Venus Protocol,NullTX,2022-08-22,https://nulltx.com/radiocaca-seals-off-new-partnership-with-venus-protocol/
Near Protocol Slips 24% as Fake Block Was Submitted During ...,Economy Watch,2022-08-22,https://www.economywatch.com/news/near-protocol-slips-24-as-fake-block-was-submitted-during-weekend
Bitcoin: goodbye to the upward trend that seemed to recover this cryptocurrency,California18,2022-08-22,https://california18.com/bitcoin-goodbye-to-the-upward-trend-that-seemed-to-recover-this-cryptocurrency/6379422022/
Best Cryptocurrency of the Year,Scoopearth.com,2022-08-22,https://www.scoopearth.com/best-cryptocurrency-of-the-year/
