Title,Publisher,Date,Link
SEC Crypto Enforcement Approach May Not Be Enough in the Long Term,PYMNTS.com,2022-02-02,https://www.pymnts.com/cryptocurrency/2022/sec-crypto-enforcement-approach-may-not-be-enough-in-the-long-term/
FTX Acquires Liquid Group in Major Eastern Expansion,Decrypt,2022-02-02,https://decrypt.co/91852/ftx-acquires-liquid-group-in-major-far-east-expansion
Texas Crypto Miners Shuttering Operations as Winter Storm Approaches,CoinDesk,2022-02-02,https://www.coindesk.com/business/2022/02/03/texas-crypto-miners-shuttering-operations-as-winter-storm-approaches/
Zcash Extends Rally Into Asian Trading Day,CoinDesk,2022-02-02,https://www.coindesk.com/markets/2022/02/02/zcash-extends-rally-into-asian-trading-day/
"This Super Bowl, Don’t Trust Celebrity Crypto Endorsements (Don’t Trust Yourself, Either)",CoinDesk,2022-02-02,https://www.coindesk.com/layer2/2022/02/02/this-super-bowl-dont-trust-celebrity-crypto-endorsements-dont-trust-yourself-either/
Ethereum's Pure Revenue Reaches $1.2 Billion as More Use Cases Appear on Chain,U.Today,2022-02-02,https://u.today/ethereums-pure-revenue-reaches-12-billion-as-more-use-cases-appear-on-chain
Crypto Donations to Tor Surged 841% in 2021,CoinDesk,2022-02-02,https://www.coindesk.com/tech/2022/02/02/crypto-donations-to-tor-surged-841-in-2021/
"Bitcoin Slides Below $38K, Support Is Above $35K",CoinDesk,2022-02-02,https://www.coindesk.com/markets/2022/02/02/bitcoin-slides-below-38k-support-above-35k/
"Ripple’s Expansion in Europe Continues, as the Company Struck Partnership with Modulr",Ripple Coin News,2022-02-02,https://ripplecoinnews.com/ripples-expansion-in-europe-continues-as-the-company-struck-partnership-with-modulr/
"Coinbase, Genesis Highlight Massive Institutional Growth at MicroStrategy Conference",CoinDesk,2022-02-02,https://www.coindesk.com/business/2022/02/02/coinbase-genesis-highlight-massive-institutional-growth-at-microstrategy-conference/
Blockchain Bridge Wormhole Suffers Possible Exploit Worth Over $326M,CoinDesk,2022-02-02,https://www.coindesk.com/tech/2022/02/02/blockchain-bridge-wormhole-suffers-possible-exploit-worth-over-250m/
Thailand Drops 15% Capital Gains Tax Plan on Crypto,Decrypt,2022-02-02,https://decrypt.co/91854/thailand-drops-15-capital-gains-tax-plan-on-crypto
Greenidge Q4 Revenue Rises Even as the Number of Coins Mined Falls,CoinDesk,2022-02-02,https://www.coindesk.com/business/2022/02/02/greenidge-q4-revenue-rises-even-as-the-number-of-coins-mined-falls/
NFT Platform Pixel Vault Closes $100M Investment,CoinDesk,2022-02-02,https://www.coindesk.com/business/2022/02/02/nft-platform-pixel-vault-closes-100m-investment/
Federal Reserve Board Nominees Bring Blank Slate on Crypto Views,CoinDesk,2022-02-02,https://www.coindesk.com/markets/2022/02/02/federal-reserve-board-nominees-bring-blank-slate-on-crypto-views/
Cardano's Most Crucial Update in 2022 Goes Live: What Does This Mean for Cardano?,U.Today,2022-02-02,https://u.today/cardanos-most-crucial-update-in-2022-goes-live-what-does-this-mean-for-cardano
Hodlers beware! New malware targets MetaMask and 40 other crypto wallets,Cointelegraph,2022-02-02,https://cointelegraph.com/news/hodlers-beware-new-malware-targets-metamask-and-40-other-crypto-wallets
FTX Buys Crypto Exchange Liquid Group for Expansion in Japan,CoinDesk,2022-02-02,https://www.coindesk.com/business/2022/02/02/ftx-buys-crypto-exchange-liquid-group-for-expansion-in-japan/
"Silvergate's Acquisition of Diem's Assets Positive for Stablecoin Launch, Analysts Say",CoinDesk,2022-02-02,https://www.coindesk.com/business/2022/02/02/silvergates-acquisition-of-diems-assets-positive-for-stablecoin-launch-analysts-say/
"South African Regulator Issues Warning on FTX, Bybit",CoinDesk,2022-02-02,https://www.coindesk.com/policy/2022/02/02/south-african-regulator-issues-warning-on-ftx-bybit/
New Chainalysis Report Suggests NFT Crime Doesn’t (Always) Pay,CoinDesk,2022-02-02,https://www.coindesk.com/business/2022/02/02/new-chainalysis-report-suggests-nft-crime-doesnt-always-pay/
Shiba Inu Community Gets Praise from Republican State Senator,U.Today,2022-02-02,https://u.today/shiba-inu-community-gets-praise-from-republican-state-senator
Bitcoin price dips below $37K as a descending channel pattern comes back into play,Cointelegraph,2022-02-02,https://cointelegraph.com/news/bitcoin-price-dips-below-37k-as-a-descending-channel-pattern-comes-back-into-play
Ethereum Data Firm Dune Analytics Hits Unicorn Status With ...,Decrypt,2022-02-02,https://decrypt.co/91875/ethereum-data-dune-analytics-unicorn-series-b
Federal Reserve Bank of NY Lays Out Possible Stablecoin Scenarios,CoinDesk,2022-02-02,https://www.coindesk.com/markets/2022/02/02/federal-reserve-bank-of-ny-lays-out-possible-stablecoin-scenarios/
Crypto Market Snoozes Through ADP Payroll Shocker,CoinDesk,2022-02-02,https://www.coindesk.com/business/2022/02/02/crypto-market-snoozes-through-adp-payroll-shocker/
Nearly $2.3 Billion Worth of Bitcoin Moved Out of Wallet Involved in 2016 Bitfinex Hack: Whale Alert,The Daily Hodl,2022-02-02,https://dailyhodl.com/2022/02/02/nearly-2-3-billion-worth-of-bitcoin-moved-out-of-wallet-involved-in-2016-bitfinex-hack-whale-alert/
All the world’s Bitcoin can only pay 2.43% of $30T US national debt,Cointelegraph,2022-02-02,https://cointelegraph.com/news/all-the-world-s-bitcoin-can-only-pay-2-43-of-30t-us-national-debt
Crypto Index Tracker – Big Jump in Metaverse Index,The Daily Hodl,2022-02-02,https://dailyhodl.com/2022/02/02/crypto-index-tracker-big-jump-in-metaverse-index/
"Over $1,570,000,000 Worth of Bitcoin Moved off Crypto Exchanges in Just Seven Days: Insights Firm Santiment",The Daily Hodl,2022-02-02,https://dailyhodl.com/2022/02/02/over-1570000000-worth-of-bitcoin-moved-off-crypto-exchanges-in-just-seven-days-insights-firm-santiment/
Kiss this: You can buy Gene Simmons’ Las Vegas mansion with crypto,Cointelegraph,2022-02-02,https://cointelegraph.com/news/kiss-this-you-can-buy-gene-simmons-las-vegas-mansion-with-crypto
Meta Reports Loss of $10.2B on Augmented/Virtual Reality Operations in 2021,CoinDesk,2022-02-02,https://www.coindesk.com/business/2022/02/02/meta-reports-a-loss-of-102b-on-augmentedvirtual-reality-operations-in-2021/
Investment Giant Fidelity Names Two Bullish Catalysts That Can Push Bitcoin (BTC) to Greater Heights,The Daily Hodl,2022-02-02,https://dailyhodl.com/2022/02/02/investment-giant-fidelity-names-two-bullish-catalysts-that-can-push-bitcoin-btc-to-greater-heights/
Litecoin (LTC) Announces Completion of Privacy Upgrade Following Years of Development,The Daily Hodl,2022-02-02,https://dailyhodl.com/2022/02/02/litecoin-ltc-announces-completion-of-privacy-upgrade-following-years-of-development/
