Title,Publisher,Date,Link
"Ripple Price Analysis: After 2 Months of Sideways, Will XRP Finally Breakout?",CryptoPotato,2022-08-14,https://cryptopotato.com/ripple-price-analysis-after-2-months-of-sideways-will-xrp-finally-breakout/
Who owns the most Ripple? XRP insiders among biggest stakeholders,Capital.com,2022-08-14,https://capital.com/ripple-who-owns-most-xrp
Cardano (ADA) Flips XRP After 4% Price Spike,U.Today,2022-08-14,https://u.today/cardano-ada-flips-xrp-after-4-price-spike
"A Massive $10 Trillion Crypto Game-Changer Is Closer Than You Think—Suddenly Boosting The Price Of Bitcoin, Ethereum, BNB, XRP, Solana, Cardano And Dogecoin",Forbes,2022-08-14,https://www.forbes.com/sites/billybambrough/2022/08/14/a-massive-10-trillion-crypto-game-changer-is-closer-than-you-think-suddenly-boosting-the-price-of-bitcoin-ethereum-bnb-xrp-solana-cardano-and-dogecoin/
What Role Can #blockchain and Tokenization Play in Transitioning to a Low Carbon ... - Latest Tweet by XRP,Latestly,2022-08-14,https://www.latestly.com/socially/technology/what-role-can-blockchain-and-tokenization-play-in-transitioning-to-a-low-carbon-latest-tweet-by-xrp-4081815.html
Will New Cryptocurrency Proprivex Do Better Than Ripple and Fantom In The Crypto Market?,Times Tabloid,2022-08-14,https://timestabloid.com/will-new-cryptocurrency-proprivex-do-better-than-ripple-and-fantom-in-the-crypto-market/
"Cardano Hits 2-Month High, Will The $1 Price Be Conquered ...",Cardano Feed,2022-08-14,https://cardanofeed.com/cardano-hits-2-month-high-will-the-1-price-be-conquered-again-107648.html
Crypto Market Daily Highlights – DOGE Jumps 11% to Return ...,FX Empire,2022-08-14,https://www.fxempire.com/forecasts/article/crypto-market-daily-highlights-doge-jumps-11-to-return-to-the-top-ten-1096183
"These Gen Z crypto investors lost as much as 6 figures in the crypto crash, but they’re doubling down on their investment",Fortune,2022-08-14,https://fortune.com/2022/08/14/crypto-investors-see-gains-ahead/
"Bitcoin and Ethereum Signal Bullish Continuation, SHIB ...",Crypto News,2022-08-14,https://cryptonews.com/news/bitcoin-and-ethereum-signaling-bullish-continuation-shib-rallies-30.htm
"Ripple Labs Looking to Acquire Celsius' Assets, Report",Wall Street Pit,2022-08-14,https://wallstreetpit.com/118173-ripple-labs-looking-to-acquire-celsius-assets-report/
Press Release Distribution Is Providing The Great Opportunity ...,Broadcast Cover,2022-08-14,https://www.broadcastcover.com/press-release-distribution-is-providing-the-great-opportunity-to-make-your-xrp-well-known-among-the-massive-audience/
Ripple Price Analysis: Bulls Eye Upside Break Above $0.4,Live Bitcoin News,2022-08-14,https://www.livebitcoinnews.com/ripple-price-analysis-bulls-eye-upside-break-above-0-4/
SEC Brings First-Ever Insider Trading Action Involving Digital ...,JD Supra,2022-08-14,https://www.jdsupra.com/legalnews/sec-brings-first-ever-insider-trading-3433890/
"Cryptocurrency Price Today: Ethereum Approaches $2,000, Shiba Inu Emerges As Biggest Gainer",ABP LIVE,2022-08-14,https://news.abplive.com/business/crypto/cryptocurrency-price-today-in-india-august-15-check-market-cap-bitcoin-ethereum-dogecoin-litecoin-ripple-shib-prices-gainer-loser-coinmarketcap-wazirx-1548161
Which Insolvent Lending Companies Are Re-Opening Frozen ...,Bitrates.com,2022-08-14,https://www.bitrates.com/news/p/frozen-crypto-accounts-which-insolvent-companies-have-opened-withdrawals
"How to Prepare For The Ethereum Merge: Risks, Trading ...",Crypto News,2022-08-14,https://cryptonews.com/videos/how-to-prepare-for-the-ethereum-merge-risks-trading-strategies-and-forks.htm
"Biggest Movers: MATIC, SOL Move Towards 4-Month Highs on Saturday – Market Updates Bitcoin News - Bitcoin News",Inferse.com,2022-08-14,https://www.inferse.com/184020/biggest-movers-matic-sol-move-towards-4-month-highs-on-saturday-market-updates-bitcoin-news-bitcoin-news/
"Analyst Warns Ethereum Merge Mania Is Blinding Crypto Traders, Says Hammer Set to Drop on Unsuspecting Inve... - The Daily Hodl",Inferse.com,2022-08-14,https://www.inferse.com/183549/analyst-warns-ethereum-merge-mania-is-blinding-crypto-traders-says-hammer-set-to-drop-on-unsuspecting-inve-the-daily-hodl/
Ian Foster 'expects' to remain All Blacks coach after Ellis Park ...,UP Jobs News,2022-08-14,https://upjobsnews.com/ian-foster-expects-to-remain-all-blacks-coach-after-ellis-park-victory-over-boks-more-latest-news-here/
"Crypto On Aug. 15: Bitcoin Momentarily Breaks $25,000, Ether Drops Below $2,000",International Business Times,2022-08-14,https://www.ibtimes.com/crypto-aug-15-bitcoin-momentarily-breaks-25000-ether-drops-below-2000-3601840
Billionaire Mark Cuban Sued for Allegedly Promoting a Massive Crypto 'Ponzi Scheme' – Featured Bitcoin News - Bitcoin News,Inferse.com,2022-08-14,https://www.inferse.com/184352/billionaire-mark-cuban-sued-for-allegedly-promoting-a-massive-crypto-ponzi-scheme-featured-bitcoin-news-bitcoin-news/
The Seven Most Useful Cryptocurrency Gambling Tips You'll ...,Crypto News BTC,2022-08-14,https://cryptonewsbtc.org/2022/08/14/the-seven-most-useful-cryptocurrency-gambling-tips-youll-ever-read/
Cryptocurrency Price Today In India August 15 Check Market ...,Crypto News BTC,2022-08-14,https://cryptonewsbtc.org/2022/08/15/cryptocurrency-price-today-in-india-august-15-check-market-cap-bitcoin-ethereum-dogecoin-litecoin-ripple-shib-prices-gainer-loser-coinmarketcap-wazirx/
Crypto: Billionaire Mark Cuban Warns of a Powerful Player - TheStreet,Inferse.com,2022-08-14,https://www.inferse.com/184548/crypto-billionaire-mark-cuban-warns-of-a-powerful-player-thestreet/
