Title,Publisher,Date,Link
"Binance Gains Bahrain Approval to Become Crypto Asset Service Provider, Registers in Canada",CoinDesk,2021-12-27,https://www.coindesk.com/business/2021/12/27/binance-gains-bahrain-approval-to-become-crypto-asset-service-provider/
DeFi Traders Push Terra’s UST Stablecoin to $10B Market Cap,CoinDesk,2021-12-27,https://www.coindesk.com/markets/2021/12/27/defi-traders-push-terras-ust-stablecoin-to-10b-market-cap/
"Cardano, Polkadot Jump as Bitcoin Holds Above $50K",CoinDesk,2021-12-27,https://www.coindesk.com/markets/2021/12/27/cardano-polkadot-jump-as-bitcoin-holds-above-50k/
"DeFi Yield Protocol v2 pools are live on Ethereum, BSC and Avalanche",Cointelegraph,2021-12-27,https://cointelegraph.com/press-releases/defi-yield-protocol-v2-pools-are-live-on-ethereum-bsc-and-avalanche
"Novogratz disses Litecoin on CNBC, does he have a point?",CryptoSlate,2021-12-27,https://cryptoslate.com/novogratz-disses-litecoin-on-cnbc-does-he-have-a-point/
Big Four accountancy firms clamp down on employee crypto disclosures,CryptoSlate,2021-12-27,https://cryptoslate.com/big-four-accountancy-firms-clamp-down-on-employee-crypto-disclosures/
