Title,Publisher,Date,Link
Binance Coin: How traders can short this setup and make profits,AMBCrypto,2021-10-09,https://ambcrypto.com/binance-coin-how-traders-can-short-this-setup-and-make-profits/
"Mirror, DAOs, and the Exclusivity Problem",Decrypt,2021-10-09,https://decrypt.co/83041/mirror-daos-and-the-exclusivity-problem
Best Bitcoin Wallets Available in Costa Rica to Store Your ...,Q COSTA RICA,2021-10-09,https://qcostarica.com/best-bitcoin-wallets-available-in-costa-rica-to-store-your-crypto-safely/
Quick History: The War On Tokens & Crypto Bans,NewsBTC,2021-10-09,https://www.newsbtc.com/all/quick-history-the-war-on-tokens-crypto-bans/
Sri Lanka Appoints Committee to Draft Digital Currency Policy ...,Bitcoin.com News,2021-10-09,https://news.bitcoin.com/sri-lanka-appoints-committee-to-draft-digital-currency-policy-seeks-crypto-investments/
