Title,Publisher,Date,Link
This DeFi platform is launching exclusive music drops on the Binance NFT marketplace,CryptoSlate,2021-06-03,https://cryptoslate.com/this-defi-platform-is-launching-exclusive-music-drops-on-the-binance-nft-marketplace/
Hamas Sees Surge in Bitcoin Donations Amidst Israel-Palestine Conflict,Decrypt,2021-06-03,https://decrypt.co/72612/hamas-sees-surge-bitcoin-donations-amidst-israel-palestine-conflict
Okcoin Integrates With Polygon to Reduce Users' Ethereum ...,CoinDesk,2021-06-03,https://www.coindesk.com/tech/2021/06/03/okcoin-integrates-with-polygon-to-reduce-users-ethereum-gas-fees/
Crypto Credit Rating Firm Credmark Pivots to Modeling DeFi Protocol Risks,CoinDesk,2021-06-03,https://www.coindesk.com/markets/2021/06/03/crypto-credit-rating-firm-credmark-pivots-to-modeling-defi-protocol-risks/
DAOs Prepare for the Next Crypto Winter With Treasury Diversification,CoinDesk,2021-06-03,https://www.coindesk.com/business/2021/06/03/daos-prepare-for-the-next-crypto-winter-with-treasury-diversification/
Former U.S. congressman Ron Paul says legalize Bitcoin and ‘let it compete with dollar’,CryptoSlate,2021-06-03,https://cryptoslate.com/former-u-s-congressman-ron-paul-says-legalize-bitcoin-and-let-it-compete-with-dollar/
"Daryl Morey on Crypto and NFTs: 'It's the Start of a Major, Major Trend'",CoinDesk,2021-06-03,https://www.coindesk.com/markets/2021/06/03/daryl-morey-on-crypto-and-nfts-its-the-start-of-a-major-major-trend/
