Title,Publisher,Date,Link
"Craig Wright Wins One Pound, Bitcoin & Ethereum Flows ...",Crypto News,2022-08-01,https://cryptonews.com/news/craig-wright-wins-one-pound-bitcoin-ethereum-flows-ledgers-deal-soulbound-binance-more-news.htm
Binance US will delist AMP following SEC claim token is a ...,Global Online Money,2022-08-01,https://globalonlinemony.com/binance-us-will-delist-amp-following-sec-claim-token-is-a-security/
Morning Brew's guide to altcoins,Morning Brew,2022-08-01,https://www.morningbrew.com/daily/stories/2022/08/01/morning-brew-s-guide-to-altcoins
"BTC, ADA and BNB Price Analysis for August 1",U.Today,2022-08-01,https://u.today/btc-ada-and-bnb-price-analysis-for-august-1
SEC Charges 11 in Alleged $300M Crypto Pyramid Scheme ...,Blockworks,2022-08-01,https://blockworks.co/sec-charges-11-in-alleged-300m-crypto-pyramid-scheme-forsage/
Nomad DeFi Bridge Drained of At Least USD 150M in 'Chaotic ...,Crypto News,2022-08-01,https://cryptonews.com/news/nomad-defi-bridge-drained-of-at-least-usd-150m-in-chaotic-decentralized-robbery.htm
Experts say growing Bitgert blockchain adoption is impacting Brise token performance,Cointelegraph,2022-08-01,https://cointelegraph.com/press-releases/experts-say-growing-bitgert-blockchain-adoption-is-impacting-brise-token-performance
"SEC charges 11 people in $300M crypto pyramid, Ponzi scheme",Seeking Alpha,2022-08-01,https://seekingalpha.com/news/3863845-sec-charges-11-people-in-300m-crypto-pyramid-ponzi-scheme
Learn to Diversify Your Crypto Holdings,NameCoinNews,2022-08-01,https://www.namecoinnews.com/learn-to-diversify-your-crypto-holdings/
Best Crypto Under USD 1 Dollar in 2022 – The Cheapest ...,Crypto News,2022-08-01,https://cryptonews.com/news/best-crypto-under-usd-1-dollar-2022-cheapest-investment-opportunities.htm
Terra LUNA Price Prediction: LUNC About To Pump 20%?,InvestingCube,2022-08-01,https://www.investingcube.com/terra-luna-price-prediction-lunc-about-to-pump-20-cryptocurrencies/
Where to Buy Polygon MATIC Crypto Token (& How To) Guide ...,Money Check,2022-08-01,https://moneycheck.com/buy-polygon/
China is all systems go for its unique vision of Web 3.0,KrASIA,2022-08-01,https://kr-asia.com/china-is-all-systems-go-for-its-unique-vision-of-web-3-0
Filecoin Price Prediction: FIL on Track to Rip in August,InvestingCube,2022-08-01,https://www.investingcube.com/filecoin-price-prediction-fil-on-track-to-rip-in-august-cryptocurrencies/
"Dogecoin (DOGE) Daily: Weekend Rally Cools Off, Robinhood Gives Update",Benzinga,2022-08-01,https://www.benzinga.com/news/22/08/28282455/vlad-tenev-tells-memecoin-millionaire-larger-instant-dogecoin-withdrawals-could-come-on-robinhood-as
Coinbase Prime Offers Ethereum Staking To US Institutions,Benzinga,2022-08-01,https://www.benzinga.com/markets/cryptocurrency/22/08/28303072/coinbase-prime-offers-ethereum-staking-to-us-institutions
"Benzinga Before The Bell: Alibaba's Delisting Concerns, Amgen's Potential $10.7B Tax Bill, Kenya Will Not",Benzinga,2022-08-01,https://www.benzinga.com/news/22/08/28287593/benzinga-before-the-bell-and-other-top-financial-stories-monday-august-1
