Title,Publisher,Date,Link
Binance Obtains Regulatory Approval to Offer Crypto Products ...,Bitcoin.com News,2022-05-29,https://news.bitcoin.com/binance-obtains-regulatory-approval-to-offer-crypto-products-in-italy/
Beat the Bear: How Gnox.io (GNOX) Paying Stable Coins in ...,Crypto News,2022-05-29,https://cryptonews.com/news/beat-bear-how-gnoxio-gnox-paying-stable-coins-binance-busd-rewards-can-revolutionary.htm
Could Quantum Computers Defeat Bitcoin? Not So Fast.,Decrypt,2022-05-29,https://decrypt.co/101340/bitcoin-quantum-computing
"The Bitcoin-Stock Market Decoupling Isn’t Happening Yet, but It Totally Will",CoinDesk,2022-05-29,https://www.coindesk.com/markets/2022/05/29/the-bitcoin-stock-market-decoupling-isnt-happening-yet-but-it-totally-will/
How to Claim LUNA on Terra 2 Guide,CryptoTicker,2022-05-29,https://cryptoticker.io/en/how-to-claim-luna-on-terra-2-guide/
Has the trilemma been solved by new a Polygon-backed layer 1 blockchain?,CryptoSlate,2022-05-29,https://cryptoslate.com/has-the-trilemma-been-solved-by-new-polygon-backed-layer-1-blockchain/
Op-Ed: Virtual real estate is booming: Benefits of buying properties in the metaverse,CryptoSlate,2022-05-29,https://cryptoslate.com/op-ed-virtual-real-estate-is-booming-benefits-of-buying-properties-in-the-metaverse/
