Title,Publisher,Date,Link
Binance Smart Chain Transactions Are Now Over 2x Ethereum’s,TronWeekly,2021-02-21,https://www.tronweekly.com/binance-smart-chain-vs-ethereums/
Tesla Has Already Profited More From $1.5 Billion Bitcoin Buy Than 2020 Car Sales: Wedbush,Decrypt,2021-02-21,https://decrypt.co/58356/tesla-stands-to-profit-more-from-1-5-billion-bitcoin-buy-than-2020-car-sales-wedbush
"The Crypto Daily – Movers and Shakers – February 22nd, 2021",FX Empire,2021-02-21,https://www.fxempire.com/news/article/the-crypto-daily-movers-and-shakers-february-22nd-2021-701997
"Crypto Trader Ben Armstrong Names Top Altcoin, Says Little-Known Crypto Asset Will Erupt in 2021",The Daily Hodl,2021-02-21,https://dailyhodl.com/2021/02/21/crypto-trader-ben-armstrong-names-top-altcoin-says-little-known-crypto-asset-will-erupt-in-2021/
A Bitcoin price dip for ants? BTC quickly rebounds to a new high above $57K,Cointelegraph,2021-02-21,https://cointelegraph.com/news/a-bitcoin-price-dip-for-ants-btc-quickly-rebounds-to-a-new-high-above-57k
"Uniswap’s 2020 UNI Airdrop Now Worth $12,000",CryptoPotato,2021-02-21,https://cryptopotato.com/uniswaps-2020-uni-airdrop-now-worth-12000/
