Title,Publisher,Date,Link
"Finance Redefined: Binance leads $60M Multichain funding, Interlay raises $6.5M, Dec. 17–24",Cointelegraph,2021-12-24,https://cointelegraph.com/news/finance-redefined-binance-leads-60m-multichain-funding-interlay-raises-6-5m-dec-17-24
Binance-backed shark metaverse StarSharks raises $4.8 million in private round,CryptoSlate,2021-12-24,https://cryptoslate.com/press-releases/binance-backed-shark-metaverse-starsharks-raises-4-8-million-in-private-round/
"Dubai set become a crypto ecosystem, Binance eyeing the ...",Bankless Times,2021-12-24,https://www.banklesstimes.com/news/2021/12/24/dubai-set-become-a-crypto-ecosystem-binance-eyeing-the-uae/
‘Turkey’s cryptocurrency law soon to be debated in Parliament’ | Daily Sabah,Daily Sabah,2021-12-24,https://www.dailysabah.com/business/tech/turkeys-cryptocurrency-law-soon-to-be-debated-in-parliament
"Crypto Exchanges Hold 6.2% of Bitcoin Circulating Supply; Ethereum, Shiba Inu Prices Rise",Outlook India,2021-12-24,https://www.outlookindia.com/website/story/business-news-crypto-exchanges-hold-62-of-bitcoin-circulating-supply-ethereum-shiba-inu-prices-rise/406619
Nearly 50% of the blockchain industry’s usage comes from games,CryptoSlate,2021-12-24,https://cryptoslate.com/nearly-50-of-the-blockchain-industrys-usage-comes-from-games/
Top 10 Crypto Metaverse Coins With a Circulating Supply of ...,The VR Soldier,2021-12-24,https://thevrsoldier.com/top-10-metaverse-coins-with-a-circulating-supply-over-1-billion/
Terra [LUNA] To Reach The Moon On Santa's Sleigh; New All-time High Unlocked,TronWeekly,2021-12-24,https://www.tronweekly.com/terra-luna-to-reach-the-moon/
Bitcoin liquidity over 2021: Supply is on a decreased trend,Coin Insider.,2021-12-24,https://www.coininsider.com/bitcoin-liquidity-over-2021-supply-is-on-a-decreased-trend/
Kraken plans to open NFT marketplace to attract collectors and speculators,Fortune,2021-12-24,https://fortune.com/2021/12/24/kraken-nft-marketplace-collectors-speculators-cryptopunk/
A beginner's guide to cryptocurrency,Los Angeles Times,2021-12-24,https://www.latimes.com/business/technology/story/2021-12-24/a-beginners-guide-to-cryptocurrency
Just 1.3 million Bitcoin left circulating on crypto exchanges,Cointelegraph,2021-12-24,https://cointelegraph.com/news/just-1-3-million-bitcoin-left-circulating-on-crypto-exchanges
Cryptocurrency Prices On December 24 2021: Know The Rate ...,ABP LIVE,2021-12-24,https://news.abplive.com/business/personal-finance/cryptocurrency-prices-on-december-24-2021-know-the-rate-of-bitcoin-ethereum-litecoin-ripple-dogecoin-and-other-cryptocurrencies-1501738
"Cardano Likely Targeting 580% Rally, but One Altcoin Looks Even Stronger: Crypto Analyst",The Daily Hodl,2021-12-24,https://dailyhodl.com/2021/12/24/cardano-likely-targeting-580-rally-but-one-altcoin-looks-even-stronger-crypto-analyst/
Avalanche Adding Fiat Payments via Alchemy Pay (ACH ...,Bitcoin.com News,2021-12-24,https://news.bitcoin.com/avalanche-adding-fiat-payments-via-alchemy-pay-ach-integration/
"Maiar Dex, EXODUS, Ledger Live... 2022, l'année d'Elrond ...",Journal Du Coin,2021-12-24,https://journalducoin.com/actualites/maiar-dex-exodus-ledger-live-2022-lannee-delrond-egld/
More Than Fifty Countries Have Bans on Cryptocurrency,Hypebeast,2021-12-24,https://hypebeast.com/2021/12/fifty-countries-ban-crypto-congress-report
Dfinity opens the ETH bridge to connect its ICP innovation,Cryptopolitan,2021-12-24,https://www.cryptopolitan.com/dfinity-opens-the-eth-bridge-to-connect-its-icp-innovation/
