Title,Publisher,Date,Link
Binance Asked To Track Down Hackers By The London High Court,TronWeekly,2021-08-14,https://www.tronweekly.com/binance-asked-to-track-down-hackers/
"Wormhole Goes Live, Providing Bridge Between Solana ...",Cryptoglobe,2021-08-14,https://www.cryptoglobe.com/latest/2021/08/wormhole-goes-live-providing-bridge-between-solana-ethereum-binance-smart-chain-and-terra/
7 Things to Know Before You Buy Terra (LUNA),The Motley Fool,2021-08-14,https://www.fool.com/the-ascent/cryptocurrency/articles/7-things-to-know-before-you-buy-terra-luna/
5 Steps to Safely Buying Dai,The Motley Fool,2021-08-14,https://www.fool.com/the-ascent/cryptocurrency/articles/5-steps-to-safely-buying-dai/
"Bitcoin Surge Fuels $100,000 Price Predictions As Massive Ethereum, Cardano, BNB, XRP And Dogecoin Rally Pushes Crypto Over $2 Trillion",Forbes,2021-08-14,https://www.forbes.com/sites/billybambrough/2021/08/14/bitcoin-rally-fuels-100000-price-predictions-as-massive-ethereum-cardano-bnb-xrp-and-dogecoin-rally-pushes-crypto-over-2-trillion/
Best Bitcoin Trading Platforms,Star of Mysore,2021-08-14,https://starofmysore.com/best-bitcoin-trading-platforms/
Can these levels halt Cardano’s attempt at a new ATH,AMBCrypto,2021-08-14,https://ambcrypto.com/can-these-levels-halt-cardanos-attempt-at-a-new-ath/
Theta Network (THETA) partners with ONE Championship to launch NFT Marketplace,CryptoSlate,2021-08-14,https://cryptoslate.com/theta-network-theta-partners-with-one-championship-to-launch-nft-marketplace/
