Title,Publisher,Date,Link
Crypto exchange Binance says Ireland is part of its HQ plans,Reuters,2021-10-07,https://www.reuters.com/technology/binance-ceo-says-ireland-is-part-its-hq-plans-2021-10-07/
"BNB price analysis: Binance Coin at $439 support, bears in ...",Cryptopolitan,2021-10-07,https://www.cryptopolitan.com/bnb-price-analysis-10-07-2021/
"How Hackers Hack Crypto Wallets, and How to Protect Yourself",MakeUseOf,2021-10-07,https://www.makeuseof.com/how-hackers-hack-crypto-wallets/
Fan tokens: Day trading your favorite sports team ...,Cointelegraph,2021-10-07,https://cointelegraph.com/magazine/2021/10/07/fungible-fan-tokens-forming-proxy-market-day-trade-sports-teams-at-high-valuations
Market Wrap: Analysts Bullish on Bitcoin as Trading Volume Rises,CoinDesk,2021-10-07,https://www.coindesk.com/markets/2021/10/07/market-wrap-analysts-bullish-on-bitcoin-as-trading-volume-rises/
The Best Cryptocurrencies to Invest in Right Now,CaptainAltcoin,2021-10-07,https://captainaltcoin.com/the-best-cryptocurrencies-to-invest-in-right-now/
Australian Tax Office: taxpayers on the hook for crypto tax earnings,Forkast News,2021-10-07,https://forkast.news/australian-tax-office-taxpayers-hook-crypto-tax/
New Chainalysis Report Reveals Who’s Leading the World in Crypto Adoption,CoinDesk,2021-10-07,https://www.coindesk.com/business/2021/10/07/new-chainalysis-report-reveals-whos-leading-the-world-in-crypto-adoption/
South Korea’s 20% Tax on Crypto Gains Will Take Effect in 2022: Report,CoinDesk,2021-10-07,https://www.coindesk.com/policy/2021/10/07/south-koreas-20-tax-on-crypto-gains-will-take-effect-in-2022-report/
Tether Has Loaned $1B to Celsius Network: Report,CoinDesk,2021-10-07,https://www.coindesk.com/business/2021/10/07/tether-has-lent-1b-to-celsius-network-report/
Bitcoin’s Technical Bias Flips Bullish as Price Climbs Above Descending Trendline,Yahoo Finance,2021-10-07,https://finance.yahoo.com/news/bitcoin-technical-bias-flips-bullish-074750287.html
"Whales Suddenly Move Over $2,200,000,000 in Ethereum As Miners Amass the Second-Largest Crypto Asset",The Daily Hodl,2021-10-07,https://dailyhodl.com/2021/10/07/whales-suddenly-move-over-2200000000-in-ethereum-as-miners-amass-the-second-largest-crypto-asset/
Advisor: Bitcoin Is the Only Digital Asset Worth Investing In,Wealth Management,2021-10-07,https://www.wealthmanagement.com/alternative-investments/advisor-bitcoin-only-digital-asset-worth-investing
"Why ‘Dogecoin Killers’ Are Making Huge Price Gains, Leaving Bitcoin, Ethereum, BNB, XRP And Cardano In The Dust",Forbes,2021-10-07,https://www.forbes.com/sites/billybambrough/2021/10/07/why-dogecoin-killers-are-making-huge-price-gains-leaving-bitcoin-ethereum-bnb-xrp-and-cardano-in-the-dust/
WorkX - Upcoming Blockchain-based Freelance Platform,Crypto News,2021-10-07,https://cryptonews.com/news/workx-upcoming-blockchain-based-freelance-platform.htm
UMA Price Prediction for 2022-2026,CryptoNewsZ,2021-10-07,https://www.cryptonewsz.com/forecast/uma-price-prediction/
How To Transfer ERC-20 Tokens Cheaper and Faster Using ...,Altcoin Buzz,2021-10-07,https://www.altcoinbuzz.io/bitcoin-and-crypto-guide/how-to-transfer-erc-20-tokens-cheaper-and-faster-to-ethereum-dapps/
Dig Chain will tokenize real estate and comply with regulations,Cointelegraph,2021-10-07,https://cointelegraph.com/press-releases/dig-chain-will-tokenize-real-estate-and-comply-with-regulations
Chia coin – why greener doesn’t always mean better,Inquirer USA,2021-10-07,https://usa.inquirer.net/84311/chia-coin-why-greener-doesnt-always-mean-better
Estas son las fechas clave de los ETF de bitcoin que esperan por aprobación de la SEC,CriptoNoticias,2021-10-07,https://www.criptonoticias.com/regulacion/estas-fechas-clave-etf-bitcoin-esperan-aprobacion-sec/
Bank of America Reveals Bitcoin is 9th Largest Asset In The World,Tokenist,2021-10-07,https://tokenist.com/bank-of-america-reveals-bitcoin-is-9th-largest-asset-in-the-world/
