Title,Publisher,Date,Link
Should You (or Anyone) Buy Binance Coin?,The Motley Fool,2021-07-10,https://www.fool.com/the-ascent/cryptocurrency/articles/should-you-or-anyone-buy-binance-coin/
8 Things to Know Before You Buy Safemoon,Nasdaq,2021-07-10,https://www.nasdaq.com/articles/8-things-to-know-before-you-buy-safemoon-2021-07-10
Mass internet outage shows why we need deeper decentralization of web 3.0,CryptoSlate,2021-07-10,https://cryptoslate.com/mass-internet-outage-shows-why-we-need-deeper-decentralization-of-web-3-0/
TikTok Bans Paid Crypto Promotions But 'Financial Analysis' Unaffected,Decrypt,2021-07-10,https://decrypt.co/75661/tiktok-bans-paid-crypto-promotions-but-financial-analysis-unaffected
"Ethereum, Cardano and 7 Altcoin Projects Are Sleeping Giants As Bitcoin Moves Sideways – According to Alt...",The Daily Hodl,2021-07-10,https://dailyhodl.com/2021/07/10/ethereum-cardano-and-7-altcoin-projects-are-sleeping-giants-as-bitcoin-moves-sideways-according-to-altcoin-daily/
Israel Seized $7.7M in Bitcoin and Dogecoin Believed to be Controlled by Hamas Terrorist Organization,CryptoPotato,2021-07-10,https://cryptopotato.com/israel-seized-7-7m-in-bitcoin-and-dogecoin-believed-to-be-controlled-by-hamas-terrorist-organization/
6YO Cardano Still Compensates Lack Of Adoption With Plans ...,Crypto News,2021-07-10,https://cryptonews.com/exclusives/6yo-cardano-still-compensates-lack-of-adoption-with-plans-ho-11016.htm
Africrypt turns sour on investors: Founders flee as court cases build up,Cointelegraph,2021-07-10,https://cointelegraph.com/news/africrypt-turns-sour-on-investors-founders-flee-as-court-cases-build-up
How to Find Free Articles on Google Scholar,MakeUseOf,2021-07-10,https://www.makeuseof.com/find-free-articles-google-scholar/
Astana Opera House to Stage Verdi's opera “Aida” on July 11 ...,The Astana Times,2021-07-10,https://astanatimes.com/2021/07/astana-opera-house-to-stage-verdis-opera-aida-on-july-11-12-to-mark-its-eighth-theater-season/
