Title,Publisher,Date,Link
Binance Coin Price Analysis: BNB tumbles 60%; What’s Next?,The Market Periodical,2021-05-22,https://themarketperiodical.com/2021/05/22/binance-coin-price-analysis-bnb-tumbles-60-whats-next/
5 Lessons from Bitcoin's Very Bad Week,Decrypt,2021-05-22,https://decrypt.co/71733/5-lessons-from-bitcoins-very-bad-week
"JPMorgan says Bitcoin’s true value is $35,000 amid price crash",CryptoSlate,2021-05-22,https://cryptoslate.com/jpmorgan-says-bitcoins-true-value-is-35000-amid-price-crash/
"Bitcoin’s Volatility Is the Price You Pay for Outperforming the S&P by 10x, Michael Saylor",CryptoPotato,2021-05-22,https://cryptopotato.com/bitcoins-volatility-is-the-price-you-pay-for-outperforming-the-sp-by-10x-michael-saylor/
Why Bitcoin's Dominance Soared As Altcoins Bleed Out,Bitcoinist,2021-05-22,https://bitcoinist.com/why-bitcoins-dominance-soared-as-altcoins-bleed-out/
"Tesla Rival Fisker Won’t Invest in Bitcoin, Says CEO",CryptoPotato,2021-05-22,https://cryptopotato.com/tesla-rival-fisker-wont-invest-in-bitcoin-says-ceo/
11 Years Since The First Bitcoin Purchase: 2 Pizzas Now Worth $365 Million,CryptoPotato,2021-05-22,https://cryptopotato.com/11-years-since-the-first-bitcoin-purchase-2-pizzas-now-worth-365-million/
Canadian Model & Influencer Stefanie Gurzanski On How She ...,Influencive,2021-05-22,https://www.influencive.com/canadian-model-influencer-stefanie-gurzanski-on-how-she-keeps-motivated-in-the-competitive-field/
