Title,Publisher,Date,Link
Binance CEO and Ripple Co-Founders Among Richest Crypto Billionaires: Forbes,U.Today,2022-04-05,https://u.today/binance-ceo-and-ripple-co-founders-among-richest-crypto-billionaires-forbes
The UN Refugee Agency Accepts First Stablecoin Crypto ...,USA for UNHCR,2022-04-05,https://www.unrefugees.org/news/the-un-refugee-agency-accepts-first-stablecoin-crypto-donation-of-2-5m-from-binance-charity-to-support-ukraine-efforts/
The Wealthiest Person In Crypto Climbs Into World's 20 Richest,Forbes,2022-04-05,https://www.forbes.com/sites/johnhyatt/2022/04/05/the-wealthiest-person-in-crypto-climbs-into-worlds-20-richest/
World’s Largest Crypto Trading Platform Binance Appoints 2 ...,American Kahani,2022-04-05,https://americankahani.com/business/worlds-largest-crypto-trading-platform-binance-appoints-2-indian-americans-to-senior-positions/
Binance Launches Mike Tyson Mystery Box NFT Collection,CryptoNewsZ,2022-04-05,https://www.cryptonewsz.com/binance-launches-mike-tyson-mystery-box-nft-collection/
The Richest Crypto And Blockchain Billionaires In The World ...,Forbes,2022-04-05,https://www.forbes.com/sites/johnhyatt/2022/04/05/the-richest-crypto-and-blockchain-billionaires-in-the-world-2022/
Here Are The Biggest Gainers On The 2022 Billionaires List,Forbes,2022-04-05,https://www.forbes.com/sites/richardjchang/2022/04/05/here-are-the-biggest-gainers-on-the-2022-billionaires-list/
Singapore Crypto Firms Operating Abroad Must Now Be ...,Blockworks,2022-04-05,https://blockworks.co/singapore-crypto-firms-operating-abroad-must-now-be-licensed-under-new-law/
Titano Finance is Breaking Ground with Their Own ...,BTC PEERS,2022-04-05,https://btcpeers.com/titano-finance-is-breaking-ground-with-their-own-decentralised-exchange/
Unchain Fund Launches Charity Crypto Debit Card for Ukraine,FinTech Magazine,2022-04-05,https://fintechmagazine.com/crypto/unchain-fund-launches-charity-crypto-debit-card-for-ukrain
Lightning Labs raises funding to enable stablecoin transfers through Bitcoin network,TechCrunch,2022-04-05,https://techcrunch.com/2022/04/05/lightning-labs-raises-funding-to-enable-stablecoin-transfers-through-bitcoin-network/
First Mover Asia: Singapore Wants More Control Over Crypto ...,CoinDesk,2022-04-05,https://www.coindesk.com/markets/2022/04/05/first-mover-asia-singapore-wants-more-control-over-crypto-companies-that-call-it-home-but-arent-there-major-cryptos-drop/
Investing In Multichain (MULTI) - Everything You Need to Know,Securities.io,2022-04-05,https://www.securities.io/investing-in-multichain-multi-everything-you-need-to-know/
CryptoStruct adds Bitfinex liquidity for algo trading,FinanceFeeds,2022-04-05,https://financefeeds.com/cryptostruct-adds-bitfinex-liquidity-algo-trading/
Factbox: How U.S. banks are dipping their toes in the crypto ...,Reuters,2022-04-05,https://www.reuters.com/business/finance/how-us-banks-are-dipping-their-toes-crypto-water-2022-04-05/
US Authorities Seize $34M in One of the Country's Largest Crypto Confiscations,CoinDesk,2022-04-05,https://www.coindesk.com/policy/2022/04/05/us-authorities-seize-34m-in-one-of-the-countrys-largest-confiscations-of-crypto/
30-year-old crypto billionaire wants to give away 99 percent of ...,Interesting Engineering,2022-04-05,https://interestingengineering.com/culture/crypto-billionaire-donate-wealth
"Quint, a luxury-centric metaverse ecosystem, is gearing up for ...",ZAWYA,2022-04-05,https://www.zawya.com/en/press-release/companies-news/quint-a-luxury-centric-metaverse-ecosystem-is-gearing-up-for-a-spectacular-token-pre-sale-iesa8olm
What Elon Musk’s investment could mean for Twitter’s crypto plans,Cointelegraph,2022-04-05,https://cointelegraph.com/news/what-elon-musk-s-investment-could-mean-for-twitter-s-crypto-plans
