Title,Publisher,Date,Link
Binance CEO praises 'pro-crypto' France as it pursues base ...,Reuters,2022-04-13,https://www.reuters.com/business/finance/binance-ceo-praises-pro-crypto-france-it-pursues-base-there-2022-04-13/
Binance Invests €100M in French Crypto Startups,Crypto Briefing,2022-04-13,https://cryptobriefing.com/binance-invests-100m-in-french-crypto-startups/
Binance’s NFT head adopted this implementation model during the platform’s creation,Cointelegraph,2022-04-13,https://cointelegraph.com/news/binance-s-nft-head-adopted-this-implementation-model-during-the-platform-s-creation
Binance CEO CZ Praises France’s ‘Pro-Crypto Regulations’,Decrypt,2022-04-13,https://decrypt.co/97721/binance-ceo-cz-praises-frances-pro-crypto-regulations
Why Binance P2P expanded its risk management roadmap to ...,Vanguard News,2022-04-13,https://www.vanguardngr.com/2022/04/why-binance-p2p-expanded-its-risk-management-roadmap-to-protect-users/
GMT Crypto: What to Know About the STEPN Network Ahead ...,InvestorPlace,2022-04-13,https://investorplace.com/2022/04/gmt-crypto-what-to-know-about-the-stepn-network-ahead-of-binance-igo/
Binance Coin - cryptocurrency developed by Binance exchange,Crypto Reporter,2022-04-13,https://www.crypto-reporter.com/news/binance-coin-cryptocurrency-developed-by-binance-exchange-29308/
"Paris Blockchain Week, April 13: Latest updates from the Cointelegraph team on the ground",Cointelegraph,2022-04-13,https://cointelegraph.com/news/paris-blockchain-week-day-1-latest-updates-from-the-cointelegraph-team-on-the-ground
Nexo Launches Crypto-Backed Credit Card in Europe,Crypto Briefing,2022-04-13,https://cryptobriefing.com/nexo-launches-crypto-backed-credit-card-in-europe/
Spread of Sanctions Makes Privacy Tokens the Hot Bet in Crypto Markets,CoinDesk,2022-04-13,https://www.coindesk.com/markets/2022/04/13/spread-of-sanctions-makes-privacy-tokens-the-hot-bet-in-crypto-markets/
"Coinbase, FTX and Biggest Crypto Exchanges Consolidate Power As Traders Prefer Lower Risk Platforms: Report",The Daily Hodl,2022-04-13,https://dailyhodl.com/2022/04/13/coinbase-ftx-and-biggest-crypto-exchanges-consolidate-power-as-traders-prefer-lower-risk-platforms-report/
ACH Is the Token Driving Global Crypto Payments ...,Bitcoin.com News,2022-04-13,https://news.bitcoin.com/ach-is-the-token-driving-global-crypto-payments/
Implementation of the Travel Rule Solution (Updated 2022.04.),Lexology,2022-04-13,https://www.lexology.com/library/detail.aspx?g=aa410758-a3e5-4c57-b63f-2d668dafed79
Cryptocurrency Wallets Likely to Become Market Movers in 2022,BeInCrypto,2022-04-13,https://beincrypto.com/cryptocurrency-wallets-likely-to-become-market-movers-in-2022/
'Fan Token' Platform Socios Signs 13 NFL Teams,Decrypt,2022-04-13,https://decrypt.co/97726/fan-token-platform-socios-signs-13-nfl-teams
Crypto Giant Coinbase Reveals List of 50 Altcoins Under Consideration for Listing,The Daily Hodl,2022-04-13,https://dailyhodl.com/2022/04/13/crypto-giant-coinbase-reveals-list-of-50-altcoins-under-consideration-for-listing/
‘Jack Dorsey’s First Tweet’ NFT Went on Sale for $48M. It Ended With a Top Bid of Just $280,CoinDesk,2022-04-13,https://www.coindesk.com/business/2022/04/13/jack-dorseys-first-tweet-nft-went-on-sale-for-48m-it-ended-with-a-top-bid-of-just-280/
Belarus-linked crypto platform stops Russian clients trading,Markets Insider,2022-04-13,https://markets.businessinsider.com/news/currencies/crypto-exchange-bitcoin-russia-ethereum-trader-investors-ban-ukraine-2022-4
How to Check Your Ethereum Transaction,CoinDesk,2022-04-13,https://www.coindesk.com/learn/how-to-check-your-ethereum-transaction/
South Africa: Migrants living 'in constant fear' after deadly attacks,African Business,2022-04-13,https://african.business/2022/04/apo-newsfeed/south-africa-migrants-living-in-constant-fear-after-deadly-attacks/
NFT domains marketplace launches to provide bridge to the next generation of internet and Web 3.0,Cointelegraph,2022-04-13,https://cointelegraph.com/news/nft-domains-marketplace-launches-to-provide-bridge-to-the-next-generation-of-internet-and-web-30
Real Vision CEO Raoul Pal suggests Bitcoin's 'low is in',CoinJournal,2022-04-13,https://coinjournal.net/news/raoul-pal-says-its-likely-the-market-has-found-its-bottom/
Short Supply Triggers 54% Cardano Interest Rate Spike,Wall Street Pit,2022-04-13,https://wallstreetpit.com/117183-short-supply-triggers-ada-cardano-rate-spike/
