Title,Publisher,Date,Link
Cristiano Ronaldo kicks off crypto partnership with Binance in multi-year NFT deal,Financial News London,2022-06-23,https://www.fnlondon.com/articles/binance-nft-cristiano-ronaldo-football-soccer-20220623
Cryptocurrency exchange Binance partners with Ronaldo in NFT push | Daily Sabah,Daily Sabah,2022-06-23,https://www.dailysabah.com/sports/football/cryptocurrency-exchange-binance-partners-with-ronaldo-in-nft-push
Binance Signs Cristiano Ronaldo for Exclusive Partnership,PR Newswire,2022-06-23,https://www.prnewswire.com/ae/news-releases/binance-signs-cristiano-ronaldo-for-exclusive-partnership-301573593.html
Binance CEO Denies Providing 3AC a Credit Line After its Failure,CryptoPotato,2022-06-23,https://cryptopotato.com/binance-ceo-denies-providing-3ac-a-credit-line-after-its-failure/
Binance.US cuts spot Bitcoin trading fees and sparks what may be the beginning of a long-awaited fee war in crypto,Fortune,2022-06-23,https://fortune.com/2022/06/23/binance-us-bitcoin-trading-fees-crypto-fee-war/
Binance.us Is Beating Coinbase in the Race to Zero Fees,The Motley Fool,2022-06-23,https://www.fool.com/investing/2022/06/23/binanceus-is-beating-coinbase-in-the-race-to-zero/
Shibaswap's BONE Can Now Be Tracked on Binance,U.Today,2022-06-23,https://u.today/shibaswaps-bone-can-now-be-tracked-on-binance
"Voyager Digital's Liquidity Crisis, and Binance Signs NFT ...",CoinDesk,2022-06-23,https://www.coindesk.com/podcasts/coindesk-podcast-network/voyager-digitals-liquidity-crisis-and-binance-signs-nft-partnership-with-football-superstar-cristiano-ronaldo/
"Major Court Decision in Ripple-SEC Case Imminent, Binance to Pause ETH Operations, SHIB Large Transactions Rise 880%: Crypto News Digest by U.Today",U.Today,2022-06-23,https://u.today/major-court-decision-in-ripple-sec-case-imminent-binance-to-pause-eth-operations-shib-large
Binance Refutes Giving Failed Hedge Fund Three Arrows Big Credit Line,U.Today,2022-06-23,https://u.today/binance-refutes-giving-failed-hedge-fund-three-arrows-big-credit-line
"Bankman-Fried, Binance Big Crypto Ride to the Rescue, for ...",Bloomberg.com,2022-06-23,https://www.bloomberg.com/news/newsletters/2022-06-23/bankman-fried-binance-big-crypto-ride-to-the-rescue-for-some
Binance scores Cristiano Ronaldo as partner for NFT push,Euronews,2022-06-23,https://www.euronews.com/next/2022/06/23/crypto-currency-binance-ronaldo
Binance Sign Cristiano Ronaldo for Exclusive Partnership to Release Multiple NFT Collections per Year,MoreBranches,2022-06-23,https://www.morebranches.com/binance-sign-cristiano-ronaldo-for-exclusive-partnership-to-release-multiple-nft-collections-per-year/
"Binance NFT to Host Ex Sports ""Belgium Edition"" Urbanball ...",eGamers.io,2022-06-23,https://egamers.io/binance-nft-to-host-ex-sports-belgium-edition-urbanball-mystery-boxes-drop/
"Three Crypto Tokens Giving Back Financial Control: Binance (BNB), Xchange Monster (MXCH), and PancakeSwap",Bitcoinist,2022-06-23,https://bitcoinist.com/three-crypto-tokens-giving-back-financial-control-binance-bnb-xchange-monster-mxch-and-pancakeswap-cake/
"First Mover Asia: Hong Kong’s OSL Sees Strong Institutional Interest in Crypto, Despite Luna-Induced Volatility; Bitcoin and Ether Surge",CoinDesk,2022-06-23,https://www.coindesk.com/markets/2022/06/23/first-mover-asia-hong-kongs-osl-sees-strong-institutional-interest-in-crypto-despite-luna-induced-volatility-bitcoin-and-ether-surge/
Brussels’ Fledgling Crypto Industry Flexes Its Muscles,CoinDesk,2022-06-23,https://www.coindesk.com/policy/2022/06/23/brussels-fledgling-crypto-industry-flexes-its-muscles/
Harmony's Cross-Chain Horizon Bridge Hacked for $100M,Blockworks,2022-06-23,https://blockworks.co/defi-cross-chain-horizon-bridge-hacked-for-100m/
Crypto Exchange CoinFLEX Freezes Withdrawals Due to Counterparty 'Uncertainty',Decrypt,2022-06-23,https://decrypt.co/103696/crypto-exchange-coinflex-freezes-withdrawals-counterparty-uncertainty
Bitcoin Advances as Concerns Over Deleveraging 'Cascades ...,Bloomberg.com,2022-06-23,https://www.bloomberg.com/news/articles/2022-06-23/bitcoin-ether-gain-ground-ahead-of-crypto-options-witching
Gucci Invests $25K in DAO of NFT Marketplace SuperRare to Start Digital Art Vault,CoinDesk,2022-06-23,https://www.coindesk.com/business/2022/06/23/gucci-invests-25k-in-nft-marketplace-superrare-to-start-digital-art-vault/
Tether Ready to Launch Stablecoin Pegged on British Pounds,CryptoTvplus,2022-06-23,https://cryptotvplus.com/2022/06/tether-ready-to-launch-stablecoin-pegged-on-british-pounds/
Coinbase Adds Support for On-Chain Polygon and Solana Transactions,CoinDesk,2022-06-23,https://www.coindesk.com/business/2022/06/23/coinbase-adds-support-for-on-chain-polygon-and-solana-transactions/
John McAfee's Widow Still Seeking Independent Autopsy One Year After Husband’s Death,Decrypt,2022-06-23,https://decrypt.co/103692/john-mcafee-widow-seeking-autopsy-one-year-later
CEO of World’s Largest Public Holder of $BTC: ‘Bitcoin Is Going To Outlast All of Us’,Cryptoglobe,2022-06-23,https://www.cryptoglobe.com/latest/2022/06/ceo-of-worlds-largest-public-holder-of-btc-bitcoin-is-going-to-outlast-all-of-us/
Singapore Will Crack Down on Bad Crypto Behavior: Report,CoinDesk,2022-06-23,https://www.coindesk.com/policy/2022/06/23/singapore-will-crack-down-on-bad-crypto-behavior-report/
Coinbase to launch Advanced Trade as a replacement for Coinbase Pro,CryptoSlate,2022-06-23,https://cryptoslate.com/coinbase-to-launch-advanced-trade-as-a-replacement-for-coinbase-pro/
How Financial Advisors Should Think About the Crypto Crash,CoinDesk,2022-06-23,https://www.coindesk.com/markets/2022/06/23/how-financial-advisors-should-think-about-the-crypto-crash/
Market Wrap: Crypto Assets Stabilize as BTC Retakes $20K,CoinDesk,2022-06-23,https://www.coindesk.com/markets/2022/06/23/market-wrap-crypto-assets-stabilize-as-btc-retakes-20k/
"BTC, SOL, ADA and BNB Price Analysis for June 23",U.Today,2022-06-23,https://u.today/btc-sol-ada-and-bnb-price-analysis-for-june-23
eBay acquires NFT marketplace KnownOrigin,CryptoTvplus,2022-06-23,https://cryptotvplus.com/2022/06/ebay-acquires-nft-marketplace-knownorigin/
"Gold-Backed Stablecoin Can Help Russia Circumvent Sanctions, Government-Owned Bank Suggests",CoinDesk,2022-06-23,https://www.coindesk.com/policy/2022/06/23/gold-backed-stablecoin-can-help-russia-circumvent-sanctions-government-owned-bank-suggests/
Ledger to launch enterprise-focused NFT marketplace,CryptoTvplus,2022-06-23,https://cryptotvplus.com/2022/06/ledger-launches-nft-marketplace/
"Crypto Trading Platform Uphold Exits Venezuela, Cites US Sanctions",CoinDesk,2022-06-23,https://www.coindesk.com/business/2022/06/23/crypto-trading-platform-uphold-exits-venezuela-cites-us-sanctions/
Ethereum to shutdown 3 testnets after Merge,CryptoSlate,2022-06-23,https://cryptoslate.com/ethereum-to-shutdown-3-testnets-after-merge/
The Risks and Benefits of On-Chain Credit Protocols,CoinDesk,2022-06-23,https://www.coindesk.com/layer2/2022/06/23/the-risks-and-benefits-of-on-chain-credit-protocols/
Ankr Price Prediction After the App Chains Launch,CoinJournal,2022-06-23,https://coinjournal.net/news/ankr-price-prediction-after-the-app-chains-launch/
Solana Labs Is Building a Web3 Mobile Phone,CoinDesk,2022-06-23,https://www.coindesk.com/business/2022/06/23/solana-labs-is-building-a-web3-mobile-phone/
Moody’s Downgrades Coinbase’s Debt on Profitability Concerns,CoinDesk,2022-06-23,https://www.coindesk.com/business/2022/06/23/moodys-downgrades-coinbases-debt/
ISO 20022 compliant crypto-list,Cryptopolitan,2022-06-23,https://www.cryptopolitan.com/iso-20022-compliant-crypto-list/
"Qatar in the ""Foundation Stage"" of Releasing a Central Bank ...",CryptoTvplus,2022-06-23,https://cryptotvplus.com/2022/06/qatar-in-the-foundation-stage-of-releasing-a-central-bank-digital-currency-cbdc/
Solar-Powered Bitcoin Miner Starts Operations Despite Difficult Market,CoinDesk,2022-06-23,https://www.coindesk.com/business/2022/06/23/new-solar-powered-bitcoin-miner-launches-operations-despite-difficult-market/
Experts say the crypto downturn shouldn’t affect the U.S economy,CryptoSlate,2022-06-23,https://cryptoslate.com/experts-say-the-crypto-downturn-shouldnt-affect-the-u-s-economy/
Terra's Do Kwon: 'There Is a Difference Between Failing and Running a Fraud',Decrypt,2022-06-23,https://decrypt.co/103642/terras-do-kwon-there-is-a-difference-between-failing-and-running-a-fraud
5 Best Crypto Options Trading Platforms In 2022,CryptoMode,2022-06-23,https://cryptomode.com/5-best-crypto-options-trading-platforms-in-2022/
XT.com Welcomes B8DEX (B8T) to Its Roster of Listed Tokens ...,PR Newswire,2022-06-23,https://www.prnewswire.com/ae/news-releases/xtcom-welcomes-b8dex-b8t-to-its-roster-of-listed-tokens-301573967.html
What is Ethereum Gray Glacier? Should you be worried?,Cryptopolitan,2022-06-23,https://www.cryptopolitan.com/what-is-ethereum-gray-glacier/
Best Crypto Memes 2022 - Saudi Billionaires Buy Bitcoin,Business 2 Community,2022-06-23,https://www.business2community.com/crypto-news/best-crypto-memes-2022-saudi-billionaires-buy-bitcoin-02510236
NFT Watches by Tag Heuer and More Brands - New Trend,Business 2 Community,2022-06-23,https://www.business2community.com/nft-news/nft-watches-by-tag-heuer-and-more-brands-new-trend-02510079
DeFi Infrastructure's Rapid Development Leaves Legacy ...,Blockonomi,2022-06-23,https://blockonomi.com/defi-legacy-finance/
Marathon Digital Cut to Neutral at B. Riley on Bitcoin Price Declines,CoinDesk,2022-06-23,https://www.coindesk.com/business/2022/06/23/marathon-digital-cut-to-neutral-at-b-riley-on-bitcoin-price-declines/
Uniswap overtakes Ethereum on fees; DeFi outperforms,Forbes India,2022-06-23,https://www.forbesindia.com/article/crypto-made-easy/uniswap-overtakes-ethereum-on-fees-defi-outperforms/77559/1
Avalanche Bridge Launches Native Bitcoin Support; AVAX Surges 7.4%,CoinDesk,2022-06-23,https://www.coindesk.com/business/2022/06/23/avalanche-bridge-launches-native-bitcoin-support-avax-surges-74/
"NHL Partners With Sweet to Offer Digital Collectibles, NFTs",CoinDesk,2022-06-23,https://www.coindesk.com/business/2022/06/23/nhl-partners-with-sweet-to-offer-digital-collectibles-nfts/
SkyBridge’s Scaramucci: Bitcoin Is ‘Technically Oversold’,CoinDesk,2022-06-23,https://www.coindesk.com/business/2022/06/23/skybridges-scaramucci-bitcoin-is-technically-oversold/
BIS: 90% of central banks exploring the utility of CBDCs,Forbes India,2022-06-23,https://www.forbesindia.com/article/crypto-made-easy/bis-90-of-central-banks-exploring-the-utility-of-cbdcs/77547/1
Powell Says Fed Plans Recommendation to Congress on CBDC,CoinDesk,2022-06-23,https://www.coindesk.com/markets/2022/06/23/powell-says-fed-plans-recommendation-to-congress-on-cbdc/
Bitcoin Back Above $20K as Analysts Debate Whether It's Good Time to Buy,CoinDesk,2022-06-23,https://www.coindesk.com/markets/2022/06/23/bitcoin-climbs-back-above-20k-as-analysts-debate-whether-its-good-time-to-buy/
"RBI, Indian Banks to Pilot Blockchain Trade Financing: Report",CoinDesk,2022-06-23,https://www.coindesk.com/business/2022/06/23/rbi-indian-banks-to-pilot-blockchain-trade-financing-report/
"'Recession Odds 50%' With Inflation, Fed Hikes – Citigroup",Business 2 Community,2022-06-23,https://www.business2community.com/stock-news/recession-odds-50-with-inflation-fed-hikes-citigroup-02509656
Meta to Start Rolling Out NFTs on Instagram,Business 2 Community,2022-06-23,https://www.business2community.com/nft-news/meta-to-start-rolling-out-nfts-on-instagram-02509765
Vulcan Forged teased the brand new Elysium Swap DEX,eGamers.io,2022-06-23,https://egamers.io/vulcan-forged-teased-the-brand-new-elysium-swap-dex/
BRISE: Bitgert Price Analysis After Introducing USDT and USDC,CoinJournal,2022-06-23,https://coinjournal.net/news/brise-bitgert-price-analysis-after-introducing-usdt-and-usdc/
"Bitcoin Is a Leading Indicator for Stock Indexes, Says Legacy Investor Mark Mobius",CryptoPotato,2022-06-23,https://cryptopotato.com/bitcoin-is-a-leading-indicator-for-stock-indexes-says-legacy-investor-mark-mobius/
Shib Enters Top 10 Trading Volume List as Whale Buys 163 Billion SHIB,U.Today,2022-06-23,https://u.today/shib-enters-top-10-trading-volume-list-as-whale-buys-163-billion-shib
"Axie-Infinity Developer to Reimburse Hack Victims, Restart ...",Bloomberg.com,2022-06-23,https://www.bloomberg.com/news/articles/2022-06-23/axie-infinity-developer-to-reimburse-hack-victims-restart-ronin
World Bank Approves $100 Million Loan to Casablanca,Morocco World News,2022-06-23,https://www.moroccoworldnews.com/2022/06/349876/world-bank-approves-100-million-loan-to-casablanca
Satstreet Passes $1 Billion Traded,Crypto Reporter,2022-06-23,https://www.crypto-reporter.com/newsfeed/satstreet-passes-1-billion-traded-33093/
University of Cincinnati Adds Crypto Courses to Curriculum,Decrypt,2022-06-23,https://decrypt.co/103653/university-of-cincinnati-adds-crypto-courses-to-curriculum
"Binance, the main sponsor of Lazio, kicks off the exclusive partnership with Cristiano Ronaldo – VIDEO",codelist.biz,2022-06-23,https://codelist.biz/2022/06/23/binance-the-main-sponsor-of-lazio-kicks-off-the-exclusive-partnership-with-cristiano-ronaldo-video/
Is UK Facing Recession on Brexit Anniversary? The Readout ...,Bloomberg.com,2022-06-23,https://www.bloomberg.com/news/newsletters/2022-06-23/the-readout-with-allegra-stratton
Is Cosmos (ATOM) Cryptocurrency a Good Investment in 2022?,CryptoNewsZ,2022-06-23,https://www.cryptonewsz.com/is-cosmos-cryptocurrency-a-good-investment-in-2022/
NFTs Accessible to All With Launch of Fiat-Focused SIMBA Market,The Daily Hodl,2022-06-23,https://dailyhodl.com/2022/06/23/nfts-accessible-to-all-with-launch-of-fiat-focused-simba-market/
This is the Level BTC Needs to Break to Reverse the Downtrend (Bitcoin Price Analysis),CryptoPotato,2022-06-23,https://cryptopotato.com/heres-the-level-btc-needs-to-break-to-reverse-the-downtrend-bitcoin-price-analysis/
On-Chain Indicator Suggests Bitcoin (BTC) Bottom Is Near With Fresh Accumulation Phase Underway: Analyst Be...,The Daily Hodl,2022-06-23,https://dailyhodl.com/2022/06/22/on-chain-indicator-suggests-bitcoin-btc-bottom-is-near-with-fresh-accumulation-phase-underway-analyst-benjamin-cowen/
"Whales Have Quietly Triggered a 900% Surge for Embattled Crypto Asset, According to Analytics Firm Santiment",The Daily Hodl,2022-06-23,https://dailyhodl.com/2022/06/23/whales-have-quietly-triggered-a-900-surge-for-embattled-crypto-asset-according-to-analytics-firm-santiment/
Thomas Kurian remade Google Cloud into an enterprise-first company. Customers and partners approve.,Protocol,2022-06-23,https://www.protocol.com/enterprise/google-cloud-ceo-thomas-kurian
The Global Metaverse Market in 2030 will be worth USD 1.6 ...,Crypto Reporter,2022-06-23,https://www.crypto-reporter.com/newsfeed/the-global-metaverse-market-in-2030-will-be-worth-usd-1-6-trillion-having-a-cagr-of-38-25-33119/
Stellar Lumens Eyes for a Trend Reversal in the Long Run,NameCoinNews,2022-06-23,https://www.namecoinnews.com/stellar-lumens-eyes-for-a-trend-reversal-in-the-long-run/
"Transparent financial systems won't get real traction, blockchain exec argues",Cointelegraph,2022-06-23,https://cointelegraph.com/news/transparent-financial-systems-won-t-get-real-traction-blockchain-exec-argues
"Elon Musk Reveals Why He Supports Dogecoin (DOGE), Says He Never Advised Investing in Crypto",The Daily Hodl,2022-06-23,https://dailyhodl.com/2022/06/23/elon-musk-reveals-why-he-supports-dogecoin-doge-says-he-never-advised-investing-in-crypto/
What Should Web 3.0 Builders Focus on To Emerge Stronger From the Bear Market?,The Daily Hodl,2022-06-23,https://dailyhodl.com/2022/06/23/what-should-web-3-0-builders-focus-on-to-emerge-stronger-from-the-bear-market/
Bybit Exchange Reaches Settlement Agreement with Ontario Regulator,InvestingCube,2022-06-23,https://www.investingcube.com/bybit-exchange-reaches-settlement-agreement-with-ontario-regulator/
A GPU Flood Is Here As Miners In Crisis,eGamers.io,2022-06-23,https://egamers.io/a-gpu-flood-is-here-as-miners-in-crisis/
"Ethereum Whale Accumulates 163,200,000,000 Shiba Inu (SHIB) As Memecoin Witnesses Trading Volume Spike: On-...",The Daily Hodl,2022-06-23,https://dailyhodl.com/2022/06/23/ethereum-whale-accumulates-163200000000-shiba-inu-shib-as-memecoin-witnesses-trading-volume-spike-on-chain-analysis/
Investing In 22x - Everything You Need to Know,Securities.io,2022-06-23,https://www.securities.io/investing-in-22x-everything-you-need-to-know/
How to Buy Dogecoin on a Crypto Exchange,Interesting Engineering,2022-06-23,https://interestingengineering.com/culture/how-to-buy-dogecoin-complete-guide
"Vladimir Putin Slams Western Monetary Policy, Predicts Global Shift to Commodity Reserves",CryptoPotato,2022-06-23,https://cryptopotato.com/vladimir-putin-slams-western-monetary-policy-predicts-global-shift-to-commodity-reserves/
Investing In Blockchain Capital (BCAP) - Everything You Need ...,Securities.io,2022-06-23,https://www.securities.io/investing-in-blockchain-capital-bcap-everything-you-need-to-know/
Jack Henry enables faster payments for more than 250 ...,IBS Intelligence,2022-06-23,https://ibsintelligence.com/ibsi-news/jack-henry-enables-faster-payments-for-more-than-250-financial-institutions/
"TT Aims for Crypto, TradFi Integration",Markets Media,2022-06-23,https://www.marketsmedia.com/tt-aims-for-crypto-and-tradfi-integration/
Data Privacy Bill Passes US House Panel,PYMNTS.com,2022-06-23,https://www.pymnts.com/news/regulation/2022/data-privacy-bill-passes-us-house-panel/
From The Metaverse Hype To Green Tech Solutions: VivaTech 2022,Forbes,2022-06-23,https://www.forbes.com/sites/forrester/2022/06/23/from-the-metaverse-hype-to-green-tech-solutions-vivatech-2022/
Payments firm SumUp raises 590 mln euros in latest funding ...,KITCO,2022-06-23,https://www.kitco.com/news/2022-06-23/Payments-firm-SumUp-raises-590-mln-euros-in-latest-funding-round.html
"Afghan authorities scramble to reach earthquake zone, toll at ...",Cyprus Mail,2022-06-23,https://cyprus-mail.com/2022/06/23/afghan-authorities-scramble-to-reach-earthquake-zone-toll-at-1000-dead/
2022 NBA Draft Betting Preview: Who Will The Magic Select First Overall?,Legal Sports Betting,2022-06-23,https://sportsbetting.legal/news/2022-nba-draft-betting-preview/
Crypto Crash May Spell Trouble for Graphics Card Makers ...,Investopedia,2022-06-23,https://www.investopedia.com/crypto-crash-gpu-amd-nvda-5496625
"No Gronk, No Problem: Bet On Elon Musk et al. Instead",Legal Sports Betting,2022-06-23,https://sportsbetting.legal/news/no-gronk-bet-on-elon-musk-instead/
Can this plucky search engine startup really compete with Google?,Fortune,2022-06-23,https://fortune.com/2022/06/23/brave-google-search-privacy-bing-yahoo-duckduckgo/
Your Evening Briefing: Jeffrey Clark's 2020 Election 'Murder ...,Bloomberg.com,2022-06-23,https://www.bloomberg.com/news/newsletters/2022-06-23/bloomberg-evening-briefing-jeffrey-clark-s-2020-election-murder-suicide-pact
What makes SuperBots different from its competitors? Everything!,Coinpedia,2022-06-23,https://coinpedia.org/press-release/what-makes-superbots-different-from-its-competitors-everything/
Kenya Inks Pact With The British Chamber Of Commerce,Soko Directory,2022-06-23,https://sokodirectory.com/2022/06/kenya-inks-pact-with-the-british-chamber-of-commerce/
5 Metrics for Analyzing NFT Projects,Coin Rivet,2022-06-23,https://coinrivet.com/5-metrics-for-analyzing-nft-projects/
Avalanche Powered DEX Swapsicle Partners With onXRP To Launch onAVAX Cross-chain Platform,AlexaBlockchain,2022-06-23,https://alexablockchain.com/avalanche-powered-dex-swapsicle-partners-with-onxrp-to-launch-onavax/
Bitcoin (BTC) : Une chute de 47 % est à craindre en 2022,Cointribune,2022-06-23,https://www.cointribune.com/cours-crypto/bitcoin-btc/bitcoin-btc-juin-2022-bear/
Inside Wells Fargo's mortgage conundrum,Business Insider,2022-06-23,https://www.businessinsider.com/wells-fargo-mortgages-lending-charlie-scharf-2022-6
"""Titanic"" returns to theaters in a high-tech remaster from ...",Somag News,2022-06-23,https://www.somagnews.com/titanic-returns-to-theaters-in-a-high-tech-remaster-from-james-cameron/
Why RHOBH Fans Want Lisa Vanderpump & Other ...,Somag News,2022-06-23,https://www.somagnews.com/why-rhobh-fans-want-lisa-vanderpump-other-housewives-og-back/
"Kim Kardashian describes her current fashion era as a ""future ...",Somag News,2022-06-23,https://www.somagnews.com/kim-kardashian-describes-her-current-fashion-era-as-a-future-alien-barbie/
Sonic Origins: How to Unlock Mirror Mode,Somag News,2022-06-23,https://www.somagnews.com/sonic-origins-how-to-unlock-mirror-mode-2/
