Title,Publisher,Date,Link
Binance to drive crypto and blockchain awareness among Indian investors,Cointelegraph,2022-04-30,https://cointelegraph.com/news/binance-to-drive-crypto-and-blockchain-awareness-among-indian-investors
Two Altcoins Are Soaring After Surprise Listings on Crypto Exchange Binance,The Daily Hodl,2022-04-30,https://dailyhodl.com/2022/04/30/two-altcoins-are-soaring-after-surprise-listings-on-crypto-exchange-binance/
Binance Controlled 30% of Crypto Spot Volume in March: Report,CryptoPotato,2022-04-30,https://cryptopotato.com/binance-controlled-30-of-crypto-spot-volume-in-march-report/
"Solana [SOL] suffered a loss in volume, should Binance be blamed",AMBCrypto,2022-04-30,https://ambcrypto.com/solana-sol-suffered-a-loss-in-volume-should-binance-be-blamed/
How Much Passive Income Can You Make From ...,The Motley Fool,2022-04-30,https://www.fool.com/investing/2022/04/30/how-much-passive-income-can-you-make-from-cryptocu/
Monetary Authority Singapore (MAS) Tightens Process To Approve Crypto License | Bitcoinist.com,Bitcoinist,2022-04-30,https://bitcoinist.com/mas-tightens-proces-to-approve-crypto-license/
"Unizen Review [2022] | Hybrid Crypto Exchange | Fees, Pros ...",Finbold,2022-04-30,https://finbold.com/review/unizen-review/
Increased trust in crypto leads retailers to invest in DeFi,Coin Insider.,2022-04-30,https://www.coininsider.com/increased-trust-in-crypto-leads-retailers-to-invest-in-defi/
Top 3 Metaverse Crypto Coins With a Unit Price Below $5 ...,The VR Soldier,2022-04-30,https://thevrsoldier.com/top-3-metaverse-crypto-coins-with-a-unit-price-below-5-to-watch-in-april-2022/
ISKRA: The Future of Web3 Gaming and Blockchain ...,CryptoPotato,2022-04-30,https://cryptopotato.com/iskra-the-future-of-web3-gaming-and-blockchain-entertainment/
