Title,Publisher,Date,Link
Billionaire Mark Cuban Finds New Means to Push For Dogecoin (DOGE) Adoption,Times Tabloid,2021-08-30,https://timestabloid.com/billionaire-mark-cuban-finds-new-means-to-push-for-dogecoin-doge-adoption/
Tennis Superstar Naomi Osaka Has a New Interest ...,Bloomberg.com,2021-08-30,https://www.bloomberg.com/news/articles/2021-08-30/naomi-osaka-tennis-superstar-and-investor-is-eyeing-cryptocurrencies
Venture Capitalist Bill Gurley Prefers Ethereum to Bitcoin ...,Bitcoin.com News,2021-08-30,https://news.bitcoin.com/venture-capitalist-bill-gurley-ethereum-bitcoin-personal-position-eth/
McDonald's Asked Twitter For A New Sign And The ...,Mashed,2021-08-30,https://www.mashed.com/590126/mcdonalds-asked-twitter-for-a-new-sign-and-the-responses-are-hilarious/
Cryptocurrency investing has a big gender problem,CNBC,2021-08-30,https://www.cnbc.com/2021/08/30/cryptocurrency-has-a-big-gender-problem.html
"Bitcoin Is ‘Worthless,’ Housing Bubble Billionaire Says. Just Don’t Try Betting on a Decline.",Barron's,2021-08-30,https://www.barrons.com/articles/things-to-know-today-51630322890
"Cardano Is ""Quite Superior,"" Says AI Pioneer Behind Robot Sophia",U.Today,2021-08-30,https://u.today/cardano-is-quite-superior-says-ai-pioneer-behind-robot-sophia
"XRP, Ethereum Classic, EOS Price Analysis: 30 August",AMBCrypto,2021-08-30,https://ambcrypto.com/xrp-ethereum-classic-eos-price-analysis-30-august/
OpenSea Hits $3B in Monthly Volume on Mutant Ape NFT Drop,Crypto Briefing,2021-08-30,https://cryptobriefing.com/opensea-hits-3b-monthly-volume-mutant-ape-nft-drop/
This is driving Dubai’s cryptocurrency market to do ‘fantastically well’,AMBCrypto,2021-08-30,https://ambcrypto.com/this-is-driving-dubais-cryptocurrency-market-to-do-fantastically-well/
Bitpanda’s Success Is Thanks to Timing and Poker,CoinDesk,2021-08-30,https://www.coindesk.com/business/2021/08/30/bitpandas-success-is-thanks-to-timing-and-poker/
How Will Cardano's Upcoming Smart Contracts Support ...,Securities.io,2021-08-30,https://www.securities.io/how-will-cardanos-upcoming-smart-contracts-support-impact-ada/
PlanB: S2F Model Predicts Bitcoin To Break $100k By Christmas,NewsBTC,2021-08-30,https://www.newsbtc.com/news/bitcoin/planb-s2f-bitcoin-100k-christmas/
Rupee Rallies 40 Paise To Close At 73.29 Against US Dollar,Outlook India,2021-08-30,https://www.outlookindia.com/website/story/business-news-rupee-rallies-40-paise-to-close-at-7329-against-us-dollar/393142
"An epitome of success, Ameer Merchant sets new benchmark ...",Deccan Herald,2021-08-30,https://www.deccanherald.com/brandspot/pr-spot/an-epitome-of-success-ameer-merchant-sets-new-benchmark-for-entrepreneurs-1025152.html
How to buy ZOO token — get the new crypto for Logan Paul's ...,Laptop Mag,2021-08-30,https://www.laptopmag.com/news/how-to-buy-zoo-token-get-the-new-crypto-for-logan-pauls-nft-game
NFT Marketplace OpenSea Continues To Break Records,TronWeekly,2021-08-30,https://www.tronweekly.com/nft-marketplace-opensea/
Damien Hirst's dotty 'currency' art makes as much sense as Bitcoin,The Conversation,2021-08-30,https://theconversation.com/damien-hirsts-dotty-currency-art-makes-as-much-sense-as-bitcoin-166958
"TA: Bitcoin Fails Again, Why BTC Remains At Risk of a Larger Decline",NewsBTC,2021-08-30,https://www.newsbtc.com/analysis/btc/bitcoin-fails-again-49k/
Solana crosses $100 price level,Forkast,2021-08-30,https://forkast.news/headlines/solana-crosses-100-price-level/
"Technical Analysis: ZAP, GRT, MATIC awaits breakout, ADA poised for a pullback",FXStreet,2021-08-30,https://www.fxstreet.com/cryptocurrencies/news/technical-analysis-zap-grt-matic-awaits-breakout-ada-poised-for-a-pullback-202108301441
Brazil seizes 591 bitcoins worth $27 million in largest cryptocurrency scam,Tech Lapse,2021-08-30,https://techlapse.com/crypto/brazil-seizes-591-bitcoins-worth-27-million-in-largest-cryptocurrency-scam/
