Title,Publisher,Date,Link
Dogecoin network withdrawals suspended on Binance after security update,AMBCrypto,2021-11-11,https://ambcrypto.com/dogecoin-network-withdrawals-suspended-on-binance-after-security-update/
"Bitcoin, Dogecoin, MATIC Price Analysis: 11 November",AMBCrypto,2021-11-11,https://ambcrypto.com/bitcoin-dogecoin-matic-price-analysis-11-november/
"Robinhood promised to take crypto investors to the moon, and there’s no turning back now",Fortune,2021-11-11,https://fortune.com/2021/11/11/robinhood-crypto-trading-shiba-inu-coin-dogecoin/
"Why Bitcoin, Ethereum, and Dogecoin Are All Down Big Today",The Motley Fool,2021-11-11,https://www.fool.com/investing/2021/11/11/why-bitcoin-ethereum-and-dogecoin-are-all-down-big/
Cryptomania Hits Stocks and Exchanges as Record ...,PR Newswire,2021-11-11,https://www.prnewswire.com/news-releases/cryptomania-hits-stocks-and-exchanges-as-record-investment-flows-into-digital-coins-including-doge-301422252.html
"Musk Loses DOGE Market Cap in One Day, 51% SHIB Supply Holder Revealed, BTC Whale Turns $249K into $150 Million: Crypto News Digest by U.Today",U.Today,2021-11-11,https://u.today/musk-loses-doge-market-cap-in-one-day-51-shib-supply-holder-revealed-btc-whale-turns-249k-into-150
Mandatory Tweets: Elon Musk Changes Name to Lorde Edge and Twitter Is Full of Conspiracies and Funny Jabs,Mandatory,2021-11-11,https://www.mandatory.com/fun/1581142-mandatory-tweets-elon-musk-changes-name-to-lorde-edge-and-twitter-is-full-of-conspiracies-and-funny-jabs
What Is Elon Musk-Inspired Elonomics?,TheStreet,2021-11-11,https://www.thestreet.com/video/elon-musk-inspired-elonomics-cryptocurrency-explained
"5 Reasons Shiba Inu Can Head Higher, and the Big Reason It ...",The Motley Fool,2021-11-11,https://www.fool.com/investing/2021/11/11/5-reasons-shiba-inu-head-higher-big-reason-avoid/
"New cryptocurrency cat trend, Schrodinger, shoots up over 500% in 4 days",Cointelegraph,2021-11-11,https://cointelegraph.com/press-releases/new-cryptocurrency-cat-trend-schrodinger-shoots-up-over-500-in-4-days
GazeTV: Empowering audiences with a social entertainment platform,AMBCrypto,2021-11-11,https://ambcrypto.com/gazetv-empowering-audiences-with-a-social-entertainment-platform/
Why is CRO going up? The next 10x coin?,Cryptopolitan,2021-11-11,https://www.cryptopolitan.com/why-is-cro-going-up-the-next-10x-coin/
"Hong Kong virtual insurer partners with exchange, brings crypto insurance to Asia",AMBCrypto,2021-11-11,https://ambcrypto.com/hong-kong-virtual-insurer-partners-with-exchange-brings-crypto-insurance-to-asia/
How To Open Cryptocurrency Trading Account in India & Complete Your KYC,Latestly,2021-11-11,https://www.latestly.com/technology/how-to-open-cryptocurrency-trading-account-in-india-complete-your-kyc-3044248.html
7 Interesting Metaverse Cryptos That Might Be Worthwhile ...,InvestorPlace,2021-11-11,https://investorplace.com/2021/11/7-interesting-metaverse-cryptos-that-might-be-worthwhile-tokens/
Vitalik Buterin Co-founder of Ethereum Owns 100k Dogs of ...,The VR Soldier,2021-11-11,https://thevrsoldier.com/vitalik-buterin-co-founder-of-ethereum-owns-100k-dogs-of-elon-doe-tokens/
10 Best Robinhood Alternatives You Should Use,Beebom,2021-11-11,https://beebom.com/best-robinhood-alternatives/
TV host Jimmy Fallon reveals he owns a Bored Ape Yacht Club NFT,Coin Rivet,2021-11-11,https://coinrivet.com/ru/tv-host-jimmy-fallon-reveals-he-owns-a-bored-ape-yacht-club-nft/
B&M (BME) shares fall on like-for-like comparison,Capital.com,2021-11-11,https://capital.com/b-m-bme-shares-fall-on-like-for-like-comparison
"After-Hours Earnings Report for November 11, 2021 : AQN, PAGS, FLO, JAMF, PVG, ARRY, BLFS, BLNK, AVIR, GAN, SFT, NTCO",Nasdaq,2021-11-11,https://www.nasdaq.com/articles/after-hours-earnings-report-for-november-11-2021-:-aqn-pags-flo-jamf-pvg-arry-blfs-blnk
