Title,Publisher,Date,Link
Dogecoin Mining 2021: Everything You Need to Know,Yahoo Finance,2021-06-28,https://finance.yahoo.com/news/dogecoin-mining-2021-everything-know-213659431.html
Dogecoin Is Down. Buy the Dip?,The Motley Fool,2021-06-28,https://www.fool.com/investing/2021/06/28/dogecoin-is-down-buy-the-dip/
Dogecoin's Future Is Secure (Cryptocurrency:DOGE-USD),Seeking Alpha,2021-06-28,https://seekingalpha.com/article/4436982-dogecoins-future-is-secure
2 Robinhood Stocks That Could Crush Dogecoin,The Motley Fool,2021-06-28,https://www.fool.com/investing/2021/06/28/2-robinhood-stocks-that-could-crush-dogecoin/
Elon Musk tweets his support over proposed Dogecoin changes,Cointelegraph,2021-06-28,https://cointelegraph.com/news/elon-musk-tweets-his-support-over-proposed-dogecoin-changes
Elon Musk's Birthday Sees #DogeFather Trend on Twitter Thanks to Dogecoin Fans,Newsweek,2021-06-28,https://www.newsweek.com/elon-musk-birthday-50-dogefather-trend-twitter-dogecoin-fans-1604758
SHIB coin: Why Shiba Inu coin just spiked again,Deseret News,2021-06-28,https://www.deseret.com/2021/6/28/22553837/shib-coin-shiba-inu-coin-elon-musk-tweet
Dogecoin's First Millionaire Explains Crypto Slang for Newbies,TheStreet,2021-06-28,https://www.thestreet.com/video/dogecoin-millionaire-glauber-contessota-explains-crypto-slang-stock
"What Are Meme Coins, and Can They Make You Rich?",The Motley Fool,2021-06-28,https://www.fool.com/investing/2021/06/28/what-are-meme-coins-and-can-they-make-you-rich/
Crypto firms drop British registration bids amid scrutiny,Reuters,2021-06-28,https://www.reuters.com/technology/bitcoin-shrugs-off-uk-crackdown-major-crypto-exchange-binance-2021-06-28/
xQc takes aim at Twitch streamers who “scam” viewers with ...,Dexerto,2021-06-28,https://www.dexerto.com/entertainment/xqc-takes-aim-at-twitch-streamers-who-scam-viewers-with-cryptocurrency-advice-1602182/
Ethereum Founder Burns Billions Worth Of Coins | Bitcoinist.com,Bitcoinist,2021-06-28,https://bitcoinist.com/ethereum-founder-burns-billions-worth-of-coins/
Select H-E-B locations now have cryptocurrency exchange ...,The Business Journals,2021-06-28,https://www.bizjournals.com/sanantonio/news/2021/06/28/h-e-b-cryptocurrency-kiosks.html
Coinbase CEO says the goal is to list every asset that is legally possible,Markets Insider,2021-06-28,https://markets.businessinsider.com/news/cryptocurrencies/cryptocurrency-exchange-coinbase-ceo-brian-armstrong-list-every-crypto-asset-2021-6
"For some Indians, crypto glitters more than gold",Al Jazeera,2021-06-28,https://www.aljazeera.com/economy/2021/6/28/for-some-indians-crypto-glitters-more-than-gold
"Jim Cramer Likes Ethereum, Describes as ""a Currency""",Crypto Briefing,2021-06-28,https://cryptobriefing.com/jim-cramer-likes-ethereum-describes-as-currency/
El Salvador Wants to Attract Bitcoin Talent. Its Strategy Is ...,CoinDesk,2021-06-28,https://www.coindesk.com/policy/2021/06/28/el-salvador-wants-to-attract-bitcoin-talent-its-strategy-is-working/
"On The Money: Headaches mount for Biden in spending fight | McConnell to Schumer: Don’t hold bipartisan bill ‘hostage’ | Court dismisses FTC, state antitrust cases against Facebook",The Hill,2021-06-28,https://thehill.com/policy/finance/overnights/560618-on-the-money-headaches-mount-for-biden-in-spending-fight-mcconnell/
The Dramatic Crash of a Buzzy Cryptocurrency Raises Eyebrows,The New York Times,2021-06-28,https://www.nytimes.com/2021/06/28/business/dealbook/icp-cryptocurrency-crash.html
ANKR Crypto Wants to Be a New Kind of DeFi Crypto,InvestorPlace,2021-06-28,https://investorplace.com/2021/06/ankr-crypto-wants-to-be-a-new-kind-of-blockchain-and-token/
CoinFlip expands into Alaska with Bitcoin ATMs,ATM Marketplace,2021-06-28,https://www.atmmarketplace.com/news/coinflip-expands-into-alaska-with-bitcoin-atms/
Moon Rabbit: Advancing Longevity Pursuit through Crypto,Coinspeaker,2021-06-28,https://www.coinspeaker.com/moon-rabbit-crypto/
Free Forex Signals and Forecast: Buy CAD/JPY - 28 June 2021,Forex Crunch,2021-06-28,https://www.forexcrunch.com/free-forex-signals-and-forecast-buy-cadjpy-28-june-2021/
Day trading grew in popularity during the pandemic—here's why people do it,CNBC,2021-06-28,https://www.cnbc.com/2021/06/28/betterment-survey-factors-that-motivate-day-traders.html
New Generation XQR Social Network: A Review of the Project and an Interview with Its Creator | Bitcoinist.com,Bitcoinist,2021-06-28,https://bitcoinist.com/new-generation-xqr-social-network-a-review-of-the-project-and-an-interview-with-its-creator/
"Tom Brady's bitcoin play has been a bust, despite his 'laser eyes' offensive. Now the 7-time Super Bowl champ is taking advice",MarketWatch,2021-06-28,https://www.marketwatch.com/story/tom-bradys-bitcoin-play-has-been-a-bust-despite-his-laser-eyes-offensivenow-the-7-time-super-bowl-champ-is-taking-advice-11624909392
Filecoin Now Has Its Own Stablecoin. But Why?,Decrypt,2021-06-28,https://decrypt.co/74538/filecoins-stablecoin-onefil-launches
Ace Wallet receives in-principle approval for money-broking and payment service license,Cointelegraph,2021-06-28,https://cointelegraph.com/press-releases/ace-wallet-receives-in-principle-approval-for-money-broking-and-payment-service-license
How Do Cryptocurrencies Work?,Global Finance Magazine,2021-06-28,https://www.gfmag.com/topics/blogs/how-do-cryptocurrencies-work
"Polygon (MATIC) Announces Launch Of New Blockchain Project, ‘Avail’",NewsBTC,2021-06-28,https://www.newsbtc.com/news/polygon-announces-new-project-avail/
Mayor Suarez Recruited Bitcoin Miners to Miami. Who Will He ...,The Jitney,2021-06-28,https://jitneybooks.com/mayor-suarez-bitcoin/
Which Countries Are Using Cryptocurrency the Most?,GOBankingRates,2021-06-28,https://www.gobankingrates.com/investing/crypto/which-countries-are-using-cryptocurrency-most/
Ethereum (ETH) bientôt sur Fortnite ? La déesse qui sème le ...,Journal Du Coin,2021-06-28,https://journalducoin.com/ethereum/fortnite-hommage-ethereum-derniere-mise-a-jour/
Cryptocurrency and online casinos: operation and advantages ...,European Gaming Industry News,2021-06-28,https://europeangaming.eu/portal/latest-news/2021/06/28/95207/cryptocurrency-and-online-casinos-operation-and-advantages/
No summer baseball for Sonoma Stompers,Petaluma Argus Courier,2021-06-28,https://www.petaluma360.com/article/sports/no-summer-baseball-for-sonoma-stompers/
Kusama Coin Price Up 14% - Time To Buy KSM Coin?,Economy Watch,2021-06-28,https://www.economywatch.com/news/kusama-coin-price-up-14-time-to-buy-ksm-coin
Ford Stock Price Forecast June 2021 - Good Time to Buy Ford ...,Economy Watch,2021-06-28,https://www.economywatch.com/news/ford-stock-price-forecast-june-2021-good-time-to-buy-ford-stock
