Title,Publisher,Date,Link
What is Dogecoin (DOGE)? 5 Facts About the Crypto That Started as a Joke,CryptoPotato,2021-02-24,https://cryptopotato.com/what-is-dogecoin-doge-5-facts-about-the-crypto-that-started-as-a-joke/
"What the heck is Cryptocurrency, anyway?!",King 5 News,2021-02-24,https://www.king5.com/article/money/what-the-heck-is-cryptocurrency-anyway/281-7251fb9a-f793-4b43-a9eb-0b44484cd07c
"Nvidia GeForce RTX 2080 Ti “Mining” GPU benchmarked in several AAA PC games, shows reduced performance",DSOGaming,2021-02-24,https://www.dsogaming.com/news/nvidia-geforce-rtx-2080-ti-mining-gpu-benchmarked-in-several-aaa-pc-games-shows-reduced-performance/
Web3's Dieter Fishbein on DeFi's pain point and the birth of ...,CryptoSlate,2021-02-24,https://cryptoslate.com/videos/web3s-dieter-fishbein-on-defis-pain-point-and-the-birth-of-kusama/
"CNBC Has Banned Him from Their Air on Bitcoin, Peter Schiff Claims",U.Today,2021-02-24,https://u.today/cnbc-has-banned-him-from-their-air-on-bitcoin-peter-schiff-claims
Elon Musk's Cryptic 'Excession' Tweet Leaves Users Wondering What It Means,Newsweek,2021-02-24,https://www.newsweek.com/elon-musks-excession-tweet-explained-spacex-tesla-cryptocurrency-1571582
"BitcoinPaperWallet ‘Back Door’ Responsible for Millions in Missing Funds, Research Suggests",CoinDesk,2021-02-24,https://www.coindesk.com/tech/2021/02/24/bitcoinpaperwallet-back-door-responsible-for-millions-in-missing-funds-research-suggests/
MicroStrategy buys another $1 billion worth of Bitcoin,CryptoSlate,2021-02-24,https://cryptoslate.com/microstrategy-buys-another-1-billion-worth-of-bitcoin/
"Aavegotchi Launch Announced, 10000 NFTs Available",Crypto Briefing,2021-02-24,https://cryptobriefing.com/aavegotchi-launch-announced-10000-nfts-available/
How Institutions Will Take Crypto Mainstream,CoinDesk,2021-02-24,https://www.coindesk.com/markets/2021/02/24/how-institutions-will-take-crypto-mainstream/
"Gold Price Analysis: Bears about to burst out of their cage to target $1,745.80",FXStreet,2021-02-24,https://www.fxstreet.com/news/gold-price-analysis-bears-about-to-burst-out-of-their-cage-to-target-1-74580-202102241903
Alameda Research invests $40 million in Oxygen DeFi project,AMBCrypto,2021-02-24,https://ambcrypto.com/alameda-research-invests-40-million-in-oxygen-defi-project/
Andreessen Horowitz Leads $25M Round in Ethereum Scaling Solution,CoinDesk,2021-02-24,https://www.coindesk.com/business/2021/02/24/andreessen-horowitz-leads-25m-round-in-ethereum-scaling-solution/
Join the Most Awaited ICO of the Year and Get your Ticket to the Crypto world,Ripple Coin News,2021-02-24,https://ripplecoinnews.com/join-the-most-awaited-ico-of-the-year-and-get-your-ticket-to-the-crypto-world/
"Whales might’ve caused Ethereum’s (ETH) 50% dive on Kraken, says CEO",CryptoSlate,2021-02-24,https://cryptoslate.com/whales-mightve-caused-ethereums-eth-50-dive-on-kraken-says-ceo/
NYC court dismisses lawsuit against Bancor alleging securities law violation,AMBCrypto,2021-02-24,https://ambcrypto.com/nyc-court-dismisses-lawsuit-against-bancor-alleging-securities-law-violation/
OKEx Announces Support for USDT and USDC Stablecoins on the Algorand Blockchain,NewsBTC,2021-02-24,https://www.newsbtc.com/news/company/okex-announces-support-for-usdt-and-usdc-stablecoins-on-the-algorand-blockchain/
"OKB Continues to Break its Own Price Records, Hits a New ATH After Crossing $22 Mark",NewsBTC,2021-02-24,https://www.newsbtc.com/news/company/okb-continues-to-break-its-own-price-records-hits-new-ath-after-crossing-22-mark/
"Here comes the GameStop rally, round 2",Fortune,2021-02-24,https://fortune.com/2021/02/24/gamestop-rally-round-2-reddit-gme/
Light Novel Ranking: the Japanese ranking as of 31/1/2021,Tech Lapse,2021-02-24,https://techlapse.com/global/light-novel-ranking-the-japanese-ranking-as-of-31-1-2021/
Ethereum Price Analysis: 24 February,AMBCrypto,2021-02-24,https://ambcrypto.com/ethereum-price-analysis-24-february/
Graco Inc. (GGG) Down 7.2% Since Last Earnings Report: Can It Rebound?,Nasdaq,2021-02-24,https://www.nasdaq.com/articles/graco-inc.-ggg-down-7.2-since-last-earnings-report:-can-it-rebound-2021-02-24
