Title,Publisher,Date,Link
Dogecoin Is Crashing: Is Now the Time to Invest?,The Motley Fool,2021-06-12,https://www.fool.com/investing/2021/06/12/dogecoin-is-crashing-is-now-the-time-to-invest/
"No DOGE Allowed? Thai SEC Bans Meme, Fan and Exchange Tokens as Well as NFTs",CoinDesk,2021-06-12,https://www.coindesk.com/markets/2021/06/12/no-doge-allowed-thai-sec-bans-meme-fan-and-exchange-tokens-as-well-as-nfts/
7 Popular Cryptocurrencies With Significantly Lower ...,The Motley Fool,2021-06-12,https://www.fool.com/investing/2021/06/12/7-cryptocurrencies-lower-transaction-fees-dogecoin/
7 Popular Cryptocurrencies With Significantly Lower Transaction Fees Than Dogecoin,Nasdaq,2021-06-12,https://www.nasdaq.com/articles/7-popular-cryptocurrencies-with-significantly-lower-transaction-fees-than-dogecoin-2021-06
"Thai SEC Orders Exchanges to Delist Meme Coins, NFTs and Social Tokens",Decrypt,2021-06-12,https://decrypt.co/73445/thai-sec-orders-exchanges-to-delist-meme-coins-nfts-and-social-tokens
Twitter CEO Jack Dorsey Reveals Surprise Bitcoin Plan After Elon Musk Sparked Crypto Price Chaos With Ethereum And Dogecoin Support,Forbes,2021-06-12,https://www.forbes.com/sites/billybambrough/2021/06/12/twitter-ceo-jack-dorsey-reveals-surprise-bitcoin-plan-after-elon-musk-sparked-crypto-price-chaos-with-ethereum-and-dogecoin-support/
Can Shiba Inu reach 1 cent by 2025? Shiba Inu Price Prediction,The Global Coverage,2021-06-12,https://theglobalcoverage.com/2021/06/12/can-shiba-inu-reach-1-cent-by-2025-shiba-inu-price-prediction/
UAE: Who will own your cryptocurrency after you die?,Khaleej Times,2021-06-12,https://www.khaleejtimes.com/uae/uae-who-will-own-your-cryptocurrency-after-you-die
