Title,Publisher,Date,Link
Coinbase CEO Hits Back At Dogecoin Creator After Attack On ‘Cult-Like’ Bitcoin And Crypto Price Culture,Forbes,2021-07-16,https://www.forbes.com/sites/billybambrough/2021/07/16/bitcoin-has-made-so-many-wealthy-coinbase-ceo-hits-back-at-dogecoin-creator-after-attack-on-cult-like-crypto-price-culture/
What is Terra? Your guide to the hot cryptocurrency,Fortune,2021-07-16,https://fortune.com/2021/07/16/what-is-terra-cryptocurrency-crypto-guide-stablecoin-luna/
Coinbase Sued for Misleading Sweepstakes Advertising,Lexology,2021-07-16,https://www.lexology.com/library/detail.aspx?g=46b19cb6-8a41-444b-bb8a-640f67545901
What's the Best Cryptocurrency to Invest in Right Now?,The Motley Fool,2021-07-16,https://www.fool.com/investing/2021/07/16/whats-the-best-cryptocurrency-to-invest-in-right-n/
Pakistan moves to bring cryptocurrency boom out of the dark,Reuters,2021-07-16,https://www.reuters.com/technology/pakistan-moves-bring-cryptocurrency-boom-out-dark-2021-07-16/
DeFi can be halal but not DOGE? Decentralizing Islamic ...,Cointelegraph,2021-07-16,https://cointelegraph.com/magazine/2021/07/16/defi-can-be-halal-but-not-doge-decentralizing-islamic-finance
Watertown company creates its own cryptocurrency,WWNY,2021-07-16,https://www.wwnytv.com/2021/07/16/watertown-men-create-their-own-cryptocurrency/
Binance ditches 'stock tokens' as global crackdown widens,Reuters,2021-07-16,https://www.reuters.com/world/china/binance-stops-selling-stock-tokens-after-regulatory-scrutiny-2021-07-16/
TERRA Price Analysis: SMA-20 is below SMA-50 but 200 is ...,The Market Periodical,2021-07-16,https://themarketperiodical.com/2021/07/16/terra-price-analysis-sma-20-is-below-sma-50-but-200-is-below-it/
THORChain hit by another exploit; loses up to $7.6M,AMBCrypto,2021-07-16,https://ambcrypto.com/thorchain-hit-by-another-exploit-loses-up-to-7-6m/
Success in DEX? Fast-growing crypto exchanges may hurt DeFi investors,Cointelegraph,2021-07-16,https://cointelegraph.com/news/success-in-dex-fast-growing-crypto-exchanges-may-hurt-defi-investors
Cryptocurrency Price News: SafeMoon Rules to Tamp Down ...,Bloomberg.com,2021-07-16,https://www.bloomberg.com/news/articles/2021-07-16/crypto-safemoon-s-rules-to-tamp-down-selling-raise-red-flags
How far is a trend reversal for Bitcoin?,AMBCrypto,2021-07-16,https://ambcrypto.com/how-far-is-a-trend-reversal-for-bitcoin/
Market Wrap: Bitcoin Holds Above $30K but Price Chart Looks 'Ugly',CoinDesk,2021-07-16,https://www.coindesk.com/markets/2021/07/16/market-wrap-bitcoin-holds-above-30k-but-price-chart-looks-ugly/
Why Spike Lee's new crypto ad is drawing backlash,Ad Age,2021-07-16,https://adage.com/article/digital-marketing-ad-tech-news/why-spike-lees-new-crypto-ad-drawing-backlash/2350946
"XRP lawsuit update: Hinman deposition to go ahead, but here’s the caveat",AMBCrypto,2021-07-16,https://ambcrypto.com/xrp-lawsuit-update-hinman-deposition-to-go-ahead-but-heres-the-caveat/
China's Digital Yuan Will Utilize Smart Contracts,Crypto Briefing,2021-07-16,https://cryptobriefing.com/chinas-digital-yuan-will-utilize-smart-contracts/
"Axie Infinity, Decentraland Tumble After Sharp Rise",Crypto Briefing,2021-07-16,https://cryptobriefing.com/axie-infinity-decentraland-tumble-after-sharp-rise/
Jack Dorsey Announces 'TBD' - A New DeFi Initiative Focused ...,Securities.io,2021-07-16,https://www.securities.io/jack-dorsey-announces-tbd-a-new-defi-initiative-focused-on-bitcoin/
Pontem to Use Polkadot to Connect Diem and DeFi,Crypto Briefing,2021-07-16,https://cryptobriefing.com/pontem-use-polkadot-connect-diem-defi/
Billionaire Ray Dalio: The 'fastest path to success starts with knowing what your weaknesses are’,CNBC,2021-07-16,https://www.cnbc.com/2021/07/16/ray-dalio-the-path-to-success-starts-with-knowing-your-weaknesses.html
Swiss Bank Sygnum to Issue NFTs for Original Picasso,Crypto Briefing,2021-07-16,https://cryptobriefing.com/swiss-bank-sygnum-to-issue-nfts-for-original-picasso/
Where to buy Cryptex Finance coin online: best CTX trading ...,CoinJournal,2021-07-16,https://coinjournal.net/news/where-to-buy-cryptex-finance-coin-online-best-ctx-trading-platforms/
"Doge, XRP, ADA take price hit while Bitcoin technicals show lack of buyer interest",CryptoSlate,2021-07-16,https://cryptoslate.com/doge-xrp-ada-take-price-hit-while-bitcoin-technicals-show-lack-of-buyer-interest/
Do Kwon Explains Synthetic Equities Trading on Blockchain,Bloomberg.com,2021-07-16,https://www.bloomberg.com/news/articles/2021-07-16/do-kwon-explains-synthetic-equities-trading-on-blockchain
Hacking group Anonymous launches Anon Inu crypto token “to fight Musk and China”,CryptoSlate,2021-07-16,https://cryptoslate.com/hacking-group-anonymous-launches-anon-inu-crypto-token-to-fight-musk-and-china/
Ripple (XRP) scores as judge orders former SEC Director to testify,CryptoSlate,2021-07-16,https://cryptoslate.com/ripple-xrp-scores-as-judge-orders-former-sec-director-to-testify/
USD/ZAR: A bearish perspective for the rand over the medium-to-longer term – Wells Fargo,FXStreet,2021-07-16,https://www.fxstreet.com/news/usd-zar-a-bearish-perspective-for-the-rand-over-the-medium-to-longer-term-wells-fargo-202107161544
Bitcoin interest declines; Rolling Stone gets into NFTs,Forkast News,2021-07-16,https://forkast.news/video-audio/bitcoin-interest-declines-rolling-stone-nfts/
"FOMO, YOLO, Crypto, Oh No!",Financial Advisor Magazine,2021-07-16,https://www.fa-mag.com/news/fomo--yolo--crypto--oh-no-63077.html
Binance Coin Price Drops 4% to $306.71 – How to Buy BNB,InsideBitcoins,2021-07-16,https://insidebitcoins.com/news/binance-coin-price-drops-4-to-306-71-how-to-buy-bnb
Australia's Evolution sees Red Lake gold mine as cornerstone ...,KITCO,2021-07-16,https://www.kitco.com/news/2021-07-16/Australia-s-Evolution-sees-Red-Lake-gold-mine-as-cornerstone-of-its-growth-strategy.html
Americans Don't Understand Their Social Security Benefits ...,Forbes,2021-07-16,https://www.forbes.com/advisor/retirement/how-to-understand-social-security-better/
