Title,Publisher,Date,Link
Doge NFT Rides Into Fractional Ownership With $DOG Tokens,Bloomberg.com,2021-08-31,https://www.bloomberg.com/news/articles/2021-08-31/doge-nft-rides-into-fractional-ownership-with-dog-tokens
How to Buy and Mine Dogecoin | HowStuffWorks,Money | HowStuffWorks,2021-08-31,https://money.howstuffworks.com/dogecoin.htm
Tennis Champion Naomi Osaka Finds Dogecoin ‘Interesting’,CryptoPotato,2021-08-31,https://cryptopotato.com/tennis-champion-naomi-osaka-finds-dogecoin-interesting/
"‘Dogecoin Millionaire’ Reveals The Cryptocurrency He Predicts Will Outperform The Bitcoin, Ethereum, BNB, XRP And Solana Price",Forbes,2021-08-31,https://www.forbes.com/sites/billybambrough/2021/08/31/dogecoin-millionaire-reveals-the-cryptocurrency-he-expects-to-outperform-the-bitcoin-ethereum-bnb-xrp-and-solana-price/
Fiancé Gets Mad at Man for Proposing to Her with NFT Instead ...,Tech Times,2021-08-31,https://www.techtimes.com/articles/264795/20210831/fianc%C3%A9-gets-mad-at-man-for-proposing-to-her-with-nft-instead-of-ring-man-lost-half-of-savings-on-dogecoin.htm
Dogecoin Rebounds As Support At 50 EMA Stays Strong,FX Empire,2021-08-31,https://www.fxempire.com/forecasts/article/dogecoin-rebounds-as-support-at-50-ema-stays-strong-771375
Solana cryptocurrency: Here's why the Ethereum competitor is ...,Fast Company,2021-08-31,https://www.fastcompany.com/90671003/solana-cryptocurrency-heres-why-the-ethereum-competitor-is-surging
"Bitcoin price dips to around $47,800 while Ethereum on the rise",Fox Business,2021-08-31,https://www.foxbusiness.com/markets/bitcoin-price-dips-to-around-47800-while-ethereum-on-the-rise
Donald Trump is not a 'big fan' of cryptocurrencies,New York Post,2021-08-31,https://nypost.com/2021/08/31/donald-trump-is-not-a-big-fan-of-crypto/
"Raoul Pal predicts Bitcoin will reach $250,000 to $400,000 in ...",Cryptopolitan,2021-08-31,https://www.cryptopolitan.com/raoul-pal-predicts-bitcoin-250000-400000/
Inside Arbitrum’s Staggered Mainnet Launch,CoinDesk,2021-08-31,https://www.coindesk.com/tech/2021/08/31/inside-arbitrums-staggered-mainnet-launch/
Babydoge's Price Prediction: Is It the Next Dogecoin?,Market Realist,2021-08-31,https://marketrealist.com/p/babydoge-price-prediction/
"Analysts recommend booking profits in BTC as Cardano, Solana and Terra lead new alt season",FXStreet,2021-08-31,https://www.fxstreet.com/cryptocurrencies/news/analysts-recommend-booking-profits-in-btc-as-cardano-solana-and-terra-lead-new-alt-season-202108310854
Arbitrum Is Now Live on Ethereum Layer Two,Crypto Briefing,2021-08-31,https://cryptobriefing.com/arbitrum-is-now-live-on-ethereum-layer-two/
Cosmos Soars 25% Amid Layer 1 Blockchain Boom,Crypto Briefing,2021-08-31,https://cryptobriefing.com/cosmos-soars-25-amid-layer-1-blockchain-boom/
"Interview with Next Earth's CEO, Gabor Retfalvi",Cryptopolitan,2021-08-31,https://www.cryptopolitan.com/interview-with-next-earths-ceo-gabor-retfalvi/
MetaMask Marks 10M Active Users With Metaverse Party,Crypto Briefing,2021-08-31,https://cryptobriefing.com/metamask-marks-10m-active-users-with-metaverse-party/
Has Banksy Just Released His First NFT on Ethereum?,Crypto Briefing,2021-08-31,https://cryptobriefing.com/has-banksy-just-released-his-first-nft-on-ethereum/
"South Korea exchanges Bithumb, CoinOne, Korbit join forces to de’CODE’ regulations",AMBCrypto,2021-08-31,https://ambcrypto.com/south-korea-exchanges-bithumb-coinone-korbit-join-forces-to-decode-regulations/
Hoskinson: These are the circumstances in which Cardano (ADA) and Solana (SOL) will collaborate,CryptoSlate,2021-08-31,https://cryptoslate.com/hoskinson-these-are-the-circumstances-in-which-cardano-ada-and-solana-sol-will-collaborate/
The Thriving TikTok Communities You Don't Know About But ...,Talking Influence,2021-08-31,https://talkinginfluence.com/2021/08/31/the-thriving-tiktok-communities-you-dont-know-about-but-need-to-know-about-if-you-care-about-youth-culture/
How Litecoin can avoid a breakdown from this pattern,AMBCrypto,2021-08-31,https://ambcrypto.com/how-litecoin-can-avoid-a-breakdown-from-this-pattern/
Experts believe Bitcoin will form a “double bubble” before prices retrace,FXStreet,2021-08-31,https://www.fxstreet.com/cryptocurrencies/news/experts-believe-bitcoin-will-form-a-double-bubble-before-prices-retrace-202108311027
XRP army play key role in SEC vs Ripple case while price remains range-bound,FXStreet,2021-08-31,https://www.fxstreet.com/cryptocurrencies/news/xrp-army-play-key-role-in-sec-vs-ripple-case-while-price-remains-range-bound-202108311445
Ethereum Price Predictions: How High Could ETH Go This ...,InvestorPlace,2021-08-31,https://investorplace.com/2021/08/ethereum-price-predictions-how-high-could-eth-go-this-year/
Player Bedazzled as Jewel-Themed Slot Gem Splitter Unlocks ...,Bitcoin.com News,2021-08-31,https://news.bitcoin.com/player-bedazzled-as-jewel-themed-slot-gem-splitter-unlocks-a-95000-jackpot-with-a-95-bet/
5 Best NFT Cryptos to Buy Now - September 2021 Wk 1,InsideBitcoins,2021-08-31,https://insidebitcoins.com/news/5-best-nft-cryptos-to-buy-now-september-2021-wk-1
Stellar Lumens (XLM) Does Not Have a Smart Contract Language but SSCs,The Currency Analytics,2021-08-31,https://thecurrencyanalytics.com/altcoins/stellar-lumens-xlm-does-not-have-a-smart-contract-language-but-sscs-32819.php
"SWU, la plateforme qui veut réinventer le marché de l'énergie",Cryptonews,2021-08-31,https://fr.cryptonews.com/news/swu-la-plateforme-qui-veut-reinventer-le-marche-de-lenergie.htm
