Title,Publisher,Date,Link
Dogecoin Price Forecast: DOGE is back on track to hit all-time ...,Forex Crunch,2021-03-18,https://www.forexcrunch.com/dogecoin-price-forecast-doge-is-back-on-track-to-hit-all-time-highs/
The Woman Behind Cambodia's Moonshot Blockchain Project,CoinDesk,2021-03-18,https://www.coindesk.com/markets/2021/03/18/meet-the-woman-behind-cambodias-moonshot-blockchain-project/
Nexus Mutual Offers DeFi Insurance to Another Bitcoin ...,Crypto Briefing,2021-03-18,https://cryptobriefing.com/nexus-mutual-offers-defi-insurance-bitcoin-lending-platform/
"Bybit expands USDT-Margined offerings with inclusion of Cardano, Polkadot, & Uniswap",CryptoSlate,2021-03-18,https://cryptoslate.com/bybit-expands-usdt-margined-offerings-with-inclusion-of-cardano-polkadot-uniswap/
Celebrity Coin Marketplace BitClout Briefly Returns,Crypto Briefing,2021-03-18,https://cryptobriefing.com/celebrity-coin-marketplace-bitclout-briefly-returns/
Theta price has a clear upside target of $9 with no opposition ...,Forex Crunch,2021-03-18,https://www.forexcrunch.com/theta-price-has-a-clear-upside-target-of-9-with-no-opposition-ahead/
"Josef Holm, Founding Partner of Draper Goren Holm ...",Securities.io,2021-03-18,https://www.securities.io/josef-holm-founding-partner-of-draper-goren-holm-interview-series/
"Star Wars, Wolf of Wall Street NFTs Coming to Ethereum",Crypto Briefing,2021-03-18,https://cryptobriefing.com/star-wars-wolf-wall-street-nfts-coming-ethereum/
US bank Morgan Stanley to launch three Bitcoin funds,CryptoSlate,2021-03-18,https://cryptoslate.com/us-bank-morgan-stanley-to-launch-three-bitcoin-funds/
"Despite Lawsuit, Ripple’s Chris Larsen Continues To Move His XRP SEC Says It Has Evidence",Ripple Coin News,2021-03-18,https://ripplecoinnews.com/despite-lawsuit-ripples-chris-larsen-continues-to-move-his-xrp-sec-says-it-has-evidence/
"Famous TikTok user ‘Doggface’ is selling his NFT for $500,000—but there’s a catch",CryptoSlate,2021-03-18,https://cryptoslate.com/tiktok-user-doggface-is-selling-his-nft-for-500000-but-theres-a-catch/
Chinese state banks start opening enterprise e-CNY accounts ...,TechNode,2021-03-18,https://technode.com/2021/03/18/exclusive-chinese-state-banks-accepting-applications-for-enterprise-e-cny-accounts/
How Will Biden Regulate Bitcoin?,Barron's,2021-03-18,https://www.barrons.com/articles/biden-may-tame-the-crypto-wild-west-why-thats-good-for-investors-51616022415
Crypto Taxes: Bitcoin Investors Get An Additional Month To File From IRS,NewsBTC,2021-03-18,https://www.newsbtc.com/news/bitcoin/crypto-taxes-bitcoin-investors-irs/
What The Heck Is An NFT And Why Is Everybody Talking ...,UPROXX,2021-03-18,https://uproxx.com/culture/nft-non-fungible-tokens-explained/
'Big Short' Michael Burry will stop tweeting after SEC agents visit,Markets Insider,2021-03-18,https://markets.businessinsider.com/currencies/news/big-short-investor-michael-burry-stop-tweets-sec-regulators-visit-2021-3-1030222890
Xenia Hotels & Resorts (XHR) Just Reclaimed the 200-Day Moving Average,Nasdaq,2021-03-18,https://www.nasdaq.com/articles/xenia-hotels-resorts-xhr-just-reclaimed-the-200-day-moving-average
YouTube Vs. TikTok Boxing: When & Where To Watch Battle Of The Platforms,Screen Rant,2021-03-18,https://screenrant.com/youtube-vs-tiktok-boxing-battle-platforms-lineup-when-where-explained/
How to Install (& Play) The Clock Mod in Valheim,Screen Rant,2021-03-18,https://screenrant.com/install-play-clock-mod-valheim/
