Title,Publisher,Date,Link
Dogecoin’s Co-Founder Speaks Out Against Online Abuse,Decrypt,2021-01-31,https://decrypt.co/56134/dogecoins-co-founder-speaks-out-against-abuse
"After Massive Dogecoin Crash, Ripple’s XRP Has Suddenly Rocketed Higher In WallStreetBets Price Surge",Forbes,2021-01-31,https://www.forbes.com/sites/billybambrough/2021/01/31/after-massive-dogecoin-crash-ripples-xrp-has-suddenly-rocketed-higher/
"There's now r/SatoshiStreetBets, the crypto version of WallStreetBets",TweakTown,2021-01-31,https://www.tweaktown.com/news/77632/theres-now-satoshistreetbets-the-crypto-version-of-wallstreetbets/index.html
Here’s why Bitcoin’s past week saw a lot of chaos,AMBCrypto,2021-01-31,https://ambcrypto.com/heres-why-bitcoins-past-week-saw-a-lot-of-chaos/
Examples of How to Ask for Donations,Business 2 Community,2021-01-31,https://www.business2community.com/non-profit-marketing/examples-of-how-to-ask-for-donations-02383290
Binance Coin Price Analysis: 31 January,AMBCrypto,2021-01-31,https://ambcrypto.com/binance-coin-price-analysis-31st-january/
"Bitcoin could soon feature on VISA network, CEO Al Kelly says",CryptoSlate,2021-01-31,https://cryptoslate.com/bitcoin-could-soon-feature-on-visa-network-ceo-al-kelly-says/
"Bitcoin miner outflows hit an ATH, what’s next",AMBCrypto,2021-01-31,https://ambcrypto.com/bitcoin-miner-outflows-hit-an-ath-whats-next/
XRP Posted Biggest Single-Day Gain in 3 Years in a Coordinated Buying Attack,CoinDesk,2021-01-31,https://www.coindesk.com/markets/2021/01/31/xrp-posted-biggest-single-day-gain-in-3-years-in-a-coordinated-buying-attack/
Monthly Dividend Stocks List For 2021,Forbes,2021-01-31,https://www.forbes.com/sites/brettowens/2021/01/31/monthly-dividend-stocks-list-for-2021/
3 Top Resources To Learn About Apache Kafka,HackerNoon,2021-01-31,https://hackernoon.com/3-top-resources-to-learn-about-apache-kafka-1e3832xp
Editor Review: Manasi 7 Strobelighter Highlighter,Hypebae,2021-01-31,https://hypebae.com/2021/1/manasi-7-strobelighter-highlighter-sunsubiro-pink-review-makeup-beauty-product-ingredients-sustainable
PM Narendra Modi Net Worth 2021 | New Assests Gained In 2021,The Global Coverage,2021-01-31,https://theglobalcoverage.com/2021/01/31/pm-modi-net-worth-2021-new-assests-gained-in-2021/
"As Ethereum’s Vitalik Buterin Celebrates His Birthday, CZ Highlights How His Effort Birthed Binance",Herald Sheets,2021-01-31,https://heraldsheets.com/as-ethereums-vitalik-buterin-celebrates-his-birthday-cz-highlights-how-his-effort-birthed-binance/
Different Types of Stock Trading: Everything You Need to Know,FinanceWhile,2021-01-31,https://www.financewhile.com/types-of-stock-trading/
Shaquille O’Neal Net Worth 2021 |Superstar New Assets Gained In 2021,The Global Coverage,2021-01-31,https://theglobalcoverage.com/2021/01/31/shaquille-oneal-net-worth-2021/
Myntra Logo Change Now? What is wrong with Myntra logo | All Details,The Global Coverage,2021-01-31,https://theglobalcoverage.com/2021/01/31/myntra-logo-change-now-what-is-wrong-with-myntra-logo-all-details/
