Title,Publisher,Date,Link
Mark Cuban Believes Dogecoin Holds More Applications ...,The Crypto Times,2022-08-09,https://www.cryptotimes.io/mark-cuban-believes-dogecoin-holds-more-applications-than-cardano/
2 No-Brainer Cryptos With More Potential Than Dogecoin,The Motley Fool,2022-08-09,https://www.fool.com/investing/2022/08/09/2-no-brainer-cryptos-with-more-potential-than-doge/
Dogecoin Extends Gains in the Aftermath of Supportive ...,FXCM,2022-08-09,https://www.fxcm.com/markets/insights/dogecoin-extends-gains-in-the-aftermath-of-supportive-entrepreneur-comments/
"Dogecoin (DOGE) Breaks Through, Reaches Resistance Level Ahead of Rally",U.Today,2022-08-09,https://u.today/dogecoin-doge-breaks-through-reaches-resistance-level-ahead-of-rally
"Dogecoin (DOGE) Is So Far Ahead Of Visa’s Payment Speed It's ‘Laughable,’ Says Lead Developer",Benzinga,2022-08-09,https://www.benzinga.com/markets/cryptocurrency/22/08/28410771/dogecoin-is-so-far-ahead-of-visas-payment-speed-its-laughable-says-lead-developer
"Shiba Inu & Dogecoin, Along With the Meme Coin Market ...",FX Empire,2022-08-09,https://www.fxempire.com/forecasts/article/shiba-inu-dogecoin-along-with-the-meme-coin-market-declined-by-3-1091392
"Cryptocurrencies Price Prediction: Tezos, Ripple and Dogecoin – European Wrap 9 August",FXStreet,2022-08-09,https://www.fxstreet.com/cryptocurrencies/news/cryptocurrencies-price-prediction-tezos-ripple-and-dogecoin-european-wrap-9-august-202208091236
Should You Sell Dogecoin (DOGE) Tuesday?,InvestorsObserver,2022-08-09,https://www.investorsobserver.com/news/crypto-update/should-you-sell-dogecoin-doge-tuesday
"Cryptocurrency Price Today: Bitcoin, Ethereum Lose Value; Popular Altcoins Land In Red",ABP LIVE,2022-08-09,https://news.abplive.com/business/crypto/cryptocurrency-price-today-in-india-august-10-check-market-cap-bitcoin-ethereum-dogecoin-litecoin-ripple-unus-sed-leo-prices-gainer-loser-coinmarketcap-wazirx-1547362
Cryptocurrency News Live: Hodlnaut Pauses Withdrawals Due To 'Market Conditions',ABP LIVE,2022-08-09,https://news.abplive.com/business/crypto/cryptocurrency-news-live-updates-august-9-crypto-market-price-charts-bitcoin-ethereum-dogecoin-1547170
"Bitcoin Approaches This Major Level, Here Are Other Crypto Movers That Should Be On Your Radar",Benzinga,2022-08-09,https://www.benzinga.com/markets/cryptocurrency/22/08/28410875/bitcoin-approaches-this-major-level-here-are-other-crypto-movers-that-should-be-on-your-ra
What is Carlossy Caterpillar? - Here Is All You Need to Know ...,The VR Soldier,2022-08-09,https://thevrsoldier.com/what-is-carlossy-caterpillar-here-is-all-you-need-to-know-about-the-new-meme-coin-project/
Why Crypto Memecoin Whales Are Accumulating Tamadoge | Global Online Money,Global Online Money,2022-08-09,https://globalonlinemony.com/why-crypto-memecoin-whales-are-accumulating-tamadoge/
Cryptocurrency: Has the Bubble Burst?: release date,National World,2022-08-09,https://www.nationalworld.com/culture/television/cryptocurrency-has-the-bubble-burst-channel-4-release-date-presenter-ade-adepitan-crypto-3798783
What triggered Cardano’s buying spree for short time,AMBCrypto,2022-08-09,https://ambcrypto.com/what-triggered-cardanos-buying-spree-for-short-time/
"Bitcoin, Ethereum Notch Losses; Here Are The Top Crypto Movers For Wednesday",Benzinga,2022-08-09,https://www.benzinga.com/markets/cryptocurrency/22/08/28429226/bitcoin-ethereum-notch-losses-here-are-the-top-crypto-movers-for-wednesday
"Precios de Bitcoin, Ethereum y Dogecoin hoy 9 de agosto en dólares, euros y pesos mexicanos",Mi Bolsillo,2022-08-09,https://www.mibolsillo.com/noticias/Precios-de-Bitcoin-Ethereum-y-Dogecoin-hoy-9-de-agosto-en-dolares-euros-y-pesos-mexicanos-20220809-0001.html
Tamadoge Raises Upwards of $1.5 million within 15 days of ...,InsideBitcoins,2022-08-09,https://insidebitcoins.com/news/tamadoge-raises-upwards-of-1-5-million-within-15-days-of-its-presale
Gucci becomes first major brand to accept crypto coin as payment | Global Online Money,Global Online Money,2022-08-09,https://globalonlinemony.com/gucci-becomes-first-major-brand-to-accept-crypto-coin-as-payment/
"Cryptocurrency Prices: Crypto Market Trading Low, BTC down 3.69%, ETH falls 4.97%",Outlook India,2022-08-09,https://www.outlookindia.com/business/cryptocurrency-prices-crypto-market-trading-low-btc-down-3-69-eth-falls-4-97--news-215243
OtterBox now offers $150 toward iPhone screen replacements,Yahoo News,2022-08-09,https://news.yahoo.com/otter-box-will-pay-up-to-150-for-a-broken-i-phone-screen-with-select-screen-protectors-082047700.html
"USD remains sensitive to US data surprises, CPI to signal the direction – TDS",FXStreet,2022-08-09,https://www.fxstreet.com/news/usd-remains-sensitive-to-us-data-surprises-cpi-to-signal-the-direction-tds-202208091427
Curve Finance front end UI compromised following DNS hack – users advised to exercise caution,CryptoSlate,2022-08-09,https://cryptoslate.com/curve-finance-front-end-ui-compromised-in-dns-hack-users-advised-not-to-interact/
What Benefits Blockchain can Bring to Healthcare,Health Tech Zone,2022-08-09,https://www.healthtechzone.com/topics/healthcare/articles/2022/08/09/453159-what-benefits-blockchain-bring-healthcare.htm
LibDogecoin: a new tool to bring developers to DogeCoin,TheGameLocus,2022-08-09,https://www.thegamelocus.com/libdogecoin-a-new-tool-to-bring-developers-to-dogecoin/
"Gorilix (SILVA), Polkadot (DOT), and Avalanche (AVAX) rally as the Global market cap hit a 30-day high",CryptoMode,2022-08-09,https://cryptomode.com/gorilix-silva-polkadot-dot-and-avalanche-avax-rally-as-the-global-market-cap-hit-a-30-day-high/
Bitcoin Is the Great Distraction: Franklin Templeton's Johnson,Bloomberg.com,2022-08-09,https://www.bloomberg.com/news/videos/2022-08-09/bitcoin-is-the-great-distraction-franklin-templeton-s-johnson
No More Connection Drops: Google’s Pixel Buds Pro Give Apple Serious Competition,Yahoo,2022-08-09,https://www.yahoo.com/entertainment/no-more-connection-drops-google-210205494.html
"$2 Trillion in Crypto Has Been Wiped Out, Is This a Good Time ...",The Motley Fool,2022-08-09,https://www.fool.com/the-ascent/cryptocurrency/articles/2-trillion-in-crypto-has-been-wiped-out-is-this-a-good-time-to-buy/
Bullish Expectations From The Ethereum Merge Rise Post ...,TheGWW.com,2022-08-09,https://thegww.com/bullish-expectations-from-the-ethereum-merge-rise-post-chainlinks-announcement/
Elon Musk In 2022: What To Know About The World's Richest ...,Bankrate,2022-08-09,https://www.bankrate.com/investing/elon-musk/
Elon Musk's Biggest Boondoggle,New York Magazine,2022-08-09,https://nymag.com/intelligencer/2022/08/elon-musks-biggest-boondoggle.html
STOCK MARKET NEWS: Nasdaq slides on Micron warning ...,Fox Business,2022-08-09,https://www.foxbusiness.com/live-news/stock-market-today-8-9-2022
Bitcoin Vs Altcoin: Which Do You Like Best?,Nation World News,2022-08-09,https://nationworldnews.com/bitcoin-vs-altcoin-which-do-you-like-best-technology-headlines-titulares-ar/
Adoption Grows as 75% of Retailers Are Eyeing Crypto ...,FX Empire,2022-08-09,https://www.fxempire.com/featured/article/adoption-grows-as-75-of-retailers-are-eyeing-crypto-payments-1090708
Polygon price analysis: MATIC falls at the $0.88 hurdle to ...,Cryptopolitan,2022-08-09,https://www.cryptopolitan.com/polygon-price-analysis-2022-08-09/
Best Missouri Gambling Sites 2022 - Online Gambling in MO,Augusta Free Press,2022-08-09,https://augustafreepress.com/gambling/missouri-gambling/
"MyBookie Promo Code 2022, Best Bonus Offers at MyBookie",Legal sports betting,2022-08-09,https://sportsbetting.legal/bonuses/mybookie/
Samsung Launches Galaxy F13 in India; Offers Immersive Viewing with FHD+ Display and Segment-First Auto Data Switching - Samsung Newsroom India,Inferse.com,2022-08-09,https://www.inferse.com/177824/samsung-launches-galaxy-f13-in-india-offers-immersive-viewing-with-fhd-display-and-segment-first-auto-data-switching-samsung-newsroom-india/
"You will now be able to make purchases with APE (Appcoin), BitPay has started payment support.",Stanford Arts Review,2022-08-09,https://stanfordartsreview.com/2022/08/09/you-will-now-be-able-to-make-purchases-with-ape-appcoin-bitpay-has-started-payment-support/
