Title,Publisher,Date,Link
Elon Musk called 'grifter' by Dogecoin co-founder,Indy100,2022-05-30,https://www.indy100.com/science-tech/elon-musk-grifter-dogecoin-crypto
"Dogecoin Creator Jackson Palmer: 'I Wish It Was The End of Crypto, But It’s Not'",Decrypt,2022-05-30,https://decrypt.co/101641/dogecoin-creator-jackson-palmer-i-wish-it-was-the-end-of-crypto-but-its-not
"Self-Proclaimed ""Dogecoin Billionaire"" Loses Significant Fortune But Remains Invested",NDTV.com,2022-05-30,https://www.ndtv.com/business/despite-losing-dogecoin-billionaire-status-los-angele-resident-remains-faithful-to-meme-coin-3022888
"SHIB Will Be Burned via Amazon, Elon Musk May Get in Trouble with SEC and DOGE, Terra Launches New Blockchain: Crypto News Digest by U.Today",U.Today,2022-05-30,https://u.today/shib-will-be-burned-via-amazon-elon-musk-may-get-in-trouble-with-sec-and-doge-terra-launches-new
Cryptocurrency: SpaceX plans to accept Dogecoin crypto ...,EconoTimes,2022-05-30,https://www.econotimes.com/Cryptocurrency-SpaceX-plans-to-accept-Dogecoin-crypto-payments-for-merchandise-1634459
BNB Chain Powered Baby Doge Coin ($BABYDOGE ...,Cryptoglobe,2022-05-30,https://www.cryptoglobe.com/latest/2022/05/bnb-chain-powered-baby-doge-coin-babydoge-prepares-for-its-first-birthday/
The 6 Best Cryptos to Buy on Coinbase in June,InvestorPlace,2022-05-30,https://investorplace.com/2022/05/these-are-the-six-best-cryptos-to-buy-on-coinbase-in-june/
South Korean Authorities Launch Probe Into Terra Crash: Report,Decrypt,2022-05-30,https://decrypt.co/101658/south-korean-authorities-launch-probe-into-terra-crash-report
Cryptocurrency: The best 5 cryptos to buy right now,Marca,2022-05-30,https://www.marca.com/en/technology/2022/05/30/62950904268e3e972d8b45ea.html
MEME COINS THAT ARE GOING TO TAKE OFF IN 2022 ...,The Crypto Update,2022-05-30,https://www.thecryptoupdates.com/meme-coins-that-are-going-to-take-off-in-2022-mehracki-mki-dogecoin-doge-and-shiba-inu-shib/
Tezos price analysis: Bullish momentum revives XTZ/USD ...,Cryptopolitan,2022-05-30,https://www.cryptopolitan.com/tezos-price-analysis-2022-05-30-2/
"BabyDoge Holder Count Soars to 1.5 Million ATH, Surpassing Shiba Inu",U.Today,2022-05-30,https://u.today/babydoge-holder-count-soars-to-15-million-ath-surpassing-shiba-inu
10 Brazilian Business Giants That Have Taken the Bitcoin ...,Crypto News,2022-05-30,https://cryptonews.com/news/10-brazilian-business-giants-that-have-taken-the-bitcoin-crypto-plunge.htm
"Cryptocurrencies of the future: Decentraland (MANA), Axie ...",NewsBTC,2022-05-30,https://www.newsbtc.com/press-releases/cryptocurrencies-of-the-future-decentraland-mana-axie-infinity-axs-and-gnox-token-gnox/
SpartaCats Goes Live to Unite the NFT and Meme Coin ...,PR Newswire,2022-05-30,https://www.prnewswire.com/news-releases/spartacats-goes-live-to-unite-the-nft-and-meme-coin-communities-into-one-smart-ecosystem-301557363.html
Nike Buys 'DotSwoosh' Ethereum Domain Via its web3 arm ...,InsideBitcoins,2022-05-30,https://insidebitcoins.com/news/nike-buys-dotswoosh-ethereum-domain-via-its-web3-arm-rtfkt
Terra 2.0 launches as old LUNA and UST holders receive ...,InsideBitcoins,2022-05-30,https://insidebitcoins.com/news/terra-2-0-launches-as-old-luna-and-ust-holders-receive-airdrops
Lucky Block Launch Day - Best Web3 and NFT to Invest in Now,InsideBitcoins,2022-05-30,https://insidebitcoins.com/news/lucky-block-launch-day-best-web3-and-nft-to-invest-in-now
"Binance Coin Price Prediction for Today, May 30: BNB ...",InsideBitcoins,2022-05-30,https://insidebitcoins.com/news/binance-coin-price-prediction-for-today-may-30-bnb-follows-bullish-sentiment-at-314
The Walt Disney Company (DIS) Is a Trending Stock: Facts to Know Before Betting on It,Nasdaq,2022-05-30,https://www.nasdaq.com/articles/the-walt-disney-company-dis-is-a-trending-stock:-facts-to-know-before-betting-on-it
