Title,Publisher,Date,Link
"Elon Musk Remains Bullish on Dogecoin, Bitcoin, and Ethereum",The Motley Fool,2022-03-15,https://www.fool.com/the-ascent/cryptocurrency/articles/elon-musk-remains-bullish-on-dogecoin-bitcoin-and-ethereum/
"Bitcoin, Dogecoin and Ethereum all down early Tuesday",Fox Business,2022-03-15,https://www.foxbusiness.com/markets/bitcoin-dogecoin-and-ethereum-all-down-early-tuesday
"What's Driving Ethereum, Dogecoin, and THORChain Higher ...",The Motley Fool,2022-03-15,https://www.fool.com/investing/2022/03/15/whats-driving-ethereum-dogecoin-and-thorchain-high/
Which are the best cheap cryptos to buy in 2022,The Jerusalem Post,2022-03-15,https://www.jpost.com/special-content/which-are-the-best-cheap-cryptos-to-buy-in-2022-701340
What's Going On With Dogecoin Today?,Benzinga,2022-03-15,https://www.benzinga.com/markets/cryptocurrency/22/03/26136145/whats-going-on-with-dogecoin-today
Why Crypto Investors Yawned at AMC's Early Adoption of ...,The Motley Fool,2022-03-15,https://www.fool.com/investing/2022/03/15/why-crypto-investors-yawned-at-amcs-early-adoption/
Mark Cuban’s metaverse predictions from SXSW,Ad Age,2022-03-15,https://adage.com/article/special-report-sxsw/mark-cubans-metaverse-predictions-sxsw/2405956
Ukraine launches website for cryptocurrency donations,Forbes India,2022-03-15,https://www.forbesindia.com/article/news/ukraine-launches-website-for-cryptocurrency-donations/74473/1
Bitcoin Is American Dream: MicroStrategy's Michael Saylor,U.Today,2022-03-15,https://u.today/bitcoin-is-american-dream-microstrategys-michael-saylor
‘Welcome To Crypto Island’: PJ Vogt Plots TV Series & Docs Based On Wild Internet Podcast,Deadline,2022-03-15,https://deadline.com/2022/03/welcome-to-crypto-island-pj-vogt-plots-tv-series-podcast-1234979459/
My No. 2 Stock Pick For 2022 Rises 100%...,InvestorPlace,2022-03-15,https://investorplace.com/2022/03/my-no-2-stock-pick-for-2022-rises-100/
"THORChain Soars on Synthetics, THORFi, Terra Interest",Crypto Briefing,2022-03-15,https://cryptobriefing.com/thorchain-soars-synthetics-thorfi-terra-interest/
Shanghai police bust $16 million crypto pyramid scheme,Cryptopolitan,2022-03-15,https://www.cryptopolitan.com/shanghai-bust-16m-crypto-pyramid-scheme/
Luno wallet adds Uniswap and Chainlink tokens due to high ...,Cryptopolitan,2022-03-15,https://www.cryptopolitan.com/luno-accepts-trading-uniswap-and-chainlink/
Has The NFT Bubble Popped? — OpenSea Revenue Drops ...,Bankless Times,2022-03-15,https://www.banklesstimes.com/news/2022/03/15/has-the-nft-bubble-popped-opensea-revenue-drops-97percent/
Bitcoin Approaching $40K Resistance Zone; Support at $37K,CoinDesk,2022-03-15,https://www.coindesk.com/markets/2022/03/15/bitcoin-approaching-40k-resistance-zone-support-at-37k/
Joe Biden’s Crypto Executive Order Is a Symbol,CoinDesk,2022-03-15,https://www.coindesk.com/policy/2022/03/15/joe-bidens-crypto-executive-order-is-a-symbol/
Ripple price analysis: XRP rejects further downside at $0.75 ...,Cryptopolitan,2022-03-15,https://www.cryptopolitan.com/ripple-price-analysis-2022-03-15/
SHIB Accepting AMC Chain Buys Gold Mine: Details,U.Today,2022-03-15,https://u.today/shib-accepting-amc-chain-buys-gold-mine-details
How Centralized Crypto Lenders Obtain High Yields for ...,Crypto Briefing,2022-03-15,https://cryptobriefing.com/how-centralized-crypto-lenders-obtain-high-yields-for-customers-phemex/
EU’s ‘Bitcoin Ban’ Fell Short but Experts Still Have Ideas for Fixing Crypto’s Carbon Costs,CoinDesk,2022-03-15,https://www.coindesk.com/business/2022/03/15/eus-bitcoin-ban-fell-short-but-experts-still-have-ideas-for-fixing-cryptos-carbon-costs/
5 Benefits of Buying Polygon Matic,Cryptopolitan,2022-03-15,https://www.cryptopolitan.com/5-benefits-of-buying-polygon-matic/
Which Industry is Most Crypto-Friendly?,TheStreet,2022-03-15,https://www.thestreet.com/investing/cryptocurrency/which-industry-is-most-crypto-friendly
Pros and Cons of Stellar Coin Investment,Cryptopolitan,2022-03-15,https://www.cryptopolitan.com/pros-and-cons-of-stellar-coin-investment/
What Is a Rebase/Elastic Token?,CoinDesk,2022-03-15,https://www.coindesk.com/learn/what-is-a-rebaseelastic-token/
$FLICK token gives investors passive income from their favorite media projects,AMBCrypto,2022-03-15,https://ambcrypto.com/flick-token-gives-investors-passive-income-from-their-favorite-media-projects/
Crypto adoption to skyrocket in South Korea as President ...,FXStreet,2022-03-15,https://www.fxstreet.com/cryptocurrencies/news/crypto-adoption-to-skyrocket-in-south-korea-as-president-elect-imposes-zero-taxes-on-gains-202203151725
Algorand price weakens and could crash to $0.60,FXStreet,2022-03-15,https://www.fxstreet.com/cryptocurrencies/news/algorand-price-weakens-and-could-crash-to-060-202203151144
"TA: Ethereum Back to Square One, Why ETH Could Surge Again",NewsBTC,2022-03-15,https://www.newsbtc.com/analysis/eth/ethereum-back-to-square-one/
"Gold Price Forecast: XAUUSD met buyers just ahead of $1,900",FXStreet,2022-03-15,https://www.fxstreet.com/news/gold-price-forecast-poised-to-challenge-a-critical-support-at-1-89064-202203151301
Buy Shiba Inu Coin at $0.000020 Support? - Forex News by ...,FXLeaders,2022-03-15,https://www.fxleaders.com/news/2022/03/15/buy-shiba-inu-coin-at-0-000020-support/
CPLAY Network (CPLAY) Is Now Available for Trading on LBank Exchange | Bitcoinist.com,Bitcoinist,2022-03-15,https://bitcoinist.com/cplay-network-cplay-is-now-available-for-trading-on-lbank-exchange/
"231 Million XRP Wired by FTX, Binance, KuCoin as XRP Is Trending",U.Today,2022-03-15,https://u.today/231-million-xrp-wired-by-ftx-binance-kucoin-as-xrp-is-trending
3 Ways to Earn Passive Crypto Income in 2022,The Motley Fool,2022-03-15,https://www.fool.com/the-ascent/cryptocurrency/articles/3-ways-to-earn-passive-crypto-income-in-2022/
"No Plan To Introduce Cryptocurrency, Says Government; Major Coins See Prices Fall",Outlook India,2022-03-15,https://www.outlookindia.com/business/no-plan-to-introduce-cryptocurrency-says-government-major-coins-see-prices-fall-news-186984
6 Promising Play-to-Earn Platforms Looking To Unseat Splinterlands | Bitcoinist.com,Bitcoinist,2022-03-15,https://bitcoinist.com/6-promising-play-to-earn-platforms-looking-to-unseat-splinterlands/
Hybrid Blockchains Disrupt Business As Usual By Merging The Best Of Private And Public Blockchains |,Bitcoinist,2022-03-15,https://bitcoinist.com/hybrid-blockchains-disrupt-business-as-usual-by-merging-the-best-of-private-and-public-blockchains/
Elliptic Identifies Crypto Wallets Linked to Sanctioned Russian ...,BeInCrypto,2022-03-15,https://beincrypto.com/elliptic-identifies-crypto-wallets-linked-sanctioned-russian-officials/
Crypto Price Check: Traders Playing the Waiting Game,TheStreet,2022-03-15,https://www.thestreet.com/investing/cryptocurrency/crypto-price-check-traders-playing-the-waiting-game
Lucky Block NFTs set to Launch after Testing,InsideBitcoins,2022-03-15,https://insidebitcoins.com/news/lucky-block-nfts-set-to-launch-after-testing
