Title,Publisher,Date,Link
Dogecoin Is on a Long-Term Downtrend; Can Doge Begin the Recovery?,CryptoNewsZ,2022-07-14,https://www.cryptonewsz.com/dogecoin-is-on-a-long-term-downtrend-can-doge-begin-the-recovery/
"Shiba Inu, Dogecoin, ElonDoge, Price Prediction and Analysis ...",The VR Soldier,2022-07-14,https://thevrsoldier.com/shiba-inu-dogecoin-elondoge-price-prediction-q3-2022-can-whales-maintain-meme-coins-bullrun/
"Meme Coins are Here to Stay - Now is the Time to Buy Dogecoin (DOGE), RoboApe (RBA), and Shiba Inu (SHIB) |",Bitcoinist,2022-07-14,https://bitcoinist.com/meme-coins-are-here-to-stay-now-is-the-time-to-buy-dogecoin-doge-roboape-rba-and-shiba-inu-shib/
"‘Never Buy It’—Warren Buffett’s Right-Hand Man Issued A Stark Crypto Warning After Terra Luna-Led Bitcoin, Ethereum, BNB, XRP, Solana, Cardano And Dogecoin Price Crash",Forbes,2022-07-14,https://www.forbes.com/sites/billybambrough/2022/07/14/never-buy-it-warren-buffetts-right-hand-man-issued-a-stark-crypto-warning-after-terra-luna-led-bitcoin-ethereum-bnb-xrp-solana-cardano-and-dogecoin-price-crash/
Uniswap’s Native Token Surges 17% on Robinhood Listing,U.Today,2022-07-14,https://u.today/uniswaps-native-token-surges-17-on-robinhood-listing
"BTC, DOGE and SHIB Price Analysis for July 14",U.Today,2022-07-14,https://u.today/btc-doge-and-shib-price-analysis-for-july-14
Así cotizan las principales criptomonedas hoy 14 de julio de 2022,Infobae,2022-07-14,https://www.infobae.com/noticias/2022/07/14/asi-cotizan-las-principales-criptomonedas-hoy-14-de-julio-de-2022/
Anonymous Bitcoin Whale Just Moved $71M Worth Of BTC Off Coinbase,Benzinga,2022-07-14,https://www.benzinga.com/markets/cryptocurrency/22/07/28068907/anonymous-bitcoin-whale-just-moved-71m-worth-of-btc-off-coinbase
Shiba Inu Makes ‘Huge Addition’ To Metaverse Team,Benzinga,2022-07-14,https://www.benzinga.com/markets/cryptocurrency/22/07/28059718/shiba-inu-makes-huge-addition-to-metaverse-team
Favorite Crypto Betting Sites for the NBA,CryptoMode,2022-07-14,https://cryptomode.com/favorite-crypto-betting-sites-for-the-nba/
Cardano price analysis: ADA shows dormancy at $0.420 after ...,Cryptopolitan,2022-07-14,https://www.cryptopolitan.com/cardano-price-analysis-2022-07-14/
“I Am Suicidal”: Celsius Customers Respond to Firm's ...,Crypto Briefing,2022-07-14,https://cryptobriefing.com/i-am-suicidal-celsius-customers-respond-to-firms-bankruptcy/
Celsius price bleeds 20% overnight after filing Chapter 11 voluntarily,FXStreet,2022-07-14,https://www.fxstreet.com/cryptocurrencies/news/celsius-price-bleeds-20-overnight-after-filing-chapter-11-voluntarily-202207140930
"Celsius Has $1.2 Billion Hole in Balance Sheet, CEO Reveals",U.Today,2022-07-14,https://u.today/celsius-has-12-billion-hole-in-balance-sheet-ceo-reveals
Cryptocurrency News Live: Celsius Files For Bankruptcy,ABP LIVE,2022-07-14,https://news.abplive.com/business/crypto/cryptocurrency-news-live-updates-july-14-crypto-market-price-charts-bitcoin-ethereum-dogecoin-price-in-india-1542424
DoNotPay to help investors sue Celsius,CoinJournal,2022-07-14,https://coinjournal.net/news/we-will-give-little-guys-the-power-to-sue-celsius-says-donotpay-ceo/
Ethereum Continues to Struggle—Does ERC20 Token Gorilix (SILVA) Offer Hope? | Bitcoinist.com,Bitcoinist,2022-07-14,https://bitcoinist.com/ethereum-continues-to-struggle-does-erc20-token-gorilix-silva-offer-hope/
CoinFLEX Reopens Limited Customer Withdrawals,Crypto Briefing,2022-07-14,https://cryptobriefing.com/coinflex-reopens-limited-customer-withdrawals/
Is it Time to Buy SNX? • Benzinga Crypto,Benzinga,2022-07-14,https://www.benzinga.com/money/is-it-time-to-buy-snx
"Celo Grinds to a Halt, Validators “Working to Restart the ...",Crypto Briefing,2022-07-14,https://cryptobriefing.com/celo-grinds-to-a-halt-validators-working-to-restart-the-network/
Bitcoin’s sudden resilience to inflation,FXStreet,2022-07-14,https://www.fxstreet.com/cryptocurrencies/news/bitcoins-sudden-resilience-to-inflation-202207140812
SIMBA Chain Makes Building on the Blockchain Easier Than ...,CoinJournal,2022-07-14,https://coinjournal.net/news/simba-chain-makes-building-on-the-blockchain-easier-than-ever-for-all-with-simba-blocks/
Nexo Price Prediction After Celsius Filed for Bankruptcy ...,Bankless Times,2022-07-14,https://www.banklesstimes.com/news/2022/07/14/nexo-price-prediction-after-celsius-filed-for-bankruptcy/
MakerDAO Adds Société Générale to Its Vaults,Crypto Briefing,2022-07-14,https://cryptobriefing.com/makerdao-adds-societe-generale-to-its-user-list/
Flare Network Developer Adoption Program Is Coming in August,Crypto Briefing,2022-07-14,https://cryptobriefing.com/flare-network-developer-adoption-program-is-coming-in-august/
"Gnox (GNOX) Could Be The Most Likely To Make Early Investors Rich, Rather Than Buying Evmos (EVMOS) Or",Bitcoinist,2022-07-14,https://bitcoinist.com/gnox-gnox-could-be-the-most-likely-to-make-early-investors-rich-rather-than-buying-evmos-evmos-or-chiliz-chz/
Are Play to Earn Crypto Games Still Profitable?,Benzinga,2022-07-14,https://www.benzinga.com/money/are-play-to-earn-crypto-games-still-profitable
When DAO Governance Goes Wrong • Benzinga Crypto,Benzinga,2022-07-14,https://www.benzinga.com/money/when-dao-governance-goes-wrong
Sri Lanka's Central bank warns public on possible risks in ...,Cryptopolitan,2022-07-14,https://www.cryptopolitan.com/sri-lanka-warns-public-on-crypto/
Euro probes below parity but break needs to be verified,FXStreet,2022-07-14,https://www.fxstreet.com/analysis/euro-probes-below-parity-but-break-needs-to-be-verified-202207141518
EUR/USD: The risk of a sharp move below parity cannot be ruled out – ANZ,FXStreet,2022-07-14,https://www.fxstreet.com/news/eur-usd-the-risk-of-a-sharp-move-below-parity-cannot-be-ruled-out-anz-202207140714
"Near Protocol: What it Is, How it Works and How the NEAR ...",CoinDesk,2022-07-14,https://www.coindesk.com/learn/what-is-near-protocol-and-how-does-it-work/
"AMZN: At the level of 83.88, we could see a price reversal and the beginning of a bullish trend",FXStreet,2022-07-14,https://www.fxstreet.com/news/amzn-at-the-level-of-8388-we-could-see-a-price-reversal-and-the-beginning-of-a-bullish-trend-202207140701
"Cardano (ADA), Polygon (MATIC) & ApeCoin (APE) Are Now Available via 5,800 DCMs Across US and Brazil",U.Today,2022-07-14,https://u.today/cardano-ada-polygon-matic-apecoin-ape-are-now-available-via-5800-dcms-across-us-and-brazil
Fed rate hike odds jump to full point after the hot CPI report,FXStreet,2022-07-14,https://www.fxstreet.com/analysis/fed-rate-hike-odds-jump-to-full-point-after-the-hot-cpi-report-202207140751
Secret Network Collaborates With Axelar for Cross-Chain Messaging,NameCoinNews,2022-07-14,https://www.namecoinnews.com/secret-network-collaborates-with-axelar-for-cross-chain-messaging/
"Digital euro would be a success only if widely used, ECB says",FXStreet,2022-07-14,https://www.fxstreet.com/cryptocurrencies/news/digital-euro-would-be-a-success-only-if-widely-used-ecb-says-202207141143
Yen is entering the turbulence territory,FXStreet,2022-07-14,https://www.fxstreet.com/analysis/yen-is-entering-the-turbulence-territory-202207140907
How Elon Musk Became the Internet’s New Main Character,Vanity Fair,2022-07-14,https://www.vanityfair.com/style/2022/07/elon-musk-the-internets-new-main-character
Fed's Waller: Markets may have gotten ahead of themselves on 100 bps hike in July,FXStreet,2022-07-14,https://www.fxstreet.com/news/feds-waller-markets-may-have-gotten-ahead-of-themselves-on-100-bps-hike-in-july-202207141552
"Ankr Unveils Its Biggest Upgrade, Ankr Network 2.0, to Truly ...",Securities.io,2022-07-14,https://www.securities.io/ankr-unveils-its-biggest-upgrade-ankr-network-2-0-to-truly-decentralize-web3s-foundational-layer/
"Ichimoku cloud analysis: EUR/USD, GBP/USD, NZD/USD",FXStreet,2022-07-14,https://www.fxstreet.com/analysis/ichimoku-cloud-analysis-eur-usd-gbp-usd-nzd-usd-202207140719
"India’s Internet And Mobile Body Decides To Distance Itseft From BACC, Bitcoin Falls",Outlook India,2022-07-14,https://www.outlookindia.com/business/india-s-internet-and-mobile-body-decides-to-distance-itseft-from-bacc-bitcoin-falls-news-209218
Markets crumble on demand destruction concerns as recession risks rise,FXStreet,2022-07-14,https://www.fxstreet.com/analysis/markets-crumble-on-demand-destruction-concerns-as-recession-risks-rise-202207141423
"Avalanche’s AVAX price at inflection point, could trigger a 15% move in either direction",FXStreet,2022-07-14,https://www.fxstreet.com/cryptocurrencies/news/avalanches-avax-price-at-inflection-point-could-trigger-a-15-move-in-either-direction-202207141002
Ripple's XRP price is a dangerous bull-trap until this level is touched,FXStreet,2022-07-14,https://www.fxstreet.com/cryptocurrencies/news/ripples-xrp-price-is-a-dangerous-bull-trap-until-this-level-is-touched-202207141948
Breaking: EUR/USD breaks below parity for the first time since 2002,FXStreet,2022-07-14,https://www.fxstreet.com/news/breaking-eur-usd-breaks-below-parity-for-the-first-time-since-2002-202207141326
"AUD/USD wobbles near 2-year low, WTI futures fail to boost selling interest [Video]",FXStreet,2022-07-14,https://www.fxstreet.com/analysis/audusd-wobbles-near-2-year-low-wti-futures-fail-to-boost-selling-interest-202207141011
Globiance and Metaverser - The Revolutionary Fusion of Global Finance with the Metaverse | Bitcoinist.com,Bitcoinist,2022-07-14,https://bitcoinist.com/globiance-and-metaverser-the-revolutionary-fusion-of-global-finance-with-the-metaverse/
EUR/JPY Price Analysis: Buyers emerge around 138.00 lifting the cross to fresh weekly highs,FXStreet,2022-07-14,https://www.fxstreet.com/news/eur-jpy-price-analysis-buyers-emerge-around-13800-lifting-the-cross-to-fresh-weekly-highs-202207141919
USD/JPY Price Analysis: Shorts about to be squeezed as buyers eye 140.00,FXStreet,2022-07-14,https://www.fxstreet.com/news/usd-jpy-price-analysis-shorts-about-to-be-squeezed-as-buyers-eye-14000-202207142318
These two triggers are key to profitably trading Terra’s LUNA price,FXStreet,2022-07-14,https://www.fxstreet.com/cryptocurrencies/news/these-two-triggers-are-key-to-profitably-trading-terras-luna-price-202207140849
Silver Price Analysis: XAG/USD rebound needs validation from $18.60 previous support,FXStreet,2022-07-14,https://www.fxstreet.com/news/silver-price-analysis-xag-usd-rebound-needs-validation-from-1860-previous-support-202207142342
Bitcoin hashrate plummets as Texas-based miners suspend operations,CryptoSlate,2022-07-14,https://cryptoslate.com/bitcoin-hashrate-plummets-as-texas-based-miners-suspend-operations/
"GBP/USD Price Analysis: Plummets below 1.1800, further downside remains on the cards",FXStreet,2022-07-14,https://www.fxstreet.com/news/gbp-usd-price-analysis-plummets-below-11800-further-downside-remains-on-the-cards-202207141352
Is Ethereum a Security? Vitalik Buterin slams critics on Twitter,FXStreet,2022-07-14,https://www.fxstreet.com/cryptocurrencies/news/is-ethereum-a-security-vitalik-buterin-slams-critics-on-twitter-202207141438
"Bexplus Exchange Announces $5,000 Giveaway for New Users",CryptoSlate,2022-07-14,https://cryptoslate.com/press-releases/bexplus-exchange-announces-5000-giveaway-for-new-users/
JPMorgan Stock Falls after it Misses Q2 Earnings Estimates,Business 2 Community,2022-07-14,https://www.business2community.com/stock-news/jpmorgan-stock-falls-after-it-misses-q2-earnings-estimates-02522602
Netflix Looks to Reverse the Slide in Subscriber Growth with ...,Business 2 Community,2022-07-14,https://www.business2community.com/stock-news/netflix-looks-to-reverse-the-slide-in-subscriber-growth-with-ad-supported-version-02522671
Gaming going strong amidst crypto winter with 1.1 million UAWs,CryptoSlate,2022-07-14,https://cryptoslate.com/gaming-going-strong-amidst-crypto-winter-with-1-1-million-uaws/
"Disney Accelerator announces Polygon, Flickplay, Lockerverse in the class of 2022",CryptoSlate,2022-07-14,https://cryptoslate.com/disney-accelerator-announces-polygon-flickplay-lockerverse-in-the-class-of-2022/
Stablecoin rules among topics discussed during Janet Yellen’s meeting with Japanese officials,CryptoSlate,2022-07-14,https://cryptoslate.com/stablecoin-rules-among-topics-discussed-during-janet-yellens-meeting-with-japanese-officials/
Uniswap Users Lose $8.17 Million to Phishing Thieves,Business 2 Community,2022-07-14,https://www.business2community.com/crypto-news/uniswap-users-lose-8-17-million-to-phishing-thieves-02522989
"Crypto's future - UK Treasury Committee Opens Inquiry, Seeks ...",Business 2 Community,2022-07-14,https://www.business2community.com/crypto-news/cryptos-future-uk-treasury-committee-opens-inquiry-seeks-evidence-02522983
Principles for Financial Market Infrastructures should be applied to stablecoins: BIS,CryptoSlate,2022-07-14,https://cryptoslate.com/principles-for-financial-market-infrastructures-should-be-applied-to-stablecoins-bis/
"Uniglo Launches Crypto Wealth Token GLO to Follow Solana (SOL), Polygon (MATIC)",U.Today,2022-07-14,https://u.today/uniglo-launches-crypto-wealth-token-glo-to-follow-solana-sol-polygon-matic
Musk’s dalliance with Twitter takes shareholders on wild ride,Washington Examiner,2022-07-14,https://www.washingtonexaminer.com/news/musks-dalliance-with-twitter-takes-shareholders-on-wild-ride
Ukraine Seizes $3 Million in Cash from OTC Traders,Business 2 Community,2022-07-14,https://www.business2community.com/crypto-news/ukraine-seizes-3-million-in-cash-from-otc-traders-02522986
"GameStop NFT Sales Reach 3,000ETH - Beats Coinbase but ...",Business 2 Community,2022-07-14,https://www.business2community.com/crypto-news/gamestop-nft-sales-reach-3000eth-beats-coinbase-but-long-way-to-top-opensea-02522980
Here's How Profitable On-Chain Bitcoin Trading Really Is: Strategy Backtesting,U.Today,2022-07-14,https://u.today/heres-how-profitable-on-chain-bitcoin-trading-really-is-strategy-backtesting
Swiss Bank PostFinance Set to Introduce Bitcoin Trading to its ...,Business 2 Community,2022-07-14,https://www.business2community.com/crypto-news/swiss-bank-postfinance-set-to-introduce-bitcoin-trading-to-its-2-million-customers-02522995
"As crypto prices crash, some blockchain projects may be struggling to survive",MarketWatch,2022-07-14,https://www.marketwatch.com/story/as-crypto-prices-crash-some-blockchain-projects-may-be-struggling-to-survive-11657826972
Cosmos Crypto Price Prediction 2022 - Will ATOM (Cosmos ...,Business 2 Community,2022-07-14,https://www.business2community.com/crypto-news/cosmos-crypto-price-prediction-2022-will-atom-cosmos-go-up-02522643
Best Long-Term Crypto Investments to Buy July 2022,Business 2 Community,2022-07-14,https://www.business2community.com/crypto-news/best-long-term-crypto-investments-to-buy-july-2022-02522846
European Central Bank hints at PoW-based crypto ban by 2025,CryptoSlate,2022-07-14,https://cryptoslate.com/european-central-bank-ecb-hints-at-pow-based-crypto-ban-by-2025/
Louis DeNicola – Forbes Advisor,Forbes,2022-07-14,https://www.forbes.com/advisor/author/ldenicola/
"Face aux Bitcoiners, Vitalik Buterin riposte sur la nature d ...",Journal Du Coin,2022-07-14,https://journalducoin.com/ethereum/vitalik-buterin-riposte-bitcoiners-nature-ethereum-securities/
Survey reveals high penetration and adoption of crypto in ...,Forbes India,2022-07-14,https://www.forbesindia.com/article/crypto-made-easy/survey-reveals-high-penetration-and-adoption-of-crypto-in-saudi-arabia/78107/1
China's central bank to expand the deployment of e-CNY,Forbes India,2022-07-14,https://www.forbesindia.com/article/crypto-made-easy/chinas-central-bank-to-expand-the-deployment-of-ecny/78109/1
South Africa to regulate crypto as a financial asset,Forbes India,2022-07-14,https://www.forbesindia.com/article/crypto-made-easy/south-africa-to-regulate-crypto-as-a-financial-asset/78099/1
"Ripple Price Prediction for Today, July 14: XRP Range ...",InsideBitcoins,2022-07-14,https://insidebitcoins.com/news/ripple-price-prediction-for-today-july-14-xrp-range-bounds-as-price-holds-0-32
HubSpot Vs. Pardot Comparison 2022,Forbes,2022-07-14,https://www.forbes.com/advisor/business/software/hubspot-vs-pardot/
Baker Hughes (BKR) Dips More Than Broader Markets: What You Should Know,Nasdaq,2022-07-14,https://www.nasdaq.com/articles/baker-hughes-bkr-dips-more-than-broader-markets:-what-you-should-know
Best NBA Sportsbooks 2022 - Top NBA Sportsbook Sites,Augusta Free Press,2022-07-14,https://augustafreepress.com/betting/best-nba-sportsbook-sites/
Ethereum (ETH) cryptocurrency overview,PVP Live,2022-07-14,https://pvplive.net/ethereum-eth-cryptocurrency-overview/
