Title,Publisher,Date,Link
Elon Musk still buying dogecoin despite cryptocurrency crash,New York Post,2022-06-20,https://nypost.com/2022/06/20/elon-musk-still-buying-dogecoin-despite-cryptocurrency-crash/
Elon Musk Tweets Support for Dogecoin After Being Named in ...,GOBankingRates,2022-06-20,https://www.gobankingrates.com/investing/crypto/elon-musk-tweets-support-for-dogecoin-pyramid-scheme-lawsuit/
'Dogecoin pyramid scheme' promotion lands Elon Musk in ...,CoinGeek,2022-06-20,https://coingeek.com/dogecoin-pyramid-scheme-promotion-lands-elon-musk-in-258b-lawsuit/
"Why ApeCoin, STEPN, Theta Network, and Dogecoin Jumped ...",The Motley Fool,2022-06-20,https://www.fool.com/investing/2022/06/20/why-apecoin-stepn-and-dogecoin-jumped-big-today/
Dogecoin Price Shows Consolidation; Will the DOGE Price Rise?,CryptoNewsZ,2022-06-20,https://www.cryptonewsz.com/dogecoin-price-shows-consolidation-will-the-doge-price-rise/
"""If Dogecoin Is A Pyramid Scheme, So Is The Entire Monetary System""- DOGE Creator",TronWeekly,2022-06-20,https://www.tronweekly.com/dogecoin-pyramid-scheme/
"Dogecoin Sees Weekend Bump After Musk Tweets, Synthetix Volumes Grow to $200M",CoinDesk,2022-06-20,https://www.coindesk.com/markets/2022/06/20/dogecoin-sees-weekend-bump-after-musk-tweets-synthetix-volumes-grow-to-200m/
FIREPIN Token (FRPN) Launches in 10 Days as Dogecoin (DOGE) Suffer Lingering Effects of the Market Crash,Coinspeaker,2022-06-20,https://www.coinspeaker.com/firepin-token-launches-in-10-days-dogecoin-suffer/
Shiba Inu (SHIB) Price Prediction 2022 to 2025,FX Empire,2022-06-20,https://www.fxempire.com/forecasts/article/shiba-inu-shib-price-prediction-2022-to-2025-1038970
Ethereum is the most profitable cryptocurrency to mine: report ...,Seeking Alpha,2022-06-20,https://seekingalpha.com/news/3849703-ethereum-verge-dogecoin-are-the-most-profitable-cryptos-to-mine-report-says
10 Best Cryptocurrencies in June 2022 – Forbes Advisor ...,Forbes,2022-06-20,https://www.forbes.com/advisor/ca/investing/cryptocurrency/top-10-cryptocurrencies/
"Bitcoin's struggle to hold at $20,000 keeps crypto market on edge",Tech Xplore,2022-06-20,https://techxplore.com/news/2022-06-bitcoin-struggle-crypto-edge.html
Ethereum Outpaces Bitcoin in Crypto Market Rebound,Crypto Briefing,2022-06-20,https://cryptobriefing.com/ethereum-outpaces-bitcoin-crypto-market-rebound/
Polkadot price analysis: Bullish momentum revives DOT/USD ...,Cryptopolitan,2022-06-20,https://www.cryptopolitan.com/polkadot-price-analysis-2022-06-20/
Tron price prediction: TRX forms a break and retest pattern,CoinJournal,2022-06-20,https://coinjournal.net/news/tron-price-prediction-trx-forms-a-break-and-retest-pattern/
Bitcoin Investors Lose Record $7.3 Billion in Three Days,Decrypt,2022-06-20,https://decrypt.co/103369/bitcoin-investors-lose-record-7-3-billion-in-three-days
"FTX CEO says firm will step in to help ""stem contagion'",CoinJournal,2022-06-20,https://coinjournal.net/news/alameda-research-to-help-stem-contagion-in-crypto-ftx-ceo-says/
Terraform Labs Staff Banned From Leaving South Korea: Report,Crypto Briefing,2022-06-20,https://cryptobriefing.com/terraform-labs-staff-banned-from-leaving-south-korea-report/
What Generation Z Considers 'Wealthy',TheStreet,2022-06-20,https://www.thestreet.com/latest-news/what-generation-z-considers-wealthy
MicroStrategy CEO on Bitcoin price and a list of 'horribles',CoinJournal,2022-06-20,https://coinjournal.net/news/michael-saylor-says-a-parade-of-horribles-are-hurting-bitcoin/
2 QAnon influencers have been blamed for the latest crypto ...,Cryptopolitan,2022-06-20,https://www.cryptopolitan.com/2-qanon-influencers-crypto-scams/
ChangeHero's users will now enjoy exchanges right inside their pocket after iOS app's release |,Bitcoinist,2022-06-20,https://bitcoinist.com/changeheros-users-will-now-enjoy-exchanges-right-inside-their-pocket-after-ios-apps-release/
"Cryptos With The Best DeFi Features:Gnox (GNOX), Cardano ...",Cryptopolitan,2022-06-20,https://www.cryptopolitan.com/cryptos-with-the-best-defi-features-gnox-gnox-cardano-ada-fantom-ftm/
Celsius claims it will take time to stabilize its financial operations,Cryptopolitan,2022-06-20,https://www.cryptopolitan.com/celsius-needs-time-to-stabilize-it-operation/
Ethereum Classic (ETC) May Take a Reversal From Its Lower Zone!,NameCoinNews,2022-06-20,https://www.namecoinnews.com/ethereum-classic-may-take-a-reversal-from-its-lower-zone/
First Mover Asia: A Chinese Alternative to Dollar-Based Stablecoins? Widening the Use of the CNH Presents Challenges; BTC Remains Above $20K,CoinDesk,2022-06-20,https://www.coindesk.com/markets/2022/06/20/first-mover-asia-a-chinese-alternative-to-dollar-based-stablecoins-widening-the-use-of-the-cnh-presents-challenges-btc-remains-above-20k/
Celsius Repays $10M DAI to Compound,Crypto Briefing,2022-06-20,https://cryptobriefing.com/celsius-repays-10m-dai-to-compound/
"Elon Musk's Eldest Daughter Wishes To ""No Longer Be Related"" To Him",HotNewHipHop,2022-06-20,https://www.hotnewhiphop.com/elon-musks-eldest-daughter-wishes-to-no-longer-be-related-to-him-news.153865.html
"Evening Reading - June 20, 2022",Shacknews,2022-06-20,https://www.shacknews.com/article/131032/evening-reading-june-20-2022
These technical indicators suggest Bitcoin price is close to a market bottom,FXStreet,2022-06-20,https://www.fxstreet.com/cryptocurrencies/news/these-technical-indicators-suggest-bitcoin-price-is-close-to-a-market-bottom-202206201502
United Kingdom Will Not Require KYC for Unhosted Wallets,Crypto Briefing,2022-06-20,https://cryptobriefing.com/united-kingdom-wont-require-kyc-for-unhosted-wallets/
Solana-Based Solend Revert Backs Its Move As SOL Surges By Double-digit Gains!,Coinpedia,2022-06-20,https://coinpedia.org/altcoin/solend-reverts-back-its-move-as-sol-surges/
"Ethereum Dips Below $1,000 on Three Arrows Selling, AVAX ...",Bitrates.com,2022-06-20,https://www.bitrates.com/news/p/ethereum-dips-below-1-000-on-three-arrows-selling-avax-cel-sol-jun-20
"Solend Network: Will a new vote, proposal mean differing fortunes for SLND",AMBCrypto,2022-06-20,https://ambcrypto.com/solend-network-will-a-new-vote-proposal-mean-differing-fortunes-for-slnd/
Celsius Network Says It Needs More Time To Get Back Into Financial Shape; Bitcoin Rises,Outlook India,2022-06-20,https://www.outlookindia.com/business/celsius-network-says-it-needs-more-time-to-get-back-into-financial-shape-bitcoin-rises-news-203514
Ubisoft’s Skull and Bones Might Be Released Later in 2022,iTech Post,2022-06-20,https://www.itechpost.com/articles/111452/20220620/ubisoft-s-skull-bones-released-later-2022.htm
Alchemy Pay Price Prediction 2022-2031: Is ACH a Good ...,Cryptopolitan,2022-06-20,https://www.cryptopolitan.com/alchemy-pay-price-prediction/
Terra Community Passes Emergency Fund Distribution ...,Securities.io,2022-06-20,https://www.securities.io/terra-community-passes-emergency-fund-distribution-method-proposal/
"Ethereum price dips toes below $1,000, bulls quickly push back",FXStreet,2022-06-20,https://www.fxstreet.com/cryptocurrencies/news/why-ethereum-price-will-need-to-bite-through-the-sour-apple-202206191234
How to Buy Protos (PRTS),Securities.io,2022-06-20,https://www.securities.io/how-to-buy-protos-prts/
The Metaverse Founders Club Wants To Unlock Cross-Metaverse Interoperability To Provide A Better User Experience,NewsBTC,2022-06-20,https://www.newsbtc.com/news/company/the-metaverse-founders-club-wants-to-unlock-cross-metaverse-interoperability-to-provide-a-better-user-experience/
"The Graph Integrated Cosmos (ATOM), Osmosis Confirmed as ...",Securities.io,2022-06-20,https://www.securities.io/the-graph-integrated-cosmos-atom-osmosis-confirmed-as-next/
"Top 3 Price Prediction Bitcoin, Ethereum, Ripple: Crypto markets recover from weekend bloodbath but not for long",FXStreet,2022-06-20,https://www.fxstreet.com/cryptocurrencies/news/top-3-price-prediction-bitcoin-ethereum-ripple-crypto-markets-recover-from-weekend-bloodbath-but-not-for-long-202206200857
Why it may be time to go long on ApeCoin price,FXStreet,2022-06-20,https://www.fxstreet.com/cryptocurrencies/news/why-it-may-be-time-to-go-long-on-apecoin-price-202206201221
A Stablecoin Flippening - Will USDC Leapfrog USDT?,Securities.io,2022-06-20,https://www.securities.io/a-stablecoin-flippening-will-usdc-leapfrog-usdt/
"Here's How Crypto Market Could Recover Faster, According to FTX U.S. President Brett Harrison",U.Today,2022-06-20,https://u.today/heres-how-crypto-market-could-recover-faster-according-to-ftx-us-president-brett-harrison
"USD/CAD Price Rally Paused at 1.3076, Correcting Before Data",Forex Crunch,2022-06-20,https://www.forexcrunch.com/usd-cad-price-rally-paused-at-1-3076-correcting-before-data/
Visit 1xBit for BTC sports betting right now,CryptoMode,2022-06-20,https://cryptomode.com/visit-1xbit-for-btc-sports-betting-right-now/
Elon Musk Says He Is Buying the Crypto Dip - TheStreet,Inferse.com,2022-06-20,https://www.inferse.com/184432/elon-musk-says-he-is-buying-the-crypto-dip-thestreet/
Roxana Nasoi of Launchpool Labs Joins Jury for Seedstars’ FT x Cardano Blockchain Challenge Finals Pitching Competition,CryptoSlate,2022-06-20,https://cryptoslate.com/press-releases/roxana-nasoi-of-launchpool-labs-joins-jury-for-seedstars-ft-x-cardano-blockchain-challenge-finals-pitching-competition/
Gold Price Forecast: XAUUSD retraces below the 200-DMA and clings to $1830s despite soft US dollar,FXStreet,2022-06-20,https://www.fxstreet.com/news/gold-price-forecast-xauusd-retraces-below-the-200-dma-and-clings-to-1830s-despite-soft-us-dollar-202206201652
Coinbase Stocks Back at Lows - May Cut More Jobs ...,Business 2 Community,2022-06-20,https://www.business2community.com/crypto-news/coinbase-stocks-back-at-lows-may-cut-more-jobs-employees-told-to-quit-02507940
Space Coin Project Is Making Space Travel Accessible to Everyone with Its New ERC20 Token,Coinspeaker,2022-06-20,https://www.coinspeaker.com/space-coin-project-making-space-travel-accessible-to-everyone/
Crypto-miners in Iran face blackout fears after latest diktat,AMBCrypto,2022-06-20,https://ambcrypto.com/crypto-miners-in-iran-face-blackout-fears-after-latest-diktat/
"Oracle Stock Keeps Declining Despite Earnings Beat, TikTok ...",Business 2 Community,2022-06-20,https://www.business2community.com/stock-news/oracle-stock-keeps-declining-despite-earnings-beat-tiktok-deal-02507885
Best Ethereum Wallets for August 2022,Business 2 Community,2022-06-20,https://www.business2community.com/cryptocurrency/best-ethereum-wallets
Oil Stocks Due for Correction? Crude Oil Price Resistance at ...,Business 2 Community,2022-06-20,https://www.business2community.com/stock-news/oil-stocks-due-for-correction-crude-oil-price-resistance-at-110-02507513
What's next for commodity prices as panicked central bankers scramble to fight inflation? [Video],FXStreet,2022-06-20,https://www.fxstreet.com/analysis/whats-next-for-commodity-prices-as-panicked-central-bankers-scramble-to-fight-inflation-video-202206200926
"Over $250 Million In Liquidations As Bitcoin Recovers Above $20,000",NewsBTC,2022-06-20,https://www.newsbtc.com/news/bitcoin/over-250-million-in-liquidations-as-bitcoin-recovers-above-20000/
"ProShares Short Bitcoin ETF to Launch on Tuesday, June 21",U.Today,2022-06-20,https://u.today/proshares-short-bitcoin-etf-to-launch-on-tuesday-june-21
"BlackRock Say Bitcoin Price Will Go Higher, Crypto a Durable ...",Business 2 Community,2022-06-20,https://www.business2community.com/crypto-news/blackrock-say-bitcoin-price-will-go-higher-crypto-a-durable-asset-02507659
Crypto Gibraltar 2022,CryptoSlate,2022-06-20,https://cryptoslate.com/event/crypto-gibraltar-2022/
"Mortgage Refinance Rates Today: June 20, 2022—Current ...",Forbes,2022-06-20,https://www.forbes.com/advisor/mortgages/mortgage-refinance-rates-06-20-22/
Circle CEO fails to dismiss allegations USDC users can be blocked,CryptoSlate,2022-06-20,https://cryptoslate.com/circle-ceo-fails-to-dismiss-allegations-usdc-users-can-be-blocked/
Gate.io: The Crypto Winter Is a Good Time to Accelerate Web 3.0,CryptoNewsZ,2022-06-20,https://www.cryptonewsz.com/gate-io-the-crypto-winter-is-a-good-time-to-accelerate-web-3-0/
Why is nobody talking about the VPOC at $0.59 when ...,FXStreet,2022-06-20,https://www.fxstreet.com/cryptocurrencies/news/why-is-nobody-talking-about-the-vpoc-at-059-when-discussing-terras-luna-price-202206202002
Mogul Make Partnerships to Accelerate NFT Adoption in Entertainment,CryptoNewsZ,2022-06-20,https://www.cryptonewsz.com/mogul-make-partnerships-to-accelerate-nft-adoption-in-entertainment/
How to Fix the YouTube Audio Renderer Error on Windows,MakeUseOf,2022-06-20,https://www.makeuseof.com/windows-youtube-audio-renderer-error/
Why I'd Rather Get a Side Hustle Than Cut Back on Expenses,The Motley Fool,2022-06-20,https://www.fool.com/the-ascent/personal-finance/articles/why-id-rather-get-a-side-hustle-than-cut-back-on-expenses/
"Lightning refuse to go silently in the night, beat Avalanche in Game 3",Yahoo,2022-06-20,https://www.yahoo.com/now/lightning-refuse-to-go-silently-in-the-night-beat-avalanche-in-game-3-032155369.html
"Cryptocurrencies Price Prediction: Ethereum, Bitcoin & more – American Wrap 20 June",FXStreet,2022-06-20,https://www.fxstreet.com/cryptocurrencies/news/cryptocurrencies-price-prediction-ethereum-bitcoin-more-american-wrap-20-june-202206202217
Precious metals hold steady as recession concerns mount,Capital.com,2022-06-20,https://capital.com/precious-metals-hold-steady-as-recession-concerns-mount
Three Arrows and Celsius fall causes massive sell-offs in Defi,Forbes India,2022-06-20,https://www.forbesindia.com/article/crypto-made-easy/three-arrows-and-celsius-fall-causes-massive-selloffs-in-defi/77445/1
BIS unveils a market intelligence platform to tackle crypto and ...,InsideBitcoins,2022-06-20,https://insidebitcoins.com/news/bis-unveils-a-market-intelligence-platform-to-tackle-crypto-and-cbdc-security
ECB's Lagarde sticks to rate-hike plans,KITCO,2022-06-20,https://www.kitco.com/news/2022-06-20/ECB-s-Lagarde-sticks-to-rate-hike-plans.html
Coinbase facing class-action suits over unstable stablecoins,Forbes India,2022-06-20,https://www.forbesindia.com/article/crypto-made-easy/coinbase-facing-classaction-suits-over-unstable-stablecoins/77441/1
GGPI Stock Forecast: Gores Guggenheim skyrockets to post a 1.2% gain for the week,FXStreet,2022-06-20,https://www.fxstreet.com/news/ggpi-stock-forecast-gores-guggenheim-skyrockets-to-post-a-12-gain-for-the-week-202206201101
Babel Finance reaches debt agreement to ease liquidity pressure,CryptoSlate,2022-06-20,https://cryptoslate.com/babel-finance-has-reached-debt-agreement-to-ease-liquidity-pressure/
Gold and silver trade higher ahead of the European open,KITCO,2022-06-20,https://www.kitco.com/news/2022-06-20/Gold-and-silver-trade-higher-ahead-of-the-European-open.html
GBP/USD outlook: Action in early Monday lacks direction but overall picture remains bearish,FXStreet,2022-06-20,https://www.fxstreet.com/analysis/gbp-usd-outlook-action-in-early-monday-lacks-direction-but-overall-picture-remains-bearish-202206200805
How’s the Great CBDC Experiment Going?,HackerNoon,2022-06-20,https://hackernoon.com/hows-the-great-cbdc-experiment-going
Ukraine becomes the third non-EU country to join the ...,Forbes India,2022-06-20,https://www.forbesindia.com/article/crypto-made-easy/ukraine-becomes-the-third-noneu-country-to-join-the-european-blockchain-partnership/77433/1
Big Oil bets that green hydrogen is the future of energy,Deccan Herald,2022-06-20,https://www.deccanherald.com/business/big-oil-bets-that-green-hydrogen-is-the-future-of-energy-1119721.html
Global Atomic receives letters of intent from banking syndicate ...,KITCO,2022-06-20,https://www.kitco.com/news/2022-06-20/Global-Atomic-receives-letters-of-intent-from-banking-syndicate-to-finance-Dasa-uranium-project-in-Niger.html
"Alamos Gold completes construction, starts initial production ...",KITCO,2022-06-20,https://www.kitco.com/news/2022-06-20/Alamos-Gold-completes-construction-starts-initial-production-at-its-La-Yaqui-Grande-gold-mine-in-Mexico.html
"ECB committed to act on fragmentation risks, Centeno says",KITCO,2022-06-20,https://www.kitco.com/news/2022-06-20/ECB-committed-to-act-on-fragmentation-risks-Centeno-says.html
Celsius Network plans to adopt a Bitfinex-like recovery plan,InsideBitcoins,2022-06-20,https://insidebitcoins.com/news/celsius-network-plans-to-adopt-a-bitfinex-like-recovery-plan
How Apple Watch’s Virtual Trainer Will Help You Run Better,Screen Rant,2022-06-20,https://screenrant.com/apple-watch-virtual-trainer-watchos-9-feature-explained/
Edelman CEO on gun safety: 2nd Amendment ‘is just kind of an excuse for delaying’,AOL,2022-06-20,https://www.aol.com/finance/edelman-ceo-gun-safety-2nd-172453020.html
Portugal to keep conservative fiscal policy due to inflation ...,KITCO,2022-06-20,https://www.kitco.com/news/2022-06-20/Portugal-to-keep-conservative-fiscal-policy-due-to-inflation-ECB-rates.html
Litecoin [LTC]: How traders can leverage these profitable outcomes,AMBCrypto,2022-06-20,https://ambcrypto.com/litecoin-ltc-how-traders-can-leverage-these-profitable-outcomes/
Gold is finely poised ahead of key events this week,KITCO,2022-06-20,https://www.kitco.com/news/2022-06-20/Gold-is-finely-poised-ahead-of-key-events-this-week.html
"What Should Your Identity in Metaverse Be Like? NFT Avatars, Anime and Japanese Bikers in This Interview with BOSO TOKYO Creative Director",U.Today,2022-06-20,https://u.today/what-should-your-identity-in-metaverse-be-like-nft-avatars-anime-and-japanese-bikers-in-this
SpaceX launched and landed 3 rockets in the space of 36 hours,Interesting Engineering,2022-06-20,https://interestingengineering.com/science/spacex-launch-3-rockets-space-36-hours
Intel seeks $624 mln in interest from EU after antitrust fine win,KITCO,2022-06-20,https://www.kitco.com/news/2022-06-20/Intel-seeks-624-mln-in-interest-from-EU-after-antitrust-fine-win.html
"Decreasing crude oil inventories, refinery problems mean US gas price climbs to continue: Rystad Energy",Capital.com,2022-06-20,https://capital.com/decreasing-crude-oil-inventories-refinery-problems-mean-us-gas-price-climbs-to-continue-rystad-energy
The risk of recession is real but not imminent,FXStreet,2022-06-20,https://www.fxstreet.com/analysis/the-risk-of-recession-is-real-but-not-imminent-202206201249
"Bancor pushes the pause button, but does that really work for ...",AMBCrypto,2022-06-20,https://ambcrypto.com/bancor-pushes-the-pause-button-but-does-that-really-work-for-bnt/
Cruising for a bruising: Can Carnival’s battered share price recover?,Capital.com,2022-06-20,https://capital.com/cruising-for-a-bruising-can-carnival-s-battered-share-price-recover
Newmont CEO sees new floor level for the gold price,KITCO,2022-06-20,https://www.kitco.com/news/2022-06-20/Newmont-CEO-sees-new-floor-level-for-the-gold-price.html
Three NFT Cryptocurrencies To Buy Now: Polygon (MATIC ...,NewsBTC,2022-06-20,https://www.newsbtc.com/press-releases/three-nft-cryptocurrencies-to-buy-now-polygon-matic-axie-infinity-axs-cashfi-cfi/
"High fares, rising economic worries could weigh on airline ...",KITCO,2022-06-20,https://www.kitco.com/news/2022-06-20/High-fares-rising-economic-worries-could-weigh-on-airline-recovery.html
Gamma - the marketplace for Bitcoin NFTs powered by Stacks ...,Brave New Coin,2022-06-20,https://bravenewcoin.com/insights/podcasts/gamma-the-marketplace-for-bitcoin-nfts-powered-by-stacks
Europe may shift back to coal as Russia turns down gas flows,Capital.com,2022-06-20,https://capital.com/europe-may-shift-back-to-coal-as-russia-turns-down-gas-flows
The seasonal weakness for USD/JPY [Video],FXStreet,2022-06-20,https://www.fxstreet.com/analysis/the-seasonal-weakness-for-usd-jpy-video-202206201215
"Polkadot Price Prediction for Today, June 20: DOT May Lose ...",InsideBitcoins,2022-06-20,https://insidebitcoins.com/news/polkadot-price-prediction-for-today-june-20-dot-may-lose-at-9
Best Web Design Software (August 2022) – Forbes Advisor,Forbes,2022-06-20,https://www.forbes.com/advisor/business/software/best-web-design-software/
"Remote Payroll Review 2022: Plans, Pricing And Features",Forbes,2022-06-20,https://www.forbes.com/advisor/business/software/remote-payroll-review/
"Texas GOP Resolution Apparently Opposes Judicial Review in the U.S., Rejects Legitimacy of 2020 Election and Flirts with Secession",Law & Crime,2022-06-20,https://lawandcrime.com/high-profile/texas-gop-resolution-apparently-opposes-judicial-review-in-the-u-s-rejects-legitimacy-of-2020-election-and-flirts-with-secession/
"PlayStation, Google Vets to Co-Create New Franchises Via Solana DAOs",Decrypt,2022-06-20,https://decrypt.co/103302/playstation-google-vets-to-co-create-new-franchises-via-solana-daos
Recent volatility sees Bitcoin Stock-to-Flow model breached for the first time,CryptoSlate,2022-06-20,https://cryptoslate.com/recent-volatility-sees-bitcoin-stock-to-flow-model-breached-for-the-first-time/
"$1.05 echoing potential weakness on EUR/USD, $1.04 eyed",FXStreet,2022-06-20,https://www.fxstreet.com/analysis/105-echoing-potential-weakness-on-eur-usd-104-eyed-202206201916
Bank of England's Mann says weak pound makes case for big rate hike,Capital.com,2022-06-20,https://capital.com/bank-of-england-s-mann-says-weak-pound-makes-case-for-big-rate-hike
"Forex market: USD/CHF dips, as haven demand flocks to Swiss franc",Capital.com,2022-06-20,https://capital.com/forex-market-usd-chf-dips-as-haven-demand-flocks-to-swiss-franc
Nokia showcases first 100Gb/second fiber broadband technology in the US -,"SymbianOne Mobile Tech, Cryptocurrency - Crypto",2022-06-20,http://symbianone.com/2022/06/nokia-showcases-first-100gb-second-fiber-broadband-technology-in-the-us/
"Gold will shine bright as Bitcoin, cryptocurrencies collapse",KITCO,2022-06-20,https://www.kitco.com/news/2022-06-20/Gold-will-shine-bright-as-Bitcoin-cryptocurrencies-collapse.html
"BitOasis joins layoff spree, firing 5% of staff",CryptoSlate,2022-06-20,https://cryptoslate.com/bitoasis-joins-layoff-spree-firing-5-of-staff/
"USD 3,071.5 Mn Weather Forecasting Systems Market Report by Type,","SymbianOne Mobile Tech, Cryptocurrency - Crypto",2022-06-20,http://symbianone.com/2022/06/usd-3071-5-mn-weather-forecasting-systems-market-report-by-type-application-and-to-grow-at-a-cagr-of-4-8/
"Bitcoin barely hits key $20K threshold, rattling crypto investors",New York Post,2022-06-20,https://nypost.com/2022/06/20/bitcoin-barely-hits-key-20k-threshold-rattling-investors/
BNPL companies: Can flexible payments beat inflation risks?,Capital.com,2022-06-20,https://capital.com/bnpl-companies-can-flexible-payments-beat-inflation-risks
Meet The Winners of Apple's Swift Student Challenge,Paste Magazine,2022-06-20,https://www.pastemagazine.com/tech/apple/apple-wwdc-swift-student-challenge-winners-apps/
This Week's Best Bets: Cryptocurrency Sports Betting Picks by ...,Bitrates.com,2022-06-20,https://www.bitrates.com/news/p/this-weeks-best-bets-cryptocurrency-sports-betting-picks-by-96ace
Litentry price prediction: Will LIT recover?,Capital.com,2022-06-20,https://capital.com/litentry-lit-price-prediction
These three analysts see lower gold prices by year-end,KITCO,2022-06-20,https://www.kitco.com/news/2022-06-20/These-three-analysts-see-lower-gold-prices-by-year-end.html
UK bank shares: Why it’s better to be HSBC than Virgin Money,Capital.com,2022-06-20,https://capital.com/uk-bank-shares-why-it-s-better-to-be-hsbc-than-virgin-money
Global gold supply to fall after 2022 - report,KITCO,2022-06-20,https://www.kitco.com/news/2022-06-20/Global-gold-supply-to-fall-after-2022-report.html
NBA Draft 2022: Top 10 Best Guard Prospects,Basketball Insiders,2022-06-20,https://www.basketballinsiders.com/news/nba-draft-2022-top-10-best-guard-prospects/
"Thousands of flights cancelled over Juneteenth, Father's Day travel chaos",New York Post,2022-06-20,https://nypost.com/2022/06/20/thousands-of-flights-cancelled-over-holiday-travel-chaos/
Ripple continues to battle SEC in court as XRP price holds $0.30 support,FXStreet,2022-06-20,https://www.fxstreet.com/cryptocurrencies/news/why-ripple-needs-another-50-correction-before-investors-will-think-about-returning-202206191031
"SimpleFX Exchange Review 2022 – Fees, Supported Coins, FAQ’s And More",Coinpedia,2022-06-20,https://coinpedia.org/exchange/simplefx-exchange-review-2022-fees-supported-coins-faqs-and-more/
Look What Happened To Me When I Came Out! - Amber ...,The Overtimer,2022-06-20,https://theovertimer.com/2022/06/look-what-happened-to-me-when-i-came-out-amber-heard-says-johnny-depps-ex-partners-are-afraid-to-accuse-him/
Seeking Sister Wife: The Whole Story Behind The Snowden's ...,The Overtimer,2022-06-20,https://theovertimer.com/2022/06/seeking-sister-wife-the-whole-story-behind-the-snowdens-abuse-allegations/
"Toby Salin, Missing Whistler SAR member found dead",The Intelligencer,2022-06-20,https://www.lintelligencer.com/toby-salin-missing-whistler-sar-member-found-dead-17455-2022/
Single Finance and SpookySwap Enter Strategic Partnership,CoinNewsSpan,2022-06-20,https://www.coinnewsspan.com/single-finance-and-spookyswap-enter-strategic-partnership/
Peel police arrest partner of woman found dead in Brampton ...,The Intelligencer,2022-06-20,https://www.lintelligencer.com/peel-police-arrest-partner-of-woman-found-dead-in-brampton-home-17452-2022/
DOJ Has Internal Campaign Emails Over Fake Electors Scheme to Present to Grand Jury,PoliticusUSA,2022-06-20,https://www.politicususa.com/2022/06/20/doj-has-internal-campaign-emails-over-fake-electors-scheme-to-present-to-grand-jury.html
USA Sensex Extends Losses To 6th Session! Markets Fell ...,aomarkets,2022-06-20,https://aomarkets.com/usa-sensex-extends-losses-6th-session/
Stock Markets Have Officially Entered Bear Territory,Born2Invest,2022-06-20,https://born2invest.com/articles/stock-markets-have-officially-entered-bear-territory/
