Title,Publisher,Date,Link
Dogecoin price fails to recover despite Elon Musk’s announcement,FXStreet,2022-05-29,https://www.fxstreet.com/cryptocurrencies/news/dogecoin-price-fails-to-recover-despite-elon-musks-announcement-202205291353
"Dogecoin Price Analysis: Despite Elon Musk’s Recent Tweets, DOGE At Critical Support",CryptoPotato,2022-05-29,https://cryptopotato.com/dogecoin-price-analysis-despite-elon-musks-recent-tweets-doge-at-critical-support/
"Like Tesla, SpaceX To Accept Dogecoin Payments For Merchandise Soon",India.com,2022-05-29,https://www.india.com/business/like-tesla-spacex-to-accept-dogecoin-payments-for-merchandise-soon-5420898/
Technology News | ⚡Elon Musk-Owned SpaceX To Soon Accept Dogecoin As Payment Option for Merchandise: Report,LatestLY,2022-05-29,https://www.latestly.com/quickly/technology/elon-musk-owned-spacex-to-soon-accept-dogecoin-as-payment-option-for-merchandise-report-3764647.html
How You Can Use Your Old Computers to Mine ...,The Motley Fool,2022-05-29,https://www.fool.com/the-ascent/cryptocurrency/articles/how-you-can-use-your-old-computers-to-mine-cryptocurrency-from-home/
"First Mover Asia: Bitcoin Extends Losing Streak, New LUNAs ...",CoinDesk,2022-05-29,https://www.coindesk.com/markets/2022/05/29/first-mover-asia-bitcoin-extends-losing-streak-new-lunas-crash-like-old-lunas-stepns-china-dilemma/
LUNA 2.0 suffers 80% decline after listing 1,Cryptopolitan,2022-05-29,https://www.cryptopolitan.com/luna-20-suffers-80-decline-after-listing/
Polkadot price analysis: DOT/USD pair set to break above $10 ...,Cryptopolitan,2022-05-29,https://www.cryptopolitan.com/polkadot-price-analysis-2022-05-29-2/
Top 5 Altcoins to Buy for 100x Gains Following the Recent Crash,Business 2 Community,2022-05-29,https://www.business2community.com/crypto-news/top-5-altcoins-to-buy-for-100x-gains-following-the-recent-crash-02499045
"Precios de Bitcoin, Ethereum y Dogecoin hoy 29 de mayo en dólares, euros y pesos mexicanos",Mi Bolsillo,2022-05-29,https://www.mibolsillo.com/noticias/Precios-de-Bitcoin-Ethereum-y-Dogecoin-hoy-29-de-mayo-en-dolares-euros-y-pesos-mexicanos-20220529-0005.html
"Ethereum Supply ""Has Flows Problems"": Analysts Indicate Dangerous Imbalance",U.Today,2022-05-29,https://u.today/ethereum-supply-has-flows-problems-analysts-indicate-dangerous-imbalance
"The Bitcoin-Stock Market Decoupling Isn’t Happening Yet, but It Totally Will",CoinDesk,2022-05-29,https://www.coindesk.com/markets/2022/05/29/the-bitcoin-stock-market-decoupling-isnt-happening-yet-but-it-totally-will/
Tezos price analysis: Bullish sentiment mounts as XTZ/USD ...,Cryptopolitan,2022-05-29,https://www.cryptopolitan.com/tezos-price-analysis-2022-05-29/
"Here’s What Next For Bitcoin, Ethereum and Solana In Coming Week",Coinpedia,2022-05-29,https://coinpedia.org/altcoin/heres-what-next-for-bitcoin-ethereum-and-solana-in-coming-week/
