Title,Publisher,Date,Link
"Dogecoin, Shiba Inu, Uniswap Price Analysis: 06 April",AMBCrypto,2022-04-06,https://ambcrypto.com/dogecoin-shiba-inu-uniswap-price-analysis-06-april/
3 Short Squeeze Penny Stocks Better Than Dogecoin To Buy For Under $5,PennyStocks.com,2022-04-06,https://pennystocks.com/featured/2022/04/06/3-short-squeeze-penny-stocks-better-dogecoin-to-buy-under-5/
Dogecoin Price Prediction: DOGE targets $0.19,FXStreet,2022-04-06,https://www.fxstreet.com/cryptocurrencies/news/dogecoin-price-prediction-doge-targets-019-202204061405
"EV Mines Bitcoin, Ethereum And Dogecoin While Parked",Benzinga,2022-04-06,https://www.benzinga.com/markets/cryptocurrency/22/04/26491796/this-electric-vehicle-mines-bitcoin-ethereum-and-dogecoin-while-parked
Memecoin Ascendent: Can Elon Musk’s Seat on Twitter Board End Dogecoin’s Joke Status?,PYMNTS.com,2022-04-06,https://www.pymnts.com/cryptocurrency/2022/memecoin-ascendent-can-elon-musks-seat-on-twitter-board-end-dogecoins-joke-status/
Bitcoin of America adds Dogecoin to ATMs,ATM Marketplace,2022-04-06,https://www.atmmarketplace.com/news/bitcoin-of-america-adds-dogecoin-to-atms/
"Why Bitcoin, Ethereum, Dogecoin, and Shiba Inu Are Down ...",The Motley Fool,2022-04-06,https://www.fool.com/investing/2022/04/06/why-bitcoin-ethereum-and-shiba-inu-are-down-today/
Largest cryptocurrencies fall as Dogecoin tumbles,MarketWatch,2022-04-06,https://www.marketwatch.com/story/largest-cryptocurrencies-fall-as-dogecoin-tumbles-01649253626-e0866a699b7e
Dogecoin Whales Increase Transactions by 126% as DOGE Enters Profit-Taking,U.Today,2022-04-06,https://u.today/dogecoin-whales-increase-transactions-by-126-as-doge-enters-profit-taking
Cryptocurrency Prices On April 6 2022: Know The Rate Of ...,ABP LIVE,2022-04-06,https://news.abplive.com/business/cryptocurrency-prices-on-april-6-2022-know-the-rate-of-bitcoin-ethereum-litecoin-ripple-dogecoin-and-other-cryptocurrencies-1523926
Binance.US Brings in More Than $200M in First Fundraising Round,PYMNTS.com,2022-04-06,https://www.pymnts.com/news/investment-tracker/2022/binance-us-brings-in-more-than-200m-in-first-fundraising-round/
"Starbucks To Take A Taste Of NFTs; Brand Is Treasure Trove Of Collectibles, Says CEO; Bitcoin Price Falls",Outlook India,2022-04-06,https://www.outlookindia.com/business/starbucks-to-take-a-taste-of-nfts-brand-is-treasure-trove-of-collectibles-says-ceo-bitcoin-price-falls-news-190366
DAO Maker New NFT Launchpad to Host the First-Ever ...,Crypto Briefing,2022-04-06,https://cryptobriefing.com/dao-maker-new-nft-launchpad-to-host-the-first-ever-licensed-maradona-collection/
Ethereum's Coming 'Merge' Could Make or Break Crypto,Bloomberg.com,2022-04-06,https://www.bloomberg.com/news/articles/2022-04-06/why-ethereum-s-coming-merge-matters-for-crypto
"US and German Authorities Close Longest-Running Darknet Market, Hydra",Benzinga,2022-04-06,https://www.benzinga.com/markets/cryptocurrency/22/04/26494054/us-and-german-authorities-close-longest-running-darknet-market-hydra
Bitcoin Miner Marathon to Transition 'Away From Fossil Fuel Generation’,Decrypt,2022-04-06,https://decrypt.co/97047/bitcoin-miner-marathon-transition-fossil-fuel-generation
Forbes reveal crypto billionaires of 2022,Cryptopolitan,2022-04-06,https://www.cryptopolitan.com/frobes-unveils-crypto-billionaires-of-2022/
"Kevin Smith to Release New Horror Film via Secret Network NFTs, Collaborate With Holders",Decrypt,2022-04-06,https://decrypt.co/97030/kevin-smith-to-release-new-horror-film-via-secret-network-nfts-collaborate-with-holders
Millennials have solved the retirement crisis,MarketWatch,2022-04-06,https://www.marketwatch.com/story/millennials-have-solved-the-retirement-crisis-11649199310
Should You Invest in Crypto? Here's What Dave Ramsey Thinks,The Motley Fool,2022-04-06,https://www.fool.com/the-ascent/cryptocurrency/articles/should-you-invest-in-crypto-dave-ramsey/
"Institutional demand for DOT, AVAX and ATOM is on the rise, painting a bullish outlook",FXStreet,2022-04-06,https://www.fxstreet.com/cryptocurrencies/news/institutional-demand-for-dot-avax-and-atom-is-on-the-rise-painting-a-bullish-outlook-202204061505
"Stablecoins are coming to the Bitcoin Lightning Network, expanding BTC price potential",FXStreet,2022-04-06,https://www.fxstreet.com/cryptocurrencies/news/stablecoins-are-coming-to-the-bitcoin-lightning-network-expanding-btc-price-potential-202204060902
5 Best Layer 1 Blockchain Cryptocurrency to Invest in Now ...,InsideBitcoins,2022-04-06,https://insidebitcoins.com/news/5-best-layer-1-blockchain-cryptocurrency-to-invest-in-now-april-2022-week-1
