Title,Publisher,Date,Link
Shiba inu coin hits record after crypto whale buys 277 billion tokens,Markets Insider,2021-10-26,https://markets.businessinsider.com/news/currencies/shiba-inu-coin-price-crypto-whale-buys-277-billion-tokens-2021-10
"Shiba Inu Price Analysis: Following Another 20% Daily Surge, What’s SHIB’s Next Target?",CryptoPotato,2021-10-26,https://cryptopotato.com/shiba-inu-price-analysis-following-another-20-daily-surge-whats-shibs-next-target/
Shiba Inu [SHIB] Takes A Flight To Paris To Savor French Cuisine,TronWeekly,2021-10-26,https://www.tronweekly.com/shiba-inu-shib-takes-a-flight-to-paris/
"Secret, Curve and Shiba Inu gains suggest that altseason is coming",Cointelegraph,2021-10-26,https://cointelegraph.com/news/secret-curve-and-shiba-inu-gains-suggest-that-altseason-is-coming
This Halloween Play the SHIB Game With StormGain and Get 5 USDT for Free! | Bitcoinist.com,Bitcoinist,2021-10-26,https://bitcoinist.com/this-halloween-play-the-shib-game-with-stormgain-and-get-5-usdt-for-free/
3 Growth Stocks I'd Buy in a Heartbeat Over Any Cryptocurrency,The Motley Fool,2021-10-26,https://www.fool.com/investing/2021/10/26/3-growth-stocks-id-buy-over-any-cryptocurrency/
"Wojak Finance Launches $22,500 Airdrop Together with CoinMarketCap",U.Today,2021-10-26,https://u.today/wojak-finance-launches-22500-airdrop-together-with-coinmarketcap
Will Cardano Be the Next Cryptocurrency to Make All-Time ...,InvestorPlace,2021-10-26,https://investorplace.com/2021/10/will-cardano-be-the-next-cryptocurrency-to-make-all-time-highs/
"Chainlink investors’ patience may have paid off, but what now",AMBCrypto,2021-10-26,https://ambcrypto.com/chainlink-investors-patience-may-have-paid-off-but-what-now/
"After Mastercard, could Amex be next with crypto-linked credit card",AMBCrypto,2021-10-26,https://ambcrypto.com/after-mastercard-could-amex-be-next-with-crypto-linked-credit-card/
The case for Bitcoin hitting $100K by November,AMBCrypto,2021-10-26,https://ambcrypto.com/the-case-for-bitcoin-hitting-100k-by-november/
"Fino Payments Bank IPO To Open On October 29. Check Price Band, Last Date And More",Outlook India,2021-10-26,https://www.outlookindia.com/website/story/business-news-fino-payments-bank-ipo-to-open-on-october-29-check-price-band-last-date-and-more/398789
Tom Brady: How much Bitcoin does he have?,Cryptopolitan,2021-10-26,https://www.cryptopolitan.com/tom-brady-how-much-bitcoin-does-he-have/
Cryptocurrency Prices On October 26 2021: Know The Rate Of ...,ABP LIVE,2021-10-26,https://news.abplive.com/business/cryptocurrency-prices-26-october-2021-know-rate-of-bitcoin-ethereum-litecoin-ripple-dogecoin-and-other-digital-currency-1489793
Solana needs to pause here before it can climb again,AMBCrypto,2021-10-26,https://ambcrypto.com/solana-needs-to-pause-here-before-it-can-climb-again/
StrongNode AMA Session With BeInCrypto,BeInCrypto,2021-10-26,https://beincrypto.com/strongnode-ama-session-with-beincrypto/
Special Economic Zones Are the Future For Crypto Exchanges,BeInCrypto,2021-10-26,https://beincrypto.com/special-economic-zones-are-the-future-for-crypto-exchanges/
Uniswap Surpasses $500B in Cumulative Trading Volume,BeInCrypto,2021-10-26,https://beincrypto.com/uniswap-surpasses-500b-in-cumulative-trading-volume/
"Don't Miss Tomi's $75,000 TOMI Token Airdrop",BeInCrypto,2021-10-26,https://beincrypto.com/dont-miss-tomis-75000-tomi-token-airdrop/
Dexsport — Revolutionizing Decentralized Betting,BeInCrypto,2021-10-26,https://beincrypto.com/meet-dexsport-revolutionizing-decentralized-betting/
