Title,Publisher,Date,Link
This Exchange Coin Heavily Undervalued: Analyst Shares Views Ahead of Coinbase IPO,U.Today,2021-04-13,https://u.today/this-exchange-coin-heavily-undervalued-analyst-shares-views-ahead-of-coinbase-ipo
XSL Labs launches its SYL token on the ProBit Exchange!,AMBCrypto,2021-04-13,https://ambcrypto.com/xsl-labs-launches-its-syl-token-on-the-probit-exchange/
These are the top-performing cryptocurrencies of Q1 2021,FXStreet,2021-04-13,https://www.fxstreet.com/cryptocurrencies/news/these-are-the-top-performing-cryptocurrencies-of-q1-2021-202104132205
Fed's Harker: Fed policy is going to hold steady for now,FXStreet,2021-04-13,https://www.fxstreet.com/news/feds-harker-fed-policy-is-going-to-hold-steady-for-now-202104131637
"Breaking: Bitcoin price hits new all-time high near $63,000",FXStreet,2021-04-13,https://www.fxstreet.com/cryptocurrencies/news/breaking-bitcoin-price-hits-new-all-time-high-of-nearly-63-000-202104130845
Long-Term On-Chain Metrics Show BTC Has Room For Growth,BeInCrypto,2021-04-13,https://beincrypto.com/long-term-on-chain-metrics-show-btc-has-room-for-growth/
Megadeth Completes First NFT Sale in Heavy Metal Music,BeInCrypto,2021-04-13,https://beincrypto.com/megadeth-completes-first-nft-sale-in-heavy-metal-music/
Nikki Grahame dead: ‘Big Brother Canada’ star dies at age 38,The Intelligencer,2021-04-13,https://www.lintelligencer.com/nikki-grahame-dead-big-brother-canada-star-dies-at-age-38-14154-2021/
