Title,Publisher,Date,Link
"South Korea exchanges Bithumb, CoinOne, Korbit join forces to de’CODE’ regulations",AMBCrypto,2021-08-31,https://ambcrypto.com/south-korea-exchanges-bithumb-coinone-korbit-join-forces-to-decode-regulations/
"Cardano Price Analysis: ADA Bounces Amid Critical Support, Is $3 Retest Incoming?",CryptoPotato,2021-08-31,https://cryptopotato.com/cardano-price-analysis-ada-bounces-amid-critical-support-is-3-retest-incoming/
How Litecoin can avoid a breakdown from this pattern,AMBCrypto,2021-08-31,https://ambcrypto.com/how-litecoin-can-avoid-a-breakdown-from-this-pattern/
XRP army play key role in SEC vs Ripple case while price remains range-bound,FXStreet,2021-08-31,https://www.fxstreet.com/cryptocurrencies/news/xrp-army-play-key-role-in-sec-vs-ripple-case-while-price-remains-range-bound-202108311445
Experts believe Bitcoin will form a “double bubble” before prices retrace,FXStreet,2021-08-31,https://www.fxstreet.com/cryptocurrencies/news/experts-believe-bitcoin-will-form-a-double-bubble-before-prices-retrace-202108311027
Ethereum: Similarities with 2018’s market structure might foreshadow this ‘worst-case scenario’,AMBCrypto,2021-08-31,https://ambcrypto.com/ethereum-similarities-with-2018s-market-structure-might-foreshadow-this-worst-case-scenario/
"Solana’s run to overtake Polkadot, Uniswap can be credited to this",AMBCrypto,2021-08-31,https://ambcrypto.com/solanas-run-to-overtake-polkadot-uniswap-can-be-credited-to-this/
Hungary vs England Prediction And Odds: Robust England To ...,crowdwisdom.live,2021-08-31,https://crowdwisdom.live/european-football/hungary-vs-england-prediction/
"SWU, la plateforme qui veut réinventer le marché de l'énergie",Cryptonews,2021-08-31,https://fr.cryptonews.com/news/swu-la-plateforme-qui-veut-reinventer-le-marche-de-lenergie.htm
