Title,Publisher,Date,Link
"TRON, Litecoin, EOS – What sentiment scores don’t tell you",AMBCrypto,2021-07-20,https://ambcrypto.com/tron-litecoin-eos-what-sentiment-scores-dont-tell-you/
Only a matter of time before Bitcoin does this,AMBCrypto,2021-07-20,https://ambcrypto.com/only-a-matter-of-time-before-bitcoin-does-this/
The Secondary Phone Repair Economy,CryptoMode,2021-07-20,https://cryptomode.com/secondary-phone-repair-economy/
Analyst on Cardano: ‘Be very careful because….’,AMBCrypto,2021-07-20,https://ambcrypto.com/analyst-on-cardano-be-very-careful-because/
"As Bitcoin Drops Below $30k, Stablecoins Surpass $100 Billion In Total Supply",NewsBTC,2021-07-20,https://www.newsbtc.com/news/bitcoin-below-30k-stablecoins-100-billion/
"EOS, MATIC, DASH Price Analysis: 20 July",AMBCrypto,2021-07-20,https://ambcrypto.com/eos-matic-dash-price-analysis-20-july/
"NFT Success Requires Authenticity, Patience And Community ...",BeInCrypto,2021-07-20,https://beincrypto.com/nft-success-requires-authenticity-patience-and-community-building/
Grooming Products Firm Axe Releases Limited Edition 'Crypto ...,Bitcoin.com News,2021-07-20,https://news.bitcoin.com/grooming-products-firm-axe-releases-limited-edition-crypto-scented-doge-body-spray/
Le double langage de BlackRock sur Bitcoin - Journal du Coin,Journal Du Coin,2021-07-20,https://journalducoin.com/bitcoin/le-double-langage-de-blackrock-sur-bitcoin/
