Title,Publisher,Date,Link
Shiba Inu [SHIB] Flips Sides With A 26% Daily Surge,TronWeekly,2021-11-06,https://www.tronweekly.com/shiba-inu-shib-flips-sides-with-a-26-surge/
Shiba Inu's 2 Biggest Catalysts Won't Save It From Tumbling,The Motley Fool,2021-11-06,https://www.fool.com/investing/2021/11/06/shiba-inu-2-big-catalysts-wont-save-from-tumbling/
Shiba Inu Dog Purchases Becoming Popular on the Back of ...,BeInCrypto,2021-11-06,https://beincrypto.com/shiba-inu-dog-purchases-becoming-popular-on-the-back-of-shib-crypto-popularity/
Shiba Inu Price Analysis: SHIB Bounces Up But What’s the Next Target for the Bulls?,CryptoPotato,2021-11-06,https://cryptopotato.com/shiba-inu-price-analysis-shib-bounces-up-but-whats-the-next-target-for-the-bulls/
"Elon Musk-Named Meme Token Dogelon Mars Gains 119% in Seven Days, Nears $1B Market Cap",Benzinga,2021-11-06,https://www.benzinga.com/markets/cryptocurrency/21/11/23937448/elon-musk-named-meme-token-dogelon-mars-gains-119-in-seven-days-nears-1b-market-cap
SHIBA INU Price Analysis: SHIB Coin Price Sees A Consolidation In Price Before The Rally,The Market Periodical,2021-11-06,https://themarketperiodical.com/2021/11/06/shiba-inu-price-analysis-shib-coin-price-sees-a-consolidation-in-price-before-the-rally/
"5 Altcoins With High Social Dominance This Weekend: SHIB, ETH, CAKE, DOGE, SAFEMOON",CryptoMode,2021-11-06,https://cryptomode.com/5-altcoins-with-high-social-dominance-this-weekend-shib-eth-cake-doge-safemoon/
"QChain Decentralized Cloud Storage Addresses Security of Data Systems, Here’s How",U.Today,2021-11-06,https://u.today/qchain-decentralized-cloud-storage-addresses-security-of-data-systems-heres-how
"Ethereum, Polkadot, Tron Price Analysis: 6 November",AMBCrypto,2021-11-06,https://ambcrypto.com/ethereum-polkadot-tron-price-analysis-6-november/
"For a chain swap, Tether mints 2 billion USDT – and a whole lot of FUD",AMBCrypto,2021-11-06,https://ambcrypto.com/for-a-chain-swap-tether-mints-2-billion-usdt-and-a-whole-lot-of-fud/
OMG Network price analysis: The OMG Token Price Could ...,The Market Periodical,2021-11-06,https://themarketperiodical.com/2021/11/06/omg-network-price-analysis-the-omg-token-price-could-plunge-to-the-15-6-mark/
"Tron outshines Ethereum, Cardano in these aspects; shows potential for further growth",AMBCrypto,2021-11-06,https://ambcrypto.com/tron-outshines-ethereum-cardano-in-these-aspects-shows-potential-for-further-growth/
"Binance Coin, Dogecoin, VeChain Price Analysis: 06 November",AMBCrypto,2021-11-06,https://ambcrypto.com/binance-coin-dogecoin-vechain-price-analysis-06-november/
Here's How RSI Can Predict Bitcoin Bull Run Peak: Analyst,U.Today,2021-11-06,https://u.today/heres-how-rsi-can-predict-bitcoin-bull-run-peak-analyst
Wormhole reveals first monthly stats and a new chain in its ecosystem,AMBCrypto,2021-11-06,https://ambcrypto.com/wormhole-reveals-first-monthly-stats-and-a-new-chain-in-its-ecosystem/
"Fantom displays ‘significantly strong’ fundamentals, may see 2x to 3x rise",AMBCrypto,2021-11-06,https://ambcrypto.com/does-fantom-have-real-potential-or-is-it-just-another-ethereum-killer/
"Assessing the chances of Uniswap, Sushiswap getting on board the bullish train",AMBCrypto,2021-11-06,https://ambcrypto.com/assessing-the-chances-of-uniswap-sushiswap-getting-on-board-the-bullish-train/
Medabots Takes the Blockchain Route - Medachain Is Coming ...,BeInCrypto,2021-11-06,https://beincrypto.com/medabots-embraces-blockchain-tech-medachain-is-coming-soon/
"At Least 8 Dead, 300 Injured at Travis Scott’s Astroworld Festival in Houston",Head Topics,2021-11-06,https://headtopics.com/us/at-least-8-dead-300-injured-at-travis-scott-s-astroworld-festival-in-houston-22419695
Milyonluk Aboneli Analist: Bu Altcoin Yakında 3x Yapacak!,Kriptokoin.com,2021-11-06,https://kriptokoin.com/analist-bu-altcoin-3x-yapacak/
