Title,Publisher,Date,Link
Crypto Exchange Kraken Set to List Shiba Inu Tomorrow ...,Bitcoin.com News,2021-11-01,https://news.bitcoin.com/crypto-exchange-kraken-list-shiba-inu-tomorrow-shib-investors-expect-price-to-pump/
Website leak sparks rumours that Tesla could accept Shiba Inu (SHIB) as payment,CryptoSlate,2021-11-01,https://cryptoslate.com/website-leak-indicates-tesla-is-about-to-accept-shiba-inu-shib-as-payment/
Explained: Why is Shiba Inu (SHIB) seen on Tesla’s website ...,Cryptopolitan,2021-11-01,https://www.cryptopolitan.com/why-is-shiba-inu-seen-on-tesla/
SHIB Jumps 16% After Binance Announces Listing,Decrypt,2021-11-01,https://decrypt.co/84953/shib-jumps-binance-listing-times-square-advertisement
Squid Game Is Memecoin Warning With Wipeout After 230000 ...,Bloomberg.com,2021-11-01,https://www.bloomberg.com/news/articles/2021-11-01/squid-game-is-memecoin-warning-with-100-dip-after-230-000-gain
Burger King serves up free crypto with meal purchases,Cointelegraph,2021-11-01,https://cointelegraph.com/news/burger-king-serves-up-free-doge-with-meal-purchases
"Shib, QUACK, Doge. Which one has the most watchlists on CoinMarketCap?",NewsBTC,2021-11-01,https://www.newsbtc.com/sponsored/shib-quack-doge-which-one-has-the-most-watchlists-on-coinmarketcap/
"Four DOGE On-Chain Indicators Show ""Bearish"" Signals",U.Today,2021-11-01,https://u.today/four-doge-on-chain-indicators-show-bearish-signals
Elon Musk Laughs at Edward Snowden's Tweet Series about SHIB and Dogecoin,U.Today,2021-11-01,https://u.today/elon-musk-laughs-at-edward-snowdens-tweet-series-about-shib-and-dogecoin
Bitcoin scam: How did a Coinbase user lose $11.6 million?,Deseret News,2021-11-01,https://www.deseret.com/2021/11/1/22757864/cryptocurrency-scam-coinbase-bit-coin
$3 Billion in ETH Burned Since EIP 1559 Activation,U.Today,2021-11-01,https://u.today/3-billion-in-eth-burned-since-eip-1559-activation
Aaron Rodgers and Cash App Are Giving Away $1 Million in Bitcoin,Decrypt,2021-11-01,https://decrypt.co/85023/aaron-rodgers-cash-app-giving-away-1-million-bitcoin
"With long-term prospects looking good, Cardano has not run out of steam just yet",AMBCrypto,2021-11-01,https://ambcrypto.com/with-long-term-prospects-looking-good-cardano-has-not-run-out-of-steam-just-yet/
Squid Game coin price crashes 99.99% - developers run ...,Cryptopolitan,2021-11-01,https://www.cryptopolitan.com/squid-game-coin-price-crashes/
AWS Seeks a Specialist to Develop Amazon's 'Digital ...,Bitcoin.com News,2021-11-01,https://news.bitcoin.com/aws-seeks-a-specialist-to-develop-amazons-digital-currency-and-blockchain-strategy-roadmap/
AAVE Price Analysis: AAVE Crypto Price Sees A Breakdown Below The Moving Average,The Market Periodical,2021-11-01,https://themarketperiodical.com/2021/11/01/aave-price-analysis-aave-crypto-price-sees-a-breakdown-below-the-moving-average/
What is Bitcoin Gold? • BTG Breakdown • Benzinga Crypto,Benzinga,2021-11-01,https://www.benzinga.com/money/what-is-bitcoin-gold
Squid Game Token Has Only One Winner: The Scammer Who Made $2 Million,Decrypt,2021-11-01,https://decrypt.co/84999/squid-game-token-winner-scammer-made-2-million
Binance Halts Crypto Withdrawals Citing “Large Backlog”,Crypto Briefing,2021-11-01,https://cryptobriefing.com/binance-halts-crypto-withdrawals-citing-large-backlog/
"Cryptocurrency investments in India cross $10 billion, show no signs of stopping",AMBCrypto,2021-11-01,https://ambcrypto.com/cryptocurrency-investments-in-india-cross-10-billion-show-no-signs-of-stopping/
"AXS, Theta, VeChain, HBAR, and XCAD Are Set To Rekindle A Grand Altseason!",Coinpedia,2021-11-01,https://coinpedia.org/altcoin/axs-theta-vechain-hbar-and-xcad-are-set-to-rekindle/
MANA Crypto: 16 Things to Know as Meta Mania Moves ...,InvestorPlace,2021-11-01,https://investorplace.com/2021/11/mana-crypto-16-things-to-know-as-meta-mania-moves-decentraland-higher/
"AnubisDAO, OlympusDAO's fork, rug pulls investors ...",Cryptopolitan,2021-11-01,https://www.cryptopolitan.com/anubisdao-rug-pulls-investors/
What is Crypto SuperStar?,GameRevolution,2021-11-01,https://www.gamerevolution.com/guides/696204-crypto-superstar-fake-legit-scam-review-testimonials
"Recovering from a sluggish pace, Solana has these milestones to watch out for",AMBCrypto,2021-11-01,https://ambcrypto.com/recovering-from-a-sluggish-pace-solana-has-these-milestones-to-watch-out-for/
IOTA Smart Contracts Enter Beta Phase To Circumvent Network Flaws,NewsBTC,2021-11-01,https://www.newsbtc.com/news/iota-introduces-smart-contracts-beta-stage/
Analysts bullish on Chainlink despite steep correction,FXStreet,2021-11-01,https://www.fxstreet.com/cryptocurrencies/news/analysts-are-bullish-on-chainlink-despite-heavy-correction-against-bitcoin-202111011326
"How To Buy Dogelon Mars, Another Hot DOGE Relative",Market Realist,2021-11-01,https://marketrealist.com/p/how-to-buy-dogelon-mars/
What is GPU Mining and How to Build a GPU Mining Rig,CoinGecko,2021-11-01,https://www.coingecko.com/learn/what-is-gpu-mining-how-to-build-gpu-mining-rig
"Mining Giants Set up Shop in Rockdale, Texas With More Set ...",BeInCrypto,2021-11-01,https://beincrypto.com/mining-giants-set-up-shop-in-rockdale-texas-with-more-set-to-follow/
