Title,Publisher,Date,Link
Dogecoin’s Co-Founder Speaks Out Against Online Abuse,Decrypt,2021-01-31,https://decrypt.co/56134/dogecoins-co-founder-speaks-out-against-abuse
Here’s why Bitcoin’s past week saw a lot of chaos,AMBCrypto,2021-01-31,https://ambcrypto.com/heres-why-bitcoins-past-week-saw-a-lot-of-chaos/
"Bitcoin miner outflows hit an ATH, what’s next",AMBCrypto,2021-01-31,https://ambcrypto.com/bitcoin-miner-outflows-hit-an-ath-whats-next/
"RBI Likely To Maintain Status Quo On Interest Rate, Say Experts",Outlook India,2021-01-31,https://www.outlookindia.com/website/story/business-news-rbi-likely-to-maintain-status-quo-on-interest-rate-say-experts/372796
"As Ethereum’s Vitalik Buterin Celebrates His Birthday, CZ Highlights How His Effort Birthed Binance",Herald Sheets,2021-01-31,https://heraldsheets.com/as-ethereums-vitalik-buterin-celebrates-his-birthday-cz-highlights-how-his-effort-birthed-binance/
