Title,Publisher,Date,Link
Chainlink issues latest grant after 2020 sees $7B+ in secured smart contract value,AMBCrypto,2021-01-04,https://ambcrypto.com/chainlink-issues-latest-grant-after-2020-sees-7b-in-secured-smart-contract-value/
Tezos Price Analysis: 04 January,AMBCrypto,2021-01-04,https://ambcrypto.com/tezos-price-analysis-04-january/
Stocks Stumble as Early Gains Turn to Losses to Start 2021,Investopedia,2021-01-04,https://www.investopedia.com/stocks-stumble-as-early-gains-turn-to-losses-to-start-2021-5094280
"Actress Tanya Roberts dies aged 65, Report",The Intelligencer,2021-01-04,https://www.lintelligencer.com/actress-tanya-roberts-dies-aged-65-report-10670-2021/
Coronavirus Canada Updates: Number of COVID-19 patients ...,The Intelligencer,2021-01-04,https://www.lintelligencer.com/coronavirus-canada-updates-number-of-covid-19-patients-in-icu-doubles-as-cases-surge-in-ottawa-2-10679-2021/
