Title,Publisher,Date,Link
Is ShibaSwap safe? DeFi Safety review gives it a score of just 3%,Cointelegraph,2021-07-08,https://cointelegraph.com/news/is-shibaswap-safe-defi-safety-review-gives-it-a-score-of-just-3
Bone Crypto News: Stop Digging and Check Out a New ...,InvestorPlace,2021-07-08,https://investorplace.com/2021/07/bone-crypto-news-stop-digging-and-check-out-a-new-exchange-listing-for-bone/
XRP and Bitcoin – Assessing the opportunities,AMBCrypto,2021-07-08,https://ambcrypto.com/xrp-and-bitcoin-assessing-the-opportunities/
Here’s what Ethereum’s price will look like after ‘The Merge’,AMBCrypto,2021-07-08,https://ambcrypto.com/heres-what-ethereums-price-will-look-like-after-the-merge/
These two altcoins may decouple from Bitcoin and target new highs,FXStreet,2021-07-08,https://www.fxstreet.com/cryptocurrencies/news/these-two-altcoins-may-decouple-from-bitcoin-and-target-new-highs-202107081719
Exclusive Elrond (EGLD) Price Breaks Out Above Long Term ...,BeInCrypto,2021-07-08,https://beincrypto.com/elrond-egld-price-breaks-out-over-long-term-resistance/
BTC On-Chain Analysis: Exchange Balances Dry Up as ...,BeInCrypto,2021-07-08,https://beincrypto.com/btc-on-chain-analysis-exchange-balances-dry-up/
FinuTrade Review – All That You Need to Know about This Broker,Herald Sheets,2021-07-08,https://heraldsheets.com/finutrade/
