Title,Publisher,Date,Link
Shiba Inu Faces Spike in Purchases After Reaching Fundamental Support,U.Today,2022-05-19,https://u.today/shiba-inu-faces-spike-in-purchases-after-reaching-fundamental-support
Shiba Inu Extinction: Finder Panel Predicts SHIB To Have Zero Value By 2030 | Bitcoinist.com,Bitcoinist,2022-05-19,https://bitcoinist.com/shiba-inu-seen-by-experts-to-go-extinct/
Shiba Inu (SHIB) and Ethereum Classic (ETC) Are Falling as Chronoly Gets Off to a Perfect Start,Coinspeaker,2022-05-19,https://www.coinspeaker.com/shiba-inu-ethereum-classic-falling-chronoly-perfect-start/
Is Shiba Inu Burn a Big Fail? No Impact on SHIB Price,Coinpedia - Fintech & Cryptocurreny News Media| Crypto Guide,2022-05-19,https://coinpedia.org/web-stories/is-shiba-inu-burn-a-big-fail/
"BTC, ETH, DOGE and SHIB Price Analysis for May 19",U.Today,2022-05-19,https://u.today/btc-eth-doge-and-shib-price-analysis-for-may-19
The 7 Best Meme Coins to Buy for the Second Half of 2022,InvestorPlace,2022-05-19,https://investorplace.com/2022/05/the-7-best-meme-coins-to-buy-for-the-second-half-of-2022/
"Sneakmart, StockX Unveil First Joint Tokenized Sneaker Collection, Metakicks",U.Today,2022-05-19,https://u.today/sneakmart-stockx-unveil-first-joint-tokenized-sneaker-collection-metakicks
Ethereum Dominance Falls to 55% While Being at 84% in March: CoinMarketCap,U.Today,2022-05-19,https://u.today/ethereum-dominance-falls-to-55-while-being-at-84-in-march-coinmarketcap
"Gnox (GNOX) Pre-Sale Kicked Off on May 12 while SOL, AVAX in Uncertainty",U.Today,2022-05-19,https://u.today/gnox-gnox-pre-sale-kicked-off-on-may12-while-sol-avax-in-uncertainty
Aussie Dollar Holds Up after a Positive Jobs Data,CryptoNewsZ,2022-05-19,https://www.cryptonewsz.com/aussie-dollar-holds-up-after-a-positive-jobs-data/
Is ApeCoin [APE] finally tired of swinging? Here’s what the metrics say about stability,AMBCrypto,2022-05-19,https://ambcrypto.com/is-apecoin-ape-finally-tired-of-swinging-heres-what-the-metrics-say-about-stability/
Here's Why Coinbase's Web3 Browser Is Important for DeFi: Head of Engineering,U.Today,2022-05-19,https://u.today/heres-why-coinbases-web3-browser-is-important-for-defi-head-of-engineering
Analyst Outlines What’s In Store For Ethereum and Solana As Crypto Markets Resurge,Times Tabloid,2022-05-19,https://timestabloid.com/analyst-outlines-whats-in-store-for-ethereum-and-solana-as-crypto-markets-resurge/
Poloniex ventures into the Indian market to propel the nation’s crypto ecosystem,AMBCrypto,2022-05-19,https://ambcrypto.com/poloniex-ventures-into-the-indian-market-to-propel-the-nations-crypto-ecosystem/
Dolce & Gabbana Announces Collaboration with Chainlink,U.Today,2022-05-19,https://u.today/dolce-gabbana-announces-collaboration-with-chainlink
"Chiliz: CHZ jumps 18% on the Bitpanda listing news, but here’s the caveat",AMBCrypto,2022-05-19,https://ambcrypto.com/chiliz-chz-jumps-18-on-the-bitpanda-listing-news-but-heres-the-caveat/
"In 2021, Ozone Layer Hole Gets Bigger, Climate Change Reaches New Extremes: WMO Report",Outlook India,2022-05-19,https://www.outlookindia.com/business/in-2021-ozone-layer-hole-gets-bigger-climate-change-reaches-new-extremes-wmo-report-news-197456
Business News: TAG Heuer Is Now Accepting Cryptocurrency ...,HODINKEE,2022-05-19,https://www.hodinkee.com/articles/tag-heuer-is-now-accepting-cryptocurrency-for-us-online-purchases
Cardano [ADA] investors should know that the whales have been actively…,AMBCrypto,2022-05-19,https://ambcrypto.com/cardano-ada-investors-should-know-that-the-whales-have-been-actively/
Delphi Digital Loses Its Entire LUNA Investment,U.Today,2022-05-19,https://u.today/delphi-digital-loses-its-entire-luna-investment
Here's Why Bitcoin Looks Ready to Plunge Further: Bloomberg,U.Today,2022-05-19,https://u.today/heres-why-bitcoin-looks-ready-to-plunge-further-bloomberg
"Ethereum Testnet, Ropsten to Experience Merge in Early June",U.Today,2022-05-19,https://u.today/ethereum-testnet-ropsten-to-experience-merge-in-early-june
Crypto Investment Now Offered to Rich Clients by One of Oldest Swiss Banking Corporations,U.Today,2022-05-19,https://u.today/crypto-investment-now-offered-to-rich-clients-by-one-of-oldest-swiss-banking-corporations
Crypto.com Pay Joins Shopify and Will Offer Multiple Benefits,NameCoinNews,2022-05-19,https://www.namecoinnews.com/crypto-com-pay-joins-shopify-and-will-offer-multiple-benefits/
Cryptocurrency Gold (PAXG) Becomes One of Most Profitable Assets on Market During Correction,U.Today,2022-05-19,https://u.today/cryptocurrency-gold-paxg-becomes-one-of-most-profitable-assets-on-market-during-correction
