Title,Publisher,Date,Link
"NFTs: Why Dogecoin (DOGE), Shiba Inu (SHIB), and Logarithmic Finance (LOG) Should Be On Your List To Invest",CryptoMode,2022-06-04,https://cryptomode.com/nfts-why-dogecoin-doge-shiba-inu-shib-and-logarithmic-finance-log-should-be-on-your-list-to-invest/
Better Buy: Shiba Inu vs. Terra Classic vs. Terra (LUNA)?,The Motley Fool,2022-06-04,https://www.fool.com/investing/2022/06/04/better-buy-shiba-inu-vs-terra-classic-terra-luna/
Is Shiba Inu dead?,Cryptopolitan,2022-06-04,https://www.cryptopolitan.com/is-shiba-inu-dead/
Make Your Crypto Work For You With Logarithmic Finance ...,NewsBTC,2022-06-04,https://www.newsbtc.com/press-releases/make-your-crypto-work-for-you-with-logarithmic-finance-log-shiba-inu-shib-and-avalanche-avax/
DOGE and SHIB Price Analysis for June 4,U.Today,2022-06-04,https://u.today/doge-and-shib-price-analysis-for-june-4
"Charles Hoskinson Trolls Critics, Saying ADA Transactions Have Dramatically Risen Due to “SpookyAlpha”",U.Today,2022-06-04,https://u.today/charles-hoskinson-trolls-critics-saying-ada-transactions-have-dramatically-risen-due-to-spookyalpha
The Graph price analysis: GRT rallies to $0.167 as bulls gain ...,Cryptopolitan,2022-06-04,https://www.cryptopolitan.com/the-graph-price-analysis-2022-06-04/
Bloomberg Senior Strategist: Bitcoin (BTC) Will Be One of the Best Assets on Earth Once Inflation Subsides,Times Tabloid,2022-06-04,https://timestabloid.com/bloomberg-senior-strategist-bitcoin-btc-will-be-one-of-the-best-assets-on-earth-once-inflation-subsides/
LUNA Can Now Be Sent From Terra 2.0 to Ethereum via a Newly Launched Terra Bridge V2,Times Tabloid,2022-06-04,https://timestabloid.com/luna-can-now-be-sent-from-terra-2-0-to-ethereum-via-a-newly-launched-terra-bridge-v2/
"This Week in Coins: Markets Flatten, Kanye Files Web3 Trademarks, Eurovision Winners Donate Ethereum to Ukraine",Decrypt,2022-06-04,https://decrypt.co/102033/this-week-in-coins-markets-flatten-kanye-files-web3-trademarks-eurovision-winners-sell-trophy-to-benefit-ukraine
Buterin Explains How to Create Algorithmic Stablecoins That Don’t Become Ponzis or Collapse,Times Tabloid,2022-06-04,https://timestabloid.com/buterin-explains-how-to-create-algorithmic-stablecoins-that-dont-become-ponzis-or-collapse/
Cryptocurrencies you should consider for a secure financial ...,The Crypto Update,2022-06-04,https://www.thecryptoupdates.com/cryptocurrencies-you-should-consider-for-a-secure-financial-future-firepin-frpn-shiba-inu-shib-and-zcash-zec/
"Cardano [ADA] may have a 28% rally in store, only if…",AMBCrypto,2022-06-04,https://ambcrypto.com/cardano-ada-may-have-a-28-rally-in-store-only-if/
Bank of Uganda finally accepts crypto in its regulatory sandbox,Cryptopolitan,2022-06-04,https://www.cryptopolitan.com/bank-of-uganda-opens-its-sandbox-to-crypto/
Binance Labs Head Bill Qian Steps Down from His Role,U.Today,2022-06-04,https://u.today/binance-labs-head-bill-qian-steps-down-from-his-role
"Bitcoin Mining Might Be Banned in New York, Here's Why",U.Today,2022-06-04,https://u.today/bitcoin-mining-might-be-banned-in-new-york-heres-why
