Title,Publisher,Date,Link
"Nobody Cares About Shiba Inu (SHIB) Anymore, And There’s a Reason For It (Opinion)",CryptoPotato,2022-07-15,https://cryptopotato.com/nobody-cares-about-shiba-inu-shib-anymore-and-theres-a-reason-for-it-opinion/
"Shiba Inu Finally Listed by Top US Exchange, Bittrex",U.Today,2022-07-15,https://u.today/shiba-inu-finally-listed-by-top-us-exchange-bittrex
Shiba Inu Price Predictions: Can RadioShack Take the SHIB ...,InvestorPlace,2022-07-15,https://investorplace.com/2022/07/shiba-inu-price-predictions-can-radioshack-take-the-shib-crypto-higher/
The Meme Coins Saga: Can Mehracki (MKI) Reach Dogecoin (DOGE) and Shiba Inu (SHIB)? | Bitcoinist.com,Bitcoinist,2022-07-15,https://bitcoinist.com/the-meme-coins-saga-can-mehracki-mki-reach-dogecoin-doge-and-shiba-inu-shib/
"SHIB, DOGE and BabyDoge: How Do Community Favorites Perform?",U.Today,2022-07-15,https://u.today/shib-doge-and-babydoge-how-do-community-favorites-perform
"ADA, DOGE and SHIB Can Now Be Sent and Swapped at More Than 6,000 ATMs Through This Feature",U.Today,2022-07-15,https://u.today/ada-doge-and-shib-can-now-be-sent-and-swapped-at-more-than-6000-atms-through-this-feature
Finder's Fintech Experts Predict Cardano Will End the Year at ...,Bitcoin.com News,2022-07-15,https://news.bitcoin.com/finders-fintech-experts-predict-cardano-will-end-the-year-at-0-63-per-unit/
"BTC, ETH, XRP and SOL Price Analysis for July 15",U.Today,2022-07-15,https://u.today/btc-eth-xrp-and-sol-price-analysis-for-july-15
Congressional Investigation Finds Bitcoin Companies Consume as Much Energy as Houston,U.Today,2022-07-15,https://u.today/congressional-investigation-finds-bitcoin-companies-consume-as-much-energy-as-houston
"Ethereum Merge Date Released, Here's When",U.Today,2022-07-15,https://u.today/ethereum-merge-date-released-heres-when
"From BitPay To Remuno, Which Crypto Payment Processor Is Best For Your Small Business? | Bitcoinist.com",Bitcoinist,2022-07-15,https://bitcoinist.com/from-bitpay-to-remuno-which-crypto-payment-processor-is-best-for-your-small-business/
"5ire raises USD 100 million in Series A Funding at valuation USD 1.5 billion, turns unicorn | Bitcoinist.com",Bitcoinist,2022-07-15,https://bitcoinist.com/5ire-raises-usd-100-million-in-series-a-funding-at-valuation-usd-1-5-billion-turns-unicorn/
Shiba Inu price rallies despite its vulnerability,FXStreet,2022-07-15,https://www.fxstreet.com/cryptocurrencies/news/shiba-inu-price-rallies-despite-its-vulnerability-202207151327
"76% of Global Financial Institutions Will Use Crypto in 2025, Ripple Forecasts",Times Tabloid,2022-07-15,https://timestabloid.com/76-of-global-financial-institutions-will-use-crypto-in-2025-ripple-forecasts/
Bitcoin Might Reach Price Bottom Once These Three Factors Align: Details,U.Today,2022-07-15,https://u.today/bitcoin-might-reach-price-bottom-once-these-three-factors-align-details
"New York Yankees Players, Staff Now Able to Convert Salary Into Bitcoin",Decrypt,2022-07-15,https://decrypt.co/105166/new-york-yankees-players-staff-able-convert-salary-bitcoin
Uniswap (UNI) Jumps More Than 15% on News of Robinhood Listing,Coinspeaker,2022-07-15,https://www.coinspeaker.com/uniswap-uni-jumps-robinhood-listing/
"Gorilix’s SILVA Pre-Sale Gains Traction in Q3, 2022, as SOL, RAY Outperform the Market",U.Today,2022-07-15,https://u.today/gorilixs-silva-pre-sale-gains-traction-in-q3-2022-as-sol-ray-outperform-the-market
The Judge Handling Ripple-SEC Lawsuit Pinpoints Hypocrisy in SEC’s Arguments,Times Tabloid,2022-07-15,https://timestabloid.com/the-judge-handling-ripple-sec-lawsuit-pinpoints-hypocrisy-in-secs-arguments/
US: Atlanta Fed GDPNow for Q2 declines to -1.5%,FXStreet,2022-07-15,https://www.fxstreet.com/news/us-atlanta-fed-gdpnow-for-q2-declines-to-15-202207151629
"USD/CHF Price Analysis: Retraces from weekly highs, targeting the 50-DMA",FXStreet,2022-07-15,https://www.fxstreet.com/news/usd-chf-price-analysis-retraces-from-weekly-highs-targeting-the-50-dma-202207151810
Draghi drama is a problem for the ECB hawks [Video],FXStreet,2022-07-15,https://www.fxstreet.com/analysis/draghi-drama-is-a-problem-for-the-ecb-hawks-video-202207150828
AUD/USD hit four-day highs above 0.6800 as US dollar retreats,FXStreet,2022-07-15,https://www.fxstreet.com/news/aud-usd-hit-four-day-highs-above-06800-as-us-dollar-retreats-202207151535
Australia: Labour market remains tight – UOB,FXStreet,2022-07-15,https://www.fxstreet.com/news/australia-labour-market-remains-tight-uob-202207151113
"Canoo Stock Price and Forecast: Attention, Army and Walmart like GOEV",FXStreet,2022-07-15,https://www.fxstreet.com/news/canoo-stock-price-and-forecast-attention-army-and-walmart-like-goev-202207151230
"DeFi coins outperform Bitcoin, Ether as traders pare bets on jumbo Fed rate hike",FXStreet,2022-07-15,https://www.fxstreet.com/cryptocurrencies/news/defi-coins-outperform-bitcoin-ether-as-traders-pare-bets-on-jumbo-fed-rate-hike-202207151046
AMC stock still looks bullish on short-term chart as CEO touts Hycroft gold mine,FXStreet,2022-07-15,https://www.fxstreet.com/news/amc-stock-still-looks-bullish-on-short-term-chart-as-ceo-touts-hycroft-gold-mine-202207151204
Gold Weekly Forecast: Upward correction could be in the books during Fed's blackout,FXStreet,2022-07-15,https://www.fxstreet.com/analysis/gold-weekly-forecast-upward-correction-could-be-in-the-books-during-feds-blackout-202207151531
Reasons why Uniswap earned a spot among weekly best performers,AMBCrypto,2022-07-15,https://ambcrypto.com/reasons-why-uniswap-earned-a-spot-among-weekly-best-performers/
Cred Protocol unveils its first decentralized credit scores,FXStreet,2022-07-15,https://www.fxstreet.com/cryptocurrencies/news/cred-protocol-unveils-its-first-decentralized-credit-scores-202207150854
USD/JPY Price Analysis: Buyers loose steam and pullback from 24-year high,FXStreet,2022-07-15,https://www.fxstreet.com/news/usd-jpy-price-analysis-buyers-loose-steam-and-pullback-from-24-year-high-202207152134
NIO Stock News: Nio Inc dips as investors await potential Shanghai COVID lockdown,FXStreet,2022-07-15,https://www.fxstreet.com/news/nio-stock-news-nio-inc-dips-as-investors-await-potential-shanghai-covid-lockdown-202207151104
SAP: Software corporation SAP offers an opportunity,FXStreet,2022-07-15,https://www.fxstreet.com/news/sap-software-corporation-sap-offers-an-opportunity-202207151122
"GBP/USD surrenders intraday gains, holds above 1.1800 as traders await US macro data",FXStreet,2022-07-15,https://www.fxstreet.com/news/gbp-usd-surrenders-intraday-gains-holds-above-11800-as-traders-await-us-macro-data-202207150659
USD/JPY: Focus now shifts to 140.00 – UOB,FXStreet,2022-07-15,https://www.fxstreet.com/news/usd-jpy-focus-now-shifts-to-14000-uob-202207150707
"AUD/USD remains on the defensive, around mid-0.6700s ahead of US economic data",FXStreet,2022-07-15,https://www.fxstreet.com/news/aud-usd-remains-on-the-defensive-around-mid-06700s-ahead-of-us-economic-data-202207150914
Euro eyes US Retail Sales,FXStreet,2022-07-15,https://www.fxstreet.com/analysis/euro-eyes-us-retail-sales-202207151117
ECB to deliver modest rate hike,FXStreet,2022-07-15,https://www.fxstreet.com/analysis/ecb-to-deliver-modest-rate-hike-202207151326
ECB's Rehn: ECB likely to raise key rate by 25 bps next week,FXStreet,2022-07-15,https://www.fxstreet.com/news/ecbs-rehn-ecb-likely-to-raise-key-rate-by-25-bps-next-week-202207151027
Philippines: Inflation urged the BSP to hike rates by 75 bps – UOB,FXStreet,2022-07-15,https://www.fxstreet.com/news/philippines-inflation-urged-the-bsp-to-hike-rates-by-75-bps-uob-202207151221
USD/CNH now looks to a test of 6.8000 – UOB,FXStreet,2022-07-15,https://www.fxstreet.com/news/usd-cnh-now-looks-to-a-test-of-68000-uob-202207150743
US Dollar Index: Bears step in and revisit 108.50,FXStreet,2022-07-15,https://www.fxstreet.com/news/us-dollar-index-bears-step-in-and-revisit-10850-202207150739
With inflation now at 9.1% it is expected that the Fed will raise rates,FXStreet,2022-07-15,https://www.fxstreet.com/analysis/with-inflation-now-at-91-it-is-expected-that-the-fed-will-raise-rates-202207151358
Pound Sterling Price News and Forecast: GBP/USD sticks to modest gains below mid-1.1800s,FXStreet,2022-07-15,https://www.fxstreet.com/news/pound-sterling-price-news-and-forecast-gbp-usd-sticks-to-modest-gains-below-mid-11800s-202207151320
AUD/USD is floating above the 6712 support level after hitting a new yearly low yesterday,FXStreet,2022-07-15,https://www.fxstreet.com/analysis/aud-usd-is-floating-above-the-6712-support-level-after-hitting-a-new-yearly-low-yesterday-202207151100
USD/SEK showing reaction from intraday buying zone,FXStreet,2022-07-15,https://www.fxstreet.com/analysis/usd-sek-showing-reaction-from-intraday-buying-zone-202207151122
USD/CLP: Chilean peso may be oversold at current levels – Wells Fargo,FXStreet,2022-07-15,https://www.fxstreet.com/news/usd-clp-chilean-peso-may-be-oversold-at-current-levels-wells-fargo-202207151607
BBIG Stock Forecast: Vinco Ventures sinks after company announces new Co-CEO appointment,FXStreet,2022-07-15,https://www.fxstreet.com/news/bbig-stock-forecast-vinco-ventures-sinks-after-company-announces-new-co-ceo-appointment-202207151101
Ripple to Explore New NFT Use Cases as It Backs NFT Lending Start-up,U.Today,2022-07-15,https://u.today/ripple-to-explore-new-nft-use-cases-as-it-backs-nft-lending-start-up
Here Is How Much 7 Commonly Prescribed Drugs Cost ...,The Motley Fool,2022-07-15,https://www.fool.com/the-ascent/personal-finance/articles/here-is-how-much-7-commonly-prescribed-drugs-cost-through-mark-cubans-online-pharmacy/
CSE New Lithium Stock - Nova Lithium Corp. (CSE: NVLI),Investorideas.com,2022-07-15,https://www.investorideas.com/news/2022/mining/07158NewList-CSE-NVLI.asp
Crypto Exchange Huobi’s Subsidiary HBIT Receives MSB License From US FinCEN,Herald Sheets,2022-07-15,https://heraldsheets.com/crypto-exchange-huobis-subsidiary-hbit-receives-msb-license-from-us-fincen/
Utility Tokens vs. Security Tokens: A Detailed Guide,Herald Sheets,2022-07-15,https://heraldsheets.com/utility-tokens-vs-security-tokens-a-detailed-guide/
