Title,Publisher,Date,Link
New Shiba Inu (SHIB) Pair to Be Listed by Pantera Capital-Backed Crypto Exchange,U.Today,2022-08-12,https://u.today/new-shiba-inu-shib-pair-to-be-listed-by-pantera-capital-backed-crypto-exchange
Shiba Inu accumulation at this price level could be beneficial,AMBCrypto,2022-08-12,https://ambcrypto.com/shiba-inu-accumulation-at-this-price-level-could-be-beneficial/
Revolutux And Shiba Inu Are Two Low-Price Altcoins To Invest In Over The Crypto Winter | Bitcoinist.com,Bitcoinist,2022-08-12,https://bitcoinist.com/revolutux-and-shiba-inu-are-two-low-price-altcoins-to-invest-in-over-the-crypto-winter/
GNOX (GNOX) Shows Similarities To Shiba Inu (SHIB) And EverRise (RISE) After ICO Sells Out | Bitcoinist.com,Bitcoinist,2022-08-12,https://bitcoinist.com/gnox-gnox-shows-similarities-to-shiba-inu-shib-and-everrise-rise-after-ico-sells-out/
"SHIB Dev Replies to User Who Wants Coin to “Go Up,” Cardano Critic Mark Cuban Sued, BabyDoge May Rise 60%: Crypto News Digest by U.Today",U.Today,2022-08-12,https://u.today/shib-dev-replies-to-user-who-wants-coin-to-go-up-cardano-critic-mark-cuban-sued-babydoge-may-rise
"Shiba Inu (SHIB), Moderate Volatility and Falling Friday: Is it Time to Cash Out?",InvestorsObserver,2022-08-12,https://www.investorsobserver.com/news/crypto-update/shiba-inu-shib-moderate-volatility-and-falling-friday-is-it-time-to-cash-out-3
"Win With The Bear Market: Pugglit Inu, Shiba Inu, and Floki Inu",Coinpedia,2022-08-12,https://coinpedia.org/press-release/win-with-the-bear-market-pugglit-inu-shiba-inu-and-floki-inu/
"bitcoinblack credit card to add more funding options including XRP, DOT, ADA, SOL, DOGE AND SHIB",EIN News,2022-08-12,https://www.einnews.com/pr_news/585679702/bitcoinblack-credit-card-to-add-more-funding-options-including-xrp-dot-ada-sol-doge-and-shib
"SHIB Worth $150 Million Settled in 1,000 Biggest ETH Whales' Pockets",U.Today,2022-08-12,https://u.today/shib-worth-150-million-settled-in-1000-biggest-eth-whales-pockets
NOWNodes Adds Support for Shiba Inu Burn Portal Reward ...,The Crypto Basic,2022-08-12,https://thecryptobasic.com/2022/08/13/nownodes-adds-support-for-shiba-inu-burn-portal-reward-token-ryoshi-vision-ryoshi/
"Introducing Pugglit Inu (PUGT), an Upcoming Meme Coin on BNB Chain (BSC)",U.Today,2022-08-12,https://u.today/introducing-pugglit-inu-pugt-an-upcoming-meme-coin-on-bnb-chain-bsc
"Cryptocurrency Prices: ETH Gets A Date For Merger With Beacon Chain, BTC Falls 2.93%",Outlook India,2022-08-12,https://www.outlookindia.com/business/cryptocurrency-prices-eth-gets-a-date-for-merger-with-beacon-chain-btc-falls-2-93--news-215983
Ethereum Validator Nodes Set To be Installed in the Capital City of Argentina in 2023,Times Tabloid,2022-08-12,https://timestabloid.com/ethereum-validator-nodes-set-to-be-installed-in-the-capital-city-of-argentina-in-2023/
Beyond Memes: Animal-Themed Projects Making Bold Moves,BSC News,2022-08-12,https://www.bsc.news/post/beyond-memes-animal-themed-projects-making-bold-moves
Japanese Bank to Offer Customers $XRP or $BTC Rewards in ...,Cryptoglobe,2022-08-12,https://www.cryptoglobe.com/latest/2022/08/japanese-bank-to-offer-customers-xrp-or-btc-rewards-in-new-campaign/
"Shiba Inu (SHIB), BNB (BNB) And Adirize Dao (ADI) - 3 Cryptocurrencies You Should Buy In 2022! - Analytics Insight",Inferse.com,2022-08-12,https://www.inferse.com/182296/shiba-inu-shib-bnb-bnb-and-adirize-dao-adi-3-cryptocurrencies-you-should-buy-in-2022-analytics-insight/
"Uniglo (GLO), Dogecoin (DOGE) And Shiba Inu (SHIB) Might Be The Most-Favored Tokens For New Investors By DailyCoin - Investing.com",Inferse.com,2022-08-12,https://www.inferse.com/181684/uniglo-glo-dogecoin-doge-and-shiba-inu-shib-might-be-the-most-favored-tokens-for-new-investors-by-dailycoin-investing-com/
Can Shiba Inu Reach $1 by 2025? - The Motley Fool,Inferse.com,2022-08-12,https://www.inferse.com/181798/can-shiba-inu-reach-1-by-2025-the-motley-fool/
Over 5.3 Billion SHIB Burned via This Platform Since July; Here Is Impact on Price - U.Today,Inferse.com,2022-08-12,https://www.inferse.com/181538/over-5-3-billion-shib-burned-via-this-platform-since-july-here-is-impact-on-price-u-today/
Dogecoin Price Prediction: DOGE Breakout is Foiled By The 200-DMA - InvestingCube,Inferse.com,2022-08-12,https://www.inferse.com/181858/dogecoin-price-prediction-doge-breakout-is-foiled-by-the-200-dma-investingcube/
Robinhood Web3 Crypto Wallet Waitlist Surpasses 1 Million Customers - U.Today,Inferse.com,2022-08-12,https://www.inferse.com/181996/robinhood-web3-crypto-wallet-waitlist-surpasses-1-million-customers-u-today/
"Ethereum Price Broke Past $1,800 Despite Higher Demand At Lower Levels",RecentlyHeard,2022-08-12,https://recentlyheard.com/2022/08/13/ethereum-price-broke-past-1800-despite-higher-demand-at-lower-levels/
The Best WallStreetBets Crypto in 2022,LA Weekly,2022-08-12,https://www.laweekly.com/the-best-wallstreetbets-crypto-in-2022/
