Title,Publisher,Date,Link
"Bigger Entertainment CEO to burn 10% of Shiba Inu supply, inadvertently pushing SHIB closer to break out",FXStreet,2022-03-03,https://www.fxstreet.com/cryptocurrencies/news/bigger-entertainment-ceo-to-burn-10-of-shiba-inu-supply-inadvertently-pushing-shib-closer-to-break-out-202203030934
Will Shiba Inu Skyrocket With This Big Upcoming Catalyst?,The Motley Fool,2022-03-03,https://www.fool.com/investing/2022/03/03/will-shiba-inu-skyrocket-with-upcoming-catalyst/
Dogecoin Competitor Shiba Inu and Ethereum Rival Cardano Witness Massive Whale Transfers in 24-Hour Period,The Daily Hodl,2022-03-03,https://dailyhodl.com/2022/03/03/dogecoin-competitor-shiba-inu-and-ethereum-rival-cardano-witness-massive-whale-transfers-in-24-hour-period/
Upgrade Your PrimeXBT Trading Portfolio With These New ...,BeInCrypto,2022-03-03,https://beincrypto.com/upgrade-your-primexbt-trading-portfolio-with-these-new-crypto-pairs/
Cardano Sees 6x More Transaction Volumes Than Ethereum at $42.1 Billion Topping in On-Chain Activity,U.Today,2022-03-03,https://u.today/cardano-sees-6x-more-transaction-volumes-than-ethereum-at-421-billion-topping-in-on-chain-activity
Why I ignored Warren Buffett's advice and invested in cryptocurrencies,The National,2022-03-03,https://www.thenationalnews.com/business/money/2022/03/04/why-i-ignored-warren-buffetts-advice-and-invested-in-cryptocurrencies/
How these feeding patterns of Bitcoin whales can help retail traders,AMBCrypto,2022-03-03,https://ambcrypto.com/how-these-feeding-patterns-of-bitcoin-whales-can-help-retail-traders/
5 Top Undervalued Cryptos to Buy Right Now,InvestorPlace,2022-03-03,https://investorplace.com/2022/03/5-top-undervalued-cryptos-to-buy-right-now/
"How Big Is the Metaverse Becoming? With MANA, SAND, & FIREPIN Token!",CryptoNewsZ,2022-03-03,https://www.cryptonewsz.com/how-big-is-the-metaverse-becoming-with-mana-sand-and-firepin-token/
"Bitcoin and Tether Become ""De Facto"" Legal Tender in Swiss Town",U.Today,2022-03-03,https://u.today/bitcoin-and-tether-become-de-facto-legal-tender-in-swiss-town
"Invest in Crypto to save more money – Bitcoin (BTC), Ethereum (ETH) & Seesaw Protocol (SSW)",Vanguard News,2022-03-03,https://www.vanguardngr.com/2022/03/invest-in-crypto-to-save-more-money-bitcoin-btc-ethereum-eth-seesaw-protocol-ssw/
"3 Crypto Not to Miss This Week: FIL (+10%), EGC (+13 ...",BeInCrypto,2022-03-03,https://beincrypto.com/3-crypto-not-to-miss-this-week-seesaw-protocol-ssw-fil-and-egc/
"BTC, ADA, BNB, AVAX and LUNA Price Analysis for March 3",U.Today,2022-03-03,https://u.today/btc-ada-bnb-avax-and-luna-price-analysis-for-march-3
Randi Zuckerberg Sings Twisted Sister: Crypto Warcry Or Viral Cringe?,Benzinga,2022-03-03,https://www.benzinga.com/markets/cryptocurrency/22/03/25969557/randi-zuckerberg-sings-twisted-sister-crypto-warcry-or-viral-cringe
186 Million XRP Shifted by Major Exchanges as Coin Shows 20% Weekly Rise,U.Today,2022-03-03,https://u.today/186-million-xrp-shifted-by-major-exchanges-as-coin-shows-20-weekly-rise
"Moody's Cuts Russia's Credit, Wheat Prices Soar, Powell ...",Investopedia,2022-03-03,https://www.investopedia.com/russia-credit-cut-to-junk-on-sanctions-5221006
"Ted Cruz: Texas Should Be ""Ground Zero"" for Crypto Industry",U.Today,2022-03-03,https://u.today/ted-cruz-texas-should-be-ground-zero-for-crypto-industry
Cryptocurrency Prices On March 3 2022: Know The Rate Of ...,ABP LIVE,2022-03-03,https://news.abplive.com/business/cryptocurrency-prices-on-march-3-2022-know-the-rate-of-bitcoin-ethereum-litecoin-ripple-dogecoin-and-other-cryptocurrencies-1516775
"Bitcoin whales are back, wanting to push BTC price higher",FXStreet,2022-03-03,https://www.fxstreet.com/cryptocurrencies/news/bitcoin-whales-are-back-wanting-to-push-btc-price-higher-202203031539
Opinion: Effects of the battle for Ukraine on the global economy,Finbold,2022-03-03,https://finbold.com/opinion-effects-of-the-battle-for-ukraine-on-the-global-economy/
"Defense stocks gain renewed focus on Russia-Ukraine conflict: Stock forecast on GD, LTM, RTX, NOC, BAESY",FXStreet,2022-03-03,https://www.fxstreet.com/news/defense-stocks-gain-renewed-focus-following-russia-ukraine-conflict-gd-ltm-rtx-noc-baesy-202203031330
Polygon (MATIC) Creates Long-Term Bullish Pattern After ...,BeInCrypto,2022-03-03,https://beincrypto.com/polygon-matic-creates-long-term-bullish-pattern-after-recent-low-of-1-24/
The first-ever crypto polo cup hosted by Luna PR,AMBCrypto,2022-03-03,https://ambcrypto.com/the-first-ever-crypto-polo-cup-hosted-by-luna-pr/
Terra Sees Total Value Staked Top $30 Billion as $LUNA ...,Cryptoglobe,2022-03-03,https://www.cryptoglobe.com/latest/2022/03/terra-sees-total-value-staked-top-30-billion-as-luna-approaches-all-time-high/
