Title,Publisher,Date,Link
Why Amazon’s Ethereum Support Funnels Through Northern Virginia,Forbes,2021-03-03,https://translate.google.com/website?sl=auto&tl=en&hl=en&client=webapp&u=https://www.forbes.com/sites/ninabambysheva/2021/03/03/why-amazons-ethereum-support-funnels-through-north-virginia/
"Enjin to Tackle Soaring Gas Fees, Scaling With New Blockchain Products",CoinDesk,2021-03-03,https://translate.google.com/website?sl=auto&tl=en&hl=en&client=webapp&u=https://www.coindesk.com/markets/2021/03/03/enjin-to-tackle-soaring-gas-fees-scaling-with-new-blockchain-products/
Evolve Fund Files for Ethereum ETF after Bitcoin Approval in Canada,Bitcoinist,2021-03-03,https://translate.google.com/website?sl=auto&tl=en&hl=en&client=webapp&u=https://bitcoinist.com/evolve-fund-files-for-ethereum-etf-after-bitcoin-approval-in-canada/
AON to pilot blockchain insurance with Ethereum startup Nayms,Ledger Insights,2021-03-03,https://translate.google.com/website?sl=auto&tl=en&hl=en&client=webapp&u=https://www.ledgerinsights.com/aon-to-pilot-blockchain-insurance-with-ethereum-startup-nayms/
Ethereum Finally Lands on Amazon Managed Blockchain,Coinspeaker,2021-03-03,https://translate.google.com/website?sl=auto&tl=en&hl=en&client=webapp&u=https://www.coinspeaker.com/ethereum-eth-amazon-blockchain/
Polkadot vs Ethereum Price Comparison: Which is a Better Buy?,InvestingCube,2021-03-03,https://translate.google.com/website?sl=auto&tl=en&hl=en&client=webapp&u=https://www.investingcube.com/polkadot-vs-ethereum-price-comparison-which-is-a-better-buy-cryptocurrencies/
Valid Points: What Coinbase's Public Listing Means for Eth 2.0,CoinDesk,2021-03-03,https://translate.google.com/website?sl=auto&tl=en&hl=en&client=webapp&u=https://www.coindesk.com/tech/2021/03/03/valid-points-what-coinbases-public-listing-means-for-eth-20/
Enjin launching two scaling solutions to remove gas and support NFTs from any blockchain,CryptoNinjas,2021-03-03,https://translate.google.com/website?sl=auto&tl=en&hl=en&client=webapp&u=https://www.cryptoninjas.net/2021/03/04/enjin-launching-two-scaling-solutions-to-remove-gas-and-support-nfts-from-any-blockchain/
"DOGE flips Bitcoin, Ethereum as ‘most discussed’ crypto on Twitter",AMBCrypto,2021-03-03,https://translate.google.com/website?sl=auto&tl=en&hl=en&client=webapp&u=https://ambcrypto.com/doge-flips-bitcoin-ether-as-most-discussed-crypto-on-twitter/
Buterin Proposes Cross-Rollup Communication Solution,The Chain Bulletin,2021-03-03,https://translate.google.com/website?sl=auto&tl=en&hl=en&client=webapp&u=https://chainbulletin.com/buterin-proposes-cross-rollup-communication-solution
Hex Trust Launches Custody Service for Ethereum NFTs,Decrypt,2021-03-03,https://translate.google.com/website?sl=auto&tl=en&hl=en&client=webapp&u=https://decrypt.co/60032/hex-trust-launches-custody-service-for-ethereum-nfts
"BitMEX Eyes Spot Trading, Custody As Arthur Hayes Prepares ...",Crypto News,2021-03-03,https://translate.google.com/website?sl=auto&tl=en&hl=en&client=webapp&u=https://cryptonews.com/news/bitmex-eyes-spot-trading-custody-as-arthur-hayes-prepares-to-9424.htm
Blockchain Node Providers and How They Work,InfoQ,2021-03-03,https://translate.google.com/website?sl=auto&tl=en&hl=en&client=webapp&u=https://www.infoq.com/articles/blockchain-as-a-service-get-block/
17% of Bitcoin's Supply Hasn't Moved for Over 7 Years,Decrypt,2021-03-03,https://translate.google.com/website?sl=auto&tl=en&hl=en&client=webapp&u=https://decrypt.co/59912/17-of-bitcoins-supply-hasnt-moved-for-over-7-years
PriFi ZK-Rollup DEX to Launch on Mute.io's Dual Token ...,Crypto News,2021-03-03,https://translate.google.com/website?sl=auto&tl=en&hl=en&client=webapp&u=https://cryptonews.com/news/prifi-zk-rollup-dex-to-launch-on-mute-io-s-dual-token-ecosys-9414.htm
Covantis blockchain platform for soft commodities trade goes ...,Global Trade Review,2021-03-03,https://translate.google.com/website?sl=auto&tl=en&hl=en&client=webapp&u=https://www.gtreview.com/news/fintech/covantis-blockchain-platform-for-soft-commodities-trade-goes-live/
The Number of Bitcoin on Exchanges is Starting to Fall Again,Decrypt,2021-03-03,https://translate.google.com/website?sl=auto&tl=en&hl=en&client=webapp&u=https://decrypt.co/60021/the-number-of-bitcoin-on-exchanges-is-starting-to-fall-again
"Cardano, NEM, Sushiswap Price Analysis: 03 March",AMBCrypto,2021-03-03,https://translate.google.com/website?sl=auto&tl=en&hl=en&client=webapp&u=https://ambcrypto.com/cardano-nem-sushiswap-price-analysis-03-march/
Badger DAO announces $21 million treasury diversification via VC partners,Cointelegraph,2021-03-03,https://translate.google.com/website?sl=auto&tl=en&hl=en&client=webapp&u=https://cointelegraph.com/news/badger-dao-announces-21-million-treasury-diversification-via-vc-partners
Amazon is getting into Ethereum - The giant AWS is playing it...,Journal Du Coin,2021-03-03,https://translate.google.com/website?sl=auto&tl=en&hl=en&client=webapp&u=https://journalducoin.com/actualites/amazon-ethereum-geant-aws-blockchain-curieux/
Ethereum is now available on Amazon Managed Blockchain,Cointelegraph,2021-03-03,https://translate.google.com/website?sl=auto&tl=en&hl=en&client=webapp&u=https://it.cointelegraph.com/news/ethereum-now-available-on-amazon-managed-blockchain
This is behind the supposed special software to mine Ethereum with a PlayStation 5,CryptoNews,2021-03-03,https://translate.google.com/website?sl=auto&tl=en&hl=en&client=webapp&u=https://www.criptonoticias.com/mineria/detras-supuesto-software-especial-minar-ethereum-playstation-5/
Cryptocurrency investors beware: Amazon has announced that it will support Ethereum!,Mynet Finance,2021-03-03,https://translate.google.com/website?sl=auto&tl=en&hl=en&client=webapp&u=https://finans.mynet.com/haber/detay/kripto-para/kripto-para-yatirimcilari-dikkat-amazon-ethereum-u-destekleyecegini-acikladi/414888/
Do you want to mine Ethereum? You even dig on Macs with Apple M1,Good programs,2021-03-03,"https://translate.google.com/website?sl=auto&tl=en&hl=en&client=webapp&u=https://www.dobreprogramy.pl/chcesz-kopac-ethereum-wykopiesz-nawet-na-macach-z-apple-m1,6628628633077377a"
Santiment reveals top 10 Ethereum projects by...,Webitcoin,2021-03-03,https://translate.google.com/website?sl=auto&tl=en&hl=en&client=webapp&u=https://webitcoin.com.br/santiment-revela-os-10-principais-projetos-ethereum-por-atividade-de-desenvolvedor-03-mar/
Santiment Released Top 10 Projects on Ethereum Ecosystem,The Cryptocurrency Post,2021-03-03,https://translate.google.com/website?sl=auto&tl=en&hl=en&client=webapp&u=https://thecryptocurrencypost.net/top-10-projects-on-ethereum-ecosystem/
BTC Branded 'the Most Portable Asset' as 420k Bitcoins Used ...,Bitcoin.com News,2021-03-03,https://translate.google.com/website?sl=auto&tl=en&hl=en&client=webapp&u=https://news.bitcoin.com/btc-branded-the-most-portable-asset-as-420k-bitcoins-used-as-collateral-in-q4-of-2020/
