Title,Publisher,Date,Link
Ethereum's Vitalik Buterin Donates Over $600K To India's COVID-19 Relief Campaign,TronWeekly,2021-04-25,https://www.tronweekly.com/vitalik-buterin-donate-600k-covid-campaign/
Antminer E9 Ethereum ASIC miner: packs power of 32 x GeForce RTX 3080s,TweakTown,2021-04-25,https://www.tweaktown.com/news/78945/antminer-e9-ethereum-asic-miner-packs-power-of-32-geforce-rtx-3080s/index.html
"Ethereum price showing relative strength, but ETH forming an ...",Forex Crunch,2021-04-25,https://www.forexcrunch.com/ethereum-price-showing-relative-strength-but-eth-forming-an-ominous-pattern/
DeFi ecosystem now exceeds 2 million unique addresses,CryptoSlate,2021-04-25,https://cryptoslate.com/defi-ecosystem-now-exceeds-2-million-unique-addresses/
Crypto Long & Short: The Pattern in Bitcoin's Volatility,CoinDesk,2021-04-25,https://www.coindesk.com/markets/2021/04/25/crypto-long-short-the-pattern-in-bitcoins-volatility/
Is Bitcoin Bull Market Over? Analyst Michaël van de Poppe Says Traders Are in Disbelief,The Daily Hodl,2021-04-25,https://dailyhodl.com/2021/04/25/is-bitcoin-bull-market-over-analyst-michael-van-de-poppe-says-traders-are-in-disbelief/
