Title,Publisher,Date,Link
"Why Bitcoin, Ethereum, and Dogecoin Are Gaining Today",The Motley Fool,2021-12-18,https://www.fool.com/investing/2021/12/18/why-bitcoin-ethereum-and-dogecoin-are-up-today/
Here's why Ethereum traders could care less about ETH's current weakness,Cointelegraph,2021-12-18,https://cointelegraph.com/news/here-s-why-ethereum-traders-could-care-less-about-eth-s-current-weakness
Adidas's First Ethereum NFT Drop Nets $23 Million and Shoots to Top of Charts,Decrypt,2021-12-18,https://decrypt.co/88705/adidas-ethereum-nft-drop-nets-23-million-and-shoots-to-top-of-charts
Consensys Launches Rollups Scaling Solution With ...,Bitcoin.com News,2021-12-18,https://news.bitcoin.com/consensys-launches-rollups-scaling-solution-with-mastercards-support/
Second-Largest Ethereum Whale on Record Just Executed a Massive Altcoin Purchase: WhaleStats,The Daily Hodl,2021-12-18,https://dailyhodl.com/2021/12/18/second-largest-ethereum-whale-on-record-just-executed-a-massive-altcoin-purchase-whalestats/
Polkadot Has Launched Parachains,Crypto Briefing,2021-12-18,https://cryptobriefing.com/polkadot-has-launched-parachains/
SBI Group launches crypto-asset fund for Japanese investors,Cointelegraph,2021-12-18,https://cointelegraph.com/news/sbi-group-launches-crypto-asset-fund-for-japanese-investors
How to Earn Interest on Stablecoins: A Beginner's Guide,Crypto News,2021-12-18,https://cryptonews.com/exclusives/how-earn-interest-stablecoins-beginners-guide.htm
These Six Works Available in the Artnet Auctions Sale ‘ArtNFT: Beginnings’ Are Redefining Contemporary Art as We Know It,Artnet News,2021-12-18,https://news.artnet.com/art-world/six-works-available-artnft-beginnings-artnet-auctions-2051070
