Title,Publisher,Date,Link
Ethereum: 3 Things to Know Before You Invest,The Motley Fool,2021-05-24,https://www.fool.com/investing/2021/05/24/ethereum-3-things-to-know-before-you-invest/
Ethereum Founder Vitalik Buterin Has a Solution to Bitcoin’s Environmental Problem,Observer,2021-05-24,https://observer.com/2021/05/ethereum-founder-solve-bitcoin-blockchain-electricity-consumption/
"Ethereum miners made record $1.93 billion revenue in May, report says",Markets Insider,2021-05-24,https://markets.businessinsider.com/currencies/news/ethereum-eth-price-miners-record-revenue-193-billion-may-report-2021-5-1030459435
Labs Group and Polygon to introduce a full-stack scaling solution,Cointelegraph,2021-05-24,https://cointelegraph.com/press-releases/labs-group-and-polygon-to-introduce-a-full-stack-scaling-solution
Wishy-washy bulls turn bearish on Ethereum price despite positive data,Cointelegraph,2021-05-24,https://cointelegraph.com/news/wishy-washy-bulls-turn-bearish-on-ethereum-price-despite-positive-data
"Dead cat bounce? Ethereum jumps 20%, while ETH inflows to exchanges soar",Cointelegraph,2021-05-24,https://cointelegraph.com/news/dead-cat-bounce-ethereum-jumps-20-while-eth-inflows-to-exchanges-soar
Here’s how this crypto crash resembles the 2017 collapse,Fortune,2021-05-24,https://fortune.com/2021/05/24/crypto-crash-resembles-2017-collapse/
Mark Cuban Calls Crypto Crash the 'Great Unwind' as Bitcoin and Others Keep Falling,GOBankingRates,2021-05-24,https://www.gobankingrates.com/investing/crypto/cuban-calls-crypto-crash-the-great-unwind-as-bitcoin-and-others-keep-falling/
Sysorex CEO Wayne Wasserberg Discusses Advantages of TTM’s US-based Ethereum Mining Operations,Yahoo Finance,2021-05-24,https://finance.yahoo.com/news/sysorex-ceo-wayne-wasserberg-discusses-154300251.html
"Bitcoin rebounds after a wild weekend that took it below $32,000",CNBC,2021-05-24,https://www.cnbc.com/2021/05/24/bitcoin-ethereum-attempt-positive-start-to-week-after-wild-plunges.html
