Title,Publisher,Date,Link
Ethereum’s ‘EIP 1559’ Fee Market Overhaul Greenlit for July,Nasdaq,2021-03-05,https://translate.google.com/website?sl=auto&tl=en&hl=en&client=webapp&u=https://www.nasdaq.com/articles/ethereums-eip-1559-fee-market-overhaul-greenlit-for-july-2021-03-05
Ethereum Price Analysis: 05 March,AMBCrypto,2021-03-05,https://translate.google.com/website?sl=auto&tl=en&hl=en&client=webapp&u=https://ambcrypto.com/ethereum-price-analysis-05-march/
Ethereum: Billionaire Mark Cuban invests in NFT marketplace ...,Crypto News Flash,2021-03-05,https://translate.google.com/website?sl=auto&tl=en&hl=en&client=webapp&u=https://www.crypto-news-flash.com/ethereum-billionaire-mark-cuban-invests-in-nft-marketplace-mintable/
Crypto Briefing's CB10 Index Yearly Returns Top Ethereum,Crypto Briefing,2021-03-05,https://translate.google.com/website?sl=auto&tl=en&hl=en&client=webapp&u=https://cryptobriefing.com/crypto-briefings-cb10-index-yearly-returns-top-ethereum/
"Crypto Price Analysis & Overview March 5th: Bitcoin, Ethereum, Ripple, Polkadot, and Cardano",CryptoPotato,2021-03-05,https://translate.google.com/website?sl=auto&tl=en&hl=en&client=webapp&u=https://cryptopotato.com/crypto-price-analysis-overview-march-5th-bitcoin-ethereum-ripple-polkadot-and-cardano/
The cost of mining for cryptocash,CNBC,2021-03-05,https://translate.google.com/website?sl=auto&tl=en&hl=en&client=webapp&u=https://www.cnbc.com/2021/03/05/mining-bitcoin-ethereum-dogecoin-how-to-do-it-and-how-much-it-costs.html
S!NG Launches Free NFT-ready App for Creators,Business Wire,2021-03-05,https://translate.google.com/website?sl=auto&tl=en&hl=en&client=webapp&u=https://www.businesswire.com/news/home/20210305005012/en/S%2521NG-Launches-Free-NFT-ready-App-for-Creators
Hashpalette to offer cross-chain NFT support for Neo ...,Neo News Today,2021-03-05,https://translate.google.com/website?sl=auto&tl=en&hl=en&client=webapp&u=https://neonewstoday.com/general/hashpalette-to-offer-cross-chain-nft-support-for-neo-ethereum-and-ontology/
SushiSwap Goes Live on Binance Smart Chain and Others in ...,Cryptoglobe,2021-03-05,https://translate.google.com/website?sl=auto&tl=en&hl=en&client=webapp&u=https://www.cryptoglobe.com/latest/2021/03/sushiswap-goes-live-on-binance-smart-chain-and-others-in-bid-to-flee-ethereums-fees/
"2 Chainz, Quavo, Lil Baby Drop NFTs for NBA All Star Weekend",Decrypt,2021-03-05,https://translate.google.com/website?sl=auto&tl=en&hl=en&client=webapp&u=https://decrypt.co/60402/2-chainz-quavo-lil-baby-drop-nfts-nba-all-star-weekend
"Ampleforth Removes Upgradeability, Decentralizes into ...",Crypto Briefing,2021-03-05,https://translate.google.com/website?sl=auto&tl=en&hl=en&client=webapp&u=https://cryptobriefing.com/ampleforth-removes-upgradeability-decentralizes-into-community/
"Gary Vaynerchuk on NFTs, Bitcoin Regulations, and Coinbase",Cheddar News,2021-03-05,https://translate.google.com/website?sl=auto&tl=en&hl=en&client=webapp&u=https://cheddar.com/media/gary-vaynerchuk-on-nfts-bitcoin-regulations-and-coinbase
The Rise of DeFi Exchanges Like Curve Finance and Uniswap,Decrypt,2021-03-05,https://translate.google.com/website?sl=auto&tl=en&hl=en&client=webapp&u=https://decrypt.co/60304/the-rise-of-defi-exchanges-like-curve-finance-and-uniswap
Mark Cuban puts high stakes on NFT marketplace Mintable in Ethereum’s space.,The Market Periodical,2021-03-05,https://translate.google.com/website?sl=auto&tl=en&hl=en&client=webapp&u=https://themarketperiodical.com/2021/03/05/mark-cuban-puts-high-stakes-on-nft-marketplace-mintable-in-ethereums-space/
Crypto Cashback App Eco Raises $26 Million in Funding Round Led by Andreessen Horowitz,Decrypt,2021-03-05,https://translate.google.com/website?sl=auto&tl=en&hl=en&client=webapp&u=https://decrypt.co/60385/crypto-cashback-eco-funding-round-andreessen-horowitz
EIP-1559 que pode cortar taxa de gás do Ethereum e diminuir recompensa dos mineradores é agendada para julho,Cointelegraph,2021-03-05,https://translate.google.com/website?sl=auto&tl=en&hl=en&client=webapp&u=https://cointelegraph.com.br/news/major-ethereum-gas-fee-overhaul-eip-1559-scheduled-for-july
Lo último de Vitalik Buterin para reducir las comisiones en Ethereum,CriptoNoticias,2021-03-05,https://translate.google.com/website?sl=auto&tl=en&hl=en&client=webapp&u=https://www.criptonoticias.com/tecnologia/ultimo-vitalik-buterin-reducir-comisiones-ethereum/
The Flash Mint is here: WETH10 turbocharges the flash loan concept,Cointelegraph,2021-03-05,https://translate.google.com/website?sl=auto&tl=en&hl=en&client=webapp&u=https://cointelegraph.com/news/the-flash-mint-is-here-weth10-turbocharges-the-flash-loan-concept
Taraxa Wants to Put Every Informal Transaction on the Record ...,Bitcoin.com News,2021-03-05,https://translate.google.com/website?sl=auto&tl=en&hl=en&client=webapp&u=https://news.bitcoin.com/taraxa-wants-to-put-every-informal-transaction-on-the-record-unveils-details-about-the-upcoming-tge/
"How to invest in Bitcoin, Ethereum and other cryptocurrencies in a simple way",Unocero,2021-03-05,https://translate.google.com/website?sl=auto&tl=en&hl=en&client=webapp&u=https://www.unocero.com/como-se-hace/como-invertir-en-bitcoin-y-otras-criptomonedas/
Taraxa Wants to Put Every Informal Transaction on the Record ...,Bitcoin.com News,2021-03-05,https://translate.google.com/website?sl=auto&tl=en&hl=en&client=webapp&u=https://news.bitcoin.com/taraxa-wants-to-put-every-informal-transaction-on-the-record-unveils-details-about-the-upcoming-tge/
"How to invest in Bitcoin, Ethereum and other criptomonedas de forma sencilla",Unocero,2021-03-05,https://translate.google.com/website?sl=auto&tl=en&hl=en&client=webapp&u=https://www.unocero.com/como-se-hace/como-invertir-en-bitcoin-y-otras-criptomonedas/
They burn a real Banksy worth millions in the name of the...,Corner Newspaper,2021-03-05,https://translate.google.com/website?sl=auto&tl=en&hl=en&client=webapp&u=https://journalducoin.com/actualites/bruler-banksy-millions-crypto-art-ethereum-genie-betise/
Piyasa Düşerken XRP Neden Yükseliyor? Bitcoin ve...,Investing.com,2021-03-05,https://translate.google.com/website?sl=auto&tl=en&hl=en&client=webapp&u=https://tr.investing.com/analysis/piyasa-duserken-xrp-neden-yukseliyor-bitcoin-ve-ethereumda-son-durum-200468065
Bybit to shut down operations in UK to comply with FCA mandate,AMBCrypto,2021-03-05,https://translate.google.com/website?sl=auto&tl=en&hl=en&client=webapp&u=https://ambcrypto.com/bybit-to-shut-down-operations-in-uk-to-comply-with-fca-mandate/
