Title,Publisher,Date,Link
Crypto crash: Ethereum co-founder Buterin is no longer a billionaire,Gulf News,2022-05-21,https://gulfnews.com/business/markets/crypto-crash-ethereum-co-founder-buterin-is-no-longer-a-billionaire-1.88026767
Number of Ethereum addresses in a loss hit a 2-year high,Finbold,2022-05-21,https://finbold.com/number-of-ethereum-addresses-in-a-loss-hit-a-2-year-high/
"Massive Ethereum Upgrade Expected To Happen in August, Says ETH Protocol Developer",The Daily Hodl,2022-05-21,https://dailyhodl.com/2022/05/21/massive-ethereum-upgrade-expected-to-happen-in-august-says-eth-protocol-developer/
Why is Ethereum used for NFTs?,Cointelegraph,2022-05-21,https://cointelegraph.com/explained/why-is-ethereum-used-for-nfts
"Bitcoin, Ethereum Technical Analysis: ETH Back Below $2000 ...",Bitcoin.com News,2022-05-21,https://news.bitcoin.com/bitcoin-ethereum-technical-analysis-eth-back-below-2000-to-start-weekend/
"Ethereum Has Destroyed $8.10 Billion in Ether, ETH Scarcity ...",Bitcoin.com News,2022-05-21,https://news.bitcoin.com/ethereum-has-destroyed-8-10-billion-in-ether-eth-scarcity-to-increase-after-the-merge/
"Bitcoin Inflowing, Ethereum Merging, Terra Do Kwoning ...",Crypto News,2022-05-21,https://cryptonews.com/exclusives/bitcoin-inflowing-ethereum-merging-terra-do-kwoning-shibless-future-and-20-crypto-jokes.htm
"Do Kwon faces legal troubles in Korea, China remains a top ...",Cointelegraph,2022-05-21,https://cointelegraph.com/magazine/2022/05/21/do-kwon-faces-legal-troubles-south-korea-china-remains-top-contributor-bitcoin-mining-ethereum-merge-testing-coming-hodlers-digest-may-15-21
"Here’s What’s Next for Bitcoin and One Ethereum Competitor, According to Crypto Analyst Michaël van de...",The Daily Hodl,2022-05-21,https://dailyhodl.com/2022/05/21/heres-whats-next-for-bitcoin-and-one-ethereum-competitor-according-to-crypto-analyst-michael-van-de-poppe/
