Title,Publisher,Date,Link
"Dogecoin price analysis: DOGE slowly fails to retrace, looks to ...",Cryptopolitan,2022-08-12,https://www.cryptopolitan.com/dogecoin-price-analysis-2022-08-12/
Five Reasons Why the Metaverse Virtual Real Estate Market Is ...,TechPresident,2022-08-12,https://techpresident.com/metaverse-crash
Crypto sector is poised for 'a lot more commercial activity ...,Finbold,2022-08-12,https://finbold.com/crypto-sector-is-poised-for-a-lot-more-commercial-activity-skybridges-scaramucci-expects/
"Why coin market expects big from BNB, Synthetix, and ...",Digital Journal,2022-08-12,https://www.digitaljournal.com/business/why-coin-market-expects-big-from-bnb-synthetix-and-keninah-concord/article
Covalent Integrates with Nervos Network to Increase ...,Crypto Reporter,2022-08-12,https://www.crypto-reporter.com/press-releases/covalent-nervos-network-35308/
Hedera Hashgraph Price Prediction: Is $0.1 the Next Price Level?,InvestingCube,2022-08-12,https://www.investingcube.com/hedera-hashgraph-price-prediction-is-0-1-the-next-price-level-cryptocurrencies/
'Bachelorette' contestant's firefighter dad has retirement locked up in bankrupt crypto lender,Los Angeles Times,2022-08-12,https://www.latimes.com/business/story/2022-08-12/bachelorette-shallcross-firefighter-dad-retirement-celsius
App Swarm Plans to Mine a Lot of Ethereum,Live Bitcoin News,2022-08-12,https://www.livebitcoinnews.com/app-swarm-plans-to-mine-a-lot-of-ethereum/
Bitpay teams up with Cardlytics to provide 15% cashback ...,FinanceFeeds,2022-08-12,https://financefeeds.com/bitpay-teams-up-with-cardlytics-to-provide-15-cashback-rewards/
StarCard Sports Games soccer NFT collection sells out again ...,Digital Journal,2022-08-12,https://www.digitaljournal.com/pr/starcard-sports-games-soccer-nft-collection-sells-out-again-in-minutes-on-the-arc-nft-marketplace
Is Uniswap about to go lower after a MACD crossover? | Global Online Money,Global Online Money,2022-08-12,https://globalonlinemony.com/is-uniswap-about-to-go-lower-after-a-macd-crossover/
BTCS Reports Q2 2022 Results,Crypto Reporter,2022-08-12,https://www.crypto-reporter.com/newsfeed/btcs-reports-q2-2022-results-35361/
BlackRock Launches Private Trust to Track the Price of Bitcoin,Crypto News,2022-08-12,https://cryptonews.com/videos/blackrock-launches-private-trust-to-track-the-price-of-bitcoin.htm
"Gold price posts fourth weekly gain, but Wall Street split ...",KITCO,2022-08-12,https://www.kitco.com/news/2022-08-12/Gold-price-posts-fourth-weekly-gain-but-Wall-Street-split-between-bulls-and-bears-Kitco-s-gold-price-survey.html
"NFT $RAP UP Week 5: Instagram, MLS, Tiffany, UFC ...",HipHopCanada,2022-08-12,https://hiphopcanada.com/nft-rap-up-gta-6-aug-12/
Coinbase Earnings Weren't as Bad as They Seem,The Motley Fool,2022-08-12,https://www.fool.com/investing/2022/08/12/coinbase-earnings-what-you-need-to-know/
Taiwan Turns to Ethereum IPFS Tech to Thwart Chinese Cyberattacks - Decrypt,Inferse.com,2022-08-12,https://www.inferse.com/182100/taiwan-turns-to-ethereum-ipfs-tech-to-thwart-chinese-cyberattacks-decrypt/
Fallout from crypto contagion subsides but no market reversal just yet,Cointelegraph,2022-08-12,https://cointelegraph.com/news/fallout-from-crypto-contagion-subsides-but-no-market-reversal-just-yet
"Ripple XRP Price at an Important Crossroads, DCR, FLOW ...",Bitrates.com,2022-08-12,https://www.bitrates.com/news/p/ripple-xrp-price-at-an-important-crossroads-dcr-flow-sol-aug-12
"Why Ethereum, Bitcoin, and Dogecoin Jumped This Morning - The Motley Fool",Inferse.com,2022-08-12,https://www.inferse.com/182258/why-ethereum-bitcoin-and-dogecoin-jumped-this-morning-the-motley-fool/
Asset Manager Giants Placing Bets on Digital Assets in Vote ...,Business 2 Community,2022-08-12,https://www.business2community.com/crypto-news/asset-manager-giants-placing-bets-on-digital-assets-in-vote-of-confidence-for-crypto-02535742
TangoID: la nueva plataforma soberana saldrá en 2023,iProUP,2022-08-12,https://www.iproup.com/innovacion/33567-tangoid-la-nueva-plataforma-soberana-saldra-en-2023
Ripple: Most financial institutions plan to use crypto within ...,Blockchain Technology News,2022-08-12,https://www.blockchaintechnology-news.com/2022/08/ripple-most-financial-institutions-plan-use-crypto-within-three-years/
What Trends Really Making Consumer Metaverse Market ...,Digital Journal,2022-08-12,https://www.digitaljournal.com/pr/what-trends-really-making-consumer-metaverse-market-attractive-players-in-spotlight-microsoft-magic-leap-nike-tencent-accenture
Kusama (KSM) | Kusama Price Index by,Cointelegraph,2022-08-12,https://cointelegraph.com/kusama-ksm-price-index
IOTA Guide – Everything you need to know about IOTA Crypto,CryptoTicker,2022-08-12,https://cryptoticker.io/en/iota-guide-everything-to-know-about-iota-crypto/
Announcing Polygon as the Title Sponsor of This Year's ...,Crypto News,2022-08-12,https://cryptonews.com/news/announcing-polygon-as-title-sponsor-of-years-crypto-fest-hybrid-edition.htm
Vergecast: Samsung's newest foldables and Disney's prices ...,The Verge,2022-08-12,https://www.theverge.com/2022/8/12/23302109/samsung-galaxy-unpacked-z-fold-4-flip-disney-plus-streaming-podcast-vergecast
"Injective Acquires $40M From Jump Crypto, BH Digital To Support Growth - Crowdfund Insider",CrowdFund Insider,2022-08-12,https://www.crowdfundinsider.com/2022/08/194709-injective-acquires-40m-from-jump-crypto-bh-digital-to-support-growth/
"Binance Labs Invests In Ankr, A Web3 Infrastructure Platform - Crowdfund Insider",CrowdFund Insider,2022-08-12,https://www.crowdfundinsider.com/2022/08/194713-binance-labs-invests-in-ankr-a-web3-infrastructure-platform/
Brazilian payment app PicPay launches crypto exchange with Paxos,Cointelegraph,2022-08-12,https://cointelegraph.com/news/brazilian-payment-app-picpay-launches-crypto-exchange-with-paxos
"Are Crypto, Stock Markets Following Incorrect CPI Data?",Watcher Guru,2022-08-12,https://watcher.guru/news/crypto-and-stock-markets-following-incorrect-cpi-data
Why Ankr (ANKR) Surged 38% in 24 Hours. Is Now the Time ...,The Motley Fool,2022-08-12,https://www.fool.com/the-ascent/cryptocurrency/articles/why-ankr-ankr-surged-38-in-24-hours-is-now-the-time-to-buy-it/
Abrdn CEO Says Blockchain Will Shape Financial Markets as Firm Buys Stake in Archax,Tokenist,2022-08-12,https://tokenist.com/abrdn-ceo-says-blockchain-will-shape-financial-markets-as-firm-buys-stake-in-archax/
"Bitcoin Washout Is Over, Analysts Say",CryptosRus,2022-08-12,https://cryptosrus.com/bitcoin-washout-is-over-analysts-say/
$BTCS Btcs Inc - Quarterly revenue increased 35% to $0.5 ...,CMLviz,2022-08-12,https://www.cmlviz.com/stocks/BTCS/news/b/2022/08/12/btcs-inc---quarterly-revenue-increased-35-to-0-5-million
"Music Entrepreneur, Dwayne “DCat” Cornelius, Moves Into the Metaverse with DCat Music NFTs",EIN News,2022-08-12,https://www.einnews.com/pr_news/585797059/music-entrepreneur-dwayne-dcat-cornelius-moves-into-the-metaverse-with-dcat-music-nfts
"Lightning Network, Regulation, Coinbase-Blackrock ...",Crypto News,2022-08-12,https://cryptonews.com/videos/hard-money-with-natalie-brunell-hailey-lennon-lyn-alden-latest-coinbase-blackrock-tornado-cash.htm
AlienWorlds Continues to Top GameFi Charts,BSC News,2022-08-12,https://www.bsc.news/post/alienworlds-continues-to-top-gamefi-charts
Blockchain Game Dragoma Falls Victim To A $3.5 Million Rug ...,eGamers.io,2022-08-12,https://egamers.io/blockchain-game-dragoma-falls-victim-to-a-3-5-million-rug-pull/
MATIC’s Latest Price Surge And The Reasons Behind It,CryptoBrowser.io,2022-08-12,https://cryptobrowser.io/news/matics-latest-price-surge-and-the-reasons-behind-it/
YCLUB: Transforming The Superyacht World Using Web3,NFT Evening,2022-08-12,https://nftevening.com/yclub-transforming-the-superyacht-world-using-web3/
The Crypto Report: Bitcoin and Ethereum enjoy a bullish week ...,ForexTV,2022-08-12,https://forextv.com/bitcoin-news/the-crypto-report-bitcoin-and-ethereum-enjoy-a-bullish-week-while-bored-ape-yacht-club-goes-south/
BitAlpha AI Reviews (Canada & UK): The Shocking Truth ...,Deccan Herald,2022-08-12,https://www.deccanherald.com/brandspot/pr-spot/bitalpha-ai-reviews-canada-uk-the-shocking-truth-behind-the-bit-alpha-ai-hype-1135497.html
Bitcoin Cash leads way as largest cryptocurrencies slump,MarketWatch,2022-08-12,https://www.marketwatch.com/story/bitcoin-cash-leads-way-as-largest-cryptocurrencies-slump-01660312834-4a336e20c982
Magic Eden Proposes An Exclusive ApeCoin NFT Marketplace,Influencive,2022-08-12,https://www.influencive.com/magic-eden-proposes-an-exclusive-apecoin-nft-marketplace/
Dogecoin Getting Ready for Rally as It Breaks This Resistance - U.Today,Inferse.com,2022-08-12,https://www.inferse.com/182334/dogecoin-getting-ready-for-rally-as-it-breaks-this-resistance-u-today/
Zilliqa Price Prediction: ZIL is Ripe for a Bullish Breakout,Bankless Times,2022-08-12,https://www.banklesstimes.com/news/2022/08/12/zilliqa-price-prediction-zil-is-ripe-for-a-bullish-breakout/
How to mine Safemoon 2022 (Complete Guide),Cryptopolitan,2022-08-12,https://www.cryptopolitan.com/how-to-mine-safemoon/
Bitcoin’s Privacy Problem—And What Cypherpunks Are Doing to Solve It,Decrypt,2022-08-12,https://decrypt.co/107376/bitcoin-privacy-problem-what-cypherpunks-are-doing
Panamanian Regulator May 'Swing the Ax' after Bitcoin ...,Crypto News,2022-08-12,https://cryptonews.com/news/panamanian-regulator-may-swing-the-ax-after-bitcoin-friendly-bank-bans-use-of-crypto-mixers.htm
Mercado Libre to Expand Cryptocurrency Services to More ...,Bitcoin.com News,2022-08-12,https://news.bitcoin.com/mercado-libre-to-expand-cryptocurrency-services-to-more-countries-in-latam/
"Crypto markets bounced and sentiment improved, but retail has yet to FOMO",Cointelegraph,2022-08-12,https://cointelegraph.com/news/crypto-markets-bounced-and-sentiment-improved-but-retail-has-yet-to-fomo
Floki Inu Price Prediction: Binstarter Deal Supportive - Meme ...,Business 2 Community,2022-08-12,https://www.business2community.com/crypto-news/floki-inu-price-prediction-binstarter-deal-supportive-meme-bulls-eyeing-tamadoge-02536153
"News: Bitcoin and Ethereum Keep Moving Lower, HT Rallies",Bitfinex Pulse,2022-08-12,https://pulse.bitfinex.com/post/News/20220812125733454
Authorities Accuse Vauld's Indian Entity of Aiding in Money ...,Crypto Briefing,2022-08-12,https://cryptobriefing.com/vauld-indian-entity-allegedly-laundered-46-million/
"Benzinga Before The Bell: Johnson & Johnson To Stop Selling Talc-Based Powder, Google Fined $43M In Austr",Benzinga,2022-08-12,https://www.benzinga.com/news/22/08/28472094/benzinga-before-the-bell-and-other-top-financial-stories-friday-august-12
"Win With The Bear Market: Pugglit Inu, Shiba Inu, and Floki Inu",Coinpedia,2022-08-12,https://coinpedia.org/press-release/win-with-the-bear-market-pugglit-inu-shiba-inu-and-floki-inu/
Secure Massive Returns in Future With Cardano (ADA) and Supontis- Latest Crypto News - Crypto Mode,Inferse.com,2022-08-12,https://www.inferse.com/181542/secure-massive-returns-in-future-with-cardano-ada-and-supontis-latest-crypto-news-crypto-mode/
Investing In Trader Joe (JOE) - Everything You Need to Know,Securities.io,2022-08-12,https://www.securities.io/investing-in-trader-joe-joe-everything-you-need-to-know/
Improbable: Powering the Otherside Metaverse,Crypto News,2022-08-12,https://cryptonews.com/videos/improbable-powering-the-otherside-metaverse-with-herman-narula-overpriced-jpegs-47.htm
Interlay Releases Bitcoin Cross-Chain Bridge,Coinposters,2022-08-12,https://coinposters.com/news/bitcoin/interlay-releases-bitcoin-cross-chain-bridge/
How to improve the user experience of DeFi to break away ...,CryptoSlate,2022-08-12,https://cryptoslate.com/videos/how-to-improve-the-user-experience-of-defi-to-break-away-from-the-traditional-banking-system/
Blockchain Bites: Second bipartisan crypto bill; Tornado cash ...,Lexology,2022-08-12,https://www.lexology.com/library/detail.aspx?g=87f332ec-edbd-47fe-a243-26255c519c47
Optimism Surpasses TVL's Billion Dollars,TheGameLocus,2022-08-12,https://www.thegamelocus.com/optimism-surpasses-tvls-billion-dollars/
"Parts of China's Hainan extend COVID-19 lockdown, Lhasa in ...",UP Jobs News,2022-08-12,https://upjobsnews.com/parts-of-chinas-hainan-extend-covid-19-lockdown-lhasa-in-tibet-tightens-curbs-more-latest-news-here/
"Where Do Ripple, Youniverze, And Dogecoin Sit On The Market?",TechBullion,2022-08-12,https://techbullion.com/where-do-ripple-youniverze-and-dogecoin-sit-on-the-market/
Toast stock soars on earnings beat while Olo stock gets ...,Up Jobs News,2022-08-12,https://upjobsnews.com/toast-stock-soars-on-earnings-beat-while-olo-stock-gets-hammered-yahoo-finance-more-latest-news-here/
"Supporters of the PoW-fork of Ethereum called it ""inevitable""",Crypto News,2022-08-12,https://crypto-daily.news/2022/08/12/supporters-of-the-pow-fork-of-ethereum-called-it-inevitable/
HIVE Blockchain Technologies Ltd. [HIVE] fell -52.20% so far ...,The DBT News,2022-08-12,https://dbtnews.com/2022/08/12/hive-blockchain-technologies-ltd-hive-fell-52-20-so-far-this-year-what-now/
Cryptocurrency market: How to segment it?,INVESTOR TIMES,2022-08-12,https://investortimes.com/cryptocurrency-market-how-to-segment-it/
"Ballet Crypto CEO Very Bullish on Bitcoin, Cryptocurrency - Bloomberg",Inferse.com,2022-08-12,https://www.inferse.com/182244/ballet-crypto-ceo-very-bullish-on-bitcoin-cryptocurrency-bloomberg/
ETH.Latam Conference: the City presented a new blockchain ...,Zyri,2022-08-12,https://www.zyri.net/2022/08/13/eth-latam-conference-the-city-presented-a-new-blockchain-based-digital-identity-system/
"As CryptoPunks NFT Owners Get Commercial Rights, Yuga Hopes to Secure Their ‘Legacy as Artwork' - Decrypt",Inferse.com,2022-08-12,https://www.inferse.com/184042/as-cryptopunks-nft-owners-get-commercial-rights-yuga-hopes-to-secure-their-legacy-as-artwork-decrypt/
Can Shiba Inu Reach $1 by 2025? - The Motley Fool,Inferse.com,2022-08-12,https://www.inferse.com/181798/can-shiba-inu-reach-1-by-2025-the-motley-fool/
Is Cryptocurrency Safe to Use at Online Casinos?,Cryptopolitan,2022-08-12,https://www.cryptopolitan.com/is-cryptocurrency-safe-to-use-at-online-casinos/
Should You Buy LTC If It Consolidates At Key Resistance?,The Bharat Express News,2022-08-12,https://www.thebharatexpressnews.com/should-you-buy-ltc-if-it-consolidates-at-key-resistance/
Bitcoin mining stocks have doubled in the last 30-days,The West News,2022-08-12,https://thewestnews.com/bitcoin-mining-stocks-have-doubled-in-the-last-30-days/
Indonesia summons Ukraine's Ambassador in connection with ...,UP Jobs News,2022-08-12,https://upjobsnews.com/indonesia-summons-ukraines-ambassador-in-connection-with-twitter-comment-more-latest-news-here/
LAUNCH OF FINEXIA CRYPTO COLLECTIVE ...,The Crypto Update,2022-08-12,https://www.thecryptoupdates.com/launch-of-finexia-crypto-collective/
Maven 11 unveils a $40 million lending pool,InsideBitcoins,2022-08-12,https://insidebitcoins.com/news/maven-11-unveils-a-40-million-lending-pool
5 Best Play-to-Earn Cryptocurrencies to Buy for Long-Term ...,InsideBitcoins,2022-08-12,https://insidebitcoins.com/news/5-best-play-to-earn-cryptocurrencies-to-buy-for-long-term-returns-august-2022
Predictions for the Hedera Hashgraph HBAR price for 2022,The Digital Weekly,2022-08-12,https://thedigitalweekly.com/predictions-for-the-hedera-hashgraph-hbar-price-for-2022/
What you need to know before signing up with NOWPayments,The Bharat Express News,2022-08-12,https://www.thebharatexpressnews.com/what-you-need-to-know-before-signing-up-with-nowpayments/
Live updates: Russia's war in Ukraine & More Latest News Here,UP Jobs News,2022-08-12,https://upjobsnews.com/live-updates-russias-war-in-ukraine-more-latest-news-here/
