Title,Publisher,Date,Link
This former financial advisor pivoted to teach advisors about crypto: 'A lot of folks are convinced it's a fad or it's a fraud',CNBC,2022-06-29,https://www.cnbc.com/2022/06/29/this-former-financial-advisor-now-educates-advisors-on-crypto.html
Why traders are rushing to exit positions on Cardano’s ADA price,FXStreet,2022-06-29,https://www.fxstreet.com/cryptocurrencies/news/why-traders-are-rushing-to-exit-positions-on-cardanos-ada-price-202206291418
Is It A Good Time To Buy Bitcoin?,Altcoin Buzz,2022-06-29,https://www.altcoinbuzz.io/top-article/is-it-a-good-time-to-buy-bitcoin-now/
South African Police Arrest Two for Alleged $2 Million Crypto Fraud,Coinfomania,2022-06-29,https://coinfomania.com/police-arrest-two-2-million-crypto-fraud/
Trust Wallet vs MetaMask | Crypto Wallet Comparison,Coindoo,2022-06-29,https://coindoo.com/trust-wallet-vs-metamask/
US Economy Slipped 1.6% To Start Year; Return To Growth Eyed,Outlook India,2022-06-29,https://www.outlookindia.com/business/us-economy-slipped-1-6-to-start-year-return-to-growth-eyed-news-205601
Router Protocol: Infrastructure for the Cross-Chain World,Messari,2022-06-29,https://messari.io/article/router-protocol-infrastructure-for-the-cross-chain-world
Coinbase vs. FTX: Which is better for beginners,Business Insider,2022-06-29,https://www.businessinsider.com/crypto-exchange-better-for-beginners-coinbase-ftx-buy-sell-nfts-2022-6
Top 5 AI & Big Data Tokens Below $50 Million Market Cap to ...,The VR Soldier,2022-06-29,https://thevrsoldier.com/top-5-ai-big-data-tokens-below-50-million-market-cap-to-watch-in-2022/
Flipside Crypto launches NFTs to pull multi-chain data,Cointelegraph,2022-06-29,https://cointelegraph.com/news/flipside-crypto-launches-nfts-to-pull-multi-chain-data
VeeFriends x MaryRuth's Launch Accountable Anteater ...,NFT Evening,2022-06-29,https://nftevening.com/veefriends-x-maryruths-launch-accountable-anteater-multivitamins/
Meet Europe's Cheapest Spot Bitcoin ETF With Bear-Market Resistance,TronWeekly,2022-06-29,https://www.tronweekly.com/europe-spot-bitcoin-etf/
Australia Briefing: All Shook Up With the Property Blues,Bloomberg.com,2022-06-29,https://www.bloomberg.com/news/newsletters/2022-06-29/australia-news-today-shaky-property-cheaper-evs-china-insecurity
Pinterest (PINS) Stock Dips as Ben Silbermann Leaves CEO ...,InvestorPlace,2022-06-29,https://investorplace.com/2022/06/pinterest-pins-stock-dips-as-ben-silbermann-leaves-ceo-seat/
Crypto market crash wipes out millions from North Korea's stolen crypto funds,Cointelegraph,2022-06-29,https://cointelegraph.com/news/crypto-market-crash-wipes-out-millions-from-north-korea-s-stolen-crypto-funds
En Venezuela lanzarán aplicación para hacer el pago móvil ...,Morocotacoin,2022-06-29,https://morocotacoin.news/venezuela/en-venezuela-lanzaran-aplicacion-para-hacer-el-pago-movil-con-criptomonedas/
"Biggest Movers: AVAX, SOL Slip by 14% on Wednesday, as ...",Bitcoin.com News,2022-06-29,https://news.bitcoin.com/biggest-movers-avax-sol-slip-by-14-on-wednesday-as-prices-near-1-week-low/
Deutsche Bank Sees Bitcoin Returning to $28000 by Year-End,Bloomberg.com,2022-06-29,https://www.bloomberg.com/news/articles/2022-06-29/deutsche-bank-says-bitcoin-could-reach-28-000-by-year-end
EU Commission Proposes Ban on Sale of Flavored Heated ...,Bloomberg.com,2022-06-29,https://www.bloomberg.com/news/articles/2022-06-29/ap-newsalert-the-european-union-s-executive-arm-proposed-a-ban-on-the-sale-of-flavored-heated-tobacco-products-such-as-vaping
La cryptomonnaie séduirait 51 % des sud-américains comme ...,Journal Du Coin,2022-06-29,https://journalducoin.com/actualites/cryptomonnaie-sud-americains-mode-de-paiement/
German Oil Refiner to Halt Diesel Loadings After Lightning Hit,Bloomberg.com,2022-06-29,https://www.bloomberg.com/news/articles/2022-06-29/german-oil-refiner-to-halt-diesel-loadings-after-lightning-hit
"Global Views of China Dim on Human Rights Issues, Pew Finds",Bloomberg.com,2022-06-29,https://www.bloomberg.com/news/articles/2022-06-29/global-views-of-china-dim-on-human-rights-issues-pew-finds
"Govt Approves Rs 2,516 Crore Scheme For Computerisation Of 63,000 Primary Agriculture Credit Societies",Outlook India,2022-06-29,https://www.outlookindia.com/business/govt-approves-rs-2-516-crore-scheme-for-computerisation-of-63-000-primary-agriculture-credit-societies-news-205638
Here’s Why Foreign Investments Firms Are Bullish On Reliance Industries,Outlook India,2022-06-29,https://www.outlookindia.com/business/here-s-why-foreign-investments-firms-are-bullish-on-reliance-industries-news-205595
Will TikTok Be Banned? FCC Commissioner Push Faces Long ...,Bloomberg.com,2022-06-29,https://www.bloomberg.com/news/articles/2022-06-29/fcc-commissioner-s-push-to-cancel-tiktok-faces-long-odds
Boris Johnson Says He'd Be 'Amazed' If Putin Attends G-20 ...,Bloomberg.com,2022-06-29,https://www.bloomberg.com/news/articles/2022-06-29/boris-johnson-says-he-d-be-amazed-if-putin-attends-g-20-summit
CityLab Daily: Mayors and Local Officials Face a Rising Tide ...,Bloomberg.com,2022-06-29,https://www.bloomberg.com/news/newsletters/2022-06-29/citylab-daily-mayors-and-local-officials-face-a-rising-tide-of-harassment
Xi Is Finally Leaving Mainland China After 893 Days at Home,Bloomberg.com,2022-06-29,https://www.bloomberg.com/news/articles/2022-06-29/china-s-xi-jinping-is-finally-leaving-mainland-china-after-893-days-at-home
"Napster Plans Crypto Comeback With NFTs, Coin Launch",Bloomberg.com,2022-06-29,https://www.bloomberg.com/news/articles/2022-06-29/napster-former-music-industry-nemesis-plans-crypto-comeback
Hello Kitty Owner Soars on China License Deal With Alibaba ...,Bloomberg.com,2022-06-29,https://www.bloomberg.com/news/articles/2022-06-30/hello-kitty-owner-soars-on-china-license-deal-with-alibaba-unit
Vietnam to Step Up Anti-Corruption Campaign After ...,Bloomberg.com,2022-06-29,https://www.bloomberg.com/news/articles/2022-06-30/-can-t-be-corrupt-vietnam-vows-to-step-up-anti-graft-campaign
Johnson and Macron Have Different Visions of a European ...,Bloomberg.com,2022-06-29,https://www.bloomberg.com/news/articles/2022-06-29/johnson-and-macron-have-different-visions-of-a-european-alliance
Ethereum had successful dress rehearsal to move to proof-of-stake - CNBC,Inferse.com,2022-06-29,https://www.inferse.com/134086/ethereum-had-successful-dress-rehearsal-to-move-to-proof-of-stake-cnbc/
"Sanderson Says Its Purchase by Cargill, Continental Is Delayed",Bloomberg.com,2022-06-29,https://www.bloomberg.com/news/articles/2022-06-29/sanderson-says-its-purchase-by-cargill-continental-is-delayed
New Zealand to Enter Recession in 2023 as Confidence ...,Bloomberg.com,2022-06-29,https://www.bloomberg.com/news/articles/2022-06-30/new-zealand-to-enter-recession-in-2023-as-confidence-slumps-bnz
Another GST Council Meeting Concludes Without Any Decision Made On Compensation Period Extension,Outlook India,2022-06-29,https://www.outlookindia.com/business/gst-compensation-to-states-gst-council-meeting-gst-council-another-gst-council-meeting-concludes-without-any-decision-made-on-compensation-period-extension-news-205605
Europeans Badly Underestimate Scientists' Agreement on ...,Bloomberg.com,2022-06-29,https://www.bloomberg.com/news/articles/2022-06-29/scientists-agree-on-man-made-climate-change-more-than-people-think
Here's How Much $100 Invested In IDEXX Laboratories 15 Years Ago Would Be Worth Today,Benzinga,2022-06-29,https://www.benzinga.com/news/earnings/22/06/27904389/heres-how-much-100-invested-in-idexx-laboratories-15-years-ago-would-be-worth-today
Oaktree's Howard Marks says he's buying aggressively ...,Finbold,2022-06-29,https://finbold.com/oaktrees-howard-marks-says-hes-buying-aggressively-heres-what-hes-eyeing/
McConnell Says Blocking Obama Supreme Court Pick Led to ...,Bloomberg.com,2022-06-29,https://www.bloomberg.com/news/articles/2022-06-29/mcconnell-says-blocking-obama-court-pick-led-to-overturning-roe
How Catholicism Lost Political Clout in the Philippines,Bloomberg.com,2022-06-29,https://www.bloomberg.com/opinion/articles/2022-06-29/bongbong-marcos-and-the-waning-clout-of-catholicism-in-the-philippines
Make FUBO Stock a Great Bet on Going Long,InvestorPlace,2022-06-29,https://investorplace.com/2022/06/make-fubo-stock-a-great-bet-on-going-long/
Acheter du bitcoin (BTC) sans KYC : Est-ce possible ?,Cointribune,2022-06-29,https://www.cointribune.com/guides-crypto/comment-acheter/acheter-du-bitcoin-btc-sans-kyc-est-ce-possible/
