Title,Publisher,Date,Link
"Instagram to Add Support for NFTs on Ethereum, Solana and Other Chains",U.Today,2022-05-08,https://u.today/instagram-to-add-support-for-nfts-on-ethereum-solana-and-other-chains
Bitcoin and Ethereum Are at Risk of Capitulation,Crypto Briefing,2022-05-08,https://cryptobriefing.com/bitcoin-and-ethereum-are-at-risk-of-capitulation/
"Whales Are Quiety Accumulating ApeCoin, Loopring and Five Additional Ethereum-Based Altcoins, According to ...",The Daily Hodl,2022-05-08,https://dailyhodl.com/2022/05/08/whales-are-quiety-accumulating-apecoin-loopring-and-five-additional-ethereum-based-altcoins-according-to-whalestats/
Ethereum Gearing Up for Parabolic Rally As Upside Potential for Bitcoin Looks Strong: Crypto Analyst,The Daily Hodl,2022-05-08,https://dailyhodl.com/2022/05/08/ethereum-gearing-up-for-parabolic-rally-as-upside-potential-for-bitcoin-looks-strong-crypto-analyst/
Here’s why Ethereum may face mounting odds against a recovery,AMBCrypto,2022-05-08,https://ambcrypto.com/heres-why-ethereum-may-face-mounting-odds-against-a-recovery/
Polygon CEO: 3 Reasons Why Matic Is the Best Layer-2 on ...,Business Insider,2022-05-08,https://www.businessinsider.com/polygon-crypto-ethereum-matic-nft-ceo-layer2-web3-2022-5
"Ethereum Price Prediction for Today, May 8: ETH Slides ...",InsideBitcoins,2022-05-08,https://insidebitcoins.com/news/ethereum-price-prediction-for-today-may-8-eth-slides-below-2400-support
"Bitcoin Below USD 34K, Ethereum Keeps Trending Lower ...",Crypto News,2022-05-08,https://cryptonews.com/news/bitcoin-below-usd-34k-ethereum-keeps-trending-lower-xmr-axs-and-near-rally.htm
What is Avalanche? An A-Z Guide to the “Ethereum Killer”,Coinfomania,2022-05-08,https://coinfomania.com/what-is-avalanche/
"WATCH Elon Musk on Bitcoin, Cryptocurrency, Renewable Energy and Twitter",SAPeople,2022-05-08,https://www.sapeople.com/2022/05/08/watch-elon-musk-on-bitcoin-cryptocurrency-renewable-energy-and-twitter/
Coinsfera Made Buy and Sell Cryptocurrency in Dubai Very Easy,Yahoo Finance,2022-05-08,https://finance.yahoo.com/news/coinsfera-made-buy-sell-cryptocurrency-150000636.html
