Title,Publisher,Date,Link
ETH’s Shanghai update: Assessing what it means for the Ethereum ecosystem,AMBCrypto,2022-03-26,https://ambcrypto.com/eths-shanghai-update-assessing-what-it-means-for-the-ethereum-ecosystem/
"Ethereum price could continue uptrend as altcoin sets eyes on $6,000 target",FXStreet,2022-03-26,https://www.fxstreet.com/cryptocurrencies/news/ethereum-price-could-continue-uptrend-as-altcoin-sets-eyes-on-6-000-target-202203261349
Ethereum Alternative and Two Low-Cap Altcoins Surge More Than 60% in Just One Week,The Daily Hodl,2022-03-26,https://dailyhodl.com/2022/03/26/ethereum-alternative-and-two-low-cap-altcoins-surge-more-than-60-percent-in-just-one-week/
"Choppy Bitcoin & Ethereum Movements, Mulling Regulators ...",Crypto News,2022-03-26,https://cryptonews.com/exclusives/choppy-bitcoin-ethereum-movements-mulling-regulators-scamy-hackers-20-crypto-jokes.htm
"DeFi Project Spotlight: Tornado Cash, Ethereum's Top Privacy ...",Crypto Briefing,2022-03-26,https://cryptobriefing.com/defi-project-spotlight-tornado-cash-ethereums-top-privacy-tool/
Ethereum Whales Are Accumulating Top ETH Rival and Dropping Dogecoin Competitor Shiba Inu,The Daily Hodl,2022-03-26,https://dailyhodl.com/2022/03/26/ethereum-whales-are-accumulating-top-eth-rival-and-dropping-dogecoin-doge-competitor-shiba-inu-shib/
Ethereum Founder Is Backing Zambia's Bid to be Africa's Tech ...,Bloomberg.com,2022-03-26,https://www.bloomberg.com/news/articles/2022-03-27/ethereum-founder-is-backing-zambia-s-bid-to-be-africa-s-tech-hub
The Quick Guide to Mining Ethereum,MakeUseOf,2022-03-26,https://www.makeuseof.com/ethereum-mining-quick-guide/
"1% TDS On Bitcoin, Ethereum, Other Virtual Digital Assets; What Does It Mean?",Outlook India,2022-03-26,https://www.outlookindia.com/business/1-tds-on-bitcoin-ethereum-other-virtual-digital-assets-what-does-it-mean--news-188678
"Bitcoin, Ethereum Technical Analysis: BTC, ETH Begin ...",Bitcoin.com News,2022-03-26,https://news.bitcoin.com/bitcoin-ethereum-technical-analysis-btc-eth-begin-weekend-close-to-key-resistance-levels/
Top 10 Ethereum Wallets Now Hold 23.7% of Total ETH Supply: Santiment,U.Today,2022-03-26,https://u.today/top-10-ethereum-wallets-now-hold-237-of-total-eth-supply-santiment
"The Mosque NFTs to mint 12,000 Shariah Compliant Digital ...",NewsBTC,2022-03-26,https://www.newsbtc.com/news/company/the-mosque-nfts-to-mint-12000-shariah-compliant-digital-mosques-on-ethereum/
"The Mosque NFT Project to Mint 12,000 Mosques on Ethereum, to Support Over 10 Charities | Bitcoinist.com",Bitcoinist,2022-03-26,https://bitcoinist.com/the-mosque-nft-project-to-mint-12000-mosques-on-ethereum-to-support-over-10-charities/
Bitcoin vs. Ethereum: What's the Difference?,TheStreet,2022-03-26,https://www.thestreet.com/investing/cryptocurrency/bitcoin-vs-ethereum-whats-the-difference
Crypto Price Outlook: Analysts Share Catalysts for $BTC ...,Business Insider,2022-03-26,https://www.businessinsider.com/price-outlook-bullish-catalysts-bitcoin-ethereum-major-breakouts-crypto-analysts-2022-3
"Top Ethereum Gaming Altcoin Erupts After $1,700,000,000 Treasury Plans Are Unveiled",The Daily Hodl,2022-03-26,https://dailyhodl.com/2022/03/26/top-ethereum-gaming-altcoin-erupts-as-project-reveals-plans-for-1700000000-treasury/
Analyst: Ethereum Metaverse Altcoin and Smart Contract Platform Are Set to Rally If Bitcoin ‘Plays Ni...,The Daily Hodl,2022-03-26,https://dailyhodl.com/2022/03/26/analyst-ethereum-metaverse-altcoin-and-smart-contract-platform-are-set-to-rally-if-bitcoin-plays-nice/
How to Educate Yourself on DeFi,Kiplinger,2022-03-26,https://www.kiplinger.com/investing/cryptocurrency/604448/how-to-educate-yourself-on-defi
What is front-running in crypto and NFT trading?,Cointelegraph,2022-03-26,https://cointelegraph.com/explained/what-is-front-running-in-crypto-and-nft-trading
Roqqu Partners with Bantu Blockchain,CryptoTvplus,2022-03-26,https://cryptotvplus.com/2022/03/roqqu-partners-with-bantu-blockchain/
