Title,Publisher,Date,Link
Ethereum definition: What is Ethereum and how does it work?,Marca,2022-03-06,https://www.marca.com/en/technology/2022/03/06/6224d227268e3e606a8b45d2.html
What does ethereum's move to proof of stake mean for its price?,Markets Insider,2022-03-06,https://markets.businessinsider.com/news/currencies/ethereum-blockchain-technology-crypto-cryptocurrency-ether-eth-vitalik-buterin-markets-2022-3
A whole lot of Ethereum [ETH] in your portfolio? Here are your LAMBO chances,AMBCrypto,2022-03-06,https://ambcrypto.com/a-whole-lot-of-ethereum-eth-in-your-portfolio-here-are-your-lambo-chances/
"Dolphin Entertainment to Produce TV Shows, Games, Music With Flower Girls Ethereum NFTs",Decrypt,2022-03-06,https://decrypt.co/94500/dolphin-entertainment-flower-girls-ethereum-nfts-announce-deal-tv-shows-games-music
Value Locked in Defi Sheds $55 Billion in 2 Months ...,Bitcoin.com News,2022-03-06,https://news.bitcoin.com/value-locked-in-defi-sheds-55-billion-in-2-months-ethereums-defi-dominance-loses-14/
"What is Solana, and how does it work?",Cointelegraph,2022-03-06,https://cointelegraph.com/news/what-is-solana-and-how-does-it-work
Ex-Goldman Exec on Why Majority of His Portfolio Is in ...,Cryptoglobe,2022-03-06,https://www.cryptoglobe.com/latest/2022/03/ex-goldman-exec-on-why-majority-of-his-portfolio-is-in-ethereum-instead-of-bitcoin/
Ethereum Price Analysis: ETH Facing Critical Support Ahead of the New Week,CryptoPotato,2022-03-06,https://cryptopotato.com/ethereum-price-analysis-eth-facing-critical-support-ahead-of-the-new-week/
"Ethereum Rival Terra (LUNA), Cosmos (ATOM) and Three Additional Altcoins Bullish for This Month: Crypto Str...",The Daily Hodl,2022-03-06,https://dailyhodl.com/2022/03/06/ethereum-rival-terra-luna-cosmos-atom-and-three-additional-altcoins-bullish-for-this-month-crypto-strategist/
Bitcoin Can't Finance A War: The Crypto Industry And Being ...,Forbes,2022-03-06,https://www.forbes.com/sites/lawrencewintermeyer/2022/03/06/bitcoin-cant-finance-a-war-the-crypto-industry-and-being-on-the-right-side-of-history/
"Crypto Wallet Trends in 2022: More Privacy, Security ...",Crypto News,2022-03-06,https://cryptonews.com/exclusives/crypto-wallet-trends-2022-more-privacy-security-features-choice.htm
"Precios de Bitcoin, Ethereum y Dogecoin hoy 6 de marzo en dólares, euros y pesos mexicanos",Mi Bolsillo,2022-03-06,https://www.mibolsillo.com/noticias/Precios-de-Bitcoin-Ethereum-y-Dogecoin-hoy-6-de-marzo-en-dolares-euros-y-pesos-mexicanos-20220306-0002.html
Elon Musk sparks debate about parenting after he tweets that ‘being a mom is just as important as any career’ - Yahoo News,Inferse.com,2022-03-06,https://www.inferse.com/187994/elon-musk-sparks-debate-about-parenting-after-he-tweets-that-being-a-mom-is-just-as-important-as-any-career-yahoo-news/
