Title,Publisher,Date,Link
"Crypto Crash: Bitcoin Suddenly Nukes, Sending The Price Of Ethereum, BNB, XRP, Solana, Cardano And Dogecoin Into Free Fall",Forbes,2022-06-29,https://www.forbes.com/sites/billybambrough/2022/06/29/crypto-crash-bitcoin-suddenly-nukes-sending-the-price-of-ethereum-bnb-xrp-solana-cardano-and-dogecoin-into-free-fall/
Bitcoin And Ethereum Dumping Spree,TronWeekly,2022-06-29,https://www.tronweekly.com/bitcoin-and-ethereum-dumping-spree/
"Top 3 Price Prediction Bitcoin, Ethereum, Ripple: Fresh lows for crypto markets in sight as recovery gains come undone",FXStreet,2022-06-29,https://www.fxstreet.com/cryptocurrencies/news/top-3-price-prediction-bitcoin-ethereum-ripple-fresh-lows-for-crypto-markets-in-sight-as-recovery-gains-come-undone-202206290856
What Is Staked Ether (stETH)?,Investopedia,2022-06-29,https://www.investopedia.com/staked-ether-5496378
Anchorage launches Ethereum staking for institutional investors,Cointelegraph,2022-06-29,https://cointelegraph.com/news/anchorage-launches-ethereum-staking-for-institutional-investors
Lido Community Signals Intent to Keep Ethereum Staking Uncapped,Decrypt,2022-06-29,https://decrypt.co/104064/lido-community-signals-intent-keep-ethereum-staking-uncapped
Is Ethereum Ready for Business? EEA Inaugural Report ...,Business Wire,2022-06-29,https://www.businesswire.com/news/home/20220629005165/en/Is-Ethereum-Ready-for-Business-EEA-Inaugural-Report-Investigates
"Chia Aims to Take on Ethereum, Solana With NFTs. Will They Blossom?",Decrypt,2022-06-29,https://decrypt.co/104049/chia-aims-take-ethereum-solana-nfts-will-they-blossom
Coinbase Adds Solana Staking Rewards—With Higher Return Than Ethereum,Decrypt,2022-06-29,https://decrypt.co/104091/coinbase-solana-staking-rewards-ethereum
A Major Crypto Exchange Abandons Ethereum: Is the World’s Computer Falling Behind?,CoinDesk,2022-06-29,https://www.coindesk.com/layer2/2022/06/29/a-major-crypto-exchange-abandons-ethereum-is-the-worlds-computer-falling-behind/
Arbitrum Pauses Odyssey as Layer 2 Fees Surpass Ethereum ...,Crypto Briefing,2022-06-29,https://cryptobriefing.com/arbitrum-pauses-odyssey-as-l2-fees-outpace-mainnet/
"EOS: Social dominance metric spiked on 27 June, thanks to Ethereum",AMBCrypto,2022-06-29,https://ambcrypto.com/eos-social-dominance-metric-spiked-on-27-june-thanks-to-ethereum/
Buckle Up: How investors can deal with crypto turbulence,Reuters,2022-06-29,https://www.reuters.com/markets/wealth/buckle-up-how-investors-can-deal-with-crypto-turbulence-2022-06-30/
"Crypto risks 'elevated,' Bitcoin's next price support is below ...",KITCO,2022-06-29,https://www.kitco.com/news/2022-06-29/Crypto-risks-elevated-Bitcoin-s-next-price-support-is-below-14k-Ethereum-s-is-below-500-Fairlead-Strategies.html
TA: Ethereum Key Indicators Suggest A Sharp Drop Below $1K,NewsBTC,2022-06-29,https://www.newsbtc.com/analysis/eth/ethereum-drop-below-1k/
"Watch out for Ethereum price as technical indicators point to dip below $1,000",FXStreet,2022-06-29,https://www.fxstreet.com/cryptocurrencies/news/watch-out-for-ethereum-price-as-technical-indicators-point-to-below-1-000-202206291306
Ethereum NFT Trading Volume Falls By 70% in June—But Number of Sales Steady,Decrypt,2022-06-29,https://decrypt.co/104101/ethereum-nft-trading-volume-falls-by-70-in-june-but-number-of-sales-steady
"Bitcoin Dips Below $20,000 as Crypto Market Pressure Intensifies",Decrypt,2022-06-29,https://decrypt.co/104055/bitcoin-dips-below-20000-crypto-market-pressure-intensifies
"Bitcoin, Ethereum, Crypto News and Price Data","CoinDesk: Bitcoin, Ethereum, Crypto News and Price Data",2022-06-29,https://www.coindesk.com/tv/all-about-bitcoin/all-about-bitcoin-june-29-2022/
"Analyst Predicts Ethereum (ETH) Bounce, Updates Outlook on XRP and Fantom (FTM)",The Daily Hodl,2022-06-29,https://dailyhodl.com/2022/06/28/analyst-predicts-ethereum-eth-bounce-updates-outlook-on-xrp-and-fantom-ftm/
What Are Layer 2s and Why Are They Important?,CoinDesk,2022-06-29,https://www.coindesk.com/learn/what-are-layer-2s-and-why-are-they-important/
Bitcoin and Ethereum most traded cryptocurrencies among ...,ZAWYA,2022-06-29,https://www.zawya.com/en/press-release/companies-news/bitcoin-and-ethereum-most-traded-cryptocurrencies-among-saxo-banks-regional-client-base-wsjyxgjy
"Cryptocurrencies Price Prediction: Ethereum, Shiba & Bitcoin – American Wrap 29 June",FXStreet,2022-06-29,https://www.fxstreet.com/cryptocurrencies/news/cryptocurrencies-price-prediction-ethereum-shiba-bitcoin-american-wrap-29-june-202206290300
Gal Gadot-Backed AdaSwap Launches Public Testnet,CryptoPotato,2022-06-29,https://cryptopotato.com/gal-gadot-backed-adaswap-launches-public-testnet/
"39% Millennials Own Crypto, Reveals Research; Bitcoin Falls",Outlook India,2022-06-29,https://www.outlookindia.com/business/39-millennials-own-crypto-reveals-research-bitcoin-falls-news-205612
BOSAGORA Launches Its BizNet to Build Business Network,Business Wire,2022-06-29,https://www.businesswire.com/news/home/20220629005377/en/BOSAGORA-Launches-Its-BizNet-to-Build-Business-Network
"Finally, Ronin Bridge Comes Back To Life After 3 Months",TronWeekly,2022-06-29,https://www.tronweekly.com/finally-ronin-bridge-comes-back-to-life/
ConsenSys Partners With StarkWare,Crypto Briefing,2022-06-29,https://cryptobriefing.com/consensys-partners-with-starkware/
What is cryptocurrency's dirty environmental secret? | Greenbiz,GreenBiz,2022-06-29,https://www.greenbiz.com/article/what-cryptocurrencys-dirty-environmental-secret
Nansen Analysis Examines How Terra Collapse Affected Celsius and Three Arrows Capital,Decrypt,2022-06-29,https://decrypt.co/104102/nansen-analysis-examines-how-terra-collapse-affected-celsius-and-three-arrows-capital
Bit.com Plans to Double Workforce as Layoffs Mount in Crypto ...,Forbes India,2022-06-29,https://www.forbesindia.com/article/crypto-made-easy/bitcom-plans-to-double-workforce-as-layoffs-mount-in-crypto-and-financial-markets/77725/1
Polygon Deploys Custom Blockchain Scaling System 'Avail',CoinDesk,2022-06-29,https://www.coindesk.com/tech/2022/06/29/polygon-deploys-custom-blockchain-scaling-solution-avail/
Bitfury’s CEO Explains Why Bitcoin Is Proned for Upcoming Gains,CryptoPotato,2022-06-29,https://cryptopotato.com/bitfurys-ceo-explains-why-bitcoin-is-proned-for-upcoming-gains/
"Bitcoin Prices Fight for $20,000 as Cryptos Follow Slide in Stocks",Barron's,2022-06-29,https://www.barrons.com/articles/bitcoin-ethereum-prices-crypto-today-51656495819
"Robert Kiyosaki Awaits BTC Testing $1,100, Michael Saylor Advises Investors, Cardano Becomes Most Actively Developed Project: Crypto News Digest by U.Today",U.Today,2022-06-29,https://u.today/robert-kiyosaki-awaits-btc-testing-1100-michael-saylor-advises-investors-cardano-becomes-most
North Korean Attackers Behind $100M Harmony Hack: Report,Decrypt,2022-06-29,https://decrypt.co/104138/north-korean-attackers-behind-100m-harmony-hack-report
BabyDoge Down 10% Amid Decision to Burn 50 Quadrillion Tokens,U.Today,2022-06-29,https://u.today/babydoge-down-10-amid-decision-to-burn-50-quadrillion-tokens
Launch Of The Year - Logarithmic Finance (LOG) Is Finally Here | Bitcoinist.com,Bitcoinist,2022-06-29,https://bitcoinist.com/launch-of-the-year-logarithmic-finance-log-is-finally-here/
Bitcoin is Still Due for a “Final Washout” says Fundstrat Analyst,CryptoPotato,2022-06-29,https://cryptopotato.com/bitcoin-is-still-due-for-a-final-washout-says-fundstrat-analyst/
Crypto Market Forecast: Midweek Update 30th June 2022 ...,Brave New Coin,2022-06-29,https://bravenewcoin.com/insights/crypto-market-forecast-midweek-update-30th-june-2022
House flippers are gentrifying neighborhoods with crypto mining now,Input Mag,2022-06-29,https://www.inputmag.com/culture/house-flipper-sell-philadelphia-home-crypto-mining-rig
Saylor’s faith in Bitcoin unshaken as MicroStrategy buys another 480 BTC,CryptoSlate,2022-06-29,https://cryptoslate.com/saylors-faith-in-bitcoin-unshaken-as-microstrategy-buys-another-480-btc/
Deutsche Bank: Crypto Free Fall Could Continue Because of the System’s Complexity,CoinDesk,2022-06-29,https://www.coindesk.com/markets/2022/06/29/deutsche-bank-crypto-freefall-could-continue-because-of-the-systems-complexity/
NFT Giant OpenSea Shares 5 Safety Recommendations as ...,Crypto News,2022-06-29,https://cryptonews.com/news/nft-giant-opensea-shares-5-safety-recommendations-as-users-emails-leaked.htm
"Crypto Should Be Banned, Blockchain Has No Value: Former ...",Business Insider,2022-06-29,https://www.businessinsider.com/crypto-bitcoin-ethereum-federal-reserve-blockchain-regulation-senator-lummins-reiners-2022-6
Citadel Securities business development head to lead the new crypto venture firm,CryptoSlate,2022-06-29,https://cryptoslate.com/citadel-securities-business-development-head-to-lead-the-new-crypto-venture-firm/
Celebrity-Endorsed Crypto Scams On Pace To Nearly Double This Year In UK: Santander,ABP LIVE,2022-06-29,https://news.abplive.com/business/crypto/crypto-scam-celebrity-endorse-santander-uk-grow-volume-increase-nearly-double-2022-1539863
Market Wrap: Bear Market Guides in Vogue as Bitcoin Drops for Fourth Straight Day,CoinDesk,2022-06-29,https://www.coindesk.com/markets/2022/06/29/market-wrap-bear-market-guides-in-vogue-as-bitcoin-drops-fourth-straight-day/
The Sandbox Launches A Polygon LAND Bridge,NFT Evening,2022-06-29,https://nftevening.com/the-sandbox-launches-a-polygon-land-bridge/
The central African Republic launches crypto initiative post ...,Forbes India,2022-06-29,https://www.forbesindia.com/article/crypto-made-easy/the-central-african-republic-launches-crypto-initiative-post-bitcoin-adoption/77713/1
Why Crypto Prices Plummeted Today,The Motley Fool,2022-06-29,https://www.fool.com/investing/2022/06/29/why-crypto-prices-crashed-today/
"CoinFLEX CEO Says Roger Ver Owes Them USDC 47M, Ver ...",Crypto News,2022-06-29,https://cryptonews.com/news/coinflex-ceo-says-roger-ver-owes-them-usdc-47m-ver-denies-the-claim.htm
CoinFlex CEO Claims Roger Ver Owes it $47 Million,Business 2 Community,2022-06-29,https://www.business2community.com/crypto-news/coinflex-ceo-claims-roger-ver-owes-it-47-million-02512730
Immutable X Token Price Prediction 2022 - IMX Staking Live ...,Business 2 Community,2022-06-29,https://www.business2community.com/crypto-news/immutable-x-token-price-prediction-2022-imx-staking-live-july-2022-02512731
Indian Crypto Companies Migrate Amidst Unclear Regulations | Bitcoinist.com,Bitcoinist,2022-06-29,https://bitcoinist.com/indian-crypto-companies-migrate-unclear-regulations/
"Celsius carried more risk than traditional banks, investor documents show",CryptoSlate,2022-06-29,https://cryptoslate.com/celsius-carried-more-risk-than-traditional-banks-investor-documents-show/
SBF claims smaller crypto exchanges will fail soon,CryptoSlate,2022-06-29,https://cryptoslate.com/some-crypto-exchanges-will-fail-soon-warns-ftx-founder/
‘I Don't Follow Trends’: Multicoin’s Kyle Samani on How to Make It in Crypto,CoinDesk,2022-06-29,https://www.coindesk.com/layer2/futureofworkweek/2022/06/29/i-dont-follow-trends-multicoins-kyle-samani-on-how-to-make-it-in-crypto/
"Gnox Network Continues GNOX Pre-Sale as DOGE, TRX Started Recovering",U.Today,2022-06-29,https://u.today/gnox-network-continues-gnox-pre-sale-as-doge-trx-started-recovering
Taiwan joins growing list of countries developing CBDCs,CryptoSlate,2022-06-29,https://cryptoslate.com/taiwan-joins-growing-list-of-countries-developing-cbdcs/
DAOs Are the Real Meritocracies,CoinDesk,2022-06-29,https://www.coindesk.com/layer2/futureofworkweek/2022/06/29/daos-are-the-real-meritocracies/
Citi Flags Crypto-Backed Real Estate Mortgages Amid Falling Market Conditions,CoinDesk,2022-06-29,https://www.coindesk.com/business/2022/06/29/citi-flags-crypto-backed-real-estate-mortgages-amid-falling-market-conditions/
Grayscale Sues SEC Over Bitcoin ETF Application Rejection,CoinDesk,2022-06-29,https://www.coindesk.com/policy/2022/06/30/grayscale-sues-sec-over-bitcoin-etf-application-rejection/
Marathon’s Crypto Mining Capacity Crippled Due to a Massive Storm,CryptoPotato,2022-06-29,https://cryptopotato.com/marathons-crypto-mining-capacity-crippled-due-to-a-massive-storm/
"Compass Mining denies allegations of $1.2M unpaid electricity bill, CEO, CFO resign",CryptoSlate,2022-06-29,https://cryptoslate.com/compass-mining-denies-allegations-ceo-cfo-resign/
North Korea's $400M Crypto Losses Could Hurt Its Nuclear Weapons Program: Report,Decrypt,2022-06-29,https://decrypt.co/104061/north-koreas-400m-crypto-losses-could-hurt-its-nuclear-weapons-program-report
Polkadot Chief Gavin Wood Announces Blockchain Governance Upgrade,CoinDesk,2022-06-29,https://www.coindesk.com/tech/2022/06/29/polkadot-chief-gavin-wood-announces-blockchain-governance-upgrade/
Azra Games Announces New RPG Title Legions & Legends,Bleeding Cool,2022-06-29,https://bleedingcool.com/games/azra-games-announces-new-rpg-title-legions-legends/
Can RoboApe (RBA) and the Graph (GRT) Ever Match Bitcoin’s (BTC) Price? | Bitcoinist.com,Bitcoinist,2022-06-29,https://bitcoinist.com/can-roboape-rba-and-the-graph-grt-ever-match-bitcoins-btc-price/
BVI Court Orders Liquidation of Three Arrows Capital,Business 2 Community,2022-06-29,https://www.business2community.com/crypto-news/bvi-court-orders-liquidation-of-three-arrows-capital-02512919
Cardano vs Solana: Here's Why SOL is a Better Buy than ADA,CoinJournal,2022-06-29,https://coinjournal.net/news/cardano-vs-solana-heres-why-sol-is-a-better-buy-than-ada/
Tom Lee's Fundstrat Warns of Big Bitcoin Sell-Off,U.Today,2022-06-29,https://u.today/tom-lees-fundstrat-warns-of-big-bitcoin-sell-off
Hive Crypto Social Networking Platform Price Rallies 16 ...,Business 2 Community,2022-06-29,https://www.business2community.com/crypto-news/hive-crypto-social-networking-platform-price-rallies-16-volume-up-14000-02513254
Compass Mining Leadership Steps Down Following Alleged Non-Payment Debacle,CryptoPotato,2022-06-29,https://cryptopotato.com/compass-mining-leadership-steps-down-following-alleged-non-payment-debacle/
Where to Buy DeFi Kingdoms (JEWEL) 2022,Business 2 Community,2022-06-29,https://www.business2community.com/cryptocurrency/buy-defi-kingdoms
Zia ul Haque: 5 NFT Projects Destined for Greatness,Deccan Herald,2022-06-29,https://www.deccanherald.com/brandspot/pr-spot/zia-ul-haque-5-nft-projects-destined-for-greatness-1122393.html
Chainlink’s Smart Contract Products Go Live on Fantom,CoinDesk,2022-06-29,https://www.coindesk.com/tech/2022/06/29/chainlinks-smart-contract-products-go-live-on-fantom/
We Now Understand How Little We Understand About ...,Crypto News,2022-06-29,https://cryptonews.com/news/we-now-understand-how-little-we-understand-about-inflation-feds-powell.htm
"Owen ""Hasheur"" Simonin: Big crypto players will shape ...",CryptoSlate,2022-06-29,https://cryptoslate.com/videos/owen-hasheur-simonin-crypto-players-will-shape-regulation/
Crypto crisis: how digital currencies went from boom to collapse,The Guardian,2022-06-29,https://www.theguardian.com/technology/2022/jun/29/crypto-crisis-digital-currencies-boom-collapse-bitcoin-terra
"LexisNexis feeds flight data to blockchain via Chainlink, for ...",Ledger Insights,2022-06-29,https://www.ledgerinsights.com/lexisnexis-flight-data-blockchain-chainlink-for-parametric-insurance/
Web3 Cryptos Explained - A Guide to Web3 Cryptocurrencies,CoinDesk,2022-06-29,https://www.coindesk.com/learn/what-are-web3-cryptos/
"As Solana Plans Own Blockchain Phone, What Happened to ...",Crypto News,2022-06-29,https://cryptonews.com/exclusives/as-solana-plans-own-blockchain-phone-what-happened-pioneers.htm
"Coin Bureau Names Potential ‘Future Gems,’ Including Avalanche (AVAX), Helium (HNT) and Two More Altcoins",The Daily Hodl,2022-06-29,https://dailyhodl.com/2022/06/29/coin-bureau-names-potential-future-gems-including-avalanche-avax-helium-hnt-and-two-more-altcoins/
"CoinDesk's Markets Daily: Payroll, Web3 and the $62B ...",CoinDesk,2022-06-29,https://www.coindesk.com/podcasts/markets-daily/crypto-news-roundup-for-june-29-2022/
First Mover Asia: How Traders Are Shorting Tether Stablecoins; Bitcoin Falls but Holds Above $20K,CoinDesk,2022-06-29,https://www.coindesk.com/markets/2022/06/29/first-mover-asia-how-traders-are-shorting-tether-stablecoins-bitcoin-falls-but-holds-above-20k/
Young Web3 Believers Unfazed by Battered Crypto Market,CoinDesk,2022-06-29,https://www.coindesk.com/layer2/futureofworkweek/2022/06/29/young-web3-believers-unfazed-by-battered-crypto-market/
The New HTC Desire 22 Pro Comes with Crypto and NFT Wallet Features,Coinspeaker,2022-06-29,https://www.coinspeaker.com/htc-desire-22-pro-crypto-nft-wallet-features/
"TRON Breaks the 100 Million Users Mark, Celebrates Mainnet 4th Anniversary, and Announces Huge Hiring Push Amid Market Meltdown",Coinspeaker,2022-06-29,https://www.coinspeaker.com/tron-100-million-users-mainnet-4th-anniversary-announces-hiring/
Three Arrows Capital Ordered to Liquidate After Defaulting on ...,CoinDesk,2022-06-29,https://www.coindesk.com/video/first-mover-on-cdtv-clips/three-arrows-capital-ordered-to-liquidate-after-defaulting-on-670m-loan/
Bitcoin Miners in China See Bleak Futures Ahead as Outlook ...,Business 2 Community,2022-06-29,https://www.business2community.com/crypto-news/bitcoin-miners-in-china-see-bleak-futures-ahead-as-outlook-darkens-02512566
"EU Finalizes Crypto Anti-Money Laundering Rules, Walks Back Tracking of Private Wallets",Decrypt,2022-06-29,https://decrypt.co/104110/eu-crypto-anti-money-laundering-rules-private-wallets
You Shall Not Pass This Opportunity: How OneRing Will Dominate DeFi 2.0,CryptoMode,2022-06-29,https://cryptomode.com/you-shall-not-pass-this-opportunity-how-onering-will-dominate-defi-2-0/
"Michael Burry Identifies 'Bullwhip Effect' in Retail, Could the ...",BeInCrypto,2022-06-29,https://beincrypto.com/michael-burry-identifies-bullwhip-effect-in-retail-could-the-fed-reverse-course/
Yield App Joins Forces with Unstoppable Domains to Simplify Web3 Journey,Coinspeaker,2022-06-29,https://www.coinspeaker.com/yield-app-unstoppable-domains-simplify-web3-journey/
Binance USD (BUSD): Fully-Backed and Regulated Stablecoin,CryptoPotato,2022-06-29,https://cryptopotato.com/binance-usd-busd-fully-backed-and-regulated-stablecoin/
LINK Shows Extremely Suspicious On-Chain Activity as Largest Amount Since Genesis Gets Moved,U.Today,2022-06-29,https://u.today/link-shows-extremely-suspicious-on-chain-activity-as-largest-amount-since-genesis-gets-moved
How to Tweak Your NFT Strategy Amid Crypto Winter,Inc. Magazine,2022-06-29,https://www.inc.com/xintian-tina-wang/nft-crypto-winter-bitcoin.html
Here's Exact Point of Bitcoin Switching from Bear to Bull Market,U.Today,2022-06-29,https://u.today/heres-exact-point-of-bitcoin-switching-from-bear-to-bull-market
"As NATO troops double, so do the bears' army in XRP",FXStreet,2022-06-29,https://www.fxstreet.com/cryptocurrencies/news/as-nato-troops-double-so-do-the-bears-army-in-xrp-202206291136
Can Blockchain Help Solve the Climate Crisis? An Interview ...,Block Telegraph,2022-06-29,https://blocktelegraph.io/can-blockchain-help-solve-the-climate-crisis-an-interview-with-klimadao/
"Influencers Are Responsible for 92% of Crypto Ad Violations in India, Report Says",CoinDesk,2022-06-29,https://www.coindesk.com/policy/2022/06/29/influencers-are-responsible-for-92-of-crypto-ad-violations-in-india-report-says/
Crypto Warning From Within: Billionaire Says More Bad News Ahead,TheStreet,2022-06-29,https://www.thestreet.com/investing/cryptocurrency/crypto-warning-from-within-billionaire-says-more-bad-news-ahead
Is now a Good Time to buy Uniswap (UNI)? • Benzinga,Benzinga,2022-06-29,https://www.benzinga.com/money/is-now-a-good-time-to-buy-uniswap
"Meet ‘Frequency,’ Polkadot’s New Decentralized Social Media Parachain",CoinDesk,2022-06-29,https://www.coindesk.com/tech/2022/06/29/meet-frequency-polkadots-new-decentralized-social-media-parachain/
US Infrastructure Law’s Reporting Requirements for Crypto Brokers Likely to Face Delay,CoinDesk,2022-06-29,https://www.coindesk.com/policy/2022/06/29/us-infrastructure-laws-reporting-requirements-for-crypto-brokers-likely-to-face-delay/
"Coinbase Commerce Announces Feature Update, Support for New Assets",Coinspeaker,2022-06-29,https://www.coinspeaker.com/coinbase-commerce-feature-update-new-assets/
Can Shiba Inu’s dissociation from Bitcoin help SHIB rally in Q3,AMBCrypto,2022-06-29,https://ambcrypto.com/can-shiba-inus-dissociation-from-bitcoin-help-shib-rally-in-q3/
Florida readies itself for a crypto real estate wave,Business Observer,2022-06-29,https://www.businessobserverfl.com/article/florida-readies-itself-for-a-crypto-real-estate-wave
Community Owned CryptoOracle Collective Announces the ...,Block Telegraph,2022-06-29,https://blocktelegraph.io/community-owned-cryptooracle-collective-announces-the-first-25-members-of-its-decentralized-web3-consultancy/
52% of Dogecoin Addresses Remain in Profit Despite Recent Price Drop,U.Today,2022-06-29,https://u.today/52-of-dogecoin-addresses-remain-in-profit-despite-recent-price-drop
"Terra's USTC, LUNC Pump While Market Bleeds - What's ...",Business 2 Community,2022-06-29,https://www.business2community.com/crypto-news/terras-ustc-lunc-pump-while-market-bleeds-whats-behind-the-rally-02513293
USTC Price is Skyrocketing: Will Terra Classic USD Regain its ...,CoinJournal,2022-06-29,https://coinjournal.net/news/ustc-price-is-skyrocketing-will-terra-classic-usd-regain-its-peg/
"LUNC & USTC Show Double-Digit Growth Amid Crypto Market Drop, What's Wrong with Them?",U.Today,2022-06-29,https://u.today/lunc-ustc-show-double-digit-growth-amid-crypto-market-drop-whats-wrong-with-them
Bitcoin Dips Under $20K on Blunted Growth Sentiment as Spain Fuels Inflation Concerns,CoinDesk,2022-06-29,https://www.coindesk.com/markets/2022/06/29/bitcoin-dips-under-20k-on-blunted-growth-sentiment-as-spain-fuels-inflation-concerns/
NIO Stock Falls after Short-Seller Accuses the Company of ...,Business 2 Community,2022-06-29,https://www.business2community.com/stock-news/nio-stock-falls-after-short-seller-accuses-the-company-of-fraud-02512829
"DeFi Shouldn't Be Regulated, Crypto Advocates Tell UK Regulator",CoinDesk,2022-06-29,https://www.coindesk.com/policy/2022/06/29/defi-should-not-be-regulated-crypto-advocates-tell-uk-regulator/
Can I Bet on Roulette with Cryptocurrencies?,CryptoCoin.News,2022-06-29,https://cryptocoin.news/sponsored/can-i-bet-on-roulette-with-cryptocurrencies-73159/
Reasons why Cardano [ADA] holders will be very pleased in July,AMBCrypto,2022-06-29,https://ambcrypto.com/reasons-why-cardano-ada-holders-will-be-very-happy-in-july/
Crypto Derivatives Exchange Bybit to Settle Options Contracts in USDC,CoinDesk,2022-06-29,https://www.coindesk.com/markets/2022/06/29/crypto-derivatives-exchange-bybit-to-settle-options-contracts-in-usdc/
$4 Billion Crypto Ponzi Scheme Getting Documentary Treatment,U.Today,2022-06-29,https://u.today/4-billion-crypto-ponzi-scheme-getting-documentary-treatment
Bitcasino launches World Cup campaign with Raffle prizes including VIP match tickets,AMBCrypto,2022-06-29,https://ambcrypto.com/bitcasino-launches-world-cup-campaign-with-raffle-prizes-including-vip-match-tickets/
Hong Kong's Broken Billionaire Factory Shows City Losing Step,Bloomberg.com,2022-06-29,https://www.bloomberg.com/news/features/2022-06-29/hong-kong-s-broken-billionaire-factory-shows-city-losing-step
Pantera's Dan Morehead Blames Fed's Mistakes for Crypto ...,Bloomberg.com,2022-06-29,https://www.bloomberg.com/news/articles/2022-06-29/more-major-crypto-meltdowns-to-come-pantera-s-morehead-says
Bitcoin Jesus denies default; Celsius fight back planned,Forkast,2022-06-29,https://forkast.news/video-audio/bitcoin-jesus-denies-default-celsius-fight-back-planned/
"Bitcoin briefly drops below $20,000 again as pressure continues to mount on crypto market",CNBC,2022-06-29,https://www.cnbc.com/2022/06/29/bitcoin-btc-briefly-drops-below-20000-as-pressure-mounts-on-crypto.html
XXL Partners with Fanpage to Drop Debut NFT,Live 5 News,2022-06-29,https://www.live5news.com/prnewswire/2022/06/29/xxl-partners-with-fanpage-drop-debut-nft/?outputType=amp
Airtel Payments Bank Partners With Axis Bank To Digitise Last Mile Cash Collection,Outlook India,2022-06-29,https://www.outlookindia.com/business/airtel-payments-bank-partners-with-axis-bank-to-digitise-last-mile-cash-collection-news-205643
TRON (TRX) Sustains Its Long-Term Support Line!,NameCoinNews,2022-06-29,https://www.namecoinnews.com/tron-sustains-its-long-term-support-line/
Bitcoin Miner Compass Denies Allegations of Unpaid Power Bills to Dynamics,Decrypt,2022-06-29,https://decrypt.co/104097/bitcoin-miner-compass-denies-allegations-of-unpaid-bills-to-dynamics
Why This Crypto Crash Is Different,CoinDesk,2022-06-29,https://www.coindesk.com/layer2/futureofmoney/2022/06/29/why-this-crypto-crash-is-different/
Cross-chain Bridge Thefts Top $1B in 2022,Blockworks,2022-06-29,https://blockworks.co/cross-chain-bridge-thefts-top-1b-in-2022/
Centrifuge Introduces Connectors Mechanism to Integrate RWAs into DeFi,U.Today,2022-06-29,https://u.today/centrifuge-introduces-connectors-mechanism-to-integrate-rwas-into-defi
"KPMG Enters The Metaverse, Invests $30M On Web3 Training",NFT Evening,2022-06-29,https://nftevening.com/kpmg-enters-the-metaverse-invests-30m-on-web3-training/
Is the Safemoon price warning investors of a future rug pull?,FXStreet,2022-06-29,https://www.fxstreet.com/cryptocurrencies/news/is-the-safemoon-price-warning-investors-of-a-future-rug-pull-202206292214
"Former Coinbase Executive Gives an ""Unusual"" Indication in Ripple-SEC Lawsuit",U.Today,2022-06-29,https://u.today/former-coinbase-executive-gives-an-unusual-indication-in-ripple-sec-lawsuit
"Gold Price Analysis: XAUUSD rebounds swiftly from two-week low, jumps to $1,835 area",FXStreet,2022-06-29,https://www.fxstreet.com/news/gold-price-analysis-xauusd-rebounds-swiftly-from-two-week-low-jumps-to-1-835-area-202206291327
