Title,Publisher,Date,Link
"Vitalik Buterin not worried about Ethereum fork, says most proponents ‘want to make a quick buck’",Fortune,2022-08-05,https://fortune.com/2022/08/06/vitalik-buterin-ethereum-creator-on-merge-ethpow/
The Ethereum Merge Resistors: Can They Succeed?,Decrypt,2022-08-05,https://decrypt.co/106815/ethereum-merge-resistors-can-they-succeed
Justin Sun Backs Ethereum Hard Fork as Merge Approaches,CoinDesk,2022-08-05,https://www.coindesk.com/business/2022/08/05/justin-sun-backs-ethereum-hard-fork-as-merge-approaches/
"Active Contribution Across Solana, Bitcoin, And Ethereum Grow",NewsBTC,2022-08-05,https://www.newsbtc.com/news/ethereum/active-contribution-across-solana-bitcoin-and-ethereum-grow/
"Bitcoin, Ethereum Technical Analysis: ETH Rebounds on ...",Bitcoin.com News,2022-08-05,https://news.bitcoin.com/bitcoin-ethereum-technical-analysis-eth-rebounds-on-friday-climbing-above-1700/
Why This One Country Alone Can Send Bitcoin and Ethereum ...,The Motley Fool,2022-08-05,https://www.fool.com/investing/2022/08/05/why-this-one-country-alone-will-send-bitcoin-and-e/
Ethereum Classic price dips become attractive,FXStreet,2022-08-05,https://www.fxstreet.com/cryptocurrencies/news/ethereum-classic-price-dips-become-attractive-202208051540
"Cardano (ADA) Beats Dogecoin, Ethereum and Bitcoin in On-Chain Transfer Volume Growth",U.Today,2022-08-05,https://u.today/cardano-ada-beats-dogecoin-ethereum-and-bitcoin-in-on-chain-transfer-volume-growth
Exploring MATIC’s long-term potential post Ethereum ‘Merge’,AMBCrypto,2022-08-05,https://ambcrypto.com/exploring-matics-long-term-potential-post-ethereums-merge/
Ethereum Users Flock to Optimism for Aave Liquidity Mining ...,Crypto Briefing,2022-08-05,https://cryptobriefing.com/ethereum-users-flock-optimism-aave-liquidity-mining-launch/
"Untold Fortune Could Await Uniglo (GLO), Bitcoin (BTC ...",Deccan Herald,2022-08-05,https://www.deccanherald.com/brandspot/pr-spot/untold-fortune-could-await-uniglo-glo-bitcoin-btc-ethereum-eth-and-fantom-ftm-1133362.html
Ethereum Creator Weighs In on Meta's Plans for the Metaverse,Acceleration Economy,2022-08-05,https://accelerationeconomy.com/metaverse/ethereum-creator-weighs-in-on-metas-plans-for-the-metaverse/
Nomad Recovers $22M of $190M in Ethereum Tokens Stolen in Hack,Decrypt,2022-08-05,https://decrypt.co/106820/nomad-recovers-ethereum-tokens-hack
"Ethereum: Will USDT, USDC hinder the future of The Merge?",Watcher Guru,2022-08-05,https://watcher.guru/news/ethereum-will-usdt-usdc-hinder-the-future-of-the-merge
Ethereum Classic (ETC) Retraces After Sharp Increase ...,BeInCrypto,2022-08-05,https://beincrypto.com/ethereum-classic-etc-retraces-after-sharp-increase-biggest-weekly-losers/
Ethereum (ETH) Competitor Pumps Nearly 35% After Announcement of New Instagram NFT Partnership,The Daily Hodl,2022-08-05,https://dailyhodl.com/2022/08/05/ethereum-eth-competitor-pumps-nearly-35-after-announcement-of-new-instagram-nft-partnership/
Ethereum Up More Than 3% In 24 hours,Benzinga,2022-08-05,https://www.benzinga.com/markets/cryptocurrency/22/08/28376118/cryptocurrency-ethereum-up-more-than-3-in-24-hours
Ethereum Classic Price Prediction: Is this the pullback we’ve been waiting for? pt.2,FXStreet,2022-08-05,https://www.fxstreet.com/cryptocurrencies/news/ethereum-classic-price-prediction-is-this-the-pullback-weve-been-waiting-for-pt2-202208052155
Cryptocurrency Ethereum Classic's Price Increased More Than 5% Within 24 hours,Benzinga,2022-08-05,https://www.benzinga.com/markets/cryptocurrency/22/08/28380428/cryptocurrency-ethereum-classics-price-increased-more-than-5-within-24-hours
"Ethereum price could provide better buying opportunities at $1,300",FXStreet,2022-08-05,https://www.fxstreet.com/cryptocurrencies/news/ethereum-price-could-provide-better-buying-opportunities-at-1-300-202208051310
"Why Coinbase, Ethereum, and Dogecoin Popped Today",The Motley Fool,2022-08-05,https://www.fool.com/investing/2022/08/05/why-coinbase-ethereum-and-dogecoin-popped-today/
Ethereum Name Service (ENS) price provides two tradable opportunities,FXStreet,2022-08-05,https://www.fxstreet.com/cryptocurrencies/news/ethereum-name-service-ens-price-provides-two-tradable-opportunities-202208051314
Is Solana the Next Ethereum Killer or a Doomed Altcoin?,InvestorPlace,2022-08-05,https://investorplace.com/2022/08/is-solana-the-next-ethereum-killer-or-a-doomed-altcoin/
"Popular Crypto Trader Forecasts What’s Next for Bitcoin (BTC), ApeCoin (APE) and Two Ethereum-Based Altcoins",The Daily Hodl,2022-08-05,https://dailyhodl.com/2022/08/05/popular-crypto-trader-forecasts-whats-next-for-bitcoin-btc-apecoin-ape-and-two-ethereum-based-altcoins/
Why Kevin Zhou Believes Ethereum Will Have 3 Forks After ...,Crypto News,2022-08-05,https://cryptonews.com/videos/why-kevin-zhou-believes-ethereum-will-have-3-forks-after-the-merge-ep-381.htm
"Largest cryptocurrencies climb on Ethereum, Polkadot increases",MarketWatch,2022-08-05,https://www.marketwatch.com/story/largest-cryptocurrencies-climb-on-ethereum-polkadot-increases-01659708035-3d0d587ca548
DeFi Protocol Voltz Could Bring 150% Interest Rate on Ether Deposits,CoinDesk,2022-08-05,https://www.coindesk.com/markets/2022/08/05/defi-protocol-voltz-could-bring-150-interest-rate-on-ether-deposits/
"Bitcoin and Ethereum Stuck in a Key Range, FLOW Surges ...",Crypto News,2022-08-05,https://cryptonews.com/news/bitcoin-and-ethereum-stuck-in-a-key-range-flow-surges-over-50.htm
Blockchain Bites: Burning deadline for Hirst NFT collectors ...,Lexology,2022-08-05,https://www.lexology.com/library/detail.aspx?g=aa3d8ad4-f604-4ebe-8c41-14808e6048d9
Arbitrum To Launch Nitro Upgrade on August 31,The Defiant,2022-08-05,https://thedefiant.io/arbitrum-nitro-aug-31
Nomad offers 10 percent bounty in $190 million ...,The Washington Post,2022-08-05,https://www.washingtonpost.com/business/2022/08/05/nomad-crypto-bounty/
Nomad Hackers Return $22M Following Bridge Attack,Crypto Briefing,2022-08-05,https://cryptobriefing.com/nomad-hackers-return-22m-following-bridge-attack/
"Nomad to crypto thieves: Please give us back 90%, keep 10% as a reward. Deal?",TheRegister,2022-08-05,https://www.theregister.com/2022/08/05/nomad_white_hat_payback/
What Is Magic Eden? How to Get Started on the NFT ...,CoinDesk,2022-08-05,https://www.coindesk.com/learn/what-is-magic-eden-how-to-get-started-on-the-nft-marketplace/
"Open Source Blockchain Development Strong, Despite ...",The New Stack,2022-08-05,https://thenewstack.io/open-source-blockchain-development-strong-despite-funding-cuts/
Ether Heads For Highest Weekly Close In Two Months As ...,The Defiant,2022-08-05,https://thedefiant.io/ether-merge-highest-close-two-months
Explained: Why hackers keep exploiting cross-blockchain ...,Protos,2022-08-05,https://protos.com/explained-why-hackers-keep-exploiting-cross-blockchain-bridges/
Web3 Interoperability: The Next Great Leap For Businesses,Forbes,2022-08-05,https://www.forbes.com/sites/forbesbusinesscouncil/2022/08/05/web3-interoperability-the-next-great-leap-for-businesses/
"‘HODLer Capitulation’ Is Near—Crypto Braced For Major Turning Point As Price Of Bitcoin, Ethereum, BNB, XRP, Solana, Cardano, Luna, Shiba Inu And Dogecoin Recover",Forbes,2022-08-05,https://www.forbes.com/sites/danrunkevicius/2022/08/05/hodler-capitulation-is-near-crypto-is-braced-for-major-turning-point-as-price-of-bitcoin-ethereum-bnb-xrp-solana-cardano-luna-shiba-inu-and-dogecoin-recover/
Moonbirds' Public Flight Sparks Debate About Intellectual ...,The Defiant,2022-08-05,https://thedefiant.io/moonbirds-cc0-license-nfts
"Ethereum (ETH) Price to Surge 200% Soon, Says Arthur Hayes!",Coinpedia - Fintech & Cryptocurreny News Media| Crypto Guide,2022-08-05,https://coinpedia.org/web-stories/ethereum-eth-price-to-surge-200-soon-says-arthur-hayes/
"Optimism (OP) Price Prediction 2022, 2023, 2024, 2025: Will OP Hit The $5 Price Mark?",Coinpedia,2022-08-05,https://coinpedia.org/price-prediction/optimism-op-price-prediction/
Ethereum Merge: The Journey So Far & Its Future,Coin Culture,2022-08-05,https://coinculture.com/au/tech/ethereum-merge-the-journey-so-far-its-future/
"Blockchain Smart Contracts And How They Are Used, Explained",Screen Rant,2022-08-05,https://screenrant.com/blockchain-smart-contracts-uses-explained/
Loopring is The King of Rollups - Time to Buy LRC?,Business 2 Community,2022-08-05,https://www.business2community.com/crypto-news/loopring-is-the-king-of-rollups-time-to-buy-lrc-02532688
Coinbase Officially Adds Support for Two Under-the-Radar Altcoins After Recent Roadmap Listings,The Daily Hodl,2022-08-05,https://dailyhodl.com/2022/08/05/coinbase-officially-adds-support-for-two-under-the-radar-altcoins-after-recent-roadmap-listings/
What Is Toncoin and Is It Safe?,MakeUseOf,2022-08-05,https://www.makeuseof.com/what-is-telegram-toncoin-is-it-safe/
FLOW is up by 39% following the Instagram partnership,CoinJournal,2022-08-05,https://coinjournal.net/news/here-is-why-flow-is-up-by-nearly-40-in-the-last-24-hours/
"Bitcoin Prices Are Trading At An ‘Extreme Discount,’ Says Bloomberg Analyst",Forbes,2022-08-05,https://www.forbes.com/sites/cbovaird/2022/08/05/bitcoin-prices-are-trading-at-an-extreme-discount-says-bloomberg-analyst/
Tiffany & Co. NFT drop sells out in an instant,BTC PEERS,2022-08-05,https://btcpeers.com/tiffany-co-nft-drop-sells-out-in-an-instant/
Crypto and Blockchain: What are L1 vs L2 Scaling Solutions?,Watcher Guru,2022-08-05,https://watcher.guru/news/crypto-and-blockchain-what-are-l1-vs-l2-scaling-solutions
"After Meta's Massive Failure, Now Is the Time to Buy ...",The Motley Fool,2022-08-05,https://www.fool.com/investing/2022/08/05/after-metas-massive-failure-now-is-the-time-to-buy/
Lido DAO Approves To Sell 1% Of Treasury To Dragonfly ...,The Crypto Times,2022-08-05,https://www.cryptotimes.io/lido-dao-approves-to-sell-1-of-treasury-to-dragonfly-capital/
"Chainlink Weekly Roundup: Swingby, Biswap, Tulip Protocol ...",BSC News,2022-08-05,https://www.bsc.news/post/chainlink-weekly-roundup-swingby-biswap-tulip-protocol-and-metis
Crypto Investors Are Accumulating These Digital Assets As Market Hits ‘Wall of Worry’: Analytics Firm S...,The Daily Hodl,2022-08-05,https://dailyhodl.com/2022/08/05/crypto-investors-are-accumulating-these-digital-assets-as-market-hits-wall-of-worry-analytics-firm-santiment/
Alchemy To Provide Its Node Infrastructure To Polkadot-based Network Astar,Coin Culture,2022-08-05,https://coinculture.com/au/business/alchemy-to-provide-its-node-infrastructure-to-polkadot-based-network-astar/
3 Reasons AAVE Price Has Jumped and What to Expect,InvestingCube,2022-08-05,https://www.investingcube.com/3-reasons-aave-price-has-jumped-and-what-to-expect-cryptocurrencies/
What Is Unstoppable Domains And How Does It Work?,CoinGecko,2022-08-05,https://www.coingecko.com/learn/what-is-unstoppable-domains-and-how-does-it-work
Why You Should Pay Attention to SocialFi,CryptoTvplus,2022-08-05,https://cryptotvplus.com/2022/08/why-you-should-pay-attention-to-socialfi/
Optimism price could see a significant pullback before its next leg-up to $2.5 and $3,FXStreet,2022-08-05,https://www.fxstreet.com/cryptocurrencies/news/optimism-price-could-see-a-significant-pullback-before-its-next-leg-up-to-25-and-3-202208051316
VeChain Price Prediction: VeChain To Touch $5 Soon?,CryptoTicker,2022-08-05,https://cryptoticker.io/en/vechain-price-prediction/
Apecoin made more than 100% in the past month! Buy APE ...,CryptoTicker,2022-08-05,https://cryptoticker.io/en/apecoin-made-more-than-100-buy-ape-crypto/
"These bullish updates could push MATIC to $1, argue analysts",FXStreet,2022-08-05,https://www.fxstreet.com/cryptocurrencies/news/these-bullish-updates-could-push-matic-to-1-argue-analysts-202208051614
"Uniglo (GLO), Celo (CELO) and Enjin Coin (ENJ) are the ...",Cyprus Mail,2022-08-05,https://cyprus-mail.com/2022/08/05/uniglo-glo-celo-celo-and-enjin-coin-enj-are-the-tokens-of-the-month-to-look-out-for-in-august/
Uniswap eyes NFT marketplace as Chronoly.io touches new ...,Cyprus Mail,2022-08-05,https://cyprus-mail.com/2022/08/05/uniswap-eyes-nft-marketplace-as-chronoly-io-touches-new-peaks/
"Stocks Rise This Week; July Jobs Report, Manufacturing Update, and Earnings Dominate Week",InvestorsObserver,2022-08-05,https://www.investorsobserver.com/news/featured/stocks-rise-this-week-july-jobs-report-manufacturing-update-and-earnings-dominate-week
There's a Really Gruesome Crypto Scam Going Around,TheStreet,2022-08-05,https://www.thestreet.com/investing/theres-a-really-gruesome-crypto-scam-going-around
Crooked Cops NFTs Are Trying To Make A Quick Buck Off ...,TheGamer,2022-08-05,https://www.thegamer.com/crooked-cops-nfts-police-brutality/
Bitcoins bounce looks corrective What to watch from here,FOREX.com,2022-08-05,https://www.forex.com/en/market-analysis/latest-research/bitcoins-bounce-looks-corrective-what-to-watch-from-here/
5 Reasons to Be Bearish on Shiba Inu Price and Bullish on ...,Business 2 Community,2022-08-05,https://www.business2community.com/crypto-news/5-reasons-to-be-bearish-on-shiba-inu-price-and-bullish-on-tamadoge-2-02532696
The Web3 Identity Meta - Evin McMullen,Crypto News,2022-08-05,https://cryptonews.com/videos/the-web3-identity-meta-evin-mcmullen-ethcc-2022-experience-7.htm
"Binance Adds Shiba Inu To Crypto Card, Enabling SHIB Payments For 60 Million Merchants | Bitcoinist.com",Bitcoinist,2022-08-05,https://bitcoinist.com/binance-adds-shiba-inu-to-crypto-card-enabling-shib-payments-for-60-million-merchants/
Blockchain dev suite Alchemy adds support for Polkadot hub Astar | Global Online Money,Global Online Money,2022-08-05,https://globalonlinemony.com/blockchain-dev-suite-alchemy-adds-support-for-polkadot-hub-astar/
The Big Flippening Between the USDT and USDC Is Getting ...,In Bitcoin We Trust,2022-08-05,https://www.inbitcoinwetrust.net/the-big-flippening-between-the-usdt-and-usdc-is-getting-closer-and-could-occur-as-early-as-october-162562e509b7
Bankless Token Ratings | August 2022 - by Ben Giove,Bankless,2022-08-05,https://newsletter.banklesshq.com/p/bankless-token-ratings-august-2022
Forex Signals Brief August 5: GBP Dives After BOE's 50 BPS ...,FXLeaders,2022-08-05,https://www.fxleaders.com/news/2022/08/05/forex-signals-brief-for-august-5-gbp-dives-after-boes-50-bps-hike-us-employment-coming-up/
"Bitcoin Whales Turn Bearish?, What’s In Store For BTC Over The Weekend",NewsBTC,2022-08-05,https://www.newsbtc.com/news/bitcoin/bitcoin-whales-turn-bearish-whats-in-store-for-btc-over-the-weekend/
How fintech is opening the door for alternative retirement ...,Fast Company,2022-08-05,https://www.fastcompany.com/90773656/how-fintech-is-opening-the-door-for-alternative-retirement-investments
PulseChain to Host Nearly 120 Projects on its Network on ...,Watcher Guru,2022-08-05,https://watcher.guru/news/pulsechain-pls-to-host-120-projects-on-its-network-launch
"Senate Bill Defines Bitcoin, Ether as Digital Commodities to be ...",JD Supra,2022-08-05,https://www.jdsupra.com/legalnews/senate-bill-defines-bitcoin-ether-as-7588116/
"Untraceable Events Launches UNNY, The Real Life Engagement Token, to Enhance Attendee Experience at Blockc ...",The Market Periodical,2022-08-05,https://themarketperiodical.com/2022/08/05/untraceable-events-launches-unny-the-real-life-engagement-token-to-enhance-attendee-experience-at-blockchain-futurist-conference-2022/
GMO offers blockchain domains to Japanese market,Domain Name Wire,2022-08-05,https://domainnamewire.com/2022/08/05/gmo-offers-blockchain-domains-to-japanese-market/
Crypto exchanges are in the hot seat as regulators look to ...,KITCO,2022-08-05,https://www.kitco.com/news/2022-08-05/Crypto-exchanges-are-in-the-hot-seat-as-regulators-look-to-clamp-down-on-the-volatile-asset-class.html
"Meet Lisk, A Blockchain Development Platform That Reports Letting Developers Build Blockchain Apps In Jav",Benzinga,2022-08-05,https://www.benzinga.com/markets/cryptocurrency/22/08/28376103/meet-lisk-a-blockchain-development-platform-that-reports-letting-developers-build-blockcha
Surging Ethereum puts pressure on Solana’s price,The Digital Weekly,2022-08-05,https://thedigitalweekly.com/surging-ethereum-puts-pressure-on-solanas-price/
How much is Zuckerberg worth? Card collector could find out,KXXV,2022-08-05,https://www.kxxv.com/news/how-much-is-zuckerberg-worth-card-collector-could-find-out
Finance Redefined: Solana and Nomad bridge fall prey to exploits losing millions,Cointelegraph,2022-08-05,https://cointelegraph.com/news/finance-redefined-solana-and-nomad-bridge-fall-prey-to-exploits-losing-millions
"Coinbase on upside catalyst watch at Citi, on ether merger,reg ...",Seeking Alpha,2022-08-05,https://seekingalpha.com/news/3868092-coinbase-on-upside-catalyst-watch
"Portuguese Banks Begin Closing Of Crypto Accounts, Cites ...",TheGWW.com,2022-08-05,https://thegww.com/portuguese-banks-begin-closing-of-crypto-accounts-cites-risk-management-issues/
Business News | Uniglo (GLO) is a New Crypto That Could Take on Spookyswap (BOO) And Binance Coin (BNB),Latestly,2022-08-05,https://www.latestly.com/agency-news/business-news-uniglo-glo-is-a-new-crypto-that-could-take-on-spookyswap-boo-and-binance-coin-bnb-4045561.html
Korean NFT’s HY NFT Seoul on a mission to connect blockchain industry leaders with the Korean market,Cointelegraph,2022-08-05,https://cointelegraph.com/press-releases/korean-nfts-hy-nft-seoul-on-a-mission-to-connect-blockchain-industry-leaders-with-the-korean-market
"Ethereum Price Soars to $1,700, Outperforms Bitcoin, Coinbase Partners With BlackRock",The Merkle News,2022-08-05,https://themerkle.com/ethereum-price-soars-to-1700-outperforms-bitcoin-coinbase-partners-with-blackrock/
Q&A: Crypto Insider Christopher Emms Details North Korean ...,Blockworks,2022-08-05,https://blockworks.co/qa-crypto-insider-chris-emms-sheds-light-on-north-korean-blockchain-conference/
Kompute Deploys Decentralized Cloud Computing Protocol ...,AiThority.com,2022-08-05,https://aithority.com/it-and-devops/cloud/kompute-deploys-decentralized-cloud-computing-protocol-specifically-for-web3/
"SEC Investigating Binance, All U.S. Crypto Exchanges: Forbes",Crypto Briefing,2022-08-05,https://cryptobriefing.com/sec-investigating-binance-us-crypto-exchanges-forbes/
"Phonon DAO Launches Its Alpha Test, Laying Down a ...",Pro News Report,2022-08-05,https://pronewsreport.com/2022/08/05/phonon-dao-launches-its-alpha-test-laying-down-a-gauntlet-to-visa-mastercard-applepay/
Bitcoin remains in ascending corridor,Forexlive,2022-08-05,https://www.forexlive.com/Education/bitcoin-remains-in-ascending-corridor-20220805/
Crypto Regulation Would Make U.S. A Leader In The Space ...,Crypto News,2022-08-05,https://cryptonews.com/videos/crypto-regulation-would-make-us-a-leader-in-the-space-says-blockchain-associations-smith.htm
CC0 summer 🌄 - by William M. Peaster,Bankless,2022-08-05,https://newsletter.banklesshq.com/p/cc0-summer-
Top Altcoins to Consider this August! Do You Have These in Your Portfolio?,Coinpedia,2022-08-05,https://coinpedia.org/price-analysis/top-altcoins-to-consider-this-august-do-you-have-in-your-portfolio/
CME Group Adds BTC And ETH Euro Futures To Its Offerings,InsideBitcoins,2022-08-05,https://insidebitcoins.com/news/cme-group-adds-btc-and-eth-euro-futures-to-its-offerings
"How Uniswap Remained Defiant as CeFi Fell, and Where it’s Heading Now",Tokenist,2022-08-05,https://tokenist.com/how-uniswap-remained-defiant-as-cefi-fell-and-where-its-heading-now/
Investing In StormX (STMX) - Everything You Need to Know,Securities.io,2022-08-05,https://www.securities.io/investing-in-stormx-stmx-everything-you-need-to-know/
Global Professionals Increasingly Interested In Bitcoin ...,Crypto News,2022-08-05,https://cryptonews.com/news/global-professionals-increasingly-interested-in-bitcoin-crypto-payments-report.htm
Splinterlands Partners With EMP Money and Huobi Exchange,eGamers.io,2022-08-05,https://egamers.io/splinterlands-partners-with-emp-money-and-huobi-exchange/
Will Dogecoin Ever Reach $1? Can It Go Beyond?,MakeUseOf,2022-08-05,https://www.makeuseof.com/can-doge-hit-1-10-100-1000-beyond/
Mastercard to bring Bitcoin to Australia: Crypto-linked card ...,Watcher Guru,2022-08-05,https://watcher.guru/news/mastercard-to-bring-bitcoin-to-australia-crypto-linked-card-underway
"Halliday Raises $6 Million for 'Buy Now, Pay Later' Ethereum NFTs - Decrypt",Inferse.com,2022-08-05,https://www.inferse.com/173757/halliday-raises-6-million-for-buy-now-pay-later-ethereum-nfts-decrypt/
State of Crypto Adoption in Germany,Coinspeaker,2022-08-05,https://www.coinspeaker.com/state-of-crypto-adoption-in-germany/
Voyager Digital Given Green Light to Return Customer Funds: Report,CryptoPotato,2022-08-05,https://cryptopotato.com/voyager-digital-given-green-light-to-return-customer-funds-report/
10 African Artists Using Technology as Their Canvas,ARTnews.com,2022-08-05,https://www.artnews.com/list/art-news/artists/african-art-technology-1234635195/
"Uniglo (GLO), Curve DAO (CRV) And Uniswap (UNI) Likely To ...",Cryptopolitan,2022-08-05,https://www.cryptopolitan.com/uniglo-glo-curve-dao-crv-and-uniswap-uni-likely-to-lead-defi-bull-wave/
Covesting Traders' Most Anticipated Feature Goes Live On ...,Crypto News,2022-08-05,https://cryptonews.com/news/covesting-traders-most-anticipated-feature-goes-live-primexbt-android-app.htm
Why Musician and Ethereum NFT Artist Jimmy Edgar Is Skeptical of Music NFTs - Decrypt,Inferse.com,2022-08-05,https://www.inferse.com/173601/why-musician-and-ethereum-nft-artist-jimmy-edgar-is-skeptical-of-music-nfts-decrypt/
Nomad announces $19-million bounty for lost funds from recent hack,Cointelegraph,2022-08-05,https://cointelegraph.com/news/nomad-announces-190-million-bounty-for-lost-funds-from-recent-hack
All You Need To Know About Quantum AI – Harlem World ...,Harlem World Magazine,2022-08-05,https://www.harlemworldmagazine.com/all-you-need-to-know-about-quantum-ai/
Ethereum’s Kaleido Collaborates With Polygon for Web3 Adoption - CoinDesk,Inferse.com,2022-08-05,https://www.inferse.com/174281/ethereums-kaleido-collaborates-with-polygon-for-web3-adoption-coindesk/
Best Ethereum Casino Sites (2022) TOP List Ranked By Gamblers - Coinpedia Fintech News,Inferse.com,2022-08-05,https://www.inferse.com/173657/best-ethereum-casino-sites-2022-top-list-ranked-by-gamblers-coinpedia-fintech-news/
OVER Launches OVER Stylist Program: A Way For Creators ...,TheGWW.com,2022-08-05,https://thegww.com/over-launches-over-stylist-program-a-way-for-creators-to-monetize-their-passion/
What Is a Bear Market?,The Defiant,2022-08-05,https://thedefiant.io/what-is-crypto-bear-market
Kim Kardashian's Claimed Role In 'Ethereum Max' Scam Is ...,Spark Chronicles,2022-08-05,https://sparkchronicles.com/kim-kardashians-claimed-role-in-ethereum-max-scam-is-misleading-legal-team/
North Korean Hackers Behind Attempted DeBridge Finance Attack: Co-Founder,Decrypt,2022-08-05,https://decrypt.co/106851/debridge-finance-targeted-by-north-korean-hackers-ceo-says
"Uniswap Whale Accumulation Increases, UNI Price Surge More Than 100% In Last 2 Months",Coinpedia,2022-08-05,https://coinpedia.org/defi/uniswap-whale-accumulation-increases/
Filecoin Gaining Traction - Storage is up 128% This Quarter ...,Business 2 Community,2022-08-05,https://www.business2community.com/crypto-news/filecoin-gaining-traction-storage-is-up-128-this-quarter-buy-fil-now-02532901
"Chris Brown's NFT, 'The Breezyverse' Remains 'iffy' & Unsold",The Crypto Times,2022-08-05,https://www.cryptotimes.io/chris-browns-nft-the-breezyverse-remains-iffy-unsold/
ANKR Price Prediction: A Look At The Most Boring Price Chart,InvestingCube,2022-08-05,https://www.investingcube.com/ankr-price-prediction-a-look-at-the-most-boring-price-chart-cryptocurrencies/
"""Pharma Bro"" Martin Shkreli Trolls Crypto Twitter",U.Today,2022-08-05,https://u.today/pharma-bro-martin-shkreli-trolls-crypto-twitter
Top 10 crypto innovators,FinTech Magazine,2022-08-05,https://fintechmagazine.com/articles/top-10-crypto-innovators
Lowest Transaction Fee Cryptocurrency 2022,Outlook India,2022-08-05,https://www.outlookindia.com/outlook-spotlight/lowest-transaction-fee-cryptocurrency-2022-news-214364
Meta Expands Instagram's NFT Rollout to 100 Countries ...,Bitcoin.com News,2022-08-05,https://news.bitcoin.com/meta-expands-instagrams-nft-rollout-to-100-countries-platform-connects-with-third-party-web3-wallets/
"Bithumb links system with Samsung Securities, mobile apps",Forkast,2022-08-05,https://forkast.news/headlines/bithumb-samsung-securities-mobile-apps/
"Bitcoin Surpasses $23,000, Here Are The Top Crypto Movers For Friday",Benzinga,2022-08-05,https://www.benzinga.com/markets/cryptocurrency/22/08/28370368/bitcoin-surpasses-23-000-here-are-the-top-crypto-movers-for-friday
BitTorrent Price Prediction: Is BTT a Good Buy Today?,InvestingCube,2022-08-05,https://www.investingcube.com/bittorrent-price-prediction-is-btt-a-good-buy-today-cryptocurrencies-2/
First Mover Americas: Bitcoin's Rally Loses Steam After US Jobs Report,CoinDesk,2022-08-05,https://www.coindesk.com/markets/2022/08/05/first-mover-americas-bitcoins-rally-loses-steam-after-us-jobs-report/
DappRadar Report: Gaming Stays Up As DeFi and NFTs Dwindle,InvestingCube,2022-08-05,https://www.investingcube.com/dappradar-report-gaming-stays-up-as-defi-and-nfts-dwindle/
How Crypto Replayed the 2008 Financial Crisis,Crypto News,2022-08-05,https://cryptonews.com/videos/how-crypto-replayed-the-2008-financial-crisis-with-david-morris.htm
DhabiCoin Joins Select Cryptocurrency and Blockchain Group ...,EIN News,2022-08-05,https://www.einnews.com/pr_news/584676937/dhabicoin-joins-select-cryptocurrency-and-blockchain-group-after-obtaining-the-coveted-dubai-dmmc-license
Ethereum’s Merge Will Have Several Consequences for the ...,Crypto News BTC,2022-08-05,https://cryptonewsbtc.org/2022/08/06/ethereums-merge-will-have-several-consequences-for-the-blockchain/
