Title,Publisher,Date,Link
Ethereum Merge's Tentative Date Is Out Now,The Crypto Times,2022-08-12,https://www.cryptotimes.io/ethereum-merges-tentative-date-is-out-now/
Derivatives Suggest a 'Sell-the-News' End to the Ethereum Rally,Bloomberg.com,2022-08-12,https://www.bloomberg.com/news/articles/2022-08-12/derivatives-suggest-a-sell-the-news-end-to-the-ethereum-rally
"Ethereum Tops $2,000 as Network Approaches Merge Event",Decrypt,2022-08-12,https://decrypt.co/107390/ethereum-tops-2000-as-network-approaches-merge-event
"Bitcoin, Ethereum Prices Rise",Wall Street Journal,2022-08-12,https://www.wsj.com/livecoverage/stock-market-news-today-08-12-2022/card/bitcoin-ethereum-prices-rise-hBszrqe7QeYyInekSy9K
"Ethereum leads the charge against Bitcoin, rising 61% since June — Flippening price target at $3,750",CryptoSlate,2022-08-12,https://cryptoslate.com/ethereum-leads-the-charge-against-bitcoin-rising-61-since-june-flippening-price-target-at-3750/
"Bitcoin, Ethereum Technical Analysis: BTC Hovers Below ...",Bitcoin.com News,2022-08-12,https://news.bitcoin.com/bitcoin-ethereum-technical-analysis-btc-hovers-below-24000-on-friday-as-crypto-markets-consolidate/
Bitcoin Calms at $24K as Ethereum Classic (ETC) Soars 10% Daily: Market Watch,CryptoPotato,2022-08-12,https://cryptopotato.com/bitcoin-calms-at-24k-as-ethereum-classic-etc-soars-10-daily-market-watch/
MakerDAO founder proposes converting $3.5B USDC reserve to Ethereum,CryptoSlate,2022-08-12,https://cryptoslate.com/makerdao-founder-considers-converting-3-5b-usdc-reserve-to-ethereum/
"Ethereum’s Merge narrative fuels LDO, ETC, OP price rally, will it last?",FXStreet,2022-08-12,https://www.fxstreet.com/cryptocurrencies/news/ethereums-merge-narrative-fuels-ldo-etc-op-price-rally-will-it-last-202208121613
Chandler Guo on Ethereum Mining: It's 'Hard Work',CoinDesk,2022-08-12,https://www.coindesk.com/video/first-mover-on-cdtv-clips/chandler-guo-on-ethereum-mining-its-hard-work/
"Tornado DAO Grapples With Arrests as Discord, Governance Forum Go Dark",Decrypt,2022-08-12,https://decrypt.co/107328/tornado-dao-grapples-with-arrests-discord-governance-forum-go-dark
"Suspected Tornado Cash Developer Detained, More Arrests ‘Not Ruled Out’",Forbes,2022-08-12,https://www.forbes.com/sites/ericmack/2022/08/12/suspected-tornado-cash-developer-detained-more-arrests-not-ruled-out/
"Netherlands Crime Agency Arrests ""Suspected Developer"" of ...",Crypto Briefing,2022-08-12,https://cryptobriefing.com/netherlands-crime-agency-arrests-suspected-developer-tornado-cash/
Uniglo.io (GLO) Set To Make Waves On Ethereum (ETH) With Launch On Uniswap (UNI) After Presale |,Bitcoinist,2022-08-12,https://bitcoinist.com/uniglo-io-glo-set-to-make-waves-on-ethereum-eth-with-launch-on-uniswap-uni-after-presale/
Huge ‘Fair Market Value’ Bitcoin And Ethereum Price Predictions Revealed,Forbes,2022-08-12,https://www.forbes.com/sites/billybambrough/2022/08/12/huge-fair-market-value-bitcoin-and-ethereum-price-predictions-revealed/
"Ethereum price analysis: ETH still trades at $1,900, swift ...",Cryptopolitan,2022-08-12,https://www.cryptopolitan.com/ethereum-price-analysis-2022-08-12/
"Top 3 Price Prediction Bitcoin, Ethereum, Ripple: What Wall ...",FXStreet,2022-08-12,https://www.fxstreet.com/cryptocurrencies/news/top-3-price-prediction-bitcoin-ethereum-ripple-what-wall-street-doesnt-want-you-to-know-202208121819
Justin Sun's Plot to Divide Ethereum Off to Rocky Start,Blockworks,2022-08-12,https://blockworks.co/justin-suns-plot-to-divide-ethereum-off-to-rocky-start/
"Ethereum-Based Altcoin Explodes 750% in Just Two Months, Outrunning Bitcoin and Crypto Markets",The Daily Hodl,2022-08-12,https://dailyhodl.com/2022/08/12/ethereum-based-altcoin-explodes-by-750-in-just-two-months-outrunning-bitcoin-and-crypto-markets/
Ethereum Merge Might Happen Sooner Than Expected,CryptoPotato,2022-08-12,https://cryptopotato.com/ethereum-merge-might-happen-sooner-than-expected/
Ethereum Classic (ETC) Rally Pushes Short Liquidations To $9M,Benzinga,2022-08-12,https://www.benzinga.com/markets/cryptocurrency/22/08/28468672/ethereum-classic-etc-rally-pushes-short-liquidations-to-9m
"Ethereum DeFi TVL Explodes Again, Growth Spills Over To Optimism, Algorand, and Arbitrum",CryptoMode,2022-08-12,https://cryptomode.com/ethereum-defi-tvl-explodes-again-growth-spills-over-to-optimism-algorand-and-arbitrum/
"DeFi Cryptos That May Soar as High as Bitcoin – Adirize DAO, Ethereum, and TRON",Coinpedia,2022-08-12,https://coinpedia.org/press-release/defi-cryptos-that-may-soar-as-high-as-bitcoin-adirize-dao-ethereum-and-tron/
$275M In Ethereum Was Just Transferred Between 2 Wallets,Benzinga,2022-08-12,https://www.benzinga.com/markets/cryptocurrency/22/08/28476458/275m-in-ethereum-was-just-transferred-between-2-wallets
Can The HUH Token Surpass Bitcoin and Ethereum In Popularity?,Outlook India,2022-08-12,https://www.outlookindia.com/outlook-spotlight/can-the-huh-token-surpass-bitcoin-and-ethereum-in-popularity--news-215911
"Bitcoin Drops Below $24,000 But Ethereum Edges Higher; Here Are The Top Crypto Movers For Friday",Benzinga,2022-08-12,https://www.benzinga.com/markets/cryptocurrency/22/08/28469094/bitcoin-drops-below-24-000-but-ethereum-edges-higher-here-are-the-top-crypto-movers-for-fr
MachineFi Lab CTO Qevan Guo explains why Ethereum Merge support is important for IoTeX,Tech Times,2022-08-12,https://www.techtimes.com/articles/279107/20220812/machinefi-lab-cto-qevan-guo-explains-why-ethereum-merge-support-is-important-for-iotex.htm
Ethereum PoW Community says 'Hard Fork is Inevitable',Watcher Guru,2022-08-12,https://watcher.guru/news/ethereum-pow-community-says-hard-fork-is-inevitable
"Gnox (GNOX), Ethereum Classic (ETC) and Bitcoin Gold (BTG) Offering The Best ROI Right Now",Coinpedia,2022-08-12,https://coinpedia.org/press-release/gnox-gnox-ethereum-classic-etc-and-bitcoin-gold-btg-offering-the-best-roi-right-now/
Ethereum Price Analysis: ETH Price May Hit $2500 in the Next 7 Days!,Coinpedia,2022-08-12,https://coinpedia.org/price-analysis/ethereum-price-analysis-eth-price-may-hit-2500-in-the-next-7-days/
Does MetaCryp Compare To The Ethereum Blockchain and Binance Smart Chain?,CryptoMode,2022-08-12,https://cryptomode.com/does-metacryp-compare-to-the-ethereum-blockchain-and-binance-smart-chain/
Major Ethereum Rebellion Will Fail,The Defiant,2022-08-12,https://thedefiant.io/major-ethereum-rebellion-will-fail
Ethereum price could continue going higher despite BTC bears' plan,FXStreet,2022-08-12,https://www.fxstreet.com/cryptocurrencies/news/ethereum-price-could-continue-going-higher-despite-btc-bears-plan-202208121248
"Analyst Warns Ethereum Merge Mania Is Blinding Crypto Traders, Says Hammer Set to Drop on Unsuspecting Inve...",The Daily Hodl,2022-08-12,https://dailyhodl.com/2022/08/12/analyst-warns-ethereum-merge-mania-is-blinding-crypto-traders-says-hammer-set-to-drop-on-unsuspecting-investors/
Ethereum Validator Nodes Set To be Installed in the Capital City of Argentina in 2023,Times Tabloid,2022-08-12,https://timestabloid.com/ethereum-validator-nodes-set-to-be-installed-in-the-capital-city-of-argentina-in-2023/
"Crypto Price Analysis August-12: Ethereum, Binance Coin, Cardano, Solana, and Avalanche",CryptoPotato,2022-08-12,https://cryptopotato.com/crypto-price-analysis-august-12-ethereum-binance-coin-cardano-solana-and-avalanche/
The Secrets Behind The Ethereum Name Service (ENS),Altcoin Buzz,2022-08-12,https://www.altcoinbuzz.io/cryptocurrency-news/product-release/the-secrets-behind-the-ethereum-name-service-ens/
"The Future Of Ethereum, According To Experts Predicting The ...",Nation World News,2022-08-12,https://nationworldnews.com/the-future-of-ethereum-according-to-experts-predicting-the-cryptocurrencys-biggest-cycle-in-history/
What Does a Risk Analysis Say About Ethereum Yield (ETHY) Friday?,InvestorsObserver,2022-08-12,https://www.investorsobserver.com/news/crypto-update/what-does-a-risk-analysis-say-about-ethereum-yield-ethy-friday
Top 5 Crypto Projects Of 2022 As Shared By Horde,Outlook India,2022-08-12,https://www.outlookindia.com/business-spotlight/top-5-crypto-projects-of-2022-as-shared-by-horde-news-215924
3 ERC Tokens Under $1 Set to Explode in 2022 | Bitcoinist.com,Bitcoinist,2022-08-12,https://bitcoinist.com/3-erc-tokens-under-1-set-to-explode-in-2022/
"Ethereum (ETH) Falls 0.01%, Underperforms the Crypto Market Friday",InvestorsObserver,2022-08-12,https://www.investorsobserver.com/news/crypto-update/ethereum-eth-falls-0-01-underperforms-the-crypto-market-friday
Hiltzik: The victims of the collapse of crypto firm Celsius,Los Angeles Times,2022-08-12,https://www.latimes.com/business/story/2022-08-12/column-celsius-bankruptcy-shows-how-small-crytpo-investors-lost-out
"The #Ethereum Merge is Coming, and Now You Know When. - Latest Tweet by Binance Coin",Latestly,2022-08-12,https://www.latestly.com/socially/technology/the-ethereum-merge-is-coming-and-now-you-know-when-latest-tweet-by-binance-coin-4075841.html
What Are Layer 2 Solutions in Crypto?,Benzinga,2022-08-12,https://www.benzinga.com/money/what-are-layer-2-solutions-in-crypto
A-Z of how Aave protocol performed in the last quarter,AMBCrypto,2022-08-12,https://ambcrypto.com/a-z-of-how-aave-protocol-performed-in-the-last-quarter/
Crypto derivative trading volume rose for first time in 4-months as market rallied in July,FXStreet,2022-08-12,https://www.fxstreet.com/cryptocurrencies/news/crypto-derivative-trading-volume-rose-for-first-time-in-4-months-as-market-rallied-in-july-202208121122
Bitcoin dominance hits 6-month lows as metric proclaims new ...,Forbes India,2022-08-12,https://www.forbesindia.com/article/crypto-made-easy/bitcoin-dominance-hits-6month-lows-as-metric-proclaims-new-alt-season/78945/1
Crypto Futures and Options Are Flashing a Warning for Ethereum: The Upcoming Upgrade Could ... - Latest,Latestly,2022-08-12,https://www.latestly.com/socially/business/crypto-futures-and-options-are-flashing-a-warning-for-ethereum-the-upcoming-upgrade-could-latest-tweet-by-bloomberg-4074481.html
"Bitcoin Sheds Midweek Gains, BTC Price Back Below $24K",Securities.io,2022-08-12,https://www.securities.io/bitcoin-sheds-midweek-gains-btc-price-back-below-24k/
PicPay Has Launched A Crypto Exchange In Collaboration With Paxos | Bitcoinist.com,Bitcoinist,2022-08-12,https://bitcoinist.com/picpay-has-launched-a-crypto-exchange-with-paxos/
"Crypto Exchange Binance Freezes $450,000 From Curve Finance Hack",Decrypt,2022-08-12,https://decrypt.co/107309/crypto-exchange-binance-freezes-450000-curve-finance-hack
Ex-SEC Attorney Shares Reason Why XRP Should Be Treated Like Bitcoin and Ethereum,Times Tabloid,2022-08-12,https://timestabloid.com/ex-sec-attorney-shares-reason-why-xrp-should-be-treated-like-bitcoin-and-ethereum/
"Markets: Bitcoin dips, Ether little changed; Huobi Token surges amid potential stake sale",Forkast,2022-08-12,https://forkast.news/headlines/markets-bitcoin-dips-ether-little-changed-huobi-token-surges-amid-stake-sale-speculation/
FTC Investigating BitMart After $200M Crypto Theft!,Foley & Lardner LLP,2022-08-12,https://www.foley.com/en/insights/publications/2022/08/ftc-investigating-bitmart-after-200m-crypto-theft
RoboApe and Cardano: Altcoins Ready To Soar Higher in 2022 | Bitcoinist.com,Bitcoinist,2022-08-12,https://bitcoinist.com/roboape-and-cardano-altcoins-ready-to-soar-higher-in-2022/
What Is Balancer AMM Protocol?,Coinspeaker,2022-08-12,https://www.coinspeaker.com/guides/what-is-balancer-amm-protocol/
"Avalanche, Enjin Coin, Metamortals Are Big-Time ...",Deccan Herald,2022-08-12,https://www.deccanherald.com/brandspot/pr-spot/avalanche-enjin-coin-metamortals-are-big-time-cryptocurrencies-that-could-reinvent-gamefi-1135450.html
Will Ethereum outperform Bitcoin? Richard Heart Interview,Singersroom,2022-08-12,https://singersroom.com/content/2022-08-12/will-ethereum-outperform-bitcoin-richard-heart-interview/
CBDCs are a Chance to Build a Greener Future,Nasdaq,2022-08-12,https://www.nasdaq.com/articles/cbdcs-are-a-chance-to-build-a-greener-future
FOMO Into Cryptocurrencies Is Not Coming Back Anytime Soon,FX Empire,2022-08-12,https://www.fxempire.com/forecasts/article/fomo-into-cryptocurrencies-is-not-coming-back-anytime-soon-1094491
Interactive Brokers Expands Cryptocurrency Trading,Traders Magazine,2022-08-12,https://www.tradersmagazine.com/featured_articles/interactive-brokers-expands-cryptocurrency-trading/
The New Game-Changing Crypto Coin announced Presale ...,PR Newswire,2022-08-12,https://www.prnewswire.com/news-releases/the-new-game-changing-crypto-coin-announced-presale-launch-301605161.html
What You Need To Know About Animalia,CryptoTvplus,2022-08-12,https://cryptotvplus.com/2022/08/what-you-need-to-know-about-animalia/
"SHIB Worth $150 Million Settled in 1,000 Biggest ETH Whales' Pockets",U.Today,2022-08-12,https://u.today/shib-worth-150-million-settled-in-1000-biggest-eth-whales-pockets
Some of the Best New Meme Coins to Buy in 2022: Tamadoge ...,CrowdWisdom360,2022-08-12,https://crowdwisdom.live/crypto/best-new-meme-coin-to-buy-in-2022/
Vaculug becomes first retreader in the world to accept Bitcoin and Ethereum as Payment,The Tech Outlook,2022-08-12,https://www.thetechoutlook.com/press-release/vaculug-becomes-first-retreader-in-the-world-to-accept-bitcoin-and-ethereum-as-payment/
ALT 5 – DIGITAL ASSETS WEEKLY,EIN News,2022-08-12,https://www.einnews.com/pr_news/585796938/alt-5-digital-assets-weekly
Loopring Price Prediction: LRC Bulls Are Very Much In The Game,InvestingCube,2022-08-12,https://www.investingcube.com/loopring-price-prediction-lrc-bulls-are-very-much-in-the-game/
Top 10 Emerging Cryptos to Buy in August 2022,Augusta Free Press,2022-08-12,https://augustafreepress.com/cryptocurrency/best-emerging-cryptocurrency/
The European Crypto Initiative gets support from the main ...,Crypto Reporter,2022-08-12,https://www.crypto-reporter.com/press-releases/the-european-crypto-initiative-gets-support-from-the-main-crypto-industry-projects-35283/
Top Crypto Movers of the Week,Small Business Trends,2022-08-12,https://smallbiztrends.com/2022/08/top-crypto-movers-of-the-week-august-12-2022.html
"Crypto Plunge 2022, Cryptocurrencies To Consider Purchasing: VertoChain (VERT), Tron (TRX), and Binance Coin (BNB)",Outlook India,2022-08-12,https://www.outlookindia.com/outlook-spotlight/crypto-plunge-2022-cryptocurrencies-to-consider-purchasing-vertochain-vert-tron-trx-and-binance-coin-bnb--news-215908
FrontFanz: Polygon Web3 subscription platform ready to list their token,AMBCrypto,2022-08-12,https://ambcrypto.com/frontfanz-polygon-web3-subscription-platform-ready-to-list-their-token/
Launchpads for NFT Projects,CryptoTvplus,2022-08-12,https://cryptotvplus.com/2022/08/launchpads-for-nft-projects/
BTCS Reports Q2 2022 Results,Yahoo Finance,2022-08-12,https://finance.yahoo.com/news/btcs-reports-q2-2022-results-123000085.html
Coincover introduces disaster recovery technology to protect ...,Crypto Reporter,2022-08-12,https://www.crypto-reporter.com/press-releases/coincover-introduces-disaster-recovery-technology-to-protect-staked-crypto-35271/
How VC's Are Changing Their Crypto Investment Strategy,Crypto News,2022-08-12,https://cryptonews.com/videos/ether-spikes-after-merge-test-and-ripple-considers-celsius-assets-cnbc-crypto-world.htm
Report Shows Hackers Launder $540M Through Crypto RenBridge Platform | Bitcoinist.com,Bitcoinist,2022-08-12,https://bitcoinist.com/report-shows-hackers-launder-540m-through-crypto-renbridge-platform/
Tracer DAO votes on historic proposal to merge with core ...,PR Newswire,2022-08-12,https://www.prnewswire.com/news-releases/tracer-dao-votes-on-historic-proposal-to-merge-with-core-service-provider-mycelium-and-launch-new-derivative-product-301605005.html
Cardano-Based Cardalonia Partners With Ready Player Me 70% Of Their Token Presale Allocation Filled |,Bitcoinist,2022-08-12,https://bitcoinist.com/cardano-based-cardalonia-partners-with-ready-player-me-70-of-their-token-presale-allocation-filled/
"SHIB Dev Replies to User Who Wants Coin to “Go Up,” Cardano Critic Mark Cuban Sued, BabyDoge May Rise 60%: Crypto News Digest by U.Today",U.Today,2022-08-12,https://u.today/shib-dev-replies-to-user-who-wants-coin-to-go-up-cardano-critic-mark-cuban-sued-babydoge-may-rise
Beyond Memes: Animal-Themed Projects Making Bold Moves,BSC News,2022-08-12,https://www.bsc.news/post/beyond-memes-animal-themed-projects-making-bold-moves
"Solana, Tron And Zompot Token: Top Three Altcoins To Invest In During The Bear Market",Outlook India,2022-08-12,https://www.outlookindia.com/outlook-spotlight/solana-tron-and-zompot-token-top-three-altcoins-to-invest-in-during-the-bear-market-news-215914
Telegram and Crypto are Joined At The Hip: “Everyone’s on ...,Business 2 Community,2022-08-12,https://www.business2community.com/crypto-news/telegram-and-crypto-are-joined-at-the-hip-everyones-on-there-02535740
"This Plot Of Digital Land Just Sold For $14,858 In MANA In Decentraland",Benzinga,2022-08-12,https://www.benzinga.com/markets/cryptocurrency/22/08/28478254/this-plot-of-digital-land-just-sold-for-14-858-in-mana-in-decentraland
2 Cryptocurrencies That Will Surge In The Coming Years,The Crypto Basic,2022-08-12,https://thecryptobasic.com/2022/08/12/2-cryptocurrencies-that-will-surge-in-the-coming-years/
Solana Has Another Critical Issue That May Harm Your PC,U.Today,2022-08-12,https://u.today/solana-has-another-critical-issue-that-may-harm-your-pc
"GryffinDOR, BNB, and AMP – 3 Coins Shaking Up The Market",CryptoNewsZ,2022-08-12,https://www.cryptonewsz.com/gryffindor-bnb-and-amp-3-coins-shaking-up-the-market/
'Bitcoin Is Still Far From Starting A New trend' Says ...,The Crypto Basics,2022-08-12,https://thecryptobasic.com/2022/08/12/bitcoin-is-still-far-from-starting-a-new-trend-says-cryptoquant-heres-why/
OFAC Blocks Smart Contract Mixer by Adding Tornado to SDN ...,Barnes & Thornburg,2022-08-12,https://btlaw.com/en/insights/alerts/2022/ofac-blocks-smart-contract-mixer-by-adding-tornado-to-sdn-list
"Digital Assets Exchange Crypto.com Adds New Support for Surging, Under-the-Radar Altcoin",The Daily Hodl,2022-08-12,https://dailyhodl.com/2022/08/12/digital-assets-exchange-crypto-com-adds-new-support-for-surging-under-the-radar-altcoin/
"Chainlink Weekly Roundup: OpenOcean, Sneaky Vampire ...",BSC News,2022-08-12,https://www.bsc.news/post/chainlink-weekly-roundup-openocean-sneaky-vampire-syndicate-and-swell-network
Why Is Web3 Security Such a Garbage Fire? Let Us Count the ...,PCMag,2022-08-12,https://www.pcmag.com/news/why-is-web3-security-such-a-garbage-fire-let-us-count-the-ways
"Supercars, Breakfast, and The Christie: enthusiasts come together for a powerful cause",EIN News,2022-08-12,https://www.einnews.com/pr_news/585191247/supercars-breakfast-and-the-christie-enthusiasts-come-together-for-a-powerful-cause
Chainlink Approaches Significant Supply Wall,Crypto Briefing,2022-08-12,https://cryptobriefing.com/chainlink-approaches-significant-supply-wall/
CFTC Files Charges Against $12 Million 'Bitcoin Ponzi Scheme',Decrypt,2022-08-12,https://decrypt.co/107364/cftc-charges-12m-bitcoin-ponzi-scheme
The Best-Performing Cryptocurrencies In 2022,Watcher Guru,2022-08-12,https://watcher.guru/news/the-best-performing-cryptocurrencies-in-2022
"It's back to basics in cryptoland, but the party is far from over",SaltWire,2022-08-12,https://www.saltwire.com/atlantic-canada/business/its-back-to-basics-in-cryptoland-but-the-party-is-far-from-over-100762964/
What Determines the Price of a Cryptocurrency Coin?,Bitrates.com,2022-08-12,https://www.bitrates.com/news/p/what-determines-the-price-of-a-cryptocurrency-coin
Quant Crypto Price Increased by +50% in 1 Month – Rumor or ...,CryptoTicker,2022-08-12,https://cryptoticker.io/en/quant-crypto-price-increased/
Japan Appoints Political Heavyweight as New Digital Minister ...,Crypto News,2022-08-12,https://cryptonews.com/news/japan-appoints-political-heavyweight-as-new-digital-minister-boosting-web3-hopes.htm
"Biggest Movers: ETC Nears 4-Month High, LINK Hits Highest ...",Bitcoin.com News,2022-08-12,https://news.bitcoin.com/biggest-movers-etc-nears-4-month-high-link-hits-highest-point-since-june/
BTCS Reports Q2 2022 Results,StreetInsider,2022-08-12,https://www.streetinsider.com/Globe+Newswire/BTCS+Reports+Q2+2022+Results/20456367.html
How to Mine Ergo 2022 (Complete Guide),Cryptopolitan,2022-08-12,https://www.cryptopolitan.com/how-to-mine-ergo/
Connecticut Banking Commission Releases Advisory on ...,JD Supra,2022-08-12,https://www.jdsupra.com/legalnews/connecticut-banking-commission-releases-4474433/
Coinmerce: Shaping the Future of Cryptocurrency Through Web 3.0,Coinspeaker,2022-08-12,https://www.coinspeaker.com/coinmerce-shaping-future-of-cryptocurrency-through-web-3-0/
Prof Peter McIntyre: could polio make a comeback? & More ...,UP Jobs News,2022-08-12,https://upjobsnews.com/prof-peter-mcintyre-could-polio-make-a-comeback-more-latest-news-here/
Top 10 Programming Languages to Learn With Their Use Cases,Dignited,2022-08-12,https://www.dignited.com/98335/top-10-programming-languages-to-learn-with-their-use-cases/
Director of the Central Bank of Brazil highlights the ...,INVESTOR TIMES,2022-08-12,https://investortimes.com/director-of-brazils-central-bank-highlights-advantages-of-bitcoin/
"SOL Makes Another Shot At $44, After Two Failed Attempts ...",TheGWW.com,2022-08-12,https://thegww.com/sol-makes-another-shot-at-44-after-two-failed-attempts-this-week/
Crypto Biz: A Futurist take on crypto,Cointelegraph,2022-08-12,https://cointelegraph.com/news/crypto-biz-a-futurist-take-on-crypto
What is Alpaca Finance?,Asia Crypto Today,2022-08-12,https://www.asiacryptotoday.com/alpaca-finance/
Young Black Americans Dominate The Cryptocurrency Market,The Seattle Medium,2022-08-12,https://seattlemedium.com/young-black-americans-dominate-the-cryptocurrency-market/
Carlossy Caterpillar – A New Meme Coin That Runs on the Binance Smart Chain,CryptoMode,2022-08-12,https://cryptomode.com/carlossy-caterpillar-a-new-meme-coin-that-runs-on-the-binance-smart-chain/
Why Ethereum And Cosmos’ Investors Are Looking At Joining ...,CoinCodex,2022-08-12,https://coincodex.com/article/17823/why-ethereum-and-cosmos-investors-are-looking-at-joining-supontis-tokens-presale/
"Top 5 cryptocurrencies of the day: BTC down by 1%, SFUND trends at no. 1",Opoyi,2022-08-12,https://opoyi.com/business/top-5-cryptocurrencies-of-the-day-btc-down-by-1-sfund-trends-at-no-724330/
"EDCON & De University of Ethereum will host ""Ethereum: a New Era"" at CHASE CENTER - PR Newswire",Inferse.com,2022-08-12,https://www.inferse.com/181616/edcon-de-university-of-ethereum-will-host-ethereum-a-new-era-at-chase-center-pr-newswire/
NFTs and privacy 🕵 - by William M. Peaster,Bankless,2022-08-12,https://newsletter.banklesshq.com/p/nfts-and-privacy-
Speculating on the future of defi mobility with Solana's new ...,Tearsheet,2022-08-12,https://tearsheet.co/blockchain-crypto/speculating-on-the-future-of-defi-mobility-with-solanas-new-crypto-phone/
NEAR records $6M in liquidations; here’s the detail of it all,AMBCrypto,2022-08-12,https://ambcrypto.com/near-records-6m-in-liquidations-heres-the-detail-of-it-all/
"Ethereum Price to Soar After Merge If This Scenario Plays Out, Arthur Hayes Says - U.Today",Inferse.com,2022-08-12,https://www.inferse.com/182274/ethereum-price-to-soar-after-merge-if-this-scenario-plays-out-arthur-hayes-says-u-today/
Why Has Ethereum Become Part of Start-up Companies?,The Libertarian Republic,2022-08-12,https://thelibertarianrepublic.com/why-has-ethereum-become-part-of-start-up-companies/
Forex Signals Brief Aug 11: US Consumer Sentiment Improve ...,FXLeaders,2022-08-12,https://www.fxleaders.com/news/2022/08/12/forex-signals-brief-for-august-11-is-us-consumer-sentiment-improving-as-inflation-cools/
Forex Today: Markets turn choppy ahead of the weekend,FXStreet,2022-08-12,https://www.fxstreet.com/news/forex-today-markets-turn-choppy-ahead-of-the-weekend-202208120741
Winz.io Casino Has Released A Branded Slot: Winz to the Moon,Crypto News,2022-08-12,https://cryptonews.com/news/winzio-casino-released-branded-slot-winz-moon.htm
Ethereum Has Carried Out A Final Test Run Before One Of The Most Important Events In Crypto,Wonderful Engineering,2022-08-12,https://wonderfulengineering.com/ethereum-has-carried-out-a-final-test-run-before-one-of-the-most-important-events-in-crypto/
Market Wrap: Bitcoin Price Finishes Higher for Third Consecutive Week,CoinDesk,2022-08-12,https://www.coindesk.com/markets/2022/08/12/market-wrap-bitcoin-price-finishes-higher-for-third-consecutive-week/
Does PayPal Allow Users to Cash Out Bitcoin?,Tech Times,2022-08-12,https://www.techtimes.com/articles/279104/20220812/does-paypal-allow-users-to-cash-out-bitcoin.htm
FTC Probe Of BitMart 2021 Cyberattack Continues,The Crypto Times,2022-08-12,https://www.cryptotimes.io/ftc-probe-of-bitmart-2021-cyberattack-continues/
Genius or Stupid? Dorsey Creates a Crypto Wallet that Looks ...,The Tech Report,2022-08-12,https://techreport.com/innovation/3478152/genius-or-stupid-dorsey-creates-a-crypto-wallet-that-looks-like-a-rock/
"Curve Finance resolves site exploits, directs users to revoke recent contracts: Finance Redefined",Cointelegraph,2022-08-12,https://cointelegraph.com/news/curve-finance-resolves-site-exploits-directs-users-to-revoke-recent-contracts-finance-redefined
Kine launches zero-fee trading event for all users,Cointelegraph,2022-08-12,https://cointelegraph.com/press-releases/kine-launches-zero-fee-trading-event-for-all-users
"Metaverse Land Just Sold For $11,877 (13,500 MANA) In Decentraland",Benzinga,2022-08-12,https://www.benzinga.com/markets/cryptocurrency/22/08/28478257/metaverse-land-just-sold-for-11-877-13-500-mana-in-decentraland
Quantum Gate 100x Faster Than Quantum Noise,IEEE Spectrum,2022-08-12,https://spectrum.ieee.org/neutral-atom-qubit
