Title,Publisher,Date,Link
Moneybees partners with ACM to launch crypto exchange services,Back End News,2022-08-05,https://backendnews.net/moneybees-partners-with-acm-to-launch-crypto-exchange-services/
"Donations with Bitcoin and other cryptos are booming, and ...",PRWeb | Online Press Release Distribution Service,2022-08-05,https://www.prweb.com/releases/2022/8/prweb18826790.htm
Les hacks se multiplient dans la crypto sphère : Nomad et ...,BeInCrypto,2022-08-05,https://fr.beincrypto.com/marches/100104/hacks-se-multiplient-crypto-sphere-nomad-et-solana-dernieres-victimes/
New Trends Report Details Enterprise Architecture's Pivotal Role in Organizations' Digital Transformation Efforts,Yahoo Finance,2022-08-05,https://finance.yahoo.com/news/trends-report-details-enterprise-architectures-143000501.html
Celo Price Prediction: Is Celo Protocol a Good Buy?,Bankless Times,2022-08-05,https://www.banklesstimes.com/news/2022/08/05/celo-price-prediction-is-celo-protocol-a-good-buy/
Uniglo (GLO) Could Revolutionize The Way Crypto is Valued ...,Crypto News,2022-08-05,https://cryptonews.com/news/uniglo-glo-could-revolutionize-way-crypto-valued-surpassing-litecoin-ltc-cronos-cro-tron-trx.htm
Polkadot Sets Sight On $9 As It Claims The 10th Spot On Crypto Top 10,NewsBTC,2022-08-05,https://www.newsbtc.com/analysis/dot/polkadot-sets-sight-on-9-as-it-claims-the-10th-spot-on-crypto-top-10/
"‘HODLer Capitulation’ Is Near—Crypto Is Braced For Major Turning Point As Price Of Bitcoin, Ethereum, BNB, XRP, Solana, Cardano, Luna, Shiba Inu, And Dogecoin Recover - Forbes",Inferse.com,2022-08-05,https://www.inferse.com/174325/hodler-capitulation-is-near-crypto-is-braced-for-major-turning-point-as-price-of-bitcoin-ethereum-bnb-xrp-solana-cardano-luna-shiba-inu-and-dogecoin-recover-forbes/
DFINITY R&D Team Announces BTC-ICP Integration Beta Release,CryptoNewsZ,2022-08-05,https://www.cryptonewsz.com/dfinity-r-and-d-team-announces-btc-icp-integration-beta-release/
FTX-Backed PACs Expand the Crypto Lobby in Congress,The Intercept,2022-08-05,https://theintercept.com/2022/08/05/crypto-lobby-ftx-pacs-sam-bankman-fried/
SushiSwap 'Head Chef' Narrowly Wins Vote,The Defiant,2022-08-05,https://thedefiant.io/sushiswap-vote-head-chef-controversy
A crypto market crash will impact the price of Cardano,The Digital Weekly,2022-08-05,https://thedigitalweekly.com/a-crypto-market-crash-will-impact-the-price-of-cardano-3/
"ESMA's crypto preparations, Ether 'flips' Bitcoin; Aave's ...",Crypto News BTC,2022-08-05,https://cryptonewsbtc.org/2022/08/06/esmas-crypto-preparations-ether-flips-bitcoin-aaves-stablecoin/
Mogul Partners with Acclaimed Filmmaker Anthony Hayes to ...,iTech Post,2022-08-05,https://www.itechpost.com/articles/112757/20220805/mogul-partners-with-acclaimed-filmmaker-anthony-hayes-to-launch-a-limited-nft-series-for-upcoming-sci-fi-trilogy-retrogression.htm
Euro Futures - All News And Posts By Crowdfund Insider,CrowdFund Insider,2022-08-05,https://www.crowdfundinsider.com/tag/euro-futures/
"Biggest Movers: THETA Hits 3-Month High, While Near Climbs ...",Bitcoin.com News,2022-08-05,https://news.bitcoin.com/biggest-movers-theta-hits-3-month-high-while-near-climbs-17-on-friday/
Building a National Framework for Web3,Crypto News,2022-08-05,https://cryptonews.com/videos/building-a-national-framework-for-web3-crypto-bahamas.htm
Incredibly Strong Crypto Buy Signals For Gnox (GNOX ...,Cryptopolitan,2022-08-05,https://www.cryptopolitan.com/incredibly-strong-crypto-buy-signals-for-gnox-gnox-solana-sol-and-bitcoin-btc/
An Instagram Stories update limits the visibility of excessive posts - PhoneArena,Inferse.com,2022-08-05,https://www.inferse.com/173937/an-instagram-stories-update-limits-the-visibility-of-excessive-posts-phonearena/
Crypto Experts Favorite Choices For August: Gnox (GNOX ...,Cryptopolitan,2022-08-05,https://www.cryptopolitan.com/crypto-experts-favorite-choices-for-august-gnox-gnox-cosmos-hub-atom-and-chain-xcn/
Crypto Appeal Among Gig Workers Growing: Bakkt Report,The Bharat Express News,2022-08-05,https://www.thebharatexpressnews.com/crypto-appeal-among-gig-workers-growing-bakkt-report/
Why Elon Musk’s Twitter Acquisition Is Good For Dogecoin | Bitcoinist.com - Bitcoinist,Inferse.com,2022-08-05,https://www.inferse.com/173535/why-elon-musks-twitter-acquisition-is-good-for-dogecoin-bitcoinist-com-bitcoinist/
