Title,Publisher,Date,Link
Ethereum Deploys Latest Shadow Fork En Route to the Merge,Decrypt,2022-07-14,https://decrypt.co/105135/ethereum-latest-shadow-fork-the-merge
"Why Bitcoin, Ethereum, and Polygon Jumped Today",The Motley Fool,2022-07-14,https://www.fool.com/investing/2022/07/14/why-bitcoin-ethereum-and-polygon-jumped-today/
"Cryptocurrencies Price Prediction: Ethereum, Polygon & Bitcoin – American Wrap 14 July",FXStreet,2022-07-14,https://www.fxstreet.com/cryptocurrencies/news/cryptocurrencies-price-prediction-ethereum-polygon-bitcoin-american-wrap-14-july-202207142200
"Ethereum (ETH) Ready for ‘Significant Run,’ Says Top Crypto Analyst – Here’s His Target",The Daily Hodl,2022-07-14,https://dailyhodl.com/2022/07/14/ethereum-eth-ready-for-significant-run-says-top-crypto-analyst-heres-his-target/
GameStop’s Ethereum-based NFT Sales Topple Coinbase NFT Just Two Days after Launch,Coinspeaker,2022-07-14,https://www.coinspeaker.com/gamestop-ethereum-based-nft-coinbase/
Is Ethereum Staging a Short-Term Rally? (ETH Price Analysis),CryptoPotato,2022-07-14,https://cryptopotato.com/is-ethereum-staging-a-short-term-rally-eth-price-analysis/
Kevin Rose’s PROOF Acquires Ethereum NFT Team Divergence,Decrypt,2022-07-14,https://decrypt.co/105061/kevin-roses-proof-acquires-ethereum-nft-divergence
Ethereum Continues to Struggle—Does ERC20 Token Gorilix (SILVA) Offer Hope? | Bitcoinist.com,Bitcoinist,2022-07-14,https://bitcoinist.com/ethereum-continues-to-struggle-does-erc20-token-gorilix-silva-offer-hope/
Better Buy: Ethereum vs. Shiba Inu,The Motley Fool,2022-07-14,https://www.fool.com/investing/2022/07/14/better-buy-ethereum-vs-shiba-inu/
"Bitcoin, Ethereum, Crypto News and Price Data","CoinDesk: Bitcoin, Ethereum, Crypto News and Price Data",2022-07-14,https://www.coindesk.com/tv/first-mover/first-mover-july-14-2022/
"GameStop NFT Marketplace Launches Beta, Nearly Doubles Total Coinbase NFT Ethereum Sales in Just Two Days",The Daily Hodl,2022-07-14,https://dailyhodl.com/2022/07/14/gamestop-nft-marketplace-launches-beta-nearly-doubles-total-coinbase-nft-ethereum-sales-in-just-two-days/
"GameStop NFT Sales Reach 3,000ETH - Beats Coinbase but ...",Business 2 Community,2022-07-14,https://www.business2community.com/crypto-news/gamestop-nft-sales-reach-3000eth-beats-coinbase-but-long-way-to-top-opensea-02522980
OpenSea Lays Off 20% of Its Staff to Prepare for 'Prolonged Downturn',Decrypt,2022-07-14,https://decrypt.co/105130/opensea-lays-off-20-percent-staff-prolonged-downturn-crypto-winter
"Disney Accelerator announces Polygon, Flickplay, Lockerverse in the class of 2022",CryptoSlate,2022-07-14,https://cryptoslate.com/disney-accelerator-announces-polygon-flickplay-lockerverse-in-the-class-of-2022/
"Celsius Network's Assets Could Be Locked for a Long Long Time Like Mt. Gox's Crypto, Says Bitfinex Whale.",Ethereum World News,2022-07-14,https://en.ethereumworldnews.com/celsius-networks-assets-could-be-locked-for-a-long-long-time-like-mt-goxs-crypto-says-bitfinex-whale/
"GeckoCon Insights: DeFi's Next Phase of Growth Will Come From Solana, Avalanche, and Other Chains",Ethereum World News,2022-07-14,https://en.ethereumworldnews.com/geckocon-insights-defis-next-phase-of-growth-will-come-from-solana-avalanche-and-other-chains/
Judge denies SEC’s motion to withhold key documents in Ripple case,CryptoSlate,2022-07-14,https://cryptoslate.com/judge-denies-secs-motion-to-withhold-key-documents-in-ripple-case/
"Under-the-Radar Ethereum Rival Soars 50% in Just One Week, Evading Bitcoin and Crypto Market Malaise",The Daily Hodl,2022-07-14,https://dailyhodl.com/2022/07/14/under-the-radar-ethereum-rival-soars-50-in-just-one-week-evading-bitcoin-and-crypto-market-malaise/
"After Being Crushed in 2022, Is It Safe to Buy This Crypto?",The Motley Fool,2022-07-14,https://www.fool.com/investing/2022/07/14/after-being-crushed-in-2022-so-far-is-it-safe-to-b/
"‘Never Buy It’—Warren Buffett’s Right-Hand Man Issued A Stark Crypto Warning After Terra Luna-Led Bitcoin, Ethereum, BNB, XRP, Solana, Cardano And Dogecoin Price Crash",Forbes,2022-07-14,https://www.forbes.com/sites/billybambrough/2022/07/14/never-buy-it-warren-buffetts-right-hand-man-issued-a-stark-crypto-warning-after-terra-luna-led-bitcoin-ethereum-bnb-xrp-solana-cardano-and-dogecoin-price-crash/
Ethereum (ETH) cryptocurrency overview,PVP Live,2022-07-14,https://pvplive.net/ethereum-eth-cryptocurrency-overview/
Oil blockchain VAKT leads consortium for Singapore ...,Ledger Insights,2022-07-14,https://www.ledgerinsights.com/oil-blockchain-vakt-consortium-singapore-electronic-bill-of-lading-ebl/
European Central Bank hints at PoW-based crypto ban by 2025,CryptoSlate,2022-07-14,https://cryptoslate.com/european-central-bank-ecb-hints-at-pow-based-crypto-ban-by-2025/
ETH/USD Forecast: Ethereum Has Slight Bounce,DailyForex.com,2022-07-14,https://www.dailyforex.com/forex-technical-analysis/2022/07/ethusd-forecast-ethereum-has-slight-bounce-july-14-2022/181651
Not All Algorithmic Stablecoins Will Be Terra: Binance CEO CZ,Decrypt,2022-07-14,https://decrypt.co/105067/not-all-algorithmic-stablecoins-will-be-terra-binance-ceo-cz
"Huge Cardano Jump on the Horizon, Will ADA Price Regain Levels Above $0.6?",Coinpedia,2022-07-14,https://coinpedia.org/price-analysis/huge-cardano-jump-on-the-horizon-will-ada-price-regain-levels-above-0-6-levels/
"DeFi Blue-Chip Tokens Aave, Uniswap, Curve Post Fresh Gains",Decrypt,2022-07-14,https://decrypt.co/105085/defi-blue-chip-tokens-aave-uniswap-curve-post-fresh-gains
"Face aux Bitcoiners, Vitalik Buterin riposte sur la nature d ...",Journal Du Coin,2022-07-14,https://journalducoin.com/ethereum/vitalik-buterin-riposte-bitcoiners-nature-ethereum-securities/
Former Meta employees seek to resurrect Diem with Aptos ...,SiliconANGLE,2022-07-14,https://siliconangle.com/2022/07/14/former-meta-employees-seek-resurrect-diem-aptos-blockchain-amid-struggling-crypto-markets/
Polkadot Continues To Make Eye-Catching Progress,The Daily Hodl,2022-07-14,https://dailyhodl.com/2022/07/14/polkadot-continues-to-make-eye-catching-progress/
"2,458 ETH Worth $2M Was Just Burned",Benzinga,2022-07-14,https://www.benzinga.com/markets/cryptocurrency/22/07/28069918/2-458-eth-worth-2m-was-just-burned
Here's Why PlaytoEarn Projects Will Fail,CryptoTvplus,2022-07-14,https://cryptotvplus.com/2022/07/why-many-playtoearn-projects-will-fail/
7 DeFi Risks You Should be Aware of According to CoinShares,Crypto News,2022-07-14,https://cryptonews.com/news/7-defi-risks-you-should-be-aware-of-according-to-coinshares.htm
Funds Are Safe But Celo Network Stalled Again After Briefly Resuming,CryptoPotato,2022-07-14,https://cryptopotato.com/funds-are-safe-but-celo-network-stalled-again-after-briefly-resuming/
MetaMask Co-Founders: 'We Can't Stop People From Making ...,VICE,2022-07-14,https://www.vice.com/en/article/v7vea9/metamask-co-founders-we-cant-stop-people-from-making-ponzis-on-blockchains
Brazil’s Largest Private Bank Itaú to Launch Tokenization Platform,CoinDesk,2022-07-14,https://www.coindesk.com/business/2022/07/14/brazils-largest-private-bank-itau-to-launch-tokenization-platform-may-eventually-offer-crypto-trading/
Bitcoin hashrate plummets as Texas-based miners suspend operations,CryptoSlate,2022-07-14,https://cryptoslate.com/bitcoin-hashrate-plummets-as-texas-based-miners-suspend-operations/
Infinity Loans: Roqqu crypto lending product,CryptoTvplus,2022-07-14,https://cryptotvplus.com/2022/07/infinity-loans-roqqu-crypto-lending-product/
CoinFLEX to enable 10% withdrawals from July 15,CryptoSlate,2022-07-14,https://cryptoslate.com/coinflex-to-enable-10-withdrawals-from-july-15/
Stablecoin rules among topics discussed during Janet Yellen’s meeting with Japanese officials,CryptoSlate,2022-07-14,https://cryptoslate.com/stablecoin-rules-among-topics-discussed-during-janet-yellens-meeting-with-japanese-officials/
"Gnox (GNOX) Could Be The Most Likely To Make Early Investors Rich, Rather Than Buying Evmos (EVMOS) Or",Bitcoinist,2022-07-14,https://bitcoinist.com/gnox-gnox-could-be-the-most-likely-to-make-early-investors-rich-rather-than-buying-evmos-evmos-or-chiliz-chz/
"Bexplus Exchange Announces $5,000 Giveaway for New Users",CryptoSlate,2022-07-14,https://cryptoslate.com/press-releases/bexplus-exchange-announces-5000-giveaway-for-new-users/
8 Binance New Listings Set To Be the Next DOGE in 2022,Crypto News,2022-07-14,https://cryptonews.com/news/8-binance-new-listings-set-next-doge-2022.htm
"No, Ukrainian Prosecutors Didn't Just Seize 830kg of Silver ...",Crypto News,2022-07-14,https://cryptonews.com/news/no-ukrainian-prosecutors-didnt-just-seize-830kg-of-silver-from-an-otc-crypto-gang-heres-what-happened.htm
Why Ripple Invested In This Buy Now Pay Later NFT Platform,Bitcoinist,2022-07-14,https://bitcoinist.com/ripple-invested-buy-now-pay-later-nft-platform/
Favorite Crypto Betting Sites for the NBA,CryptoMode,2022-07-14,https://cryptomode.com/favorite-crypto-betting-sites-for-the-nba/
Russian’s Central Bank and Ministry of Finance clash over stablecoins,CryptoSlate,2022-07-14,https://cryptoslate.com/russians-central-bank-and-ministry-of-finance-clash-over-stablecoins/
Market Wrap: Bitcoin Surges as Fed Governor Talks Down ...,CoinDesk,2022-07-14,https://www.coindesk.com/markets/2022/07/14/market-wrap-bitcoin-surges-as-fed-governor-talks-down-100-basis-point-rate-hike/
Gaming going strong amidst crypto winter with 1.1 million UAWs,CryptoSlate,2022-07-14,https://cryptoslate.com/gaming-going-strong-amidst-crypto-winter-with-1-1-million-uaws/
"Flare Network genesis 14.07.22 – Network live and ready for builders, developer adoption program coming in August",CryptoSlate,2022-07-14,https://cryptoslate.com/press-releases/flare-network-genesis-14-07-22-network-live-and-ready-for-builders-developer-adoption-program-coming-in-august/
3 reasons why Polygon (MATIC) is up 100%+ during a bear market,Cointelegraph,2022-07-14,https://cointelegraph.com/news/3-reasons-why-polygon-matic-is-up-100-during-a-bear-market
Bitcoin’s Correlation With Stocks Nears Yearly Low,CryptoPotato,2022-07-14,https://cryptopotato.com/bitcoins-correlation-with-stocks-nears-yearly-low/
"Why Uniswap, Elrond, Arweave, and Synthetix Network ...",The Motley Fool,2022-07-14,https://www.fool.com/investing/2022/07/14/why-uniswap-elrond-arweave-and-synthetix-network-p/
Exclusive: Rare Three-Digit ENS Domain Coming To Fractional Investing — Here's Why And How You Can Own A,Benzinga,2022-07-14,https://www.benzinga.com/markets/cryptocurrency/22/07/28073730/exclusive-rare-three-digit-ens-domain-coming-to-fractional-investing-heres-why-and-how-you
Kazakhstan to Increase Bitcoin Mining Tax Rates from 2023,Crypto News,2022-07-14,https://cryptonews.com/news/kazakhstan-to-increase-bitcoin-mining-tax-rates-from-2023.htm
Crypto Community Unimpressed as ECB President Pushes for ...,Crypto News,2022-07-14,https://cryptonews.com/news/crypto-community-unimpressed-as-ecb-president-pushes-for-digital-euro-with-privacy-of-the-highest-standard.htm
"Fasset Collaborates with Mastercard, New York Yankees ...",Crypto News,2022-07-14,https://cryptonews.com/news/fasset-collaborates-with-mastercard-new-york-yankees-bitcoin-deal-tencent-shutters-nft-platform-crypto-industry-donates-to-us-senator-more-news.htm
"Ankr Unveils Its Biggest Upgrade, Ankr Network 2.0, to Truly ...",Crypto News,2022-07-14,https://cryptonews.com/news/ankr-unveils-its-biggest-upgrade-ankr-network-20-truly-decentralize-web3s-foundational-layer.htm
Is it Time to Buy SNX? • Benzinga Crypto,Benzinga,2022-07-14,https://www.benzinga.com/money/is-it-time-to-buy-snx
Cardano Price Prediction: ADA to be $0.63 by End of 2022 ...,BeInCrypto,2022-07-14,https://beincrypto.com/cardano-price-prediction-ada-to-be-0-63-by-end-of-2022-6-54-in-2030/
"Digivault Becomes First Custody Partner of poundtoken.io, the ...",Crypto News,2022-07-14,https://cryptonews.com/news/digivault-becomes-first-custody-partner-of-poundtokenio-the-first-british-isles-regulated-and-100-backed-gbp-stablecoin.htm
"Following Terra's Lehman Moment, What's Next for the Market?",Crypto News,2022-07-14,https://cryptonews.com/exclusives/following-terras-lehman-moment-whats-next-for-market.htm
Bitcoin’s sudden resilience to inflation,FXStreet,2022-07-14,https://www.fxstreet.com/cryptocurrencies/news/bitcoins-sudden-resilience-to-inflation-202207140812
Globiance and Metaverser - The Revolutionary Fusion of Global Finance with the Metaverse | Bitcoinist.com,Bitcoinist,2022-07-14,https://bitcoinist.com/globiance-and-metaverser-the-revolutionary-fusion-of-global-finance-with-the-metaverse/
"See You in Court, Anon: UK Judge Allows Lawsuits via NFT Airdrop",Decrypt,2022-07-14,https://decrypt.co/105146/uk-court-lawsuits-nft-airdrop-anon
"Cryptocurrency Prices Today July 15: Bitcoin in the green; Ethereum, XRP biggest gainers",MSN,2022-07-14,https://www.msn.com/en-in/money/topstories/cryptocurrency-prices-today-july-15-bitcoin-in-the-green-ethereum-xrp-biggest-gainers/ar-AAZAX5f
CoinShares Unveils Staked Algorand ETP on Deutsche Boerse,CryptoPotato,2022-07-14,https://cryptopotato.com/coinshares-unveils-staked-algorand-etp-on-deutsche-boerse/
CryptoPunk NFT Sells For $2.7 Million - Why These Rare Collectibles Are Resurging | Bitcoinist.com,Bitcoinist,2022-07-14,https://bitcoinist.com/cryptopunk-sells-for-2-7m/
Uniswap’s Native Token Surges 17% on Robinhood Listing,U.Today,2022-07-14,https://u.today/uniswaps-native-token-surges-17-on-robinhood-listing
Arthur Hayes Expects Fed Intervention Following BTC Price Rise If These Events Happen,U.Today,2022-07-14,https://u.today/arthur-hayes-expects-fed-intervention-following-btc-price-rise-if-these-events-happen
DOT/USD is still searching for the support – Elliott Wave forecast,FXStreet,2022-07-14,https://www.fxstreet.com/cryptocurrencies/news/dotusd-is-still-searching-for-the-support-elliott-wave-forecast-202207140804
Ledger & FTX Partnership and What It Means for You,Crypto News,2022-07-14,https://cryptonews.com/news/ledger-ftx-partnership-what-it-means-for-you.htm
"Bitcoin Should Be Regulated Like Security, Chamath Palihapitiya Opines",Coinspeaker,2022-07-14,https://www.coinspeaker.com/bitcoin-security-chamath-palihapitiya/
When DAO Governance Goes Wrong • Benzinga Crypto,Benzinga,2022-07-14,https://www.benzinga.com/money/when-dao-governance-goes-wrong/
UK Treasury Launches Inquiry on Crypto-Related Risks and Opportunities,CryptoPotato,2022-07-14,https://cryptopotato.com/uk-treasury-launches-inquiry-on-crypto-related-risks-and-opportunities/
"Cardano (ADA), Polygon (MATIC) & ApeCoin (APE) Are Now Available via 5,800 DCMs Across US and Brazil",U.Today,2022-07-14,https://u.today/cardano-ada-polygon-matic-apecoin-ape-are-now-available-via-5800-dcms-across-us-and-brazil
"OKX Wins License in Dubai, Plans to Advance Regulatory Dialogue",CryptoPotato,2022-07-14,https://cryptopotato.com/okx-wins-license-in-dubai-plans-to-advance-regulatory-dialogue/
Here's How Profitable On-Chain Bitcoin Trading Really Is: Strategy Backtesting,U.Today,2022-07-14,https://u.today/heres-how-profitable-on-chain-bitcoin-trading-really-is-strategy-backtesting
The FED Released A Study Of The Lightning Network. These ...,Bitcoinist,2022-07-14,https://bitcoinist.com/the-fed-released-a-study-of-the-lightning-network/
"HIVE Blockchain Is Efficient And Strategically On Point, With A ...",Seeking Alpha,2022-07-14,https://seekingalpha.com/article/4523433-hive-blockchains-efficient-strategically-on-point-with-catch
Hard Fork: MultiDAG 2.0 to Arrive on COTI’s Mainnet,CryptoPotato,2022-07-14,https://cryptopotato.com/hard-fork-multidag-2-0-to-arrive-on-cotis-mainnet/
BNB Chain launches DApp platform with 'Red Alarm' to warn users about scams,Cointelegraph,2022-07-14,https://cointelegraph.com/news/bnb-chain-launches-dapp-platform-with-red-alarm-to-warn-users-about-scams
Why Does Bitcoin Go Crazy Whenever CPI Numbers Are Published?,CryptoPotato,2022-07-14,https://cryptopotato.com/why-does-bitcoin-go-crazy-whenever-cpi-numbers-are-published/
"What is a crypto airdrop, and how does it work?",Cointelegraph,2022-07-14,https://cointelegraph.com/news/what-is-a-crypto-airdrop-and-how-does-it-work
Sri Lanka's Central bank warns public on possible risks in ...,Cryptopolitan,2022-07-14,https://www.cryptopolitan.com/sri-lanka-warns-public-on-crypto/
"150,000 Qubits Printed on a Chip",IEEE Spectrum,2022-07-14,https://spectrum.ieee.org/silicon-spin-qubits
Solana price analysis: Bullish momentum to continue as ...,Cryptopolitan,2022-07-14,https://www.cryptopolitan.com/solana-price-analysis-2022-07-14/
"Before you Buy Ethereum, these are The Impact of Proof of ...",WHYD,2022-07-14,https://whyd.com/before-you-buy-ethereum-these-are-the-impact-of-proof-of-stake-pos-and-centralization/
The Chopping Block: Anatoly Yakovenko on Why Solana Is ...,Unchained Podcast,2022-07-14,https://unchainedpodcast.com/the-chopping-block-anatoly-yakovenko-on-why-solana-is-building-the-saga-phone-ep-373/
BEAM Seeks Support After Break Out From 447-Day ...,BeInCrypto,2022-07-14,https://beincrypto.com/beam-seeks-support-after-break-out-from-447-day-resistance-line/
