Title,Publisher,Date,Link
"$300 Billion Crypto Price Boom: Bitcoin Is Suddenly Soaring Toward $50,000 As Ethereum, BNB, Cardano, XRP, Dogecoin And Uniswap Surge",Forbes,2021-08-08,https://www.forbes.com/sites/billybambrough/2021/08/08/300-billion-crypto-price-boom-bitcoin-is-suddenly-soaring-toward-50000-as-ethereum-bnb-cardano-xrp-dogecoin-and-uniswap-surge/
PSG fan token price surge as Messi deal edge closer,Cryptopolitan,2021-08-08,https://www.cryptopolitan.com/psg-fan-token-price-surge-on-messi/
"Gajesh Naik: Miracle 13-year-old DeFi, NFT developer",Cryptopolitan,2021-08-08,https://www.cryptopolitan.com/gajesh-naik-13-year-old-defi-nft-developer/
Coffee coin: The Brazilian cryptocurrency that promises ...,Cryptopolitan,2021-08-08,https://www.cryptopolitan.com/coffee-coin-brazilian-cryptocurrency/
SNFT and its powerful ecosystem established to make NFT universal,AMBCrypto,2021-08-08,https://ambcrypto.com/snft-and-its-powerful-ecosystem-established-to-make-nft-universa/
Earning Passive Income with DeFi Staking: An Overview,HackerNoon,2021-08-08,https://hackernoon.com/earning-passive-income-with-defi-staking-an-overview-4a1y3720
"Coinbase Adds Option To Buy Crypto With Apple Pay, Google Pay To Follow",NewsBTC,2021-08-08,https://www.newsbtc.com/news/buy-crypto-with-apple-pay-coinbase/
High GAS Fees for On-chain Transactions: Can We Fix it in ...,HackerNoon,2021-08-08,https://hackernoon.com/high-gas-fees-for-on-chain-transactions-can-we-fix-it-in-time-516v37w0
"Atari DEX, Smart Wallet Bring New Level of Functionality to Atari Chain, Make It Ready for Prime Time",Coinspeaker,2021-08-08,https://www.coinspeaker.com/atari-dex-smart-wallet-atari-chain/
