Title,Publisher,Date,Link
Attention Kraken Shoppers! Ether Was Half Off at $700 During Monday’s Crypto Sale,CoinDesk,2021-02-22,https://www.coindesk.com/markets/2021/02/22/attention-kraken-shoppers-ether-was-half-off-at-700-during-mondays-crypto-sale/
Cheap ETH: Ethereum Flash-Crashed 63% To $700 On Kraken Exchange,CryptoPotato,2021-02-22,https://cryptopotato.com/cheap-eth-ethereum-flash-crashed-63-to-700-on-kraken-exchanges/
Ethereum (ETH) Price Analysis for February 22,U.Today,2021-02-22,https://u.today/ethereum-eth-price-analysis-for-february-22
The Next Cryptocurrency to Explode in 2021? 5 Names to ...,InvestorPlace,2021-02-22,https://investorplace.com/2021/02/the-next-cryptocurrency-to-explode-in-2021-5-names-to-consider-as-bitcoin-plunges/
Bitcoin Flash Crash Leads to $4 Billion Liquidated Across ...,BeInCrypto,2021-02-22,https://beincrypto.com/bitcoin-flash-crash-leads-to-4-billion-liquidated-across-exchanges/
3 Reasons Why Gold Bug Peter Schiff Tweets About Bitcoin More Often Than Gold,U.Today,2021-02-22,https://u.today/3-reasons-why-gold-bug-peter-schiff-tweets-about-bitcoin-more-often-than-gold
"Long Blockchain, Icon of the 2017 Crypto Frenzy, Gets Stock Delisted by SEC",Decrypt,2021-02-22,https://decrypt.co/58593/long-blockchain-shares-delisted-sec
BNY Mellon Said to Hire Fireblocks for Bitcoin Custody Service,CoinDesk,2021-02-22,https://www.coindesk.com/business/2021/02/22/bny-mellon-said-to-hire-fireblocks-for-bitcoin-custody-service/
How to Win a Bitcoin Street Fight (Without Mortal Combat),CoinDesk,2021-02-22,https://www.coindesk.com/policy/2021/02/22/how-to-win-a-bitcoin-street-fight-without-mortal-combat/
Nigeria's Crypto Ban Fuels Mistrust in Government,CoinDesk,2021-02-22,https://www.coindesk.com/business/2021/02/22/nigerias-crypto-ban-fuels-mistrust-in-government/
Palm beach letter reviews (teeka tiwari) New banking ticker ...,Seattle Weekly,2021-02-22,https://www.seattleweekly.com/marketplace/palm-beach-letter-reviews-sea-210222/
Want to Influence the Buyer’s Journey? Start With the Right ...,Business 2 Community,2021-02-22,https://www.business2community.com/communications/want-to-influence-the-buyers-journey-start-with-the-right-content-02387215
First Mover: Laser Eyes Can't Stop Correction as Bitcoin Tumbles to $53K,CoinDesk,2021-02-22,https://www.coindesk.com/markets/2021/02/22/first-mover-laser-eyes-cant-stop-correction-as-bitcoin-tumbles-to-53k/
Market Wrap: Bitcoin Stabilizes After Margin Calls Fuel Biggest Plunge in Month,CoinDesk,2021-02-22,https://www.coindesk.com/markets/2021/02/22/market-wrap-bitcoin-stabilizes-after-margin-calls-fuel-biggest-plunge-in-month/
Brave Browser Was Exposing Addresses in Tor Mode for Months,CoinDesk,2021-02-22,https://www.coindesk.com/tech/2021/02/22/brave-browser-was-exposing-addresses-in-tor-mode-for-months/
Lindsay Lohan is Selling a Daft Punk NFT for $15K in Ethereum,Decrypt,2021-02-22,https://decrypt.co/58592/daft-punk-lindsay-lohan-nft
The Hype Behind Dogecoin: A Crypto for the Influencer Generation,Coinfomania,2021-02-22,https://coinfomania.com/dogecoin-crypto-influencer-generation/
Russian Man Turns Video of Him Eating Live Bat Into NFT,Decrypt,2021-02-22,https://decrypt.co/58485/russian-man-turns-video-of-him-eating-live-bat-into-nft
Bitcoin Price Analysis: 4 Takeaways Following the Dump to $47K and Back Above $53K,CryptoPotato,2021-02-22,https://cryptopotato.com/bitcoin-price-analysis-4-takeaways-following-the-dump-to-47k-and-back-above-53k/
Trader's Lesson: Why You Shouldn't Keep Large Amounts of ...,Crypto News,2021-02-22,https://cryptonews.com/news/trader-s-lesson-why-you-shouldn-t-keep-large-amounts-of-cry-9302.htm
