Title,Publisher,Date,Link
Cardano Price Prediction: Is ADA on the Cusp of a Bearish Breakout?,InvestingCube,2021-03-08,https://www.investingcube.com/cardano-price-prediction-is-ada-on-the-cusp-of-a-bearish-breakout-cryptocurrencies/
Binance's MANTRA DAO listing sparks massive criticism due to fraudulent background,FXStreet,2021-03-08,https://www.fxstreet.com/cryptocurrencies/news/binances-mantra-dao-listing-sparks-massive-criticism-due-to-fraudulent-background-202103081143
5 New NFT Projects On The Rise,HackerNoon,2021-03-08,https://hackernoon.com/5-new-nft-projects-on-the-rise-c75b35jm
"FLR, DFLR Airdrops Explained by XRP Community: Rates Revealed",U.Today,2021-03-08,https://u.today/flr-dflr-airdrops-explained-by-xrp-community-rates-revealed
Central Bank of France Eyes XRP as Basis for Digital Euro,U.Today,2021-03-08,https://u.today/central-bank-of-france-eyes-xrp-as-basis-for-digital-euro
"Coinbase, Naval, Framework Ventures Back $19M Raise for a Capital-Efficient Stablecoin",CoinDesk,2021-03-08,https://www.coindesk.com/business/2021/03/08/coinbase-naval-framework-ventures-back-19m-raise-for-a-capital-efficient-stablecoin/
How to Get Started with Smart Contract Development,Tech Times,2021-03-08,https://www.techtimes.com/articles/257804/20210308/how-to-get-started-with-smart-contract-development.htm
"Coinbase Ventures, VCs Pile $2M Into DeFi Platform Saffron: Sources",Decrypt,2021-03-08,https://decrypt.co/60563/coinbase-ventures-vcs-pile-2m-into-defi-platform-saffron-sources
Taco Bell Rides NFT Hype Train With Collectible Digital Tacos,Decrypt,2021-03-08,https://decrypt.co/60587/taco-bell-rides-nft-hype-train-with-collectible-digital-tacos
Litecoin’s high Grayscale premium and what it means for the price,AMBCrypto,2021-03-08,https://ambcrypto.com/litecoins-high-grayscale-premium-and-what-it-means-for-the-price/
Wonder Woman Crypto Artwork NFTs Lasso Up $1.85 Million,Decrypt,2021-03-08,https://decrypt.co/60633/wonder-woman-crypto-artwork-nfts
OpenSea Crashes Following BossLogic NFT Drop via Ethernity,CryptoPotato,2021-03-08,https://cryptopotato.com/opensea-crashes-following-bosslogic-nft-drop-via-ethernity/
FD7 Ventures Acquires Stake in Provider of Canada's First Crypto Credit Card,CoinDesk,2021-03-08,https://www.coindesk.com/business/2021/03/08/fd7-ventures-acquires-stake-in-provider-of-canadas-first-crypto-credit-card/
LiL Moon Rockets Evolves NFT Trend | Bitcoinist.com,Bitcoinist,2021-03-08,https://bitcoinist.com/lil-moon-rockets-evolves-nft-trend/
8 Women Shaking Up the Crypto & Blockchain Space,BeInCrypto,2021-03-08,https://beincrypto.com/8-women-shaking-up-the-crypto-blockchain-space/
Justin Kan Mints YouTube Videos as NFTs - Spotlight,Altcoin Buzz,2021-03-08,https://www.altcoinbuzz.io/cryptocurrency-news/spotlight/justin-kan-mints-youtube-videos-as-nfts/
"Soulja Boy Joins NFT Bandwagon, Sells Five Tweets in Three ...",BeInCrypto,2021-03-08,https://beincrypto.com/soulja-boy-nft-bandwagon-sells-tweets-three-hours/
Top 10 mujeres más influyentes del sector NFT de crypto art,BeInCrypto,2021-03-08,https://es.beincrypto.com/top-10-mujeres-mas-influyentes-sector-nft-crypto-art/
