Title,Publisher,Date,Link
"Do errors in first public testnet dApp, post Alonzo hardfork, mean ‘death of Cardano’",AMBCrypto,2021-09-06,https://ambcrypto.com/are-errors-in-first-public-testnet-dapp-post-alonzo-hardfork-the-death-of-cardano/
"Bitcoin Braced For A 3.3 Million-Strong Global Earthquake This Week As The Price Of Ethereum, Cardano, BNB, XRP, Solana And Dogecoin Soar",Forbes,2021-09-06,https://www.forbes.com/sites/billybambrough/2021/09/06/bitcoin-is-braced-for-a-huge-global-earthquake-this-week-as-the-price-of-ethereum-cardano-bnb-xrp-solana-and-dogecoin-continue-to-soar/
Solana Leads Massive Altcoin And Bitcoin Rally As JPMorgan Warns Crypto Markets Are Looking Bubbly Again,Forbes,2021-09-06,https://www.forbes.com/sites/jonathanponciano/2021/09/06/solana-leads-massive-altcoin-rally-as-jpmorgan-warns-crypto-markets-are-looking-bubbly-again/
What is crypto staking? Best staking coins in 2021,FXStreet,2021-09-06,https://www.fxstreet.com/cryptocurrencies/news/what-is-crypto-staking-best-staking-coins-in-2021-202109060807
"Link, dot and XRP rally as investors opt for cheaper coins",Markets Insider,2021-09-06,https://markets.businessinsider.com/news/currencies/altcoins-crypto-link-dot-xrp-rally-bitcoin-ethereum-cardano-blockchains-2021-9
KCON's YouTube channel has been hijacked and posts ...,allkpop,2021-09-06,https://www.allkpop.com/article/2021/09/kcons-youtube-channel-has-been-hijacked-and-posts-content-about-scammy-looking-nft-blockchain
Bitcoin preserves $51K — Here are the BTC price levels to watch,Cointelegraph,2021-09-06,https://cointelegraph.com/news/bitcoin-preserves-51k-here-are-the-btc-price-levels-to-watch
"Little Baby Doge launches its own token, a cryptocurrency that fights global warming",AMBCrypto,2021-09-06,https://ambcrypto.com/little-baby-doge-launches-its-own-token-a-cryptocurrency-that-fights-global-warming/
"Ethereum Mining Difficulty Hit New High with 200,000 ETH Burned: Here's How Market Reacts",U.Today,2021-09-06,https://u.today/ethereum-mining-difficulty-hit-new-high-with-200000-eth-burned-heres-how-market-reacts
Senegalese worried over progress made Akon crypto city,Cryptopolitan,2021-09-06,https://www.cryptopolitan.com/senegalese-worried-over-akon-crypto-city/
"Solana, rival to Ethereum, is climbing the crypto top 10",Al Jazeera,2021-09-06,https://www.aljazeera.com/economy/2021/9/6/solana-rival-to-ethereum-is-climbing-the-crypto-top-10
The Top 3 Competitive Advantages of Elite Investors,Business 2 Community,2021-09-06,https://www.business2community.com/finance/the-top-3-competitive-advantages-of-elite-investors-02429362
Aragon deploys on Polygon (MATIC) to optimize DAO creation,CryptoSlate,2021-09-06,https://cryptoslate.com/aragon-deploys-on-polygon-matic-to-optimize-dao-creation/
Cabital Secures $4 Million in Seed Funding as It Further Strengthens Its Offerings | Bitcoinist.com,Bitcoinist,2021-09-06,https://bitcoinist.com/cabital-secures-4-million-in-seed-funding-as-it-further-strengthens-its-offerings/
El Salvador Officially Becomes First Country to Buy Bitcoin with Initial 200 BTC Purchase,CryptoPotato,2021-09-06,https://cryptopotato.com/el-salvador-officially-becomes-first-country-to-buy-bitcoin-with-initial-200-btc-purchase/
ZKSwap (ZKS) and SofaSwap Launch Joint Staking Program to Boost Earning Opportunities,U.Today,2021-09-06,https://u.today/zkswap-zks-and-sofaswap-launch-joint-staking-program-to-boost-earning-opportunities
$19 Million: The Current Bid for 107 Bored Yacht Apes NFTs Minted for 0.08 ETH Each,CryptoPotato,2021-09-06,https://cryptopotato.com/19-million-the-current-bid-for-107-bored-yacht-apes-nfts-minted-for-0-08-eth-each/
Here’s why crypto-mining rigs are in high demand in Vietnam,AMBCrypto,2021-09-06,https://ambcrypto.com/heres-why-crypto-mining-rigs-are-in-high-demand-in-vietnam/
