Title,Publisher,Date,Link
Crypto Analyst on Cardano: “September 12th Isn't the Target ...,Cryptoglobe,2021-08-27,https://www.cryptoglobe.com/latest/2021/08/crypto-analyst-on-cardano-september-12th-isnt-the-target-its-the-starting-line/
Cardano (ADA) Founder Responds To Criticism Over New Crypto Partnership,NewsBTC,2021-08-27,https://www.newsbtc.com/news/cardano/cardano-founder-responds-to-criticism/
Cardano chart painting a bull flag for $3 ADA price ahead of ERC-20 converter launch,Cointelegraph,2021-08-27,https://cointelegraph.com/news/cardano-chart-painting-a-bull-flag-for-3-ada-price-ahead-of-erc-20-converter-launch
Crypto Price Prediction: Ethereum To ‘Exceed’ Bitcoin But Both Could Be Left In The Dust By Cardano,Forbes,2021-08-27,https://www.forbes.com/sites/billybambrough/2021/08/27/crypto-price-prediction-ethereum-to-exceed-bitcoin-but-both-could-be-left-in-the-dust-by-cardano/
Polkadot lags behind Solana and Cardano as it attempts to solve Vitalik Buterin's ‘Blockchain Trilemma’,FXStreet,2021-08-27,https://www.fxstreet.com/cryptocurrencies/news/polkadot-lags-behind-solana-and-cardano-as-it-attempts-to-solve-vitalik-buterins-blockchain-trilemma-202108270846
"These 7 Altcoins Are ‘About To Pop,’ According to Altcoin Daily",The Daily Hodl,2021-08-27,https://dailyhodl.com/2021/08/27/these-7-altcoins-are-about-to-pop-according-to-altcoin-daily/
"Price Analysis Overview August 27: Bitcoin, Ethereum, Ripple, Cardano & Solana",CryptoPotato,2021-08-27,https://cryptopotato.com/price-analysis-overview-august-27-bitcoin-ethereum-ripple-cardano-solana/
Cardano: A Realistic Way to Handle Competing Elliott Wave ...,Elliott Wave International,2021-08-27,https://www.elliottwave.com/ElliottWaveTV/Cardano-A-Realistic-Way-to-Handle-Competing-Elliott-Wave-Counts
"7 Altcoins With Huge Upside As Bitcoin Rises to $85,000",Business Insider,2021-08-27,https://www.businessinsider.com/bitcoin-crypto-ethereum-cardano-solana-altcoins-polkadot-chainlink-david-gokhshtein-2021-8
Ethereum Displaying Encouraging Signs Amid Crypto Market Pullback: Santiment,The Daily Hodl,2021-08-27,https://dailyhodl.com/2021/08/27/ethereum-displaying-encouraging-signs-amid-crypto-market-pullback-santiment/
Morgan Stanley holds over $36 million worth of Bitcoin (BTC) via Grayscale,CryptoSlate,2021-08-27,https://cryptoslate.com/morgan-stanley-holds-over-36-million-worth-of-bitcoin-btc-via-grayscale/
VeChain price prediction 2021: Can the crypto reach $1?...,The Sun,2021-08-27,https://www.the-sun.com/money/3550635/vechain-price-prediction-2021/
The Crypto Evolution Continues as DeFi and NFTS Meet and ...,Securities.io,2021-08-27,https://www.securities.io/the-crypto-evolution-continues-as-defi-and-nfts-meet-and-merge/
Cartesi (CTSI) NOWPayment and Other Important Updates ...,Altcoin Buzz,2021-08-27,https://www.altcoinbuzz.io/cryptocurrency-news/product-release/cartesi-ctsi-nowpayment-and-other-important-updates/
Ethereum Faces Chain Split as Node Operators Fail to Update Geth Hotfix,CoinDesk,2021-08-27,https://www.coindesk.com/tech/2021/08/27/ethereum-faces-chain-split-as-node-operators-fail-to-update-geth-hotfix/
Hard Forks vs Soft Forks: How Do They Differ?,Ripple Coin News,2021-08-27,https://ripplecoinnews.com/hard-forks-vs-soft-forks-how-do-they-differ/
How an alleged Dogecoin scam in Turkey saw crypto investors lose €100 million,Euronews,2021-08-27,https://www.euronews.com/next/2021/08/27/how-an-alleged-dogecoin-scam-in-turkey-saw-crypto-investors-lose-100-million
Solana hits record high with SOL price up over 218% in six ...,Cointelegraph,2021-08-27,https://cointelegraph.com/news/solana-hits-record-high-with-sol-price-up-over-218-in-six-weeks-what-s-behind-the-rally
DJ Alok: Twitter and YouTube Profiles Get Hacked,Somag News,2021-08-27,https://www.somagnews.com/dj-alok-twitter-and-youtube-profiles-get-hacked/
Nearly $2 Billion Stablecoins Recently Flowed into Exchanges: Here’s What This Means (Analysis),CryptoPotato,2021-08-27,https://cryptopotato.com/nearly-2-billion-stablecoins-recently-flowed-into-exchanges-heres-what-this-means-analysis/
SOL 2030 Price Prediction: Why Is It Rising and How High Will ...,Market Realist,2021-08-27,https://marketrealist.com/p/sol-2030-price-prediction-why-rising-how-high/
