Title,Publisher,Date,Link
"Cardano (ADA) Demand Rises Amongst Retail And Institutional Investors, Why This Is Happening",NewsBTC,2021-07-13,https://www.newsbtc.com/news/cardano/cardano-demand-rises-amongst-investors/
Watch These 7 Cryptos With Major Upgrades Ahead,InvestorPlace,2021-07-13,https://investorplace.com/2021/07/7-cryptos-major-upgrades-ahead/
Chainlink Challenger Band Protocol Launches Next Phase of Its Network,CoinDesk,2021-07-13,https://www.coindesk.com/business/2021/07/13/chainlink-challenger-band-protocol-launches-next-phase-of-its-network/
"Interoperability Project Connext Raises $12M From 1kx, ConsenSys",CoinDesk,2021-07-13,https://www.coindesk.com/business/2021/07/13/interoperability-project-connext-raises-12m-from-1kx-consensys/
Greysheet News,Greysheet News,2021-07-13,https://www.greysheet.com/news/story/redesigned-united-states-mint-2021-american-eagle-silver-proof-coin-available-july-20
Science school toilets turn dumps into digital currencies,Forkast News,2021-07-13,https://forkast.news/science-school-toilets-turn-crap-into-crypto/
Billy Markus Dogecoin co-founder to auction new NFT,Cryptopolitan,2021-07-13,https://www.cryptopolitan.com/billy-markus-to-auction-new-nft/
"Crypto Report: Traders Outflows 2,000 BTC from Centralized Exchanges on a Daily Basis",Ripple Coin News,2021-07-13,https://ripplecoinnews.com/traders-outflows-2000-btc-from-centralized-exchanges-on-a-daily-basis/
Is Satoshi cashing out? 640 nine-year-old Bitcoin on the move,FXStreet,2021-07-13,https://www.fxstreet.com/cryptocurrencies/news/is-satoshi-cashing-out-640-nine-year-old-bitcoin-on-the-move-202107131344
Baby Doge Plunges 40% As Hype Dies Down | Bitcoinist.com,Bitcoinist,2021-07-13,https://bitcoinist.com/baby-doge-plunges-40-as-hype-dies-down/
Paraguay Proposed Bitcoin Law Includes Crypto Registration: Report,CoinDesk,2021-07-13,https://www.coindesk.com/markets/2021/07/14/paraguay-proposed-bitcoin-law-includes-crypto-registration-report/
Don't Blame Bitcoin for Ransomware,CoinDesk,2021-07-13,https://www.coindesk.com/markets/2021/07/13/dont-blame-bitcoin-for-ransomware/
NFTs and the music industry: Token gesture or transformative technology? | Part 1,Forkast,2021-07-13,https://forkast.news/nfts-and-the-music-industry-part-1/
The best places to buy Jasmy coin: JASMY crypto is up 125 ...,CoinJournal,2021-07-13,https://coinjournal.net/news/the-best-places-to-buy-jasmy-coin-jasmy-crypto-is-up-130-today/
3 Firms Vie to Develop South Korea's CBDC Pilot,CoinDesk,2021-07-13,https://www.coindesk.com/markets/2021/07/13/3-firms-vie-to-develop-south-koreas-cbdc-pilot/
Visa Approves Australian Startup to Issue Debit Cards for Spending Bitcoin,CoinDesk,2021-07-13,https://www.coindesk.com/markets/2021/07/14/visa-approves-australian-startup-to-issue-debit-cards-for-spending-bitcoin/
How to build a profitable industrial-scale Bitcoin mining operation,CryptoSlate,2021-07-13,https://cryptoslate.com/how-to-build-a-profitable-industrial-scale-bitcoin-mining-operation/
Poland Regulators Spread Warning Against Cryptocurrency Exchange Binance,NewsBTC,2021-07-13,https://www.newsbtc.com/news/poland-regulators-cryptocurrency-exchange/
Sanshu Inu to Offer Meme Coins Staking with Dogpark,Coinspeaker,2021-07-13,https://www.coinspeaker.com/sanshu-inu-meme-coins-dogpark/
"Ethereum Price Analysis: ETH Facing Critical Long-Term Support, Will $2K Hold?",CryptoPotato,2021-07-13,https://cryptopotato.com/ethereum-price-analysis-eth-facing-critical-long-term-support-will-2k-hold/
BABYDOGE Price Dips 15.2% to $0.00000000257 – How to ...,InsideBitcoins,2021-07-13,https://insidebitcoins.com/news/babydoge-price-dips-15-2-to-0-00000000257-how-to-buy-baby-doge-dip
