Title,Publisher,Date,Link
Cardano: This Indicator Reveals Buyers' Indecision as Price Nears $0.50,U.Today,2022-06-12,https://u.today/cardano-this-indicator-reveals-buyers-indecision-as-price-nears-050
How to Start Generating Passive Income with Cryptocurrency ...,Crypto News,2022-06-12,https://cryptonews.com/news/how-start-generating-passive-income-with-cryptocurrency-staking-cardano-ada-by-simply-holding-gnox-token-gnox.htm
$ADA: Actor and Comedian Martin Lawrence Starts Selling ...,Cryptoglobe,2022-06-12,https://www.cryptoglobe.com/latest/2022/06/ada-actor-and-comedian-martin-lawrence-starts-selling-his-cardano-powered-nfts/
"Crypto continues to bleed: Ethereum, Cardano, Dogecoin and ...",Cardano Feed,2022-06-12,https://cardanofeed.com/crypto-continues-to-bleed-ethereum-cardano-dogecoin-and-more-are-falling-hard-again-85850.html
Cardano: IOG Launches Its New Permissionless Ethereum ...,Cardano Feed,2022-06-12,https://cardanofeed.com/cardano-iog-launches-its-new-permissionless-ethereum-virtual-machine-evm-sidechain-alpha-on-testnet-85909.html
Hard fork de Cardano (ADA) : Nouvel espoir des investisseurs,Cointribune,2022-06-12,https://www.cointribune.com/analyses/institutions-entreprises/hard-fork-de-cardano-ada-nouvel-espoir-des-investisseurs/
Jack Dorsey's Web 5 to Compete with Web 3,Business 2 Community,2022-06-12,https://www.business2community.com/crypto-news/jack-dorseys-web-5-to-compete-with-web-3-02503836
"Ethereum's Dip to $1,150 May Cause Catastrophe on Lending Market, Here's How",U.Today,2022-06-12,https://u.today/ethereums-dip-to-1150-may-cause-catastrophe-on-lending-market-heres-how
Terra’s Do Kwon Denies Cashing Out $2.7 Billion,U.Today,2022-06-12,https://u.today/terras-do-kwon-denies-cashing-out-27-billion
Ethereum’s Vitalik Buterin Says There’s No Coherent Definition of Metaverse,U.Today,2022-06-12,https://u.today/ethereums-vitalik-buterin-says-theres-no-coherent-definition-of-metaverse
Nigeria’s Largest Stock Exchange Plans to Adopt Blockchain for Settling Trades,CryptoPotato,2022-06-12,https://cryptopotato.com/nigerias-largest-stock-exchange-plans-to-adopt-blockchain-for-settling-trades/
