Title,Publisher,Date,Link
Cardano Successfully Launches Vasil Upgrade on Testnet,CryptoPotato,2022-07-04,https://cryptopotato.com/cardano-successfully-launches-vasil-upgrade-on-testnet/
Cardano (ADA) Moves Toward Last Stage of Key Network ...,The Motley Fool,2022-07-04,https://www.fool.com/the-ascent/cryptocurrency/articles/cardano-ada-moves-toward-last-stage-of-key-network-upgrade/
Cardano launches Vasil upgrade on testnet,Blockchain Technology News,2022-07-04,https://www.blockchaintechnology-news.com/2022/07/cardano-launches-vasil-upgrade-testnet/
Exploit seeks to take $8.8M from Solana network's Crema,Cryptopolitan,2022-07-04,https://www.cryptopolitan.com/solana-based-crema-loses-8-78-million/
"Crypto Lender Celsius Cuts 150 Jobs Citing ‘Extreme Market Conditions’, Bitcoin Rises",Outlook India,2022-07-04,https://www.outlookindia.com/business/crypto-lender-celsius-cuts-150-jobs-citing-extreme-market-conditions-bitcoin-rises-news-206716
"Celsius Sends $72 Million Worh of ETH to ""Dump"" Wallet, Here's What to Expect",U.Today,2022-07-04,https://u.today/celsius-sends-72-million-worh-of-eth-to-dump-wallet-heres-what-to-expect
"Massive Bitcoin (BTC) Longs Show up on Holiday Crypto Market, What It's About",U.Today,2022-07-04,https://u.today/massive-bitcoin-btc-longs-show-up-on-holiday-crypto-market-what-its-about
"Coinlocally Crypto Service Introduces New Features, Releases NFT Marketplace: Review",U.Today,2022-07-04,https://u.today/coinlocally-crypto-service-introduces-new-features-releases-nft-marketplace-review-1
Crypto Industry Players Say Market Correction Is 'Healthy ...,Cryptoglobe,2022-07-04,https://www.cryptoglobe.com/latest/2022/07/crypto-industry-players-say-market-correction-is-healthy-despite-historic-selloff/
Did You Get Rug-Pulled by Baller Ape Club NFT and Can the ...,Business 2 Community,2022-07-04,https://www.business2community.com/nft-news/did-you-get-rug-pulled-by-baller-ape-club-nft-and-can-the-doj-help-02515925
EasyJet Stock Collapses to Pandemic Lows as COO Resigns,Business 2 Community,2022-07-04,https://www.business2community.com/stock-news/easyjet-stock-collapses-to-pandemic-lows-as-coo-resigns-02516231
Did You Know that Shiba Inu Burned Coins Value Have Exceeded the Market Cap of MATIC?,Times Tabloid,2022-07-04,https://timestabloid.com/did-you-know-that-shiba-inu-burned-coins-value-have-exceeded-the-total-market-cap-of-matic/
Komodo Climbs 34% - Is it Time to Buy KMD Crypto?,Business 2 Community,2022-07-04,https://www.business2community.com/crypto-news/komodo-climbs-34-is-it-time-to-buy-kmd-crypto-02515976
Why Ethereum Scaler Arbitrum Hit Pause on Odyssey NFT Campaign,Decrypt,2022-07-04,https://decrypt.co/104408/why-ethereum-scaler-arbitrum-hit-pause-on-odyssey-nft-campaign
"NFT Platforms Should Be Subject to Money-Laundering Regulation, EU Lawmakers Say",CoinDesk,2022-07-04,https://www.coindesk.com/policy/2022/07/04/nft-platforms-should-be-caught-by-eu-money-laundering-overhaul-lawmakers-say/
Coinbase-backed Vauld becomes the latest crypto lender to pause withdrawals,CryptoSlate,2022-07-04,https://cryptoslate.com/coinbase-backed-vauld-becomes-the-latest-crypto-lender-to-pause-withdrawals/
Why Zuckerberg Kills Off Novi Crypto Wallet but Still Loves ...,Business 2 Community,2022-07-04,https://www.business2community.com/crypto-news/why-zuckerberg-kills-off-novi-crypto-wallet-but-still-loves-nfts-02515663
Watch this element to pinpoint the next leg lower in MATIC price action,FXStreet,2022-07-04,https://www.fxstreet.com/cryptocurrencies/news/watch-this-element-to-pinpoint-the-next-leg-lower-in-matic-price-action-202207041246
Best Inventory Management Software : August 2022,Business 2 Community,2022-07-04,https://www.business2community.com/workflow/best-inventory-management-software
BIS Explores Allowing Banks to Hold 1% of Reserves in Bitcoin,Business 2 Community,2022-07-04,https://www.business2community.com/crypto-news/bis-explores-allowing-banks-to-hold-1-of-reserves-in-bitcoin-02515896
Price of Bitcoin Exchange KuCoin's KCS Token Tanks Amid Insolvency Rumors,Decrypt,2022-07-04,https://decrypt.co/104422/price-of-kucoin-tanks-amid-exchanges-insolvency-rumors
18.8 Million Dogecoin Bought by Whale with 40 Million XRP,U.Today,2022-07-04,https://u.today/188-million-dogecoin-bought-by-whale-with-40-million-xrp
"EUR/USD erases gains, drops toward 1.0400 on a quiet day",FXStreet,2022-07-04,https://www.fxstreet.com/news/eur-usd-erases-gains-drops-toward-10400-on-a-quiet-day-202207041635
BNB Chain Updates | Superfluid Protocol is Now on BNB ...,Altcoin Buzz,2022-07-04,https://www.altcoinbuzz.io/cryptocurrency-news/bnb-chain-updates-superfluid-protocol-is-now-bnb-chain-july-week-1/
GBP/USD steadily moves back above mid-1.2100s to fresh daily high amid weaker USD,FXStreet,2022-07-04,https://www.fxstreet.com/news/gbp-usd-steadily-moves-back-above-mid-12100s-fresh-daily-high-amid-weaker-usd-202207041317
"Discover These Three Cryptocurrencies: Hedera (HBAR), Cronos (CRO) and Mehracki Token (MKI) | Bitcoinist.com",Bitcoinist,2022-07-04,https://bitcoinist.com/discover-these-three-cryptocurrencies-hedera-hbar-cronos-cro-and-mehracki-token-mki/
Bitgert Price Prediction for July 2022. Is BRISE a Good Buy?,CoinJournal,2022-07-04,https://coinjournal.net/news/bitgert-price-prediction-for-july-2022-is-brise-a-good-buy/
Will USDC collapse? Assessing if these claims hold water,AMBCrypto,2022-07-04,https://ambcrypto.com/usdc-might-experience-a-collapse-assessing-if-claims-hold-water/
"Pantera Capital Highlights Terra (LUNA), Celsius, and Three Arrows Capital’s Fiasco",Times Tabloid,2022-07-04,https://timestabloid.com/pantera-capital-highlights-terra-luna-celsius-and-three-arrows-capitals-fiasco/
"BTC, DOGE and SHIB Price Analysis for July 4",U.Today,2022-07-04,https://u.today/btc-doge-and-shib-price-analysis-for-july-4
The British Army's spokesperson says a probe into the matter ...,Bankless Times,2022-07-04,https://www.banklesstimes.com/news/2022/07/04/british-armys-social-media-accounts-breached-by-pro-crypto-hackers/
Multichain Bridge Integrates With RSK to Enhance DeFi Access on Bitcoin,CryptoPotato,2022-07-04,https://cryptopotato.com/multichain-bridge-integrates-with-rsk-to-enhance-defi-access-on-bitcoin/
‘Aave of Klaytn’ KLAP Protocol TVL Soars $102 Million in First Week of Launch,CryptoPotato,2022-07-04,https://cryptopotato.com/aave-of-klaytn-klap-protocol-tvl-soars-102-million-in-first-week-of-launch/
Bank of Cyprus announces voluntary retirement scheme,Cyprus Mail,2022-07-04,https://cyprus-mail.com/2022/07/04/bank-of-cyprus-announces-voluntary-retirement-scheme/
Mobile Applications Are Changing The Business Landscape ...,Techpoint.Africa,2022-07-04,https://techpoint.africa/2022/07/04/mobile-applications-are-changing-the-business-landscape-a-major-case-study-is-the-kashia-app-of-mzuri-solutions
Fund Manager 21Shares Slashes Fees in Face of Market ...,BeInCrypto,2022-07-04,https://beincrypto.com/fund-manager-21shares-slashes-fees-in-face-of-market-collapse/
Here's Why You Should Watch Bitcoin Closely This Week,U.Today,2022-07-04,https://u.today/heres-why-you-should-watch-bitcoin-closely-this-week
"ViaBTC’s Sixth-Anniversary Events Come to a Successful End, Bringing Tens of Thousands of Users to a Crypto Carnival",NewsBTC,2022-07-04,https://www.newsbtc.com/news/company/viabtcs-sixth-anniversary-events-come-to-a-successful-end-bringing-tens-of-thousands-of-users-to-a-crypto-carnival/
OpenSea Co-Founder Steps Down to Focus on New Projects,CryptoPotato,2022-07-04,https://cryptopotato.com/opensea-co-founder-steps-down-to-focus-on-new-projects/
Singapore Regulator May Limit Retail Participation in Crypto,CryptoPotato,2022-07-04,https://cryptopotato.com/singapore-regulator-may-limit-retail-participation-in-crypto/
Can Mehracki (MKI) Compete Against Amp (AMP)?,CryptoNewsZ,2022-07-04,https://www.cryptonewsz.com/can-mehracki-compete-against-amp/
Roger Ver delivers ‘disappointing’ statement on unfolding CoinFLEX saga,CryptoSlate,2022-07-04,https://cryptoslate.com/roger-ver-delivers-disappointing-statement-on-unfolding-coinflex-saga/
Investing In Stratis (STRAX) - Everything You Need to Know,Securities.io,2022-07-04,https://www.securities.io/investing-in-stratis-strax-everything-you-need-to-know/
Jasmy Coin Price is Nearing its Record Low. Is it a Good Buy?,CoinJournal,2022-07-04,https://coinjournal.net/news/jasmy-coin-price-is-nearing-its-record-low-is-it-a-good-buy/
Ethereum Name Service Sells for Second-Highest Price Ever of 300 ETH,CryptoPotato,2022-07-04,https://cryptopotato.com/ethereum-name-service-sells-for-second-highest-price-ever-of-300-eth/
Polkadot Vs. Cosmos – Everything You Need to Know,Securities.io,2022-07-04,https://www.securities.io/polkadot-vs-cosmos-everything-you-need-to-know/
Stacks Announces Scaling of its Grants and Stacks ...,Securities.io,2022-07-04,https://www.securities.io/stacks-announces-scaling-of-its-grants-and-stacks-foundation-programming/
Pi Coin Price Prediction: Is Pi a Well-Designed Scam?,InvestingCube,2022-07-04,https://www.investingcube.com/pi-coin-price-prediction-is-pi-a-well-designed-scam-cryptocurrencies/
"Crypto.com Referral Codes & Bonuses: Earn Up To $2,000",GOBankingRates,2022-07-04,https://www.gobankingrates.com/investing/crypto/crypto-com-referral-code/
Circle CEO Refutes Rumor of USDC Collapse Due to Exposure to Troubled Firms,CryptoPotato,2022-07-04,https://cryptopotato.com/circle-ceo-refutes-rumor-of-usdc-collapse-due-to-exposure-to-troubled-firms/
"Bitsliced, the Revolution Behind Asset Tokenization",BeInCrypto,2022-07-04,https://beincrypto.com/bitsliced-the-revolution-behind-asset-tokenization/
Don’t Miss Out on These 5 Cryptocurrencies! | Bitcoinist.com,Bitcoinist,2022-07-04,https://bitcoinist.com/dont-miss-out-on-these-5-cryptocurrencies/
Jacobi to Launch Europe's First Bitcoin ETF This Month ...,Securities.io,2022-07-04,https://www.securities.io/jacobi-to-launch-europes-first-bitcoin-etf-this-month-vaneck-refiles-for-bitcoin-spot-etf/
Forex Signals Brief for July 4: Central Bankers on the Agenda ...,FXLeaders,2022-07-04,https://www.fxleaders.com/news/2022/07/04/forex-signals-brief-for-july-4-central-bankers-on-the-agenda-this-week/
Almost a quarter of US investors used loans to buy crypto,CryptoSlate,2022-07-04,https://cryptoslate.com/21-percent-of-crypto-investors-used-a-loan-to-buy-cryptocurrencies/
Monthly NFT sales fall below US$1B for 1st time in 12 months,Forkast,2022-07-04,https://forkast.news/monthly-nft-sales-below-1billion-12-months/
Gold Price Prediction: Hawkish Fedspeak Pressurizing XAU/USD,InvestingCube,2022-07-04,https://www.investingcube.com/gold-price-prediction-hawkish-fedspeak-pressurizng-xau-usd-commodities/
Does Cutting Back on Small Expenses Really Make a Big ...,The Motley Fool,2022-07-04,https://www.fool.com/the-ascent/buying-stocks/articles/does-cutting-back-on-small-expenses-really-make-a-big-difference-heres-what-warren-buffett-says/
Splinterlands Tops Blockchain Gaming This Week As Axie Infinity Shows A Minor Rebound,CryptoMode,2022-07-04,https://cryptomode.com/splinterlands-tops-blockchain-gaming-this-week-as-axie-infinity-shows-a-minor-rebound/
Why this Ex 'Call of Duty' chief is getting into GameFi - John ...,KITCO,2022-07-04,https://www.kitco.com/news/2022-07-04/Why-this-Ex-Call-of-Duty-chief-is-getting-into-GameFi-John-Linden.html
Crypto winter impact: 50% drop in the number of active crypto ...,KITCO,2022-07-04,https://www.kitco.com/news/2022-07-04/Crypto-winter-impact-50-drop-in-the-number-of-active-crypto-users-says-Bank-of-America.html
Bitcoin as a global standard would be an 'absolute economic ...,KITCO,2022-07-04,https://www.kitco.com/news/2022-07-04/Bitcoin-as-a-global-standard-would-be-an-absolute-economic-catastrophe-Ernst-Young-s-global-blockchain-leader.html
'Now they are reaching out to us' - Giyani Metals on battery ...,KITCO,2022-07-04,https://www.kitco.com/news/2022-07-04/-Now-they-are-reaching-out-to-us-Giyani-Metals-on-battery-makers-growing-interest-in-manganese.html
Bet On MrBeast Odds To Reach 100 Million YouTube Subscribers By 2023,Legal Sports Betting,2022-07-04,https://sportsbetting.legal/news/bet-on-mrbeast-odds-to-reach-100-million-youtube-subscribers/
This One Choice Can Add Hundreds to Your Mortgage ...,The Motley Fool,2022-07-04,https://www.fool.com/the-ascent/mortgages/articles/this-one-choice-can-add-hundreds-to-your-mortgage-payment-but-it-can-sometimes-be-a-good-move/
Binance CEO Raises Alarm on Chinese Data Breach,BeInCrypto,2022-07-04,https://beincrypto.com/binance-ceo-raises-alarm-on-chinese-data-breach/
Brazilian Nickel launches the world's first stand-alone nickel ...,KITCO,2022-07-04,https://www.kitco.com/news/2022-07-04/Brazilian-Nickel-launches-the-world-s-first-stand-alone-nickel-laterite-heap-leaching-operation.html
Could Paying Cash Save You Money? Here's What Mark ...,The Motley Fool,2022-07-04,https://www.fool.com/the-ascent/credit-cards/articles/could-paying-cash-save-you-money-heres-what-mark-cuban-says/
Will Runaway Inflation Lead to Higher Costco Subscriptions?,The Motley Fool,2022-07-04,https://www.fool.com/the-ascent/personal-finance/articles/will-runaway-inflation-lead-to-higher-costco-subscriptions/
Barbara Corcoran Has These 3 Side Hustle Tips,The Motley Fool,2022-07-04,https://www.fool.com/the-ascent/personal-finance/articles/barbara-corcoran-has-these-3-side-hustle-tips/
"Millennium Partners, L.P. UK Regulatory Announcement ...",ACROFAN,2022-07-04,https://us.acrofan.com/detail.php?number=687941
Stimulus Update: No Stimulus Checks in Sight as U.S. Rents ...,The Motley Fool,2022-07-04,https://www.fool.com/the-ascent/personal-finance/articles/stimulus-update-no-stimulus-checks-in-sight-as-us-rents-soar/
SiO2 Finance will Offer Services on Astar and Polkadot,NameCoinNews,2022-07-04,https://www.namecoinnews.com/sio2-finance-will-offer-services-on-astar-and-polkadot/
Planning to Finance a Home Repair? You May Want to ...,The Motley Fool,2022-07-04,https://www.fool.com/the-ascent/personal-finance/articles/planning-to-finance-a-home-repair-you-may-want-to-rethink-that/
Why I Financed My Last Car Even Though I Could've Paid for ...,The Motley Fool,2022-07-04,https://www.fool.com/the-ascent/personal-finance/articles/why-i-financed-my-last-car-even-though-i-couldve-paid-for-it-upfront/
75% of Hourly Workers Have Struggled to Pay the Bills This ...,The Motley Fool,2022-07-04,https://www.fool.com/the-ascent/personal-finance/articles/75-percent-of-hourly-workers-have-struggled-to-pay-the-bills-this-year-how-can-they-get-out-of-the-grind/
Voyager confirms withdrawals for transactions submitted prior to suspending trading,CryptoSlate,2022-07-04,https://cryptoslate.com/voyager-opens-withdrawals-for-transactions-submitted-prior-to-suspending-trading/
Buying a Home? Dave Ramsey Says to Avoid This Loan at All ...,The Motley Fool,2022-07-04,https://www.fool.com/the-ascent/mortgages/articles/buying-a-home-dave-ramsey-says-to-avoid-this-loan-at-all-costs/
Why AMC's $20-per-Month Ticket Plan Is an Unbeatable Deal,The Motley Fool,2022-07-04,https://www.fool.com/the-ascent/personal-finance/articles/why-amcs-20-per-month-ticket-plan-is-an-unbeatable-deal/
Web3 Company Speaks Nintendo GameCube Logo Plagiarized?,Bitcoinist,2022-07-04,https://bitcoinist.com/web3-gaming-speaks-nintendo-gamecube-plagiarized/
I Quit My Job Without Another Lined Up. Here's How I ...,The Motley Fool,2022-07-04,https://www.fool.com/the-ascent/personal-finance/articles/i-quit-my-job-without-another-lined-up-heres-how-i-managed-it/
Cineworld Share Price Forecast: CINE Bankruptcy Can’t be Ruled Out,InvestingCube,2022-07-04,https://www.investingcube.com/cineworld-share-price-forecast-cine-bankruptcy-cant-be-ruled-out-shares/
Gorilix (SILVA): A Full-Featured Heir to Dogecoin’s Success? | Bitcoinist.com,Bitcoinist,2022-07-04,https://bitcoinist.com/gorilix-silva-a-full-featured-heir-to-dogecoins-success/
Will Chronoly (CRNO) Be As Successful As Dogecoin (DOGE)? | Bitcoinist.com,Bitcoinist,2022-07-04,https://bitcoinist.com/will-chronoly-crno-be-as-successful-as-dogecoin-doge/
"The Evolution of Blockchain Gave Us DeFi, NFTs, Alt-L1s ...",Crypto News BTC,2022-07-04,https://cryptonewsbtc.org/2022/07/04/the-evolution-of-blockchain-gave-us-defi-nfts-alt-l1s-next-up/
Polkadot is Down 70% in 2 Months; DOT Finds Support at $6.4,Crypto Economy,2022-07-04,https://crypto-economy.com/polkadot-is-down-70-in-2-months-dot-finds-support-at-6-4/
Central African Republic Announces the Release of its Crypto ...,The Cryptocurrency Post,2022-07-04,https://thecryptocurrencypost.net/central-african-republic-announces-the-release-of-its-crypto-sango-coin/
Meitu loses up To $52.3 Million due to the fall in crypto prices,Coinnounce,2022-07-04,https://coinnounce.com/meitu-loses-up-to-52-3-million-due-to-the-fall-in-crypto-prices/
"Ripple does not stand a chance against SEC, affirms former ...",Crypto News BTC,2022-07-04,https://cryptonewsbtc.org/2022/07/04/ripple-does-not-stand-a-chance-against-sec-affirms-former-securities-regulator/
