Title,Publisher,Date,Link
Cardano Launched EVM Sidechain on its Testnet,CryptoPotato,2022-06-14,https://cryptopotato.com/cardaon-launched-evm-sidechain-on-its-testnet/
Cardano launches EVM side chain alpha,CryptoSlate,2022-06-14,https://cryptoslate.com/cardano-launches-evm-side-chain/
Why the crypto bloodbath can present a unique opportunity for Cardano’s ADA price,FXStreet,2022-06-14,https://www.fxstreet.com/cryptocurrencies/news/why-the-crypto-bloodbath-can-present-a-unique-opportunity-for-cardanos-ada-price-202206141250
Can Mehracki (MKI) Match the Success of Aave (AAVE) and Cardano (ADA)?,Outlook India,2022-06-14,https://www.outlookindia.com/outlook-spotlight/can-mehracki-mki-match-the-success-of-aave-aave-and-cardano-ada--news-202297
"Cardano, XRP Face Institutional Inflows as Investors Draw Funds from Bitcoin and Ethereum",U.Today,2022-06-14,https://u.today/cardano-xrp-face-institutional-inflows-as-investors-draw-funds-from-bitcoin-and-ethereum
Ethereum Virtual Machine goes live on Cardano testnet,Blockchain Technology News,2022-06-14,https://www.blockchaintechnology-news.com/2022/06/ethereum-virtual-machine-live-cardano-testnet/
"Apexaverse, the First Cardano-Based Metaverse P2E Gaming with Web3 Launches Token Sale",U.Today,2022-06-14,https://u.today/apexaverse-the-first-cardano-based-metaverse-p2e-gaming-with-web3-launches-token-sale
Cardano Price Analysis: Dead Cat Bounce or Recovery for ...,CryptoPotato,2022-06-14,https://cryptopotato.com/cardano-price-analysis-dead-cat-bounce-or-recovery-for-ada-following-9-daily-surge/
'Tons of Projects' of Cardano-Powered Projects Are 'Moving ...,Cryptoglobe,2022-06-14,https://www.cryptoglobe.com/latest/2022/06/tons-of-projects-of-cardano-powered-projects-are-moving-forward-without-a-care/
"Bitcoin And Ethereum Steady, Cardano And Polkadot Jump ...",Forbes,2022-06-14,https://www.forbes.com/sites/stevenehrlich/2022/06/14/bitcoin-and-ethereum-steady-cardano-and-polkadot-jump-as-crypto-market-nurses-wounds-from-yesterdays-dump/
Cardano Price Prediction: Current Price Surge Unlikely to Hold,InvestingCube,2022-06-14,https://www.investingcube.com/cardano-price-prediction-current-price-surge-unlikely-to-hold/
Can Parody Coins’ (PARO) NFT exchange Beat Solana (SOL) and Cardano (ADA)?,CryptoMode,2022-06-14,https://cryptomode.com/can-parody-coins-paro-nft-exchange-beat-solana-sol-and-cardano-ada/
"Bitcoin And Crypto Now Braced For A Surprise Fed Bombshell After $300 Billion Ethereum, BNB, XRP, Solana And Cardano Price Crash",Forbes,2022-06-14,https://www.forbes.com/sites/billybambrough/2022/06/14/bitcoin-and-crypto-now-braced-for-a-surprise-fed-bombshell-after-huge--ethereum-bnb-xrp-solana-and-cardano-crash/
Decoding why ADA’s structural support is holding strong despite headwinds,AMBCrypto,2022-06-14,https://ambcrypto.com/decoding-why-adas-structural-support-is-holding-strong-despite-headwinds/
7 Must-Buy Cryptos if You Only Have $100 to Spend,InvestorPlace,2022-06-14,https://investorplace.com/2022/06/7-must-buy-cryptos-if-you-only-have-100-to-spend/
"BREAKING: Coinbase to Fire 1,100 Employees",U.Today,2022-06-14,https://u.today/breaking-coinbase-to-fire-1100-employees
Ripple CEO Explains How His Company Survives Through Bear Markets,U.Today,2022-06-14,https://u.today/ripple-ceo-explains-how-his-company-survives-through-bear-markets
Polkadot price analysis: DOT could rise as high as $8.15 if ...,Cryptopolitan,2022-06-14,https://www.cryptopolitan.com/polkadot-price-analysis-2022-06-14/
Shiba Inu Major Developer Hints at Shibarium Release,U.Today,2022-06-14,https://u.today/shiba-inu-major-developer-hints-at-shibarium-release
Bitcoin (BTC) Dormancy Flow Indicator at Lowest Since 2010: Why Is This Crucial for Crypto?,U.Today,2022-06-14,https://u.today/bitcoin-btc-dormancy-flow-indicator-at-lowest-since-2010-why-is-this-crucial-for-crypto
"If You'd Listened to Matt Damon on Crypto, You'd Have Lost This Much Money",Newsweek,2022-06-14,https://www.newsweek.com/matt-damon-crypto-how-much-money-lost-bitcoin-1715555
Announcing Our Partnership With The French Electronic ...,Cardano Feed,2022-06-14,https://cardanofeed.com/announcing-our-partnership-with-the-french-electronic-music-festival-delices-sonores-in-saint-tropez-86775.html
Chainlink price analysis: LINK soars to $6.64 after a ...,Cryptopolitan,2022-06-14,https://www.cryptopolitan.com/chainlink-price-analysis-2022-06-14/
"Crypto Is Not Going Away, Says David Rubenstein",U.Today,2022-06-14,https://u.today/crypto-is-not-going-away-says-david-rubenstein
What is Staking Crypto? Everything You Need To Know,GOBankingRates,2022-06-14,https://www.gobankingrates.com/investing/crypto/what-is-staking-crypto/
"Crypto market wrap: Bitcoin falls again, others fare better",Capital.com,2022-06-14,https://capital.com/crypto-market-wrap-bitcoin-falls-again-others-fare-better
"Update of Crypto Crash(6/14): Bitcoin, Ethereum, Solana ...",Broadcast Cover,2022-06-14,https://www.broadcastcover.com/update-of-crypto-crash6-14-bitcoin-ethereum-solana-cardano-dot-doge-xrp-bnb-fall-upto-15/
