Title,Publisher,Date,Link
"COTI to issue multiple tokens in 2022, including Cardano's ...",FinanceFeeds,2022-03-09,https://financefeeds.com/coti-issue-multiple-tokens-2022-including-cardanos-stablecoin-djed/
AdaLend: The World's Leading Cardano-Based Lending ...,Bitcoin.com News,2022-03-09,https://news.bitcoin.com/adalend-the-worlds-leading-cardano-based-lending-protocol/
Flickto: DeMe aims to disrupt an industry worth $2.6 trillion starting on Cardano,AMBCrypto,2022-03-09,https://ambcrypto.com/flickto-deme-aims-to-disrupt-an-industry-worth-2-6-trillion-starting-on-cardano/
3 Undervalued Cryptocurrencies to Buy Now | by Stephen ...,DataDrivenInvestor,2022-03-09,https://medium.datadriveninvestor.com/3-undervalued-cryptocurrencies-to-buy-now-31e6efe2f15c
Cardano Creator Invests in Reviving Woolly Mammoths,U.Today,2022-03-09,https://u.today/cardano-creator-invests-in-reviving-woolly-mammoths
"Leak Reveals Biden’s Crypto Plans—Sending The Price Of Bitcoin, Ethereum, BNB, Solana, Cardano, XRP, Terra’s Luna And Avalanche Higher",Forbes,2022-03-09,https://www.forbes.com/sites/billybambrough/2022/03/09/leak-reveals-bidens-crypto-plans--sending-the-price-of-bitcoin-ethereum-bnb-solana-cardano-xrp-terras-luna-and-avalanche-higher/
Terra Luna Outpaces Solana and Cardano After Gaining 30%: Details,U.Today,2022-03-09,https://u.today/terra-luna-outpaces-solana-and-cardano-after-gaining-30-details
Djed Development Update,Cardano Feed,2022-03-09,https://cardanofeed.com/djed-development-update-55475.html
Veteran Trader Peter Brandt Is 'Getting Ready To Pull the ...,Cryptoglobe,2022-03-09,https://www.cryptoglobe.com/latest/2022/03/veteran-trader-peter-brandt-is-getting-ready-to-pull-the-trigger-on-bitcoin/
The top 8 cryptocurrencies to invest in for 2022,Las Vegas Review-Journal,2022-03-09,https://www.reviewjournal.com/business/personal-finance/the-top-8-cryptocurrencies-to-invest-in-for-2022-2542381/
Biden Issues Long-Awaited US Executive Order on Crypto,CoinDesk,2022-03-09,https://www.coindesk.com/policy/2022/03/09/biden-issues-long-awaited-executive-order-on-crypto/
2 Diamond-in-the-Rough Cryptos Destined to Shine,InvestorPlace,2022-03-09,https://investorplace.com/2022/03/2-diamond-in-the-rough-cryptos-destined-to-shine/
‘People Will Get Burned’: Matt Odell on the Long Road to Bitcoin Privacy,CoinDesk,2022-03-09,https://www.coindesk.com/layer2/2022/03/09/people-will-get-burned-matt-odell-on-the-long-road-to-bitcoin-privacy/
"Shiba Inu Adds Nearly 200,000 Users Since the Start of 2022: Details",U.Today,2022-03-09,https://u.today/shiba-inu-adds-nearly-200000-users-since-the-start-of-2022-details
NFT frenzy begins to decline as OpenSea volume drops 27%,Cryptopolitan,2022-03-09,https://www.cryptopolitan.com/nft-frenzy-opensea-volume-drop-27/
Full Text of Biden’s Crypto-Focused Executive Order Released,Times Tabloid,2022-03-09,https://timestabloid.com/full-text-of-bidens-crypto-focused-executive-order-released/
Crypto Giant Binance to Go on Acquisition Spree,U.Today,2022-03-09,https://u.today/crypto-giant-binance-to-go-on-acquisition-spree
State Street Partners With Copper in Push for Crypto Custody,Bloomberg.com,2022-03-09,https://www.bloomberg.com/news/articles/2022-03-09/state-street-partners-with-copper-in-push-for-crypto-custody
Is Polkadot Dead? Strong competition in the Crypto Scene ...,CryptoTicker,2022-03-09,https://cryptoticker.io/en/is-polkadot-dead-buy-dot/
