Title,Publisher,Date,Link
Cardano v. Ethereum: How one transaction on Cardano covers 100s on Ethereum,FXStreet,2022-07-22,https://www.fxstreet.com/cryptocurrencies/news/cardano-v-ethereum-how-one-transaction-on-cardano-covers-100s-on-ethereum-202207221310
How to Stake Cardano (ADA)?,Tribune India,2022-07-22,https://www.tribuneindia.com/news/brand-connect/how-to-stake-cardano-ada-414710
Cardano price analysis: Bulls defeat bearish momentum to ...,Cryptopolitan,2022-07-22,https://www.cryptopolitan.com/cardano-price-analysis-2022-07-22/
This Is How Cardano Plans to Attract 100 Million Africans into Crypto,U.Today,2022-07-22,https://u.today/this-is-how-cardano-plans-to-attract-100-million-africans-into-crypto
Cryptocurrency Cardano Rises More Than 3% In 24 hours,Benzinga,2022-07-22,https://www.benzinga.com/markets/cryptocurrency/22/07/28169728/cryptocurrency-cardano-rises-more-than-3-in-24-hours
"Supercharge Your Portfolio By Adding These Cryptos; Uniglo (GLO), Polygon (MATIC) And Cardano (ADA)",Outlook India,2022-07-22,https://www.outlookindia.com/business-spotlight/supercharge-your-portfolio-by-adding-these-cryptos-uniglo-glo-polygon-matic-and-cardano-ada--news-211148
"Cryptocurrencies Price Prediction: Polygon, Cardano & Bitcoin – American Wrap 22 July",FXStreet,2022-07-22,https://www.fxstreet.com/cryptocurrencies/news/cryptocurrencies-price-prediction-polygon-cardano-bitcoin-american-wrap-22-july-202207221756
Cardano Updates | Oura Announce New Feature | July Week 3,Altcoin Buzz,2022-07-22,https://www.altcoinbuzz.io/cryptocurrency-news/cardano-updates-oura-announce-new-feature-july-week-3/
"20x Returns Could Be True If You Invest In These Cryptos: Uniglo (GLO), Cardano (ADA) And Solana (SOL) |",Bitcoinist,2022-07-22,https://bitcoinist.com/20x-returns-could-be-true-if-you-invest-in-these-cryptos-uniglo-glo-cardano-ada-and-solana-sol/
RoboApe (RBA) Meme Coin Breaks Out as ADA Leads Recovery,U.Today,2022-07-22,https://u.today/roboape-rba-meme-coin-breaks-out-as-ada-leads-recovery
Cardano price provides investors a missed opportunity before rallying to $0.550,FXStreet,2022-07-22,https://www.fxstreet.com/cryptocurrencies/news/cardano-price-provides-investors-a-missed-opportunity-before-rallying-to-0550-202207221239
"‘Amazon Of Crypto’—Former Blackrock Exec Predicts Everyone Will Hold This Crypto As Price Of Bitcoin, Ethereum, BNB, XRP, Solana, Cardano, Luna, And Dogecoin Soar",Forbes,2022-07-22,https://www.forbes.com/sites/danrunkevicius/2022/07/22/amazon-of-crypto-former-blackrock-exec-predicts-everyone-will-hold-this-crypto-as-price-of-bitcoin-ethereum-bnb-xrp-solana-cardano-luna-and-dogecoin-soar/
"Ethereum Cofounder Reveals ‘Surge’ Expectations After Radical Upgrade As Ether Price Leaves Bitcoin, BNB, XRP, Solana, Cardano And Dogecoin In The Dust",Forbes,2022-07-22,https://www.forbes.com/sites/billybambrough/2022/07/22/ethereum-cofounder-reveals-surge-expectations-after-radical-upgrade-as-its-price-leaves-bitcoin-bnb-xrp-solana-cardano-and-dogecoin-in-the-dust/
"Cardalonia (LONIA) Metaverse Announces Land NFTs Sale, LONIA Presale",U.Today,2022-07-22,https://u.today/cardalonia-lonia-metaverse-announces-land-nfts-sale-lonia-presale
Most Undervalued Cryptocurrency to Invest in For 10x Returns,Business 2 Community,2022-07-22,https://www.business2community.com/crypto-news/most-undervalued-cryptocurrency-to-invest-in-for-x10-returns-02526525
The Secret to Winning With Cryptocurrency While Prices Are ...,The Motley Fool,2022-07-22,https://www.fool.com/investing/2022/07/22/the-secret-to-crypto-win-while-prices-down/
7 Cheap Cryptos to Buy Now for Big Gains,InvestorPlace,2022-07-22,https://investorplace.com/2022/07/7-cheap-cryptos-to-buy-now-for-big-gains/
The importance of using scenarios in Trustee decision-making,Pensions Expert,2022-07-22,https://www.pensions-expert.com/ESG/The-importance-of-using-scenarios-in-Trustee-decision-making
"Dream Sports Signs Five-Year Deal With Kiwi Cricket Team For NFTs, Crypto Market Up",Outlook India,2022-07-22,https://www.outlookindia.com/business/dream-sports-signs-five-year-deal-with-kiwi-cricket-team-for-nfts-crypto-market-up-news-211255
ApeCoin Rallies by Over 40% in 7 Days,Watcher Guru,2022-07-22,https://watcher.guru/news/apecoin-rallies-by-over-40-in-7-days
"Ether Breaks $1.6K on Merge Hype, Crypto Funds Price in July Rate Hike",CoinDesk,2022-07-22,https://www.coindesk.com/markets/2022/07/22/ether-breaks-16k-on-merge-hype-crypto-funds-price-in-july-rate-hike/
"Adademon, a play-to-earn immersive MetaVerse platform, announces its private seed sale",TechBullion,2022-07-22,https://techbullion.com/adademon-a-play-to-earn-immersive-metaverse-platform-announces-its-private-seed-sale/
70 to 90% Down — Crypto Economy's Decline Shakes Out $2 Trillion in 8 Months – Market Updates Bitcoin News - Bitcoin News,Inferse.com,2022-07-22,https://www.inferse.com/159826/70-to-90-down-crypto-economys-decline-shakes-out-2-trillion-in-8-months-market-updates-bitcoin-news-bitcoin-news/
