Title,Publisher,Date,Link
"Cardano: Vasil’s delay is not exactly ADA’s gain, but it is…",AMBCrypto,2022-08-01,https://ambcrypto.com/cardano-vasils-delay-is-not-exactly-adas-gain-but-it-is/
Does Cardano Overtly Focus On Theory And Ignore Utility?,TronWeekly,2022-08-01,https://www.tronweekly.com/cardano-theory-ignore-utility/
Ledger Adds Support for 100 More Cardano ($ADA) Native ...,Cryptoglobe,2022-08-01,https://www.cryptoglobe.com/latest/2022/08/ledger-adds-support-for-100-more-cardano-ada-native-tokens/
"Top Crypto Strategist Predicts ‘Turbo’ Rallies for Solana (SOL), Cardano (ADA) and Polygon (MATIC)",The Daily Hodl,2022-08-01,https://dailyhodl.com/2022/08/01/top-crypto-strategist-predicts-turbo-rallies-for-solana-sol-cardano-ada-and-polygon-matic/
Cardano's EVM Sidechain Records 7.5 Million Transactions After Launch,U.Today,2022-08-01,https://u.today/cardanos-evm-sidechain-records-75-million-transactions-after-launch
Is Now a Good Time to Buy Cardano (ADA)? • Benzinga,Benzinga,2022-08-01,https://www.benzinga.com/money/is-now-a-good-time-to-buy-cardano-ada
Cryptocurrency Cardano Down More Than 3% Within 24 hours,Benzinga,2022-08-01,https://www.benzinga.com/markets/cryptocurrency/22/08/28291154/cryptocurrency-cardano-down-more-than-3-within-24-hours
"Is The Bull Market Coming Back? Chronoly.io Grows 560% Stronger, As Cardano (ADA), Gala (GALA) Prices Also Rally",CryptoMode,2022-08-01,https://cryptomode.com/is-the-bull-market-coming-back-chronoly-io-grows-560-stronger-as-cardano-ada-gala-gala-prices-also-rally/
"Vitalik Buterin Calls Michael Saylor “Clown,” SHIB Team Shares Mysterious Teaser, Cardano’s Vasil Hard Fork Delayed Again: Crypto News Digest by U.Today",U.Today,2022-08-01,https://u.today/vitalik-buterin-calls-michael-saylor-clown-shib-team-shares-mysterious-teaser-cardanos-vasil-hard
Bitcoin Down for Third Day as Caution Washes Over Global ...,Bloomberg.com,2022-08-01,https://www.bloomberg.com/news/articles/2022-08-02/bitcoin-down-for-third-day-as-caution-washes-over-global-markets
"BTC, ADA and BNB Price Analysis for August 1",U.Today,2022-08-01,https://u.today/btc-ada-and-bnb-price-analysis-for-august-1
Morning Brew's guide to altcoins,Morning Brew,2022-08-01,https://www.morningbrew.com/daily/stories/2022/08/01/morning-brew-s-guide-to-altcoins
What is Solana (SOL)? Is it Halal?,Islamic Finance Guru,2022-08-01,https://www.islamicfinanceguru.com/articles/what-is-solana-sol-is-it-halal
Annual D&I survey of trustee boards launches,Professional Pensions,2022-08-01,https://www.professionalpensions.com/news/4054134/annual-survey-trustee-boards-launches
How NFTs Could Help Fight Counterfeit Products In The Future,Screen Rant,2022-08-01,https://screenrant.com/nfts-fight-counterfeit-products-authentication-how/
Bitwise Announces Results of July 2022 Month-End Crypto ...,Business Wire,2022-08-01,https://www.businesswire.com/news/home/20220801005700/en/Bitwise-Announces-Results-of-July-2022-Month-End-Crypto-Index-Reconstitution
Crypto Hardware Wallet Maker Ledger Seeks New Funding,The Crypto Times,2022-08-01,https://www.cryptotimes.io/crypto-hardware-wallet-maker-ledger-seeks-new-funding/
Polkadot leads way as largest cryptocurrencies decline,MarketWatch,2022-08-01,https://www.marketwatch.com/story/polkadot-leads-way-as-largest-cryptocurrencies-decline-01659362434-6ede217b258a
"Bitcoin Prices Could Rally 35% This Week, Analyst Says. Cryptos Are Still Down.",Barron's,2022-08-01,https://www.barrons.com/articles/bitcoin-rally-cryptos-slip-51659351687
Crypto ATM Market To Reach $472-mln by 2027; Uruguay Summons Binance Over Product Offerings,Outlook India,2022-08-01,https://www.outlookindia.com/business/crypto-atm-market-to-reach-472-mln-by-2027-uruguay-summons-binance-over-product-offerings-news-213425
Michael Saylor Slammed By Vitalik Buterin and John Deaton For Saying Altcoins are Securities and Unethical,Times Tabloid,2022-08-01,https://timestabloid.com/michael-saylor-slammed-by-vitalik-buterin-and-john-deaton-for-saying-altcoins-are-securities-and-unethical/
Bitcoin takes another step up,FXStreet,2022-08-01,https://www.fxstreet.com/cryptocurrencies/news/bitcoin-takes-another-step-up-202208011017
Here's Who Sold Most of Their Crypto Holdings During This ...,Watcher Guru,2022-08-01,https://watcher.guru/news/heres-who-sold-most-of-their-crypto-holdings-during-this-years-crash
Top 5 Altcoins to BUY in August 2022 - Best Cryptocurrency ...,CryptoTicker,2022-08-01,https://cryptoticker.io/en/top-5-altcoins-to-buy-in-august-2022/
Pando Asset Lists First Crypto ETP on SIX Swiss Exchange,Digital Journal,2022-08-01,https://www.digitaljournal.com/pr/pando-asset-lists-first-crypto-etp-on-six-swiss-exchange
Bitcoin Price To Pump Or Dump? Here Is The Key Factors To Looks This Week,Coinpedia,2022-08-01,https://coinpedia.org/bitcoin/bitcoin-price-to-pump-or-dump-here-is-the-key-factors-to-looks-this-week/
"Valour Inc. Announces New Product Manager, Elaine Bühler",Yahoo Finance,2022-08-01,https://finance.yahoo.com/news/valour-inc-announces-product-manager-070000753.html
Best Crypto on Twitter in August 2022,Business 2 Community,2022-08-01,https://www.business2community.com/cryptocurrency/best-twitter-crypto
"Markets Rally On Earnings Boost, Fed Fears Subside",RTTNews,2022-08-01,https://www.rttnews.com/3301169/markets-rally-on-earnings-boost-fed-fears-subside.aspx
Terra Classic Price Predictions: Where Will the LUNC Crypto ...,InvestorPlace,2022-08-01,https://investorplace.com/2022/08/terra-classic-price-predictions-where-will-the-lunc-crypto-go-next/
DOT Clamping On $8 Support Crucial To Maintain Bullish Pace | Global Online Money,Global Online Money,2022-08-01,https://globalonlinemony.com/dot-clamping-on-8-support-crucial-to-maintain-bullish-pace/
WEMADE Signs MoU With Blockdaemon To Support The ...,PR Newswire,2022-08-01,https://www.prnewswire.com/news-releases/wemade-signs-mou-with-blockdaemon-to-support-the-growth-and-development-of-wemix-3-0-ecosystem-301597136.html
Crypto Newbies Have Family and Friends to Thank for Losses,Wealth Management,2022-08-01,https://www.wealthmanagement.com/alternative-investments/crypto-newbies-have-family-and-friends-thank-losses
"Dogecoin (DOGE) Daily: Weekend Rally Cools Off, Robinhood Gives Update",Benzinga,2022-08-01,https://www.benzinga.com/news/22/08/28282455/vlad-tenev-tells-memecoin-millionaire-larger-instant-dogecoin-withdrawals-could-come-on-robinhood-as
Coin Race: Top Winners/Losers of July; Ethereum & Ethereum ...,Crypto News,2022-08-01,https://cryptonews.com/news/coin-race-top-winnerslosers-of-july-ethereum-ethereum-classic-win-the-month.htm
Immediate Edge Reviews (Australia): Critical Update Reveals ...,Deccan Herald,2022-08-01,https://www.deccanherald.com/brandspot/pr-spot/immediate-edge-reviews-australia-critical-update-reveals-shocking-canada-customer-concerns-1132056.html
These Are the Easiest Ways to Invest in Blockchain As a ...,Market Realist,2022-08-01,https://marketrealist.com/cryptocurrency/how-to-invest-in-blockchain-as-a-beginner/
The Kyber Network (knc): What Is It and How Does It Operate?,ChoResearch,2022-08-01,https://choresearch.com/knc-chain/
