Title,Publisher,Date,Link
"Top 5 cryptocurrencies to watch this week: BTC, XRP, DOT, XLM, SOL",Cointelegraph,2021-05-16,https://cointelegraph.com/news/top-5-cryptocurrencies-to-watch-this-week-btc-xrp-dot-xlm-sol
What Is Polygon (MATIC)?,Coinspeaker,2021-05-16,https://www.coinspeaker.com/guides/what-is-polygon-matic/
"Crypto Markets Take Deep Losses, Global Trade Volumes ...",Bitcoin.com News,2021-05-16,https://news.bitcoin.com/crypto-markets-deep-losses-trade-volumes-skyrocket-elon-battles-crypto-twitter/
Norwegian Billionaire: Bitcoin Becoming Mainstream Is ...,Bitcoin.com News,2021-05-16,https://news.bitcoin.com/norwegian-billionaire-bitcoin-becoming-mainstream-inevitable-elon-musks/
John Lennon's Son Defends Bitcoin- Musician Highlights ...,Bitcoin.com News,2021-05-16,https://news.bitcoin.com/john-lennons-son-defends-bitcoin-musician-highlights-carbon-footprint-tied-to-consumerism/
Major Music Festival Exit Takes Bitcoin for Tickets – Featured ...,Bitcoin.com News,2021-05-16,https://news.bitcoin.com/major-music-festival-exit-takes-bitcoin-for-tickets/
Cobie Livestream Raises $800000 in Crypto to Pay Child's ...,Bitcoin.com News,2021-05-16,https://news.bitcoin.com/cobie-twitter-raises-800k-to-pay-childs-cancer-treatment/
The 2021 Crypto Bubble Is Unlike Anything We've Seen ...,Report Door,2021-05-16,https://www.reportdoor.com/the-2021-crypto-bubble-is-unlike-anything-weve-seen/
