Title,Publisher,Date,Link
Polkadot: Why this top-10 crypto could be ‘overvalued’ when compared to…,AMBCrypto,2021-11-30,https://ambcrypto.com/polkadot-why-this-top-10-crypto-could-be-overvalued-when-compared-to/
Solana vs. Polkadot: Which is Better? • Benzinga Crypto,Benzinga,2021-11-30,https://www.benzinga.com/money/solana-vs-polkadot
"BTC, ETH steady as SHIB surges; crypto funds record inflows",Forkast News,2021-11-30,https://forkast.news/headlines/bitcoin-ether-hold-rebound-shib-surges/
5 Web 3.0 Cryptos to Buy for the Future of the Internet,InvestorPlace,2021-11-30,https://investorplace.com/2021/11/5-web-3-0-cryptos-to-buy-for-the-future-of-the-internet/
"Avalanche, Layer 1 Tokens Soared in November as Ethereum Fees Drove Competition",Yahoo Finance,2021-11-30,https://finance.yahoo.com/news/avalanche-layer-1-tokens-soared-183336463.html
Donate Bitcoin to The Discalced Hermits of Our Lady of Mount ...,The Giving Block,2021-11-30,https://thegivingblock.com/donate/the-discalced-hermits-of-our-lady-of-mount-carmel/
"See how much Changpeng Zhao, Binance CEO, is worth",Cryptopolitan,2021-11-30,https://www.cryptopolitan.com/how-much-changpeng-zhao-binance-ceo-is-worth/
Shiba Inu creators should be in jail - Real Wolf of Wall Street,Cryptopolitan,2021-11-30,https://www.cryptopolitan.com/shiba-inu-creators-should-be-in-jail/
Binance Coin Price Prediction - Will BNB BOOM back to $700?,CryptoTicker,2021-11-30,https://cryptoticker.io/en/binance-coin-price-prediction-will-bnb-token-boom-back-to-700/
Three Ethereum Competitors Explode As Layer 1 Altcoins Outperform Bitcoin and Overall Crypto Markets,The Daily Hodl,2021-11-30,https://dailyhodl.com/2021/11/30/three-ethereum-competitors-explode-as-layer-1-altcoins-outperform-bitcoin-and-overall-crypto-markets/
"Exploring Kusama Kings, Kusama’s majestic new NFT collection",CryptoSlate,2021-11-30,https://cryptoslate.com/exploring-kusama-kings-kusamas-majestic-new-nft-collection/
"Huobi chooses Singapore as its Southeast Asia base, but cannot cater to local customers",AMBCrypto,2021-11-30,https://ambcrypto.com/huobi-chooses-singapore-as-its-southeast-asia-base-and-is-deliberating-between-the-u-k-and-france/
MetaKovan Says Please Download “Everydays: the First 5000 ...,Bloomberg.com,2021-11-30,https://www.bloomberg.com/news/articles/2021-11-30/metakovan-would-be-happy-if-you-download-his-69-3-million-nft
How Ethereum block times will change after the Merge,AMBCrypto,2021-11-30,https://ambcrypto.com/how-ethereum-block-times-will-change-after-the-merge/
"XRP nodes run by Ripple fell out of sync for over 5 hours, disrupted wallet services",FXStreet,2021-11-30,https://www.fxstreet.com/cryptocurrencies/news/xrp-nodes-run-by-ripple-fell-out-of-sync-for-over-5-hours-disrupted-wallet-services-202112010630
"Uphold Adds Algorand (ALGO), Avalanche (AVAX), Elrond ...",Securities.io,2021-11-30,https://www.securities.io/uphold-adds-algorand-algo-avalanche-avax-elrond-egld-fantom-ftm-to-trading-platform/
AMC and Sony to Gift NFTs to 'Spider-Man: No Way Home ...,Bitcoin.com News,2021-11-30,https://news.bitcoin.com/amc-and-sony-to-gift-nfts-to-spider-man-no-way-home-advance-opening-ticket-buyers/
Denver Nuggets vs Orlando Magic Prediction and Odds,CrowdWisdom360,2021-11-30,https://crowdwisdom.live/nba/denver-nuggets-vs-orlando-magic-prediction-a/
GameFi: The New Golden Child of the Cryptoverse – Press ...,Bitcoin.com News,2021-11-30,https://news.bitcoin.com/gamefi-the-new-golden-child-of-the-cryptoverse/
