Title,Publisher,Date,Link
"A Metaverse Wolf? That'll Be $80000 in Ethereum, Please",Crypto Briefing,2021-11-22,https://cryptobriefing.com/metaverse-wolf-thatll-be-80000-ethereum-please/
Polkadot (DOT) Crypto In Focus After The Recent Profit Booking,DRP Journal,2021-11-22,https://www.drpjournal.com/polkadot-dot-crypto-in-focus-after-the-recent-profit-booking/
Multi-Chain Projects Can Fix Blockchain Compatibility Problems,Nasdaq,2021-11-22,https://www.nasdaq.com/articles/multi-chain-projects-can-fix-blockchain-compatibility-problems
"Australia mustn’t ‘fear the unknown’ as Senator voices support for DeFi, crypto",AMBCrypto,2021-11-22,https://ambcrypto.com/australia-mustnt-fear-the-unknown-as-senator-voices-support-for-defi-crypto/
What Algorand’s curious price trajectory says about the altcoin,AMBCrypto,2021-11-22,https://ambcrypto.com/what-algorands-curious-price-trajectory-says-about-the-altcoin/
"Bitcoin, Ethereum Down Double-Digits in Past Week as Crypto Market Sheds $300B",Decrypt,2021-11-22,https://decrypt.co/86574/bitcoin-ethereum-down-past-week-crypto-market-sheds
"After approval, can Bithumb shake Upbit’s crypto monopoly in South Korea",AMBCrypto,2021-11-22,https://ambcrypto.com/after-approval-can-bithumb-shake-upbits-crypto-monopoly-in-south-korea/
Is Cosmos (ATOM) a Good Investment? • Benzinga Crypto,Benzinga,2021-11-22,https://www.benzinga.com/money/is-cosmos-atom-a-good-investment
Bitcoin le 22 novembre 2021 - Le piège des 55 000$ - Journal ...,Journal Du Coin,2021-11-22,https://journalducoin.com/bitcoin/bitcoin-le-22-novembre-2021-le-piege-des-55-000/
XRP Ledger activates the NegativeUNL amendment on its network,AMBCrypto,2021-11-22,https://ambcrypto.com/xrp-ledger-activates-the-negativeunl-amendment-on-its-network/
"ONSTON, a Blockchain-Based Economy-Oriented Multi ...",NewsBTC,2021-11-22,https://www.newsbtc.com/press-releases/onston-a-blockchain-based-economy-oriented-multi-metaverse-platform-now-listed-on-bittrex/
Third-Generation Blockchains Will Pick Up the Defi Slack Left ...,Bitcoin.com News,2021-11-22,https://news.bitcoin.com/third-generation-blockchains-will-pick-up-defi-slack-left-by-ethereum/
"Like SQUID, another memecoin pulls off a million dollar scam",AMBCrypto,2021-11-22,https://ambcrypto.com/much-like-squid-yet-another-memecoin-pulls-off-a-million-dollar-scam/
"Shiba Inu price squeezes, restoring SHIB uptrend towards ...",FXStreet,2021-11-22,https://www.fxstreet.com/cryptocurrencies/news/shiba-inu-price-squeezes-restoring-shib-uptrend-towards-0000088-202111221331
NFT marketplace EX Sports Unveils the Diego Maradona NFT ...,Securities.io,2021-11-22,https://www.securities.io/nft-marketplace-ex-sports-unveils-the-diego-maradona-nft-collection/
"These Xiaomi, POCO and Redmi smartphones to receive MIUI 13",Tech Lapse,2021-11-22,https://techlapse.com/news/xiaomi-poco-redmi-to-receive-miui-13/
