Title,Publisher,Date,Link
"DeFi Protocol Anchor Launches on Terra, Token Moons 66X",Crypto Briefing,2021-03-17,https://cryptobriefing.com/defi-protocol-anchor-launches-on-terra-token-moons-66x/
Want to Mint and Sell an NFT? These Tools Can Give Anyone ...,Bitcoin.com News,2021-03-17,https://news.bitcoin.com/want-to-mint-and-sell-an-nft-these-tools-can-give-anyone-the-skills-to-issue-nft-assets/
"Cardano, Ethereum Classic, Crypto.com Coin Price Analysis: 17 March",AMBCrypto,2021-03-17,https://ambcrypto.com/cardano-ethereum-classic-crypto-com-coin-price-analysis-17-march/
Grayscale Launches 5 New Crypto Investment Products as ...,Bitcoin.com News,2021-03-17,https://news.bitcoin.com/grayscale-launches-5-new-cryptocurrency-investment-products-demand-soars/
A Ledger Hardware Wallet Is the Best Solution to Protect and ...,Bitcoin.com News,2021-03-17,https://news.bitcoin.com/a-ledger-hardware-wallet-is-the-best-solution-to-protect-and-own-your-private-keys/
St. Patrick's Day Stats: Why Bitcoin Investors Aren't Likely To See Green,Bitcoinist,2021-03-17,https://bitcoinist.com/st-patricks-day-stats-why-bitcoin-investors-arent-likely-to-see-green/
Crypto Analyst Lark Davis: These 4 Low-Cap Altcoins Have ...,Cryptoglobe,2021-03-17,https://www.cryptoglobe.com/latest/2021/03/crypto-analyst-lark-davis-these-4-low-cap-altcoins-have-massive-potential-for-gains/
