Title,Publisher,Date,Link
10 Reasons to Buy Polkadot (DOT) - Altcoin Projects,Altcoin Buzz,2021-06-06,https://www.altcoinbuzz.io/reviews/10-reasons-to-buy-polkadot-dot/
Tesla taxi firm now accepts Dogecoin payment,Cryptopolitan,2021-06-06,https://www.cryptopolitan.com/tesla-taxi-firm-now-accepts-dogecoin-payment/
Comparing Settlement Times and Transaction Speeds of ...,Cryptopolitan,2021-06-06,https://www.cryptopolitan.com/comparing-settlement-times-and-transaction-speeds-of-stablecoins/
Is this the consequence Elon Musk faces over Bitcoin tweets ...,AMBCrypto,2021-06-06,https://ambcrypto.com/is-this-the-consequence-elon-musk-faces-over-bitcoin-tweets-anonymous-says-expect-us/
Deeper Network (DPR) Details Strategic Improvements,Altcoin Buzz,2021-06-06,https://www.altcoinbuzz.io/cryptocurrency-news/product-release/deeper-network-dpr-details-strategic-improvements/
What Chainlink’s drop in popularity means for its price,AMBCrypto,2021-06-06,https://ambcrypto.com/what-chainlinks-drop-in-popularity-means-for-its-price/
Study Shows 36% of Nigerian Adults Are Financially Excluded ...,Bitcoin.com News,2021-06-06,https://news.bitcoin.com/study-shows-36-of-nigerian-adults-are-financially-excluded-digital-financial-services-bolsters-inclusion/
Tony Hawk Purchased Bitcoin in 2012 After Reading About ...,Bitcoin.com News,2021-06-06,https://news.bitcoin.com/tony-hawk-purchased-bitcoin-in-2012-after-reading-about-the-silk-road-marketplace/
Vulcan Forged Launches NFTs Designed by the Godfather of ...,Bitcoin.com News,2021-06-06,https://news.bitcoin.com/vulcan-forged-launches-nfts-designed-by-the-godfather-of-fantasy-art/
