Title,Publisher,Date,Link
"120% Rally for Polkadot ‘Seems Reasonable,’ According to Crypto Analyst Benjamin Cowen",The Daily Hodl,2021-09-16,https://dailyhodl.com/2021/09/16/120-rally-for-polkadot-seems-reasonable-according-to-crypto-analyst-benjamin-cowen/
Why Investing in Better-Built Blockchains Could Pay Off,The Motley Fool,2021-09-16,https://www.fool.com/investing/2021/09/16/why-investing-in-better-built-blockchains-could-pa/
"Bitcoin Price Around $48K, Altcoins on Green Run",Coinspeaker,2021-09-16,https://www.coinspeaker.com/bitcoin-altcoins-green-run/
Kyber Network (KNC),The Giving Block,2021-09-16,https://thegivingblock.com/resources/cryptocurrency/kyber-network/
Alt winds of change? What an altcoin season would mean for crypto,Cointelegraph,2021-09-16,https://cointelegraph.com/news/alt-winds-of-change-what-an-altcoin-season-would-mean-for-crypto
"Ethereum price analysis: ETH on the move at $3,630",Cryptopolitan,2021-09-16,https://www.cryptopolitan.com/ethereum-price-analysis-2021-09-16/
Pooshi to fair-launch on 18th September,AMBCrypto,2021-09-16,https://ambcrypto.com/pooshi-to-fair-launch-on-18th-september/
Market Wrap: Bitcoin Drifts Lower as Altcoins Outperform,CoinDesk,2021-09-16,https://www.coindesk.com/markets/2021/09/16/market-wrap-bitcoin-drifts-lower-as-altcoins-outperform/
"Yes, inflation is critical, but is Bitcoin truly the best bet for hedging",AMBCrypto,2021-09-16,https://ambcrypto.com/yes-inflation-is-critical-but-is-bitcoin-truly-the-best-bet-for-hedging/
Cryptocurrency Prices On September 16 2021: Know The ...,ABP LIVE,2021-09-16,https://news.abplive.com/business/crypto/cryptocurrency-prices-september-16-2021-know-the-rate-of-bitcoin-ethereum-litecoin-ripple-dogecoin-cryptocurrencies-1482475
PrimeXBT Adds Uniswap (UNI) As The DeFi Platform Takes ...,Crypto News,2021-09-16,https://cryptonews.com/news/primexbt-adds-uniswap-uni-as-the-defi-platform-takes-over-crypto.htm
India’s biggest lender disables UPI payments facility for crypto-merchants,AMBCrypto,2021-09-16,https://ambcrypto.com/indias-biggest-lender-disables-upi-payments-facility-for-crypto-merchants/
Why Could Cardano Return1668% In 8-month and Became the Third-largest Cryptocurrency?,Ripple Coin News,2021-09-16,https://ripplecoinnews.com/why-could-cardano-return1668-in-8-month-and-became-the-third-largest-cryptocurrency/
Study Shows Cross-Chain Bridge Technology Growth ...,Bitcoin.com News,2021-09-16,https://news.bitcoin.com/study-shows-cross-chain-bridge-technology-growth-bridges-to-ethereum-exceed-7-billion/
Ripple Price Analysis: Can XRP Hit its Old ATH Anytime Soon?,Securities.io,2021-09-16,https://www.securities.io/ripple-price-analysis-can-xrp-hit-its-old-ath-anytime-soon/
Africa Has Some of the 'Highest Grassroots Adoptions in the ...,Bitcoin.com News,2021-09-16,https://news.bitcoin.com/africa-has-some-of-highest-grassroots-adoptions-in-the-world-chainalysis-crypto-preview/
"Crypto market in Africa grows by 1,200 percent in one year",City Telegraph,2021-09-16,https://citytelegraph.com/blockchain/5715/crypto-market-in-africa-grows-by-1200-percent-in-one-year/
