Title,Publisher,Date,Link
Polkadot on Coinbase Went Up More Than 70% in the Midst of Crypto Market Sell-Off,CoinDesk,2021-06-22,https://www.coindesk.com/markets/2021/06/22/polkadot-on-coinbase-went-up-more-than-70-in-the-midst-of-crypto-market-sell-off/
DeFi hub Karura emerges as first Kusama parachain slot auction winner,Cointelegraph,2021-06-22,https://cointelegraph.com/news/defi-hub-karura-emerges-as-first-kusama-parachain-slot-auction-winner
Kraken vs. Binance: Which Should You Choose?,Investopedia,2021-06-22,https://www.investopedia.com/kraken-vs-binance-5189457
Ripple CTO says this about Dogecoin’s DogeCar crash,AMBCrypto,2021-06-22,https://ambcrypto.com/ripple-cto-says-this-about-dogecoins-dogecar-crash/
Hedgeye: This Model Predicts Bitcoin at $1000000 ...,Bitcoin.com News,2021-06-22,https://news.bitcoin.com/hedgeye-this-model-predicts-bitcoin-at-1000000/
Rwanda Central Bank Joins CBDC Bandwagon After ...,Bitcoin.com News,2021-06-22,https://news.bitcoin.com/rwanda-central-bank-joins-cbdc-bandwagon-after-announcing-digital-currency-research/
