Title,Publisher,Date,Link
How Phala Network is bringing on-chain privacy to the Polkadot (DOT) ecosystem,CryptoSlate,2021-01-22,https://cryptoslate.com/how-phala-network-is-bringing-on-chain-privacy-to-the-polkadot-dot-ecosystem/
Polkadot Price: Will DOT cross $100? - Altcoin Projects,Altcoin Buzz,2021-01-22,https://www.altcoinbuzz.io/reviews/altcoin-projects/polkadot-price-will-dot-cross-100/
"Crypto Price Analysis & Overview January 22nd: Bitcoin, Ethereum, Ripple, Polkadot, and Chainlink",CryptoPotato,2021-01-22,https://cryptopotato.com/crypto-price-analysis-overview-january-22nd-bitcoin-ethereum-ripple-polkadot-and-chainlink/
Here’s how whales buying the Bitcoin dip will impact the market,AMBCrypto,2021-01-22,https://ambcrypto.com/heres-how-whales-buying-the-bitcoin-dip-will-impact-the-market/
Canadian firm Hut 8 finalizes $11.8 million loan for new Bitcoin mining machines,AMBCrypto,2021-01-22,https://ambcrypto.com/canadian-firm-hut-8-finalizes-11-8-million-loan-for-new-bitcoin-mining-machines/
"Binance Coin, Ethereum Classic, VeChain Price Analysis: 22 January",AMBCrypto,2021-01-22,https://ambcrypto.com/binance-coin-ethereum-classic-vechain-price-analysis-22-january/
Bitcoin’s network mining difficulty (7d moving average) hits new all-time high,AMBCrypto,2021-01-22,https://ambcrypto.com/bitcoins-network-mining-difficulty-7d-moving-average-hits-new-all-time-high/
Privacy-Centric Cryptocurrency Firo Suffers 51% Attack on Its ...,Bitcoin.com News,2021-01-22,https://news.bitcoin.com/privacy-centric-cryptocurrency-firo-suffers-51-attack-on-its-network/
