Title,Publisher,Date,Link
Vietnam has the highest number of crypto holders - Finder poll,Cryptopolitan,2021-08-15,https://www.cryptopolitan.com/vietnam-the-highest-number-of-crypto-holders/
History Was Made In Crypto Adoption at Saratoga 100th Anniversary Sale,AMBCrypto,2021-08-15,https://ambcrypto.com/history-was-made-in-crypto-adoption-at-saratoga-100th-anniversary-sale/
Here’s when traders can bet Dogecoin again,AMBCrypto,2021-08-15,https://ambcrypto.com/heres-when-traders-can-bet-dogecoin-again/
"What traders need to know about AAVE, Uniswap, and COMP",AMBCrypto,2021-08-15,https://ambcrypto.com/what-traders-need-to-know-about-aave-uniswap-and-comp/
An In Depth Look at Bitcoin's First Chain Split: Satoshi Helps ...,Bitcoin.com News,2021-08-15,https://news.bitcoin.com/an-in-depth-look-at-bitcoins-first-chain-split-satoshi-helps-reverse-the-creation-of-184-billion-btc/
Leonicorn Swap Token ($LEOS) Is Now Trading on BitMart ...,Bitcoin.com News,2021-08-15,https://news.bitcoin.com/leonicorn-swap-token-leos-is-now-trading-on-bitmart/
Homeowners Offered Crypto-Backed Loans to Finance Home ...,Bitcoin.com News,2021-08-15,https://news.bitcoin.com/homeowners-offered-crypto-backed-loans-to-finance-home-improvement-projects/
