Title,Publisher,Date,Link
Polkadot founder Gavin Wood: Decentralization shouldn’t ‘cut corners’ in favor of scalability,CryptoSlate,2021-10-29,https://cryptoslate.com/polkadot-founder-gavin-wood-decentralization-shouldnt-cut-corners-in-favor-of-scalability/
"Top Trader Capo Says He’s Still All In on Altcoins, Updates Outlook on Three Crypto Assets",The Daily Hodl,2021-10-29,https://dailyhodl.com/2021/10/29/top-trader-capo-says-hes-still-all-in-on-altcoins-updates-outlook-on-three-crypto-assets/
The Squid Game token rises to $7.79 in 24 hours,Cryptopolitan,2021-10-29,https://www.cryptopolitan.com/the-squid-game-crypto-raises-to-7-79/
3 Crypto Moonshots to Get Ahead of the 'Next Big Thing',InvestorPlace,2021-10-29,https://investorplace.com/2021/10/3-crypto-moonshots-to-get-ahead-of-the-next-big-thing/
"This expert says, if you have Bitcoin, hold it until…",AMBCrypto,2021-10-29,https://ambcrypto.com/this-expert-says-if-you-have-bitcoin-hold-it-until/
"What’s next for Shiba Inu, as it steps on the brakes for now",AMBCrypto,2021-10-29,https://ambcrypto.com/whats-next-for-shiba-inu-as-it-steps-on-the-brakes-for-now/
Surmising what the next few days can look like for Bitcoin,AMBCrypto,2021-10-29,https://ambcrypto.com/surmising-what-the-next-few-days-can-look-like-for-bitcoin/
Binance Coin awaits potential 25% surge from this rising wedge,AMBCrypto,2021-10-29,https://ambcrypto.com/binance-coin-awaits-potential-25-surge-from-this-rising-wedge/
What will it take for Cardano to reach for the $2.14 – $2.23 zone once again,AMBCrypto,2021-10-29,https://ambcrypto.com/what-will-it-take-for-cardano-to-reach-for-the-2-14-2-23-zone-once-again/
Cream Finance Suffers $130 Million Hack – Bitcoin News,Bitcoin.com News,2021-10-29,https://news.bitcoin.com/cream-finance-suffers-130-million-hack/
Bitcoin Dominance and What It Really Means for the Crypto ...,Securities.io,2021-10-29,https://www.securities.io/bitcoin-dominance-and-what-it-really-means-for-the-crypto-market/
Kate Hudson's most daring style moments,Insider,2021-10-29,https://www.insider.com/kate-hudson-most-daring-looks-photos
Ethereum Captures New All-Time Price High — ETH Market ...,Bitcoin.com News,2021-10-29,https://news.bitcoin.com/ethereum-captures-new-all-time-price-high-eth-market-cap-surpasses-510-billion/
Zelwin Price Prediction for 2022-2026,CryptoNewsZ,2021-10-29,https://www.cryptonewsz.com/forecast/zelwin-price-prediction/
Liquid Craft's Dragon and Bourbon NFT Series – Press ...,Bitcoin.com News,2021-10-29,https://news.bitcoin.com/liquid-crafts-dragon-and-bourbon-nft-series/
SXSW's 2022 Festival in Texas to Host Major On-Site NFT ...,Bitcoin.com News,2021-10-29,https://news.bitcoin.com/sxsws-2022-festival-in-texas-to-host-major-on-site-nft-workshop-for-participants/
