Title,Publisher,Date,Link
Polkadot technology adoption with NFTs and gaming could see DOT price double,FXStreet,2021-09-13,https://www.fxstreet.com/cryptocurrencies/news/polkadot-technology-adoption-with-nfts-and-gaming-could-see-dot-price-double-202109131025
These Are The 'Altcoins' Everyone Loves Right Now,Forbes,2021-09-13,https://www.forbes.com/sites/kenrapoza/2021/09/13/these-are-the-altcoins-everyone-loves-right-now/
"Are DeFi platforms Fantom, Avalanche scoring points over Ethereum",AMBCrypto,2021-09-13,https://ambcrypto.com/are-defi-platforms-fantom-avalanche-scoring-points-over-ethereum/
"Market Wrap: Bitcoin Whipsaws on Fake News, Investors Flow Into Solana Funds",CoinDesk,2021-09-13,https://www.coindesk.com/markets/2021/09/13/market-wrap-bitcoin-whipsaws-on-fake-news-investors-flow-into-solana-funds/
Ocean-view Properties in Hawaii as Virtual Property NFTs,Cryptopolitan,2021-09-13,https://www.cryptopolitan.com/ocean-view-properties-in-hawaii-as-virtual-property-nfts/
"After Smart-Contracts, 3 New NFT’s Minted On Cardano Blockchain!",Coinpedia,2021-09-13,https://coinpedia.org/news/after-smart-contracts-nfts-make-their-way-on-cardano-blockchain/
Cryptocurrency Prices On September 13 2021: Know The ...,ABP LIVE,2021-09-13,https://news.abplive.com/business/crypto/cryptocurrency-prices-on-september-13-2021-know-the-rate-of-bitcoin-ethereum-litecoin-ripple-dogecoin-and-other-cryptocurrencies-1481875
Salvador - Le jour où les banques ont du plier devant Bitcoin,Journal Du Coin,2021-09-13,https://journalducoin.com/bitcoin/banques-salvador-contraintes-bitcoin/
"Valued under $2, XRP, Algorand, MATIC, Stellar can generate higher returns if…",AMBCrypto,2021-09-13,https://ambcrypto.com/valued-under-2-xrp-algorand-matic-stellar-can-generate-higher-returns-if/
Kevin O'Leary: I'm Finding Ethereum (ETH) Too Slow,Somag News,2021-09-13,https://www.somagnews.com/kevin-oleary-im-finding-ethereum-eth-too-slow/
Las Vegas Aces vs Dallas Wings Prediction and Betting Odds ...,crowdwisdom.live,2021-09-13,https://crowdwisdom.live/nba/las-vegas-aces-vs-dallas-wings-prediction-and-betting-odds/
The shipping giant Amazon wants to make the delivery ...,City Telegraph,2021-09-13,https://citytelegraph.com/business/5660/the-shipping-giant-amazon-wants-to-make-the-delivery-process-more-secure-with-password/
