Title,Publisher,Date,Link
Huobi Token Wallet Choosing Guide - How to Find the Best ...,YouHodler.com,2021-11-20,https://www.youhodler.com/wallet/ht
"PayPal looks into Solana to scale payment network, pushing SOL closer to breakout",FXStreet,2021-11-20,https://www.fxstreet.com/cryptocurrencies/news/analysts-are-bullish-on-sol-as-paypal-looks-into-ethereum-killer-solana-to-scale-its-payment-network-202111200836
"Post a 1000% surge, Loopring is headed in this direction",AMBCrypto,2021-11-20,https://ambcrypto.com/post-a-1000-surge-loopring-is-headed-in-this-direction/
GYEN offers high liquidity of the world's 1st regulated stablecoin,Cryptopolitan,2021-11-20,https://www.cryptopolitan.com/gyen-crypto-features-use-cases/
Crypto.com adds Polygon support for Ethereum deposits and withdrawals,AMBCrypto,2021-11-20,https://ambcrypto.com/crypto-com-adds-polygon-support-for-ethereum-deposits-and-withdrawals/
"Binance Coin, Solana, Fantom Price Analysis: 20 November",AMBCrypto,2021-11-20,https://ambcrypto.com/binance-coin-solana-fantom-price-analysis-20-november/
"How are stablecoins Tether, USDC influencing Bitcoin’s price movements",AMBCrypto,2021-11-20,https://ambcrypto.com/how-are-stablecoins-tether-usdc-influencing-bitcoins-price-movements/
Mainnet integration of Arbitrum One could be just the push Binance needs right now,AMBCrypto,2021-11-20,https://ambcrypto.com/mainnet-integration-of-arbitrum-one-could-be-just-the-push-binance-needs-right-now/
"Kraken to delist Monero, cites regulatory compliance issues in the UK",AMBCrypto,2021-11-20,https://ambcrypto.com/kraken-to-delist-monero-citing-regulatory-compliance-in-the-uk/
These Moving Averages can help Shiba Inu traders determine their investment decisions,AMBCrypto,2021-11-20,https://ambcrypto.com/these-moving-averages-can-help-shiba-inu-traders-determine-their-investment-decisions/
5 Reasons to Get Hold of Litecoin before it's Too Late,Securities.io,2021-11-20,https://www.securities.io/5-reasons-to-get-hold-of-litecoin-before-its-too-late/
Quentin Tarantino Sued for an Upcoming Auction of Pulp ...,Bitcoin.com News,2021-11-20,https://news.bitcoin.com/quentin-tarantino-sued-for-an-upcoming-auction-of-pulp-fiction-nfts/
Crypto Is Not a Currency -- It's More Like a Stock Option,The Motley Fool,2021-11-20,https://www.fool.com/investing/2021/11/20/crypto-is-not-a-currency-its-more-like-a-stock-opt/
"Opposed to Bitcoin Payments, Bank of Russia Says State ...",Bitcoin.com News,2021-11-20,https://news.bitcoin.com/opposed-to-bitcoin-payments-bank-of-russia-says-state-should-not-stimulate-spread-of-cryptocurrencies/
Floki Inu Cryptocurrency Ads Under Investigation in UK ...,Bitcoin.com News,2021-11-20,https://news.bitcoin.com/floki-inu-cryptocurrency-ads-under-investigation-uk/
"As Bitcoin Struggles, Metaverse And Blockchain Entertainment Tokens Surge",Herald Sheets,2021-11-20,https://heraldsheets.com/as-bitcoin-struggles-metaverse-and-blockchain-entertainment-tokens-surge/
