Title,Publisher,Date,Link
Polkadot: Assessing whether DOT is really at the risk of a 16% sell-off,AMBCrypto,2021-10-06,https://ambcrypto.com/polkadot-assessing-whether-dot-is-really-at-the-risk-of-a-16-sell-off/
Polkadot to breakout with bullish updates in the DOT ecosystem,FXStreet,2021-10-06,https://www.fxstreet.com/cryptocurrencies/news/polkadot-to-breakout-with-bullish-updates-in-the-dot-ecosystem-202110061451
"Pro traders cut their EOS longs, but retail FOMO and $50K+ BTC could tip the scale",Cointelegraph,2021-10-06,https://cointelegraph.com/news/pro-traders-cut-their-eos-longs-but-retail-fomo-and-50k-btc-could-tip-the-scale
Ethereum: Death By 1000 Paper Cuts (Cryptocurrency:ETH ...,Seeking Alpha,2021-10-06,https://seekingalpha.com/article/4458739-ethereum-death-by-1000-paper-cuts
Best NFT marketplace: Guide to top choices,Cryptopolitan,2021-10-06,https://www.cryptopolitan.com/best-nft-marketplace-guide-to-top-choices/
"India’s ‘most-valued crypto company’ receives funding from Coinbase, a16z",AMBCrypto,2021-10-06,https://ambcrypto.com/indias-most-valued-crypto-company-receives-funding-from-coinbase-a16z/
"Ethereum may have come to DeFi’s rescue, but here’s the whole story",AMBCrypto,2021-10-06,https://ambcrypto.com/ethereum-may-have-come-to-defis-rescue-but-heres-the-whole-story/
AMC Theatres Begin Accepting Dogecoin for Gift Cards,Decrypt,2021-10-06,https://decrypt.co/82722/amc-theatres-begin-accepting-dogecoin-gift-cards
Shiba Inu Price Analysis: SHIB swiftly moves to $0.000024 ...,Cryptopolitan,2021-10-06,https://www.cryptopolitan.com/shiba-inu-price-analysis-2021-10-06/
Britney Spears memorable kiss with Madonna to be released ...,Cryptopolitan,2021-10-06,https://www.cryptopolitan.com/britney-spears-kiss-with-madonna-as-nft/
"2 Undervalued Altcoins to Buy, Per 26-Year Wall Street ...",Business Insider,2021-10-06,https://www.businessinsider.com/altcoins-to-buy-bitcoin-price-forecast-wall-street-veteran-trader-2021-10
Enjinstarter AMA With Co-Founder Prakash Somosundram ...,Altcoin Buzz,2021-10-06,https://www.altcoinbuzz.io/cryptocurrency-news/spotlight/enjinstarter-ama-with-co-founder-prakash-somosundram/
Ethereum clients run merge event to prepare for PoS transition,AMBCrypto,2021-10-06,https://ambcrypto.com/ethereum-clients-run-merge-event-to-prepare-for-pos-transition/
Polygon network introduces ‘a small change’ to tackle spam transactions,AMBCrypto,2021-10-06,https://ambcrypto.com/polygon-network-introduces-a-small-change-to-tackle-spam-transactions/
Qatar National Bank joins RippleNet to further remittances to Turkey,AMBCrypto,2021-10-06,https://ambcrypto.com/qatar-national-bank-joins-ripplenet-to-further-remittances-to-turkey/
Here’s why XRP price will skyrocket to $15,FXStreet,2021-10-06,https://www.fxstreet.com/cryptocurrencies/news/heres-why-xrp-price-will-skyrocket-to-15-202110060855
"SEC Chairman Gary Gensler: No Plan to Ban Crypto, It's up to ...",Bitcoin.com News,2021-10-06,https://news.bitcoin.com/sec-chairman-gary-gensler-no-plan-to-ban-crypto-up-to-congress/
Youth Fashion Retail Chain Pacsun Now Accepts 11 ...,Bitcoin.com News,2021-10-06,https://news.bitcoin.com/youth-fashion-retail-chain-pacsun-now-accepts-11-cryptocurrencies/
Coinsbee Review: Buy Gift Cards With Bitcoin and 70+ Other ...,BeInCrypto,2021-10-06,https://beincrypto.com/coinsbee-review-buy-gift-cards-with-bitcoin-other-crypto/
Central Bank of Uruguay Describes Roadmap to Crypto Asset ...,Bitcoin.com News,2021-10-06,https://news.bitcoin.com/central-bank-of-uruguay-describes-roadmap-to-crypto-asset-regulation/
