Title,Publisher,Date,Link
"Ripple price analysis: XRP rejects downside at $0.56, sharp ...",Cryptopolitan,2022-05-08,https://www.cryptopolitan.com/ripple-price-analysis-2022-05-08/
"Crypto Market Takes a Dive | This Week in Crypto – May 9, 2022",99Bitcoins,2022-05-08,https://99bitcoins.com/bitcoin-news-summary-may-9-2022/
Bitcoin: Mapping out the odds of a BTC rally in the short-term,AMBCrypto,2022-05-08,https://ambcrypto.com/bitcoin-mapping-out-the-odds-of-a-btc-rally-in-the-short-term/
Terra [LUNA] loses $6 billion in TVL in under two days thanks to this…,AMBCrypto,2022-05-08,https://ambcrypto.com/terra-luna-loses-6-billion-in-tvl-in-under-two-days-thanks-to-this/
"Cardano, Tron, NEAR Price Analysis: 08 May",AMBCrypto,2022-05-08,https://ambcrypto.com/cardano-tron-near-price-analysis-08-may/
Here’s why Ethereum may face mounting odds against a recovery,AMBCrypto,2022-05-08,https://ambcrypto.com/heres-why-ethereum-may-face-mounting-odds-against-a-recovery/
Bitcoin: Short term price action looks bleak but here’s what to look out for,AMBCrypto,2022-05-08,https://ambcrypto.com/bitcoin-short-term-price-action-looks-bleak-but-heres-what-to-look-out-for/
"Tron: As TRX falls prey to market wide sell-off, here’s what to look out for",AMBCrypto,2022-05-08,https://ambcrypto.com/tron-as-trx-falls-prey-to-market-wide-sell-off-heres-what-to-look-out-for/
"Cryptocurrencies Price Prediction: Ripple, Shiba Inu & Axie Infinity — Asian Wrap 09 May",FXStreet,2022-05-08,https://www.fxstreet.com/cryptocurrencies/news/cryptocurrencies-price-prediction-ripple-shiba-inu-axie-infinity-asian-wrap-09-may-202205082354
