Title,Publisher,Date,Link
Why isn't Polkadot BOOMING yet? 3 Polkadot Cons,CryptoTicker,2022-01-24,https://cryptoticker.io/en/why-isnt-polkadot-booming-yet-3-polkadot-cons/
"Make Or Brake Situation For Terra, Polkadot, And Harmony Price! Here’s What Traders Can Expect",Coinpedia,2022-01-24,https://coinpedia.org/altcoin/make-or-brake-situation-for-terra-polkadot-and-harmony-price/
"Here’s What’s Next for Cardano (ADA), Polkadot (DOT), Terra (LUNA) and Four Additional Altcoins, Accord...",The Daily Hodl,2022-01-24,https://dailyhodl.com/2022/01/24/heres-whats-next-for-cardano-ada-polkadot-dot-terra-luna-and-four-additional-altcoins-according-to-top-crypto-trader/
Here are 5 altcoins to study as crypto prices drop to near 1-year lows,Cointelegraph,2022-01-24,https://cointelegraph.com/news/here-s-5-altcoins-to-study-as-crypto-prices-drop-close-to-a-1-year-low
"As Markets Break Down, Traders Favor Ethereum (ETH), Solana (SOL), and Two More Altcoins, According to Cryp...",The Daily Hodl,2022-01-24,https://dailyhodl.com/2022/01/24/as-markets-break-down-traders-favor-ethereum-eth-solana-sol-and-two-more-altcoins-according-to-crypto-algorithm/
"Crypto market tumbles amid uncertainty over Russia, Ukraine",Forkast,2022-01-24,https://forkast.news/crypto-market-tumbles-uncertainty-russia-ukraine/
Binance continues its #BUIDL drive to push forth innovation in cryptoverse,AMBCrypto,2022-01-24,https://ambcrypto.com/binance-continues-its-buidl-drive-to-push-forth-innovation-in-cryptoverse/
Solana Tanks 16% Amid Ruthless Crypto Market Crash,Decrypt,2022-01-24,https://decrypt.co/91067/solana-tanks-amid-ruthless-crypto-market-crash
"Litecoin, Stellar, NEAR Price Analysis: 24 January",AMBCrypto,2022-01-24,https://ambcrypto.com/litecoin-stellar-near-price-analysis-24-january/
"Cosmos, Chainlink, GALA Price Analysis: 24 January",AMBCrypto,2022-01-24,https://ambcrypto.com/cosmos-chainlink-gala-price-analysis-24-january/
India: Crypto-bill unlikely to make it to Parliament’s Budget session,AMBCrypto,2022-01-24,https://ambcrypto.com/india-crypto-bill-unlikely-to-make-it-to-parliaments-budget-session/
Olympus DAO’s OHM down 97.97% from ATH; Can project’s 12-month action plan help?,AMBCrypto,2022-01-24,https://ambcrypto.com/olympus-daos-ohm-down-97-97-from-ath-can-projects-12-month-action-plan-help/
"Kusari Blockchain the Decentralised Option for Fast, Cheap and Secure DeFi Network, Web 3 Substrate and Full",EIN News,2022-01-24,https://www.einnews.com/pr_news/561380867/kusari-blockchain-the-decentralised-option-for-fast-cheap-and-secure-defi-network-web-3-substrate-and-full-evm
"Cardano, Tron, Axie Infinity Price Analysis: 24 January",AMBCrypto,2022-01-24,https://ambcrypto.com/cardano-tron-axie-infinity-price-analysis-24-january/
Opinion: Why Won't Wikipedia Classify NFTs as Art?,Crypto Briefing,2022-01-24,https://cryptobriefing.com/opinion-why-wont-wikipedia-classify-nfts-art/
"No Developed Nation Bans Cryptocurrencies, Telegram ...",Bitcoin.com News,2022-01-24,https://news.bitcoin.com/no-developed-nation-bans-cryptocurrencies-telegram-founder-pavel-durov-warns-russia/
'Ponzi Schemes Have Created a Negative Reputation for the ...,Bitcoin.com News,2022-01-24,https://news.bitcoin.com/ponzi-schemes-have-created-a-negative-reputation-for-industry-uganda-blockchain-enthusiast/
SEC Has Taken 97 Crypto Enforcement Actions So Far ...,Bitcoin.com News,2022-01-24,https://news.bitcoin.com/sec-97-crypto-enforcement-actions-crypto-top-priority-for-chairman-gensler/
Cardax Aims To Solve Concurrency Issues On Cardano’s Blockchain,TechBullion,2022-01-24,https://techbullion.com/cardax-aims-to-solve-concurrency-issues-on-cardanos-blockchain/
