Title,Publisher,Date,Link
"Polkadot At $9.30, But Is There A Chance Of Slight Shift In Trend?",NewsBTC,2022-06-03,https://www.newsbtc.com/news/polkadot-at-9-30-but-is-there-a-chance-of-slight-shift-in-trend/
"Cardano (ADA), Polkadot (DOT), and Ripple (XRP) Attracting Institutional Investors! Here’s Why",Coinpedia,2022-06-03,https://coinpedia.org/altcoin/institutional-investors-are-betting-on-these-3-altcoins-in-bearish-market/
MixBytes Launches Lido Pool on Curve for DOT Staking,CryptoNewsZ,2022-06-03,https://www.cryptonewsz.com/mixbytes-launches-lido-pool-on-curve-for-dot-staking/
Market Wrap: Altcoins Underperform as Bearish Sentiment Rises,CoinDesk,2022-06-03,https://www.coindesk.com/markets/2022/06/03/market-wrap-altcoins-underperform-as-bearish-sentiment-rises/
IOTA: Assessing if higher timeframe bears could be defeated in June,AMBCrypto,2022-06-03,https://ambcrypto.com/iota-assessing-if-higher-timeframe-bears-could-be-defeated-in-june/
Terra LUNA 2.0: How many coins are there? How to buy it in ...,Cryptopolitan,2022-06-03,https://www.cryptopolitan.com/terra-luna-2-supply-and-how-to-buy-in-the-us/
Sónar Festival Welcomes the Tezos NFT Art Community with ...,Cryptopolitan,2022-06-03,https://www.cryptopolitan.com/sonar-festival-welcomes-the-tezos-nft-art-community-with-the-first-ever-sonarmatic-gallery-at-sonard/
Japan approves stablecoin law to ensure protection for crypto ...,Cryptopolitan,2022-06-03,https://www.cryptopolitan.com/japan-approves-stablecoin-protection-crypto/
"ICP: Despite the strong surge recently, here is why shorting could be profitable",AMBCrypto,2022-06-03,https://ambcrypto.com/icp-fails-to-achieve-a-breakout-but-can-see-a-bounce-back-at-these-levels/
What Is The Process For Raising Capital With A Security Token? - Benzinga,Benzinga,2022-06-03,https://www.benzinga.com/markets/cryptocurrency/22/06/27547035/what-is-the-process-for-raising-capital-with-a-security-token
Here’s how Ethereum price will react to the Merge testnet upgrade,FXStreet,2022-06-03,https://www.fxstreet.com/cryptocurrencies/news/heres-how-ethereum-price-will-react-to-the-merge-testnet-upgrade-202206031435
Chainlink launches price feeds on Solana to provide data to DeFi developers,Cointelegraph,2022-06-03,https://cointelegraph.com/news/chainlink-launches-price-feeds-on-solana-to-provide-data-to-defi-developers
MarketAcross Is Named Korea Blockchain Week's Official ...,BeInCrypto,2022-06-03,https://beincrypto.com/marketacross-official-media-partner-korea-blockchain-week/
Bitcoin (BTC) Attempts New Upsurge; Why 100SMA Remains Crucial,Herald Sheets,2022-06-03,https://heraldsheets.com/bitcoin-btc-attempts-new-upsurge-why-100sma-remains-crucial/
Top 13 Cryptos for the Best Short-Term Investments in June ...,Securities.io,2022-06-03,https://www.securities.io/top-13-cryptos-for-the-best-short-term-investments-in-june-2022/
"Bitcoin, Ethereum Technical Analysis: BTC Gains Prior to NFP ...",Bitcoin.com News,2022-06-03,https://news.bitcoin.com/bitcoin-ethereum-technical-analysis-btc-gains-prior-to-nfp-report-following-a-cross-of-moving-averages/
LABEL Foundation Integrates With Binance Custody to Offer ...,Bitcoin.com News,2022-06-03,https://news.bitcoin.com/label-foundation-integrates-with-binance-custody-to-offer-cold-storage-support-for-lbl-token/
How to download Parental Love Mod APK (100% working ...,City Telegraph,2022-06-03,https://citytelegraph.com/technology/40459/how-to-download-parental-love-mod-apk-100-working-updated-2022/
