Title,Publisher,Date,Link
Free Crypto Nexo Promotion - Earn up to $1500 for HODLing,Business 2 Community,2022-03-28,https://www.business2community.com/crypto-news/free-crypto-nexo-promotion-hodl-challenge-02461840
"Polkadex Co-founder Vivek Prasannan on Parachains, Crowdloans, and Polkadot’s Role in Realizing Web3 |",Bitcoinist,2022-03-28,https://bitcoinist.com/polkadex-co-founder-vivek-prasannan-on-parachains-crowdloans-and-polkadots-role-in-realizing-web3/
"British Crypto Investment Firm Launches Avalanche, Cosmos, Polygon ETPs",CryptoPotato,2022-03-28,https://cryptopotato.com/british-crypto-investment-firm-launches-avalanche-cosmos-polygon-etps/
Buy Decentraland Online | How to Buy MANA Instantly,YouHodler.com,2022-03-28,https://www.youhodler.com/buy/mana
Buy Gala Online | How to Buy GALA Instantly,YouHodler.com,2022-03-28,https://www.youhodler.com/buy/gala
Bank of England collaborates with MIT for CBDC research,Cryptopolitan,2022-03-28,https://www.cryptopolitan.com/bank-of-england-collaborates-with-mit/
Dogecoin price analysis: DOGE/USD set to break below the ...,Cryptopolitan,2022-03-28,https://www.cryptopolitan.com/dogecoin-price-analysis-2022-02-28-2/
Bit2Me to collaborate with DFG to assist crypto startups in the Spanish and Portuguese markets,CryptoNinjas,2022-03-28,https://www.cryptoninjas.net/2022/03/28/bit2me-launchpad-collaborating-with-dfg-to-assist-crypto-startups-in-the-spanish-and-portuguese-markets/
Buy Axie Infinity Online | How to Buy AXS Instantly,YouHodler.com,2022-03-28,https://www.youhodler.com/buy/axs
Market Wrap: Bitcoin Rallies as Crypto Holders Accumulate,CoinDesk,2022-03-28,https://www.coindesk.com/markets/2022/03/28/market-wrap-bitcoin-rallies-as-crypto-holders-accumulate/
This Crypto Is Looking To Connect The Ethereums Or Solanas Of The World,Benzinga,2022-03-28,https://www.benzinga.com/markets/cryptocurrency/22/03/26159069/this-crypto-is-looking-to-connect-the-ethereums-or-solanas-of-the-world
Congress Is Discussing a Digital Dollar Pilot. It's Not What You Think,Decrypt,2022-03-28,https://decrypt.co/96220/congress-discussing-digital-dollar-pilot-not-what-you-think
Does Ethereum’s ‘Merge’ only ‘harden Bitcoin’s use case’,AMBCrypto,2022-03-28,https://ambcrypto.com/abras-barhydt-ethereums-merge-only-hardens-bitcoins-use-case/
"Up by >160% in a day, can Zilliqa go higher in search of liquidity",AMBCrypto,2022-03-28,https://ambcrypto.com/up-by-160-in-a-day-can-zilliqa-go-higher-in-search-of-liquidity/
"Decoding the if, but, and so of ‘Cashio Hack’",AMBCrypto,2022-03-28,https://ambcrypto.com/decoding-the-if-but-and-so-of-cashio-hack/
Le créateur de Cardano (ADA) admet s'être lourdement trompé,Journal Du Coin,2022-03-28,https://journalducoin.com/actualites/createur-cardano-ada-admet-lourdement-trompe/
"Terra, Chainlink, Ethereum Classic Price Analysis: 28 March",AMBCrypto,2022-03-28,https://ambcrypto.com/terra-chainlink-ethereum-classic-price-analysis-28-march/
Cross the Ages: 12 millions levés pour catapulter le jeu dans ...,Journal Du Coin,2022-03-28,https://journalducoin.com/nft/cross-the-ages-annonce-une-levee-de-fonds-de-12-millions-de-dollars/
Executive Order Legitimizes Crypto But Highlights Conflict ...,Seeking Alpha,2022-03-28,https://seekingalpha.com/article/4498228-executive-order-legitimizes-crypto-assets
Cardano Sidechain Project Set To Bring EVM Compatibility ...,Cryptoglobe,2022-03-28,https://www.cryptoglobe.com/latest/2022/03/cardano-sidechain-project-set-to-bring-evm-compatibility-after-mainnet-launch/
"Zilliqa Integrates Ramp, Furthering Global Accessibility of ZIL ...",Bitcoin.com News,2022-03-28,https://news.bitcoin.com/zilliqa-integrates-ramp-furthering-global-accessibility-of-zil-token/
Top 7 Cryptos to Day Trade in April 2022,Securities.io,2022-03-28,https://www.securities.io/top-7-cryptos-to-day-trade-in-april-2022/
Indian Government Reveals 11 Crypto Exchanges ...,Bitcoin.com News,2022-03-28,https://news.bitcoin.com/indian-government-11-crypto-exchanges-investigated-for-tax-evasion-13-million-recovered/
BNB Chain to Introduce Sidechains in Bid to Further Support ...,Cryptoglobe,2022-03-28,https://www.cryptoglobe.com/latest/2022/03/bnb-chain-to-introduce-sidechains-in-bid-to-further-support-resource-intense-applications/
Charles Hoskinson Calls Launch of Milkomeda C1 Mainnet 'A ...,Cryptoglobe,2022-03-28,https://www.cryptoglobe.com/latest/2022/03/charles-hoskinson-calls-launch-of-milkomeda-c1-mainnet-a-great-moment-for-cardano/
Former Exchange CEO Mark Karpeles Reveals Plans to ...,Bitcoin.com News,2022-03-28,https://news.bitcoin.com/former-exchange-ceo-mark-karpeles-plans-airdrop-nfts-mt-gox-customers/
Ghana CBDC Development: New Central Bank Document ...,Bitcoin.com News,2022-03-28,https://news.bitcoin.com/ghana-cbdc-development-new-central-bank-document-outlines-key-motivations-for-issuing-the-digital-currency/
Cele|bitchy | Duchess Kate's final Flop Tour look was a creepy ...,Celebitchy,2022-03-28,https://www.celebitchy.com/759750/duchess_kates_final_flop_tour_look_was_a_creepy_horrendous_diana_cosplay/
