Title,Publisher,Date,Link
VanEck Rolls Out Its First Multi-Token Cryptocurrency Fund,TronWeekly,2022-02-01,https://www.tronweekly.com/vaneck-first-cryptocurrency-fund/
First Mover Asia: Crypto Prices Rise With Investors' Appetite ...,CoinDesk,2022-02-01,https://www.coindesk.com/markets/2022/02/01/first-mover-asia-crypto-prices-rise-with-investors-appetite-for-risk/
"Solana, Shiba Inu, Fantom Price Analysis: 01 February",AMBCrypto,2022-02-01,https://ambcrypto.com/solana-shiba-inu-fantom-price-analysis-01-february/
Cryptocurrency Prices On February 1 2021: Know The Rate Of ...,ABP LIVE,2022-02-01,https://news.abplive.com/business/cryptocurrency-prices-on-february-1-2021-know-the-rate-of-bitcoin-ethereum-litecoin-ripple-dogecoin-and-other-cryptocurrencies-1510146
"Meta’s stablecoin project, Diem now sold – is it a lost cause or a new beginning?",AMBCrypto,2022-02-01,https://ambcrypto.com/metas-stablecoin-project-diem-now-sold-is-it-a-lost-cause-or-a-new-beginning/
Blockchain-based decentralized messengers: A privacy ...,Cointelegraph,2022-02-01,https://cointelegraph.com/news/blockchain-based-decentralized-messengers-a-privacy-pipedream
Blockchain Software Firm Consensys Acquires Mycrypto ...,Bitcoin.com News,2022-02-01,https://news.bitcoin.com/blockchain-software-firm-consensys-acquires-mycrypto-ethereum-wallet/
Circle Launches USDC on Flow Blockchain – Bitcoin News,Bitcoin.com News,2022-02-01,https://news.bitcoin.com/circle-launches-usdc-on-top-of-flow-blockchain/
Central Bank of Jordan Exploring the Possibility of Launching ...,Bitcoin.com News,2022-02-01,https://news.bitcoin.com/central-bank-of-jordan-exploring-possibility-of-launching-cbdc/
